{
  "metadata": {
    "total_threads": 959,
    "tagged_count": 934,
    "last_updated": "2025-11-16T17:11:36.914111",
    "source": "Merged from enhanced_manual_tags_COMPLETE.json and thread_index_production.csv"
  },
  "enhanced_tags": {
    "10-dawn-solution": {
      "thread_file": "10-dawn-solution_10-Dawn-solution.md",
      "thread_title": "10% Dawn solution",
      "thread_url": "https://connect.ntminfo.org/discussion/10-dawn-solution",
      "relevant_topics": [
        "equipment_sterilization"
      ],
      "topic_count": 1,
      "tagged_date": "2025-11-15T20:45:01.000000",
      "original_post_date": "Posted 07-03-2024 09:26 AM",
      "original_post_date_iso": "2024-07-03T00:00:00",
      "latest_post_date": "Posted 07-18-2025 04:36 PM",
      "latest_post_date_iso": "2025-07-18T00:00:00",
      "post_count": 6,
      "user_count": 6
    },
    "1st-north-american-bronchiectasis-ntm-patient-education-program-virtual-in-person": {
      "thread_file": "1st-north-american-bronchiectasis-ntm-patient-education-program-virtual-in-person_1ST-North-American-Bronchiectasis-NTM-Pa.md",
      "thread_title": "1ST North American Bronchiectasis & NTM Patient Education Program- virtual & in person",
      "thread_url": "https://connect.ntminfo.org/discussion/1st-north-american-bronchiectasis-ntm-patient-education-program-virtual-in-person",
      "relevant_topics": [],
      "topic_count": 0,
      "tagged_date": "2025-11-15T20:45:02.000000",
      "original_post_date": "Posted 08-15-2024 07:27 AM",
      "original_post_date_iso": "2024-08-15T00:00:00",
      "latest_post_date": "Posted 01-09-2025 03:55 PM",
      "latest_post_date_iso": "2025-01-09T00:00:00",
      "post_count": 6,
      "user_count": 3
    },
    "2024-ntm-bronchiectasis-patient-conference-session-previews": {
      "thread_file": "2024-ntm-bronchiectasis-patient-conference-session-previews_2025-NTM-Bronchiectasis-Patient-Conferen.md",
      "thread_title": "2025 NTM & Bronchiectasis Patient Conference Session Previews!",
      "thread_url": "https://connect.ntminfo.org/discussion/2024-ntm-bronchiectasis-patient-conference-session-previews",
      "relevant_topics": [
        "research_trials",
        "environmental_exposures"
      ],
      "topic_count": 2,
      "tagged_date": "2025-11-15T20:45:03.000000",
      "original_post_date": "Posted 04-30-2025 04:29 PMEdited by Helga Rosado 05-29-2025 12:39 PM",
      "original_post_date_iso": "2025-04-30T00:00:00",
      "latest_post_date": "Posted 05-13-2025 08:20 AM",
      "latest_post_date_iso": "2025-05-13T00:00:00",
      "post_count": 3,
      "user_count": 3
    },
    "25-nebulizer-tubing-ok-to-use": {
      "thread_file": "25-nebulizer-tubing-ok-to-use_25-nebulizer-tubing-OK-to-use.md",
      "thread_title": "25' nebulizer tubing OK to use?",
      "thread_url": "https://connect.ntminfo.org/discussion/25-nebulizer-tubing-ok-to-use",
      "relevant_topics": [
        "nebulizers",
        "saline_therapy"
      ],
      "topic_count": 2,
      "tagged_date": "2025-11-15T20:45:04.000000",
      "original_post_date": "Posted 09-06-2025 10:22 AM",
      "original_post_date_iso": "2025-09-06T00:00:00",
      "latest_post_date": "Posted 09-06-2025 10:22 AM",
      "latest_post_date_iso": "2025-09-06T00:00:00",
      "post_count": 1,
      "user_count": 1
    },
    "3-antibiotics-regimen-what-if-you-have-to-stop-due-to-side-effects": {
      "thread_file": "3-antibiotics-regimen-what-if-you-have-to-stop-due-to-side-effects_3-antibiotics-regimen-what-if-you-have-t.md",
      "thread_title": "3 antibiotics regimen - what if you have to stop due to side effects",
      "thread_url": "https://connect.ntminfo.org/discussion/3-antibiotics-regimen-what-if-you-have-to-stop-due-to-side-effects",
      "relevant_topics": [
        "big3_antibiotics",
        "medication_side_effects",
        "emotional_support",
        "treatment_monitoring"
      ],
      "topic_count": 4,
      "tagged_date": "2025-11-15T20:45:05.000000",
      "original_post_date": "Posted 10-16-2022 01:29 AM",
      "original_post_date_iso": "2022-10-16T00:00:00",
      "latest_post_date": "Posted 04-07-2025 01:26 PM",
      "latest_post_date_iso": "2025-04-07T00:00:00",
      "post_count": 8,
      "user_count": 7
    },
    "a-new-treatment-for-bronchiectasis-mid-2025": {
      "thread_file": "a-new-treatment-for-bronchiectasis-mid-2025_A-new-treatment-for-bronchiectasis-mid-2.md",
      "thread_title": "A new treatment for bronchiectasis mid 2025",
      "thread_url": "https://connect.ntminfo.org/discussion/a-new-treatment-for-bronchiectasis-mid-2025",
      "relevant_topics": [
        "alternative_therapies",
        "medical_centers",
        "research_trials"
      ],
      "topic_count": 3,
      "tagged_date": "2025-11-15T20:45:06.000000",
      "original_post_date": "Posted 01-07-2025 12:27 PM",
      "original_post_date_iso": "2025-01-07T00:00:00",
      "latest_post_date": "Posted 01-09-2025 10:00 AM",
      "latest_post_date_iso": "2025-01-09T00:00:00",
      "post_count": 7,
      "user_count": 7
    },
    "able-to-purchase-vest-without-a-prescription": {
      "thread_file": "able-to-purchase-vest-without-a-prescription_Able-to-purchase-vest-without-a-prescrip.md",
      "thread_title": "Able to purchase vest without a prescription?",
      "thread_url": "https://connect.ntminfo.org/discussion/able-to-purchase-vest-without-a-prescription",
      "relevant_topics": [
        "vest_therapy",
        "insurance_costs",
        "imaging_scans"
      ],
      "topic_count": 3,
      "tagged_date": "2025-11-15T20:45:07.000000",
      "original_post_date": "Posted 03-21-2025 11:43 AM",
      "original_post_date_iso": "2025-03-21T00:00:00",
      "latest_post_date": "Posted 03-28-2025 03:22 PM",
      "latest_post_date_iso": "2025-03-28T00:00:00",
      "post_count": 21,
      "user_count": 9
    },
    "abscessus": {
      "thread_file": "abscessus_Abscessus.md",
      "thread_title": "Abscessus",
      "thread_url": "https://connect.ntminfo.org/discussion/abscessus",
      "relevant_topics": [
        "species_specific_treatment",
        "iv_antibiotics",
        "emotional_support",
        "sputum_cultures"
      ],
      "topic_count": 4,
      "tagged_date": "2025-11-15T20:45:08.000000",
      "original_post_date": "Posted 23 days ago",
      "original_post_date_iso": "2025-10-22T21:30:58.622348",
      "latest_post_date": "Posted 20 days ago",
      "latest_post_date_iso": "2025-10-25T21:30:58.622348",
      "post_count": 7,
      "user_count": 3
    },
    "abscessus-treatment": {
      "thread_file": "abscessus-treatment_Abscessus-treatment.md",
      "thread_title": "Abscessus treatment",
      "thread_url": "https://connect.ntminfo.org/discussion/abscessus-treatment",
      "relevant_topics": [
        "species_specific_treatment",
        "iv_antibiotics",
        "hearing_complications",
        "patient_stories"
      ],
      "topic_count": 4,
      "tagged_date": "2025-11-15T20:45:09.000000",
      "original_post_date": "Posted 11-28-2024 01:37 AM",
      "original_post_date_iso": "2024-11-28T00:00:00",
      "latest_post_date": "Posted 12-01-2024 03:02 AM",
      "latest_post_date_iso": "2024-12-01T00:00:00",
      "post_count": 8,
      "user_count": 5
    },
    "abscessus-treatment-nausea": {
      "thread_file": "abscessus-treatment-nausea_Abscessus-treatment-nausea.md",
      "thread_title": "Abscessus treatment - nausea",
      "thread_url": "https://connect.ntminfo.org/discussion/abscessus-treatment-nausea",
      "relevant_topics": [
        "species_specific_treatment",
        "medication_side_effects",
        "iv_antibiotics",
        "inhaled_medications",
        "newer_antibiotics"
      ],
      "topic_count": 5,
      "tagged_date": "2025-11-15T20:45:10.000000",
      "original_post_date": "Posted 07-23-2025 10:55 AM",
      "original_post_date_iso": "2025-07-23T00:00:00",
      "latest_post_date": "Posted 07-31-2025 11:02 AM",
      "latest_post_date_iso": "2025-07-31T00:00:00",
      "post_count": 11,
      "user_count": 4
    },
    "acetylcysteine-nebulized": {
      "thread_file": "acetylcysteine-nebulized_Acetylcysteine-nebulized.md",
      "thread_title": "Acetylcysteine nebulized",
      "thread_url": "https://connect.ntminfo.org/discussion/acetylcysteine-nebulized",
      "relevant_topics": [
        "nebulizers",
        "alternative_therapies"
      ],
      "topic_count": 2,
      "tagged_date": "2025-11-15T20:45:11.000000",
      "original_post_date": "Posted 10-11-2024 12:09 PM",
      "original_post_date_iso": "2024-10-11T00:00:00",
      "latest_post_date": "Posted 11-03-2024 12:07 PM",
      "latest_post_date_iso": "2024-11-03T00:00:00",
      "post_count": 6,
      "user_count": 5
    },
    "ada-accommodations-uncertainty-and-worries-due-to-small-company": {
      "thread_file": "ada-accommodations-uncertainty-and-worries-due-to-small-company_ADA-Accommodations-Uncertainty-and-Worri.md",
      "thread_title": "ADA Accommodations - Uncertainty and Worries due to Small Company",
      "thread_url": "https://connect.ntminfo.org/discussion/ada-accommodations-uncertainty-and-worries-due-to-small-company",
      "relevant_topics": [
        "work_employment"
      ],
      "topic_count": 1,
      "tagged_date": "2025-11-15T20:45:12.000000",
      "original_post_date": "Posted 10-02-2025 12:32 PM",
      "original_post_date_iso": "2025-10-02T00:00:00",
      "latest_post_date": "Posted 10-03-2025 09:34 AM",
      "latest_post_date_iso": "2025-10-03T00:00:00",
      "post_count": 3,
      "user_count": 0
    },
    "adjustable-bed-frame-cervical-arthitis": {
      "thread_file": "adjustable-bed-frame-cervical-arthitis_Adjustable-bed-frame-cervical-arthitis.md",
      "thread_title": "Adjustable bed frame & cervical arthitis",
      "thread_url": "https://connect.ntminfo.org/discussion/adjustable-bed-frame-cervical-arthitis",
      "relevant_topics": [],
      "topic_count": 0,
      "tagged_date": "2025-11-15T20:45:13.000000",
      "original_post_date": "Posted 07-10-2025 12:39 PM",
      "original_post_date_iso": "2025-07-10T00:00:00",
      "latest_post_date": "Posted 08-07-2025 10:29 AM",
      "latest_post_date_iso": "2025-08-07T00:00:00",
      "post_count": 14,
      "user_count": 5
    },
    "aerators": {
      "thread_file": "aerators_Aerators.md",
      "thread_title": "Aerators",
      "thread_url": "https://connect.ntminfo.org/discussion/aerators",
      "relevant_topics": [
        "water_safety",
        "environmental_exposures"
      ],
      "topic_count": 2,
      "tagged_date": "2025-11-15T20:45:14.000000",
      "original_post_date": "Posted 07-11-2025 03:08 PM",
      "original_post_date_iso": "2025-07-11T00:00:00",
      "latest_post_date": "Posted 07-18-2025 08:00 PM",
      "latest_post_date_iso": "2025-07-18T00:00:00",
      "post_count": 16,
      "user_count": 5
    },
    "aerobicaneb-equipment-storing-extra-sets-keeping-sterile": {
      "thread_file": "aerobicaneb-equipment-storing-extra-sets-keeping-sterile_AerobicaNeb-equipment-storing-extra-sets.md",
      "thread_title": "Aerobica/Neb equipment - storing extra sets - keeping sterile",
      "thread_url": "https://connect.ntminfo.org/discussion/aerobicaneb-equipment-storing-extra-sets-keeping-sterile",
      "relevant_topics": [
        "equipment_sterilization",
        "aerobika_opep",
        "nebulizers",
        "travel_equipment"
      ],
      "topic_count": 4,
      "tagged_date": "2025-11-15T20:45:15.000000",
      "original_post_date": "Dr Falkinham - Posted 06-05-2023 09:14 AM",
      "original_post_date_iso": "2023-06-05T00:00:00",
      "latest_post_date": "Posted 01-11-2025 11:45 AM",
      "latest_post_date_iso": "2025-01-11T00:00:00",
      "post_count": 3,
      "user_count": 1
    },
    "aerobika-device": {
      "thread_file": "aerobika-device_Aerobika-device.md",
      "thread_title": "Aerobika device",
      "thread_url": "https://connect.ntminfo.org/discussion/aerobika-device",
      "relevant_topics": [
        "aerobika_opep",
        "equipment_maintenance"
      ],
      "topic_count": 2,
      "tagged_date": "2025-11-15T20:45:16.000000",
      "original_post_date": "Posted 11-19-2024 05:35 PM",
      "original_post_date_iso": "2024-11-19T00:00:00",
      "latest_post_date": "Posted 11-22-2024 11:20 AM",
      "latest_post_date_iso": "2024-11-22T00:00:00",
      "post_count": 4,
      "user_count": 3
    },
    "aerobika-life-span": {
      "thread_file": "aerobika-life-span_Aerobika-life-span.md",
      "thread_title": "Aerobika life span",
      "thread_url": "https://connect.ntminfo.org/discussion/aerobika-life-span",
      "relevant_topics": [
        "aerobika_opep",
        "equipment_maintenance"
      ],
      "topic_count": 2,
      "tagged_date": "2025-11-15T20:45:17.000000",
      "original_post_date": "Posted 06-04-2025 05:39 PM",
      "original_post_date_iso": "2025-06-04T00:00:00",
      "latest_post_date": "Posted 06-05-2025 09:07 AM",
      "latest_post_date_iso": "2025-06-05T00:00:00",
      "post_count": 3,
      "user_count": 2
    },
    "aeroeclipse-breath-actuated-nebulizer": {
      "thread_file": "aeroeclipse-breath-actuated-nebulizer_Aeroeclipse-Breath-Actuated-Nebulizer.md",
      "thread_title": "Aeroeclipse Breath Actuated Nebulizer",
      "thread_url": "https://connect.ntminfo.org/discussion/aeroeclipse-breath-actuated-nebulizer",
      "relevant_topics": [
        "nebulizers",
        "equipment_maintenance"
      ],
      "topic_count": 2,
      "tagged_date": "2025-11-15T20:45:18.000000",
      "original_post_date": "Posted 10-14-2024 04:05 PM",
      "original_post_date_iso": "2024-10-14T00:00:00",
      "latest_post_date": "Posted 10-15-2024 10:02 AM",
      "latest_post_date_iso": "2024-10-15T00:00:00",
      "post_count": 3,
      "user_count": 1
    },
    "air-purifier-ionizer": {
      "thread_file": "air-purifier-ionizer_Air-purifier-ionizer.md",
      "thread_title": "Air purifier - ionizer",
      "thread_url": "https://connect.ntminfo.org/discussion/air-purifier-ionizer",
      "relevant_topics": [
        "environmental_exposures"
      ],
      "topic_count": 1,
      "tagged_date": "2025-11-15T20:45:19.000000",
      "original_post_date": "Posted 10-06-2024 12:54 AM",
      "original_post_date_iso": "2024-10-06T00:00:00",
      "latest_post_date": "Posted 10-10-2024 01:03 AM",
      "latest_post_date_iso": "2024-10-10T00:00:00",
      "post_count": 4,
      "user_count": 1
    },
    "air-purifiers-3": {
      "thread_file": "air-purifiers-3_Air-purifiers.md",
      "thread_title": "Air purifiers",
      "thread_url": "https://connect.ntminfo.org/discussion/air-purifiers-3",
      "relevant_topics": [
        "environmental_exposures",
        "infection_prevention"
      ],
      "topic_count": 2,
      "tagged_date": "2025-11-15T20:45:20.000000",
      "original_post_date": "Posted 10-14-2024 12:51 PM",
      "original_post_date_iso": "2024-10-14T00:00:00",
      "latest_post_date": "Posted 10-12-2025 10:53 AM",
      "latest_post_date_iso": "2025-10-12T00:00:00",
      "post_count": 14,
      "user_count": 8
    },
    "air-quality-concern-with-recent-fish-kill-in-our-pond": {
      "thread_file": "air-quality-concern-with-recent-fish-kill-in-our-pond_Air-quality-concern-with-recent-fish-kil.md",
      "thread_title": "Air quality concern with recent fish kill in our pond",
      "thread_url": "https://connect.ntminfo.org/discussion/air-quality-concern-with-recent-fish-kill-in-our-pond",
      "relevant_topics": [
        "environmental_exposures",
        "water_safety",
        "emotional_support",
        "family_relationships"
      ],
      "topic_count": 4,
      "tagged_date": "2025-11-15T20:45:21.000000",
      "original_post_date": "Posted 02-17-2025 11:25 PM",
      "original_post_date_iso": "2025-02-17T00:00:00",
      "latest_post_date": "Posted 02-19-2025 11:52 PMEdited by Janet Wilson 02-19-2025 11:52 PM",
      "latest_post_date_iso": "2025-02-19T00:00:00",
      "post_count": 6,
      "user_count": 2
    },
    "airsupra-inhaler-for-bronchospasms": {
      "thread_file": "airsupra-inhaler-for-bronchospasms_Airsupra-inhaler-for-bronchospasms.md",
      "thread_title": "Airsupra inhaler for bronchospasms?",
      "thread_url": "https://connect.ntminfo.org/discussion/airsupra-inhaler-for-bronchospasms",
      "relevant_topics": [
        "alternative_therapies",
        "coinfections",
        "other_complications"
      ],
      "topic_count": 3,
      "tagged_date": "2025-11-15T20:45:22.000000",
      "original_post_date": "Posted 02-26-2025 08:37 AM",
      "original_post_date_iso": "2025-02-26T00:00:00",
      "latest_post_date": "Posted 02-26-2025 08:37 AM",
      "latest_post_date_iso": "2025-02-26T00:00:00",
      "post_count": 1,
      "user_count": 1
    },
    "airway-clearance-10": {
      "thread_file": "airway-clearance-10_Airway-Clearance.md",
      "thread_title": "Airway Clearance",
      "thread_url": "https://connect.ntminfo.org/discussion/airway-clearance-10",
      "relevant_topics": [
        "saline_therapy",
        "manual_techniques",
        "nebulizers",
        "alternative_therapies"
      ],
      "topic_count": 4,
      "tagged_date": "2025-11-15T20:45:23.000000",
      "original_post_date": "Posted 7 days ago",
      "original_post_date_iso": "2025-11-07T21:31:06.645174",
      "latest_post_date": "Posted 6 days ago",
      "latest_post_date_iso": "2025-11-08T21:31:06.645174",
      "post_count": 6,
      "user_count": 5
    },
    "airway-clearance-9": {
      "thread_file": "airway-clearance-9_Airway-clearance.md",
      "thread_title": "Airway clearance",
      "thread_url": "https://connect.ntminfo.org/discussion/airway-clearance-9",
      "relevant_topics": [
        "manual_techniques",
        "aerobika_opep",
        "saline_therapy",
        "nebulizers",
        "sputum_cultures",
        "emotional_support",
        "patient_stories"
      ],
      "topic_count": 7,
      "tagged_date": "2025-11-15T20:45:24.000000",
      "original_post_date": "Posted 10-02-2025 10:51 AM",
      "original_post_date_iso": "2025-10-02T00:00:00",
      "latest_post_date": "Posted 10-05-2025 09:54 AM",
      "latest_post_date_iso": "2025-10-05T00:00:00",
      "post_count": 16,
      "user_count": 11
    },
    "airway-clearance-and-sputum": {
      "thread_file": "airway-clearance-and-sputum_Airway-Clearance-and-Sputum.md",
      "thread_title": "Airway Clearance and Sputum",
      "thread_url": "https://connect.ntminfo.org/discussion/airway-clearance-and-sputum",
      "relevant_topics": [
        "saline_therapy",
        "aerobika_opep",
        "manual_techniques",
        "nebulizers"
      ],
      "topic_count": 4,
      "tagged_date": "2025-11-15T20:45:25.000000",
      "original_post_date": "Posted 10-10-2024 05:07 PM",
      "original_post_date_iso": "2024-10-10T00:00:00",
      "latest_post_date": "Posted 10-13-2024 09:49 AM",
      "latest_post_date_iso": "2024-10-13T00:00:00",
      "post_count": 8,
      "user_count": 4
    },
    "airway-clearance-questions": {
      "thread_file": "airway-clearance-questions_Airway-Clearance-Questions.md",
      "thread_title": "Airway Clearance Question(s)",
      "thread_url": "https://connect.ntminfo.org/discussion/airway-clearance-questions",
      "relevant_topics": [
        "manual_techniques",
        "saline_therapy",
        "nebulizers"
      ],
      "topic_count": 3,
      "tagged_date": "2025-11-15T20:45:26.000000",
      "original_post_date": "Posted 07-21-2025 11:14 AM",
      "original_post_date_iso": "2025-07-21T00:00:00",
      "latest_post_date": "Posted 07-23-2025 02:55 PM",
      "latest_post_date_iso": "2025-07-23T00:00:00",
      "post_count": 2,
      "user_count": 1
    },
    "alkaline-water-for-gerd": {
      "thread_file": "alkaline-water-for-gerd_Alkaline-Water-for-GERD.md",
      "thread_title": "Alkaline Water for GERD",
      "thread_url": "https://connect.ntminfo.org/discussion/alkaline-water-for-gerd",
      "relevant_topics": [
        "water_safety",
        "digestive_issues",
        "alternative_therapies",
        "other_complications"
      ],
      "topic_count": 4,
      "tagged_date": "2025-11-15T20:45:27.000000",
      "original_post_date": "Posted 08-02-2023 02:40 PM",
      "original_post_date_iso": "2023-08-02T00:00:00",
      "latest_post_date": "Posted 19 days ago",
      "latest_post_date_iso": "2025-10-26T21:30:42.443440",
      "post_count": 18,
      "user_count": 11
    },
    "alkaline-water-for-gerd-reflux": {
      "thread_file": "alkaline-water-for-gerd-reflux_Alkaline-Water-for-GERD-Reflux.md",
      "thread_title": "Alkaline Water for GERD, Reflux",
      "thread_url": "https://connect.ntminfo.org/discussion/alkaline-water-for-gerd-reflux",
      "relevant_topics": [
        "digestive_issues",
        "water_safety"
      ],
      "topic_count": 2,
      "tagged_date": "2025-11-15T20:45:28.000000",
      "original_post_date": "Posted 19 days ago",
      "original_post_date_iso": "2025-10-26T21:30:45.524041",
      "latest_post_date": "Posted 18 days ago",
      "latest_post_date_iso": "2025-10-27T21:30:45.524041",
      "post_count": 2,
      "user_count": 2
    },
    "all-about-mucus-an-interesting-read": {
      "thread_file": "all-about-mucus-an-interesting-read_All-About-Mucus-an-interesting-read.md",
      "thread_title": "All About Mucus --an interesting read",
      "thread_url": "https://connect.ntminfo.org/discussion/all-about-mucus-an-interesting-read",
      "relevant_topics": [
        "alternative_therapies"
      ],
      "topic_count": 1,
      "tagged_date": "2025-11-15T20:45:29.000000",
      "original_post_date": "Posted 11-10-2024 10:43 AM",
      "original_post_date_iso": "2024-11-10T00:00:00",
      "latest_post_date": "Posted 11-12-2024 09:19 AM",
      "latest_post_date_iso": "2024-11-12T00:00:00",
      "post_count": 6,
      "user_count": 5
    },
    "allergy-meds": {
      "thread_file": "allergy-meds_Allergy-meds.md",
      "thread_title": "Allergy meds",
      "thread_url": "https://connect.ntminfo.org/discussion/allergy-meds",
      "relevant_topics": [
        "alternative_therapies",
        "other_complications",
        "infection_prevention",
        "medical_centers"
      ],
      "topic_count": 4,
      "tagged_date": "2025-11-15T20:45:30.000000",
      "original_post_date": "Posted 09-02-2025 09:25 AM",
      "original_post_date_iso": "2025-09-02T00:00:00",
      "latest_post_date": "Posted 09-06-2025 09:31 AMEdited by Whitney Ball 09-06-2025 09:31 AM",
      "latest_post_date_iso": "2025-09-06T00:00:00",
      "post_count": 5,
      "user_count": 5
    },
    "am-i-the-only-one-who-is-breathless": {
      "thread_file": "am-i-the-only-one-who-is-breathless_Am-I-the-only-one-who-is-breathless.md",
      "thread_title": "Am I the only one who is breathless ?",
      "thread_url": "https://connect.ntminfo.org/discussion/am-i-the-only-one-who-is-breathless",
      "relevant_topics": [
        "other_complications",
        "coinfections",
        "alternative_therapies",
        "medical_centers",
        "patient_stories",
        "emotional_support",
        "exercise_activity",
        "big3_antibiotics",
        "treatment_monitoring"
      ],
      "topic_count": 9,
      "tagged_date": "2025-11-15T20:45:31.000000",
      "original_post_date": "Posted 10-30-2024 11:51 AM",
      "original_post_date_iso": "2024-10-30T00:00:00",
      "latest_post_date": "Posted 11-08-2024 09:40 AM",
      "latest_post_date_iso": "2024-11-08T00:00:00",
      "post_count": 33,
      "user_count": 14
    },
    "amikacin-3": {
      "thread_file": "amikacin-3_Amikacin.md",
      "thread_title": "Amikacin",
      "thread_url": "https://connect.ntminfo.org/discussion/amikacin-3",
      "relevant_topics": [
        "inhaled_medications",
        "hearing_complications",
        "medication_side_effects",
        "patient_stories"
      ],
      "topic_count": 4,
      "tagged_date": "2025-11-15T20:45:32.000000",
      "original_post_date": "Posted 11-21-2024 06:10 PM",
      "original_post_date_iso": "2024-11-21T00:00:00",
      "latest_post_date": "Posted 01-23-2025 09:14 AM",
      "latest_post_date_iso": "2025-01-23T00:00:00",
      "post_count": 15,
      "user_count": 12
    },
    "amikacin-4": {
      "thread_file": "amikacin-4_Amikacin.md",
      "thread_title": "Amikacin",
      "thread_url": "https://connect.ntminfo.org/discussion/amikacin-4",
      "relevant_topics": [
        "iv_antibiotics",
        "home_iv_care",
        "species_specific_treatment",
        "medication_side_effects",
        "hearing_complications",
        "newer_antibiotics",
        "patient_stories",
        "research_trials",
        "treatment_monitoring"
      ],
      "topic_count": 9,
      "tagged_date": "2025-11-15T20:45:33.000000",
      "original_post_date": "Posted 05-23-2025 10:35 AM",
      "original_post_date_iso": "2025-05-23T00:00:00",
      "latest_post_date": "Posted 06-02-2025 09:33 AM",
      "latest_post_date_iso": "2025-06-02T00:00:00",
      "post_count": 26,
      "user_count": 13
    },
    "an-antibiotic-that-may-be-on-your-kitchen-table": {
      "thread_file": "an-antibiotic-that-may-be-on-your-kitchen-table_An-antibiotic-that-may-be-on-your-kitche.md",
      "thread_title": "An antibiotic that may be on your kitchen table",
      "thread_url": "https://connect.ntminfo.org/discussion/an-antibiotic-that-may-be-on-your-kitchen-table",
      "relevant_topics": [
        "alternative_therapies"
      ],
      "topic_count": 1,
      "tagged_date": "2025-11-15T20:45:34.000000",
      "original_post_date": "Posted 04-07-2025 03:40 AM",
      "original_post_date_iso": "2025-04-07T00:00:00",
      "latest_post_date": "Posted 04-12-2025 04:40 PM",
      "latest_post_date_iso": "2025-04-12T00:00:00",
      "post_count": 5,
      "user_count": 5
    },
    "an-ode-to-kefir": {
      "thread_file": "an-ode-to-kefir_An-ode-to-kefir.md",
      "thread_title": "An ode to kefir",
      "thread_url": "https://connect.ntminfo.org/discussion/an-ode-to-kefir",
      "relevant_topics": [
        "alternative_therapies",
        "nutrition_lifestyle",
        "coinfections",
        "digestive_issues"
      ],
      "topic_count": 4,
      "tagged_date": "2025-11-15T20:45:35.000000",
      "original_post_date": "Posted 11-19-2024 11:31 AM",
      "original_post_date_iso": "2024-11-19T00:00:00",
      "latest_post_date": "Posted 11-22-2024 02:35 PM",
      "latest_post_date_iso": "2024-11-22T00:00:00",
      "post_count": 7,
      "user_count": 6
    },
    "and-we-are-live": {
      "thread_file": "and-we-are-live_And-we-are-LIVE.md",
      "thread_title": "And we are LIVE!",
      "thread_url": "https://connect.ntminfo.org/discussion/and-we-are-live",
      "relevant_topics": [],
      "topic_count": 0,
      "tagged_date": "2025-11-15T20:45:36.000000",
      "original_post_date": "Posted 01-14-2025 12:56 PMEdited by Bekah Weidner 01-14-2025 12:57 PM",
      "original_post_date_iso": "2025-01-14T00:00:00",
      "latest_post_date": "Posted 01-14-2025 12:56 PMEdited by Bekah Weidner 01-14-2025 12:57 PM",
      "latest_post_date_iso": "2025-01-14T00:00:00",
      "post_count": 1,
      "user_count": 1
    },
    "anemia": {
      "thread_file": "anemia_Anemia.md",
      "thread_title": "Anemia",
      "thread_url": "https://connect.ntminfo.org/discussion/anemia",
      "relevant_topics": [
        "other_complications"
      ],
      "topic_count": 1,
      "tagged_date": "2025-11-15T20:45:37.000000",
      "original_post_date": "Posted 08-19-2025 09:12 AM",
      "original_post_date_iso": "2025-08-19T00:00:00",
      "latest_post_date": "Posted 08-19-2025 09:12 AM",
      "latest_post_date_iso": "2025-08-19T00:00:00",
      "post_count": 1,
      "user_count": 0
    },
    "announcing-a-new-illinois-indiana-support-group": {
      "thread_file": "announcing-a-new-illinois-indiana-support-group_Announcing-a-new-Illinois-Indiana-Suppor.md",
      "thread_title": "Announcing a new Illinois & Indiana Support Group!",
      "thread_url": "https://connect.ntminfo.org/discussion/announcing-a-new-illinois-indiana-support-group",
      "relevant_topics": [
        "emotional_support"
      ],
      "topic_count": 1,
      "tagged_date": "2025-11-15T20:45:38.000000",
      "original_post_date": "Posted 02-07-2025 12:35 PM",
      "original_post_date_iso": "2025-02-07T00:00:00",
      "latest_post_date": "Posted 02-16-2025 04:13 PM",
      "latest_post_date_iso": "2025-02-16T00:00:00",
      "post_count": 2,
      "user_count": 2
    },
    "announcing-new-australia-and-new-zealand-forums-on-connect": {
      "thread_file": "announcing-new-australia-and-new-zealand-forums-on-connect_Announcing-new-Australia-and-New-Zealand.md",
      "thread_title": "Announcing new Australia and New Zealand Forums on Connect!",
      "thread_url": "https://connect.ntminfo.org/discussion/announcing-new-australia-and-new-zealand-forums-on-connect",
      "relevant_topics": [
        "emotional_support"
      ],
      "topic_count": 1,
      "tagged_date": "2025-11-15T20:45:39.000000",
      "original_post_date": "Posted 03-05-2025 04:59 PM",
      "original_post_date_iso": "2025-03-05T00:00:00",
      "latest_post_date": "Posted 03-08-2025 11:26 AM",
      "latest_post_date_iso": "2025-03-08T00:00:00",
      "post_count": 5,
      "user_count": 5
    },
    "another-cruise-dilemma": {
      "thread_file": "another-cruise-dilemma_Another-Cruise-dilemma.md",
      "thread_title": "Another Cruise dilemma",
      "thread_url": "https://connect.ntminfo.org/discussion/another-cruise-dilemma",
      "relevant_topics": [
        "water_safety",
        "travel_safety",
        "infection_prevention"
      ],
      "topic_count": 3,
      "tagged_date": "2025-11-15T20:45:40.000000",
      "original_post_date": "Posted 06-29-2025 03:13 PM",
      "original_post_date_iso": "2025-06-29T00:00:00",
      "latest_post_date": "Posted 07-05-2025 05:46 PM",
      "latest_post_date_iso": "2025-07-05T00:00:00",
      "post_count": 19,
      "user_count": 9
    },
    "any-experience-with-different-inhaled-antibiotics": {
      "thread_file": "any-experience-with-different-inhaled-antibiotics_Any-experience-with-different-inhaled-an.md",
      "thread_title": "Any experience with different inhaled antibiotics?",
      "thread_url": "https://connect.ntminfo.org/discussion/any-experience-with-different-inhaled-antibiotics",
      "relevant_topics": [
        "inhaled_medications",
        "coinfections",
        "medication_side_effects"
      ],
      "topic_count": 3,
      "tagged_date": "2025-11-15T20:45:41.000000",
      "original_post_date": "Posted 01-01-2025 11:11 AM",
      "original_post_date_iso": "2025-01-01T00:00:00",
      "latest_post_date": "Posted 01-01-2025 11:11 AM",
      "latest_post_date_iso": "2025-01-01T00:00:00",
      "post_count": 1,
      "user_count": 1
    },
    "any-success-with-natural-ways-to-build-up-immunity-to-fight-ntm-mac": {
      "thread_file": "any-success-with-natural-ways-to-build-up-immunity-to-fight-ntm-mac_Any-success-with-natural-ways-to-build-u.md",
      "thread_title": "Any success with natural ways to build up immunity to fight NTM Mac",
      "thread_url": "https://connect.ntminfo.org/discussion/any-success-with-natural-ways-to-build-up-immunity-to-fight-ntm-mac",
      "relevant_topics": [
        "alternative_therapies",
        "nutrition_lifestyle",
        "manual_techniques",
        "saline_therapy",
        "aerobika_opep",
        "nebulizers",
        "vest_therapy",
        "sputum_cultures",
        "research_trials",
        "medical_centers",
        "inhaled_medications",
        "exercise_activity",
        "equipment_maintenance"
      ],
      "topic_count": 13,
      "tagged_date": "2025-11-15T20:45:42.000000",
      "original_post_date": "Posted 05-31-2025 02:44 AM",
      "original_post_date_iso": "2025-05-31T00:00:00",
      "latest_post_date": "Posted 06-18-2025 05:03 PM",
      "latest_post_date_iso": "2025-06-18T00:00:00",
      "post_count": 37,
      "user_count": 19
    },
    "anyone-chosen-not-to-do-any-drug-treatment-with-macmai-and-a-cavity": {
      "thread_file": "anyone-chosen-not-to-do-any-drug-treatment-with-macmai-and-a-cavity_Anyone-chosen-not-to-do-any-drug-treatme.md",
      "thread_title": "Anyone chosen not to do any drug treatment with MAC/MAI and a cavity ?",
      "thread_url": "https://connect.ntminfo.org/discussion/anyone-chosen-not-to-do-any-drug-treatment-with-macmai-and-a-cavity",
      "relevant_topics": [
        "big3_antibiotics",
        "inhaled_medications",
        "research_trials",
        "manual_techniques",
        "surgical_treatment",
        "medical_centers",
        "patient_stories"
      ],
      "topic_count": 7,
      "tagged_date": "2025-11-15T20:45:43.000000",
      "original_post_date": "Posted 09-02-2023 02:17 PM",
      "original_post_date_iso": "2023-09-02T00:00:00",
      "latest_post_date": "Posted 01-23-2025 12:55 AM",
      "latest_post_date_iso": "2025-01-23T00:00:00",
      "post_count": 18,
      "user_count": 8
    },
    "anyone-going-to-stanford-for-care": {
      "thread_file": "anyone-going-to-stanford-for-care_Anyone-going-to-Stanford-for-care.md",
      "thread_title": "Anyone going to Stanford for care?",
      "thread_url": "https://connect.ntminfo.org/discussion/anyone-going-to-stanford-for-care",
      "relevant_topics": [
        "medical_centers"
      ],
      "topic_count": 1,
      "tagged_date": "2025-11-15T20:45:44.000000",
      "original_post_date": "Posted 03-16-2025 04:32 AM",
      "original_post_date_iso": "2025-03-16T00:00:00",
      "latest_post_date": "Posted 03-24-2025 01:19 PM",
      "latest_post_date_iso": "2025-03-24T00:00:00",
      "post_count": 5,
      "user_count": 2
    },
    "anyone-had-a-total-lung-removal-done": {
      "thread_file": "anyone-had-a-total-lung-removal-done_anyone-had-a-total-lung-removal-done.md",
      "thread_title": "anyone had a total lung removal done?",
      "thread_url": "https://connect.ntminfo.org/discussion/anyone-had-a-total-lung-removal-done",
      "relevant_topics": [
        "surgical_treatment",
        "patient_stories",
        "medical_centers",
        "other_complications"
      ],
      "topic_count": 4,
      "tagged_date": "2025-11-15T20:45:45.000000",
      "original_post_date": "Posted 11-23-2024 05:09 PM",
      "original_post_date_iso": "2024-11-23T00:00:00",
      "latest_post_date": "Posted 03-22-2025 01:41 PM",
      "latest_post_date_iso": "2025-03-22T00:00:00",
      "post_count": 7,
      "user_count": 5
    },
    "anyone-taking-ahcc-from-mushrooms": {
      "thread_file": "anyone-taking-ahcc-from-mushrooms_Anyone-taking-AHCC-from-mushrooms.md",
      "thread_title": "Anyone taking AHCC (from mushrooms)?",
      "thread_url": "https://connect.ntminfo.org/discussion/anyone-taking-ahcc-from-mushrooms",
      "relevant_topics": [
        "alternative_therapies"
      ],
      "topic_count": 1,
      "tagged_date": "2025-11-15T20:45:46.000000",
      "original_post_date": "Posted 08-16-2025 12:00 PM",
      "original_post_date_iso": "2025-08-16T00:00:00",
      "latest_post_date": "Posted 08-19-2025 09:27 AM",
      "latest_post_date_iso": "2025-08-19T00:00:00",
      "post_count": 8,
      "user_count": 4
    },
    "aquamedix-shower-head": {
      "thread_file": "aquamedix-shower-head_Aquamedix-Shower-Head.md",
      "thread_title": "Aquamedix Shower Head",
      "thread_url": "https://connect.ntminfo.org/discussion/aquamedix-shower-head",
      "relevant_topics": [
        "water_safety",
        "equipment_sterilization",
        "infection_prevention"
      ],
      "topic_count": 3,
      "tagged_date": "2025-11-15T20:45:47.000000",
      "original_post_date": "Posted 28 days ago",
      "original_post_date_iso": "2025-10-17T21:31:17.694265",
      "latest_post_date": "Posted 26 days ago",
      "latest_post_date_iso": "2025-10-19T21:31:17.694265",
      "post_count": 7,
      "user_count": 7
    },
    "aquasana-whole-home-water-treatment-system": {
      "thread_file": "aquasana-whole-home-water-treatment-system_Aquasana-whole-home-water-treatment-syst.md",
      "thread_title": "Aquasana whole home water treatment system",
      "thread_url": "https://connect.ntminfo.org/discussion/aquasana-whole-home-water-treatment-system",
      "relevant_topics": [
        "water_safety",
        "medical_centers",
        "infection_prevention"
      ],
      "topic_count": 3,
      "tagged_date": "2025-11-15T20:45:48.000000",
      "original_post_date": "Posted 10-02-2024 09:34 PM",
      "original_post_date_iso": "2024-10-02T00:00:00",
      "latest_post_date": "Posted 10-04-2024 11:13 AM",
      "latest_post_date_iso": "2024-10-04T00:00:00",
      "post_count": 8,
      "user_count": 5
    },
    "are-antibiotic-resistant-mac-patients-able-to-spread-the-resistant-strain": {
      "thread_file": "are-antibiotic-resistant-mac-patients-able-to-spread-the-resistant-strain_Are-antibiotic-resistant-MAC-patients-ab.md",
      "thread_title": "Are antibiotic resistant MAC patients able to spread the resistant strain ?",
      "thread_url": "https://connect.ntminfo.org/discussion/are-antibiotic-resistant-mac-patients-able-to-spread-the-resistant-strain",
      "relevant_topics": [
        "species_specific_treatment",
        "medication_side_effects",
        "infection_prevention",
        "medical_centers"
      ],
      "topic_count": 4,
      "tagged_date": "2025-11-15T20:45:49.000000",
      "original_post_date": "Posted 03-04-2025 05:40 PM",
      "original_post_date_iso": "2025-03-04T00:00:00",
      "latest_post_date": "Posted 03-13-2025 02:27 PM",
      "latest_post_date_iso": "2025-03-13T00:00:00",
      "post_count": 8,
      "user_count": 4
    },
    "are-my-symptoms-related-to-mac-and-bronchiectasis": {
      "thread_file": "are-my-symptoms-related-to-mac-and-bronchiectasis_Are-My-Symptoms-Related-to-MAC-and-Bronc.md",
      "thread_title": "Are My Symptoms Related to MAC and Bronchiectasis?",
      "thread_url": "https://connect.ntminfo.org/discussion/are-my-symptoms-related-to-mac-and-bronchiectasis",
      "relevant_topics": [
        "other_complications",
        "emotional_support",
        "medical_centers",
        "patient_stories",
        "treatment_monitoring"
      ],
      "topic_count": 5,
      "tagged_date": "2025-11-15T20:45:50.000000",
      "original_post_date": "Posted 11-04-2024 06:21 AM",
      "original_post_date_iso": "2024-11-04T00:00:00",
      "latest_post_date": "Posted 11-06-2024 07:27 PM",
      "latest_post_date_iso": "2024-11-06T00:00:00",
      "post_count": 8,
      "user_count": 8
    },
    "are-you-signed-up-for-dr-chalmers-talk-in-2-days": {
      "thread_file": "are-you-signed-up-for-dr-chalmers-talk-in-2-days_Are-you-signed-up-for-Dr-Chalmers-talk-i.md",
      "thread_title": "Are you signed up for Dr. Chalmers' talk in 2 days???",
      "thread_url": "https://connect.ntminfo.org/discussion/are-you-signed-up-for-dr-chalmers-talk-in-2-days",
      "relevant_topics": [
        "research_trials",
        "medical_centers"
      ],
      "topic_count": 2,
      "tagged_date": "2025-11-15T20:45:51.000000",
      "original_post_date": "Posted 02-25-2025 11:05 AM",
      "original_post_date_iso": "2025-02-25T00:00:00",
      "latest_post_date": "Posted 02-25-2025 11:05 AM",
      "latest_post_date_iso": "2025-02-25T00:00:00",
      "post_count": 1,
      "user_count": 1
    },
    "are-you-signed-up-for-the-world-bronchiectasis-conf-patient-summary-talks": {
      "thread_file": "are-you-signed-up-for-the-world-bronchiectasis-conf-patient-summary-talks_Are-you-signed-up-for-the-World-Bronchie.md",
      "thread_title": "Are you signed up for the World Bronchiectasis Conf. Patient Summary talks?",
      "thread_url": "https://connect.ntminfo.org/discussion/are-you-signed-up-for-the-world-bronchiectasis-conf-patient-summary-talks",
      "relevant_topics": [
        "research_trials",
        "medical_centers"
      ],
      "topic_count": 2,
      "tagged_date": "2025-11-15T20:45:52.000000",
      "original_post_date": "Posted 07-11-2025 09:00 AMEdited by Patricia Kemp 07-13-2025 08:40 AM",
      "original_post_date_iso": "2025-07-11T00:00:00",
      "latest_post_date": "Posted 07-19-2025 03:20 PM",
      "latest_post_date_iso": "2025-07-19T00:00:00",
      "post_count": 4,
      "user_count": 3
    },
    "arikayce-6": {
      "thread_file": "arikayce-6_Arikayce.md",
      "thread_title": "Arikayce",
      "thread_url": "https://connect.ntminfo.org/discussion/arikayce-6",
      "relevant_topics": [
        "inhaled_medications",
        "medication_side_effects",
        "insurance_costs",
        "patient_stories",
        "treatment_monitoring",
        "newer_antibiotics"
      ],
      "topic_count": 6,
      "tagged_date": "2025-11-15T20:45:53.000000",
      "original_post_date": "Posted 03-18-2023 08:17 PM",
      "original_post_date_iso": "2023-03-18T00:00:00",
      "latest_post_date": "Posted 11-12-2024 10:22 PM",
      "latest_post_date_iso": "2024-11-12T00:00:00",
      "post_count": 32,
      "user_count": 20
    },
    "arikayce-8": {
      "thread_file": "arikayce-8_Arikayce.md",
      "thread_title": "Arikayce",
      "thread_url": "https://connect.ntminfo.org/discussion/arikayce-8",
      "relevant_topics": [
        "inhaled_medications",
        "insurance_costs",
        "newer_antibiotics"
      ],
      "topic_count": 3,
      "tagged_date": "2025-11-15T20:45:54.000000",
      "original_post_date": "Posted 08-16-2023 09:59 AM",
      "original_post_date_iso": "2023-08-16T00:00:00",
      "latest_post_date": "Posted 10-06-2025 01:24 PM",
      "latest_post_date_iso": "2025-10-06T00:00:00",
      "post_count": 18,
      "user_count": 6
    },
    "arikayce-amikacine": {
      "thread_file": "arikayce-amikacine_Arikayce-Amikacine.md",
      "thread_title": "Arikayce - Amikacine",
      "thread_url": "https://connect.ntminfo.org/discussion/arikayce-amikacine",
      "relevant_topics": [
        "inhaled_medications",
        "medication_side_effects",
        "hearing_complications",
        "species_specific_treatment",
        "surgical_treatment",
        "research_trials"
      ],
      "topic_count": 6,
      "tagged_date": "2025-11-15T20:45:55.000000",
      "original_post_date": "Posted 08-02-2025 02:43 PM",
      "original_post_date_iso": "2025-08-02T00:00:00",
      "latest_post_date": "Posted 08-13-2025 02:06 AM",
      "latest_post_date_iso": "2025-08-13T00:00:00",
      "post_count": 23,
      "user_count": 11
    },
    "arikayce-and-abdominal-cramps": {
      "thread_file": "arikayce-and-abdominal-cramps_Arikayce-and-abdominal-cramps.md",
      "thread_title": "Arikayce and abdominal cramps",
      "thread_url": "https://connect.ntminfo.org/discussion/arikayce-and-abdominal-cramps",
      "relevant_topics": [
        "inhaled_medications",
        "medication_side_effects",
        "iv_antibiotics"
      ],
      "topic_count": 3,
      "tagged_date": "2025-11-15T20:45:56.000000",
      "original_post_date": "Posted 03-17-2025 03:27 AM",
      "original_post_date_iso": "2025-03-17T00:00:00",
      "latest_post_date": "Posted 03-26-2025 10:39 AM",
      "latest_post_date_iso": "2025-03-26T00:00:00",
      "post_count": 8,
      "user_count": 5
    },
    "arikayce-caused-drop-in-fev1": {
      "thread_file": "arikayce-caused-drop-in-fev1_Arikayce-caused-drop-in-FEV1.md",
      "thread_title": "Arikayce caused drop in FEV1",
      "thread_url": "https://connect.ntminfo.org/discussion/arikayce-caused-drop-in-fev1",
      "relevant_topics": [
        "inhaled_medications",
        "medication_side_effects",
        "treatment_monitoring",
        "other_complications",
        "patient_stories"
      ],
      "topic_count": 5,
      "tagged_date": "2025-11-15T20:45:57.000000",
      "original_post_date": "Posted 06-12-2024 11:06 AM",
      "original_post_date_iso": "2024-06-12T00:00:00",
      "latest_post_date": "Posted 06-11-2025 11:24 AM",
      "latest_post_date_iso": "2025-06-11T00:00:00",
      "post_count": 13,
      "user_count": 11
    },
    "arikayce-cough": {
      "thread_file": "arikayce-cough_Arikayce-Cough.md",
      "thread_title": "Arikayce Cough",
      "thread_url": "https://connect.ntminfo.org/discussion/arikayce-cough",
      "relevant_topics": [
        "inhaled_medications",
        "medication_side_effects",
        "manual_techniques"
      ],
      "topic_count": 3,
      "tagged_date": "2025-11-15T20:45:58.000000",
      "original_post_date": "Posted 12-09-2024 06:05 AM",
      "original_post_date_iso": "2024-12-09T00:00:00",
      "latest_post_date": "Posted 12-23-2024 11:20 AM",
      "latest_post_date_iso": "2024-12-23T00:00:00",
      "post_count": 4,
      "user_count": 2
    },
    "arikayse": {
      "thread_file": "arikayse_Arikayse.md",
      "thread_title": "Arikayse",
      "thread_url": "https://connect.ntminfo.org/discussion/arikayse",
      "relevant_topics": [
        "inhaled_medications",
        "hearing_complications",
        "medication_side_effects"
      ],
      "topic_count": 3,
      "tagged_date": "2025-11-15T20:45:59.000000",
      "original_post_date": "Posted 10-04-2024 07:20 PM",
      "original_post_date_iso": "2024-10-04T00:00:00",
      "latest_post_date": "Posted 10-05-2024 10:02 AM",
      "latest_post_date_iso": "2024-10-05T00:00:00",
      "post_count": 2,
      "user_count": 1
    },
    "arikayse-1": {
      "thread_file": "arikayse-1_Arikayse.md",
      "thread_title": "Arikayse",
      "thread_url": "https://connect.ntminfo.org/discussion/arikayse-1",
      "relevant_topics": [
        "inhaled_medications",
        "hearing_complications",
        "medication_side_effects",
        "treatment_monitoring"
      ],
      "topic_count": 4,
      "tagged_date": "2025-11-15T20:46:00.000000",
      "original_post_date": "Posted 08-02-2025 03:51 PM",
      "original_post_date_iso": "2025-08-02T00:00:00",
      "latest_post_date": "Posted 08-05-2025 12:52 PM",
      "latest_post_date_iso": "2025-08-05T00:00:00",
      "post_count": 5,
      "user_count": 3
    },
    "arina-1-nebulized-treatment-for-bronchiectasis-update": {
      "thread_file": "arina-1-nebulized-treatment-for-bronchiectasis-update_ARINA-1-nebulized-treatment-for-bronchie.md",
      "thread_title": "ARINA-1 (nebulized treatment for bronchiectasis) UPDATE",
      "thread_url": "https://connect.ntminfo.org/discussion/arina-1-nebulized-treatment-for-bronchiectasis-update",
      "relevant_topics": [
        "research_trials",
        "alternative_therapies",
        "nebulizers"
      ],
      "topic_count": 3,
      "tagged_date": "2025-11-15T20:46:01.000000",
      "original_post_date": "Posted 07-23-2025 05:42 PM",
      "original_post_date_iso": "2025-07-23T00:00:00",
      "latest_post_date": "Posted 07-26-2025 10:55 AM",
      "latest_post_date_iso": "2025-07-26T00:00:00",
      "post_count": 9,
      "user_count": 7
    },
    "arthritis-and-vest": {
      "thread_file": "arthritis-and-vest_Arthritis-and-Vest.md",
      "thread_title": "Arthritis and Vest",
      "thread_url": "https://connect.ntminfo.org/discussion/arthritis-and-vest",
      "relevant_topics": [
        "vest_therapy",
        "other_complications",
        "equipment_maintenance",
        "insurance_costs"
      ],
      "topic_count": 4,
      "tagged_date": "2025-11-15T20:46:02.000000",
      "original_post_date": "Posted 04-07-2025 03:57 PM",
      "original_post_date_iso": "2025-04-07T00:00:00",
      "latest_post_date": "Posted 04-14-2025 09:44 AM",
      "latest_post_date_iso": "2025-04-14T00:00:00",
      "post_count": 14,
      "user_count": 8
    },
    "arthritis-and-vest-1": {
      "thread_file": "arthritis-and-vest-1_Arthritis-and-Vest.md",
      "thread_title": "Arthritis and Vest",
      "thread_url": "https://connect.ntminfo.org/discussion/arthritis-and-vest-1",
      "relevant_topics": [
        "vest_therapy",
        "other_complications",
        "aerobika_opep",
        "medication_side_effects",
        "manual_techniques"
      ],
      "topic_count": 5,
      "tagged_date": "2025-11-15T20:46:03.000000",
      "original_post_date": "Posted 04-08-2025 03:09 PM",
      "original_post_date_iso": "2025-04-08T00:00:00",
      "latest_post_date": "Posted 04-08-2025 03:09 PM",
      "latest_post_date_iso": "2025-04-08T00:00:00",
      "post_count": 1,
      "user_count": 0
    },
    "aspergillus-terreus": {
      "thread_file": "aspergillus-terreus_Aspergillus-Terreus.md",
      "thread_title": "Aspergillus Terreus",
      "thread_url": "https://connect.ntminfo.org/discussion/aspergillus-terreus",
      "relevant_topics": [
        "coinfections",
        "patient_stories",
        "other_complications"
      ],
      "topic_count": 3,
      "tagged_date": "2025-11-15T20:46:04.000000",
      "original_post_date": "Posted 11-11-2024 08:53 PM",
      "original_post_date_iso": "2024-11-11T00:00:00",
      "latest_post_date": "Posted 11-12-2024 02:09 PM",
      "latest_post_date_iso": "2024-11-12T00:00:00",
      "post_count": 4,
      "user_count": 4
    },
    "aspiration": {
      "thread_file": "aspiration_Aspiration.md",
      "thread_title": "Aspiration",
      "thread_url": "https://connect.ntminfo.org/discussion/aspiration",
      "relevant_topics": [
        "other_complications"
      ],
      "topic_count": 1,
      "tagged_date": "2025-11-15T20:46:05.000000",
      "original_post_date": "Posted 04-17-2025 10:31 AM",
      "original_post_date_iso": "2025-04-17T00:00:00",
      "latest_post_date": "Posted 04-17-2025 10:31 AM",
      "latest_post_date_iso": "2025-04-17T00:00:00",
      "post_count": 1,
      "user_count": 0
    },
    "association-franaise-mnt-mon-poumon-mon-air": {
      "thread_file": "association-franaise-mnt-mon-poumon-mon-air_Association-franaise-MNT-Mon-Poumon-Mon.md",
      "thread_title": "Association franaise : MNT Mon Poumon Mon Air",
      "thread_url": "https://connect.ntminfo.org/discussion/association-franaise-mnt-mon-poumon-mon-air",
      "relevant_topics": [
        "emotional_support"
      ],
      "topic_count": 1,
      "tagged_date": "2025-11-15T20:46:06.000000",
      "original_post_date": "Posted 10-25-2023 01:28 PM",
      "original_post_date_iso": "2023-10-25T00:00:00",
      "latest_post_date": "Posted 01-03-2025 12:10 PM",
      "latest_post_date_iso": "2025-01-03T00:00:00",
      "post_count": 15,
      "user_count": 3
    },
    "asymptomatic-but-should-i-be-concerned": {
      "thread_file": "asymptomatic-but-should-i-be-concerned_Asymptomatic-but-should-I-be-concerned.md",
      "thread_title": "Asymptomatic, but should I be concerned?",
      "thread_url": "https://connect.ntminfo.org/discussion/asymptomatic-but-should-i-be-concerned",
      "relevant_topics": [
        "emotional_support",
        "treatment_monitoring",
        "sputum_cultures",
        "patient_stories",
        "medical_centers"
      ],
      "topic_count": 5,
      "tagged_date": "2025-11-15T20:46:07.000000",
      "original_post_date": "Posted 06-12-2025 08:04 PM",
      "original_post_date_iso": "2025-06-12T00:00:00",
      "latest_post_date": "Posted 06-16-2025 11:08 AM",
      "latest_post_date_iso": "2025-06-16T00:00:00",
      "post_count": 4,
      "user_count": 1
    },
    "australia-support-group-june-13-at-3pm-aest": {
      "thread_file": "australia-support-group-june-13-at-3pm-aest_Australia-Support-Group-June-13-at-3pm-A.md",
      "thread_title": "Australia Support Group - June 13 at 3pm AEST",
      "thread_url": "https://connect.ntminfo.org/discussion/australia-support-group-june-13-at-3pm-aest",
      "relevant_topics": [
        "emotional_support"
      ],
      "topic_count": 1,
      "tagged_date": "2025-11-15T20:46:08.000000",
      "original_post_date": "Posted 05-23-2025 09:34 AM",
      "original_post_date_iso": "2025-05-23T00:00:00",
      "latest_post_date": "Posted 06-06-2025 10:34 AM",
      "latest_post_date_iso": "2025-06-06T00:00:00",
      "post_count": 2,
      "user_count": 1
    },
    "autoclave": {
      "thread_file": "autoclave_Autoclave.md",
      "thread_title": "Autoclave",
      "thread_url": "https://connect.ntminfo.org/discussion/autoclave",
      "relevant_topics": [
        "equipment_sterilization",
        "medical_centers"
      ],
      "topic_count": 2,
      "tagged_date": "2025-11-15T20:46:09.000000",
      "original_post_date": "Posted 05-26-2025 09:25 AM",
      "original_post_date_iso": "2025-05-26T00:00:00",
      "latest_post_date": "Posted 05-27-2025 05:05 PM",
      "latest_post_date_iso": "2025-05-27T00:00:00",
      "post_count": 2,
      "user_count": 2
    },
    "ayr-saline-nasal-gel": {
      "thread_file": "ayr-saline-nasal-gel_Ayr-saline-nasal-gel.md",
      "thread_title": "Ayr saline nasal gel",
      "thread_url": "https://connect.ntminfo.org/discussion/ayr-saline-nasal-gel",
      "relevant_topics": [
        "infection_prevention",
        "other_complications"
      ],
      "topic_count": 2,
      "tagged_date": "2025-11-15T20:46:10.000000",
      "original_post_date": "Posted 01-05-2025 09:41 AM",
      "original_post_date_iso": "2025-01-05T00:00:00",
      "latest_post_date": "Posted 01-05-2025 09:41 AM",
      "latest_post_date_iso": "2025-01-05T00:00:00",
      "post_count": 1,
      "user_count": 1
    },
    "ayr-saline-nasal-gel-1": {
      "thread_file": "ayr-saline-nasal-gel-1_Ayr-Saline-Nasal-gel.md",
      "thread_title": "Ayr Saline Nasal gel",
      "thread_url": "https://connect.ntminfo.org/discussion/ayr-saline-nasal-gel-1",
      "relevant_topics": [
        "infection_prevention",
        "equipment_sterilization",
        "other_complications",
        "water_safety"
      ],
      "topic_count": 4,
      "tagged_date": "2025-11-15T20:46:11.000000",
      "original_post_date": "Posted 01-05-2025 09:53 AM",
      "original_post_date_iso": "2025-01-05T00:00:00",
      "latest_post_date": "Posted 01-07-2025 07:49 AM",
      "latest_post_date_iso": "2025-01-07T00:00:00",
      "post_count": 8,
      "user_count": 4
    },
    "azithromycin-and-a-rash": {
      "thread_file": "azithromycin-and-a-rash_Azithromycin-and-a-Rash.md",
      "thread_title": "Azithromycin and a Rash",
      "thread_url": "https://connect.ntminfo.org/discussion/azithromycin-and-a-rash",
      "relevant_topics": [
        "big3_antibiotics",
        "medication_side_effects",
        "species_specific_treatment"
      ],
      "topic_count": 3,
      "tagged_date": "2025-11-15T20:46:12.000000",
      "original_post_date": "Posted 11-09-2024 09:38 AM",
      "original_post_date_iso": "2024-11-09T00:00:00",
      "latest_post_date": "Posted 11-14-2024 02:01 PMEdited by Lorraine Schelfe 11-14-2024 02:02 PM",
      "latest_post_date_iso": "2024-11-14T00:00:00",
      "post_count": 4,
      "user_count": 3
    },
    "baby-bottle-steriliser-papers": {
      "thread_file": "baby-bottle-steriliser-papers_Baby-Bottle-Steriliser-Papers.md",
      "thread_title": "Baby Bottle Steriliser Papers",
      "thread_url": "https://connect.ntminfo.org/discussion/baby-bottle-steriliser-papers",
      "relevant_topics": [
        "equipment_sterilization",
        "research_trials",
        "equipment_maintenance"
      ],
      "topic_count": 3,
      "tagged_date": "2025-11-15T20:46:13.000000",
      "original_post_date": "Posted 04-09-2025 07:47 PM",
      "original_post_date_iso": "2025-04-09T00:00:00",
      "latest_post_date": "Posted 04-15-2025 10:25 AM",
      "latest_post_date_iso": "2025-04-15T00:00:00",
      "post_count": 10,
      "user_count": 7
    },
    "baby-bottle-sterilizer-2": {
      "thread_file": "baby-bottle-sterilizer-2_Baby-Bottle-Sterilizer.md",
      "thread_title": "Baby Bottle Sterilizer",
      "thread_url": "https://connect.ntminfo.org/discussion/baby-bottle-sterilizer-2",
      "relevant_topics": [
        "equipment_sterilization",
        "equipment_maintenance",
        "travel_equipment",
        "water_safety"
      ],
      "topic_count": 4,
      "tagged_date": "2025-11-15T20:46:14.000000",
      "original_post_date": "Posted 08-16-2024 10:34 AM",
      "original_post_date_iso": "2024-08-16T00:00:00",
      "latest_post_date": "Posted 15 days ago",
      "latest_post_date_iso": "2025-10-30T21:31:11.889610",
      "post_count": 50,
      "user_count": 21
    },
    "baby-bottle-sterilizer-3": {
      "thread_file": "baby-bottle-sterilizer-3_Baby-bottle-sterilizer.md",
      "thread_title": "Baby bottle sterilizer",
      "thread_url": "https://connect.ntminfo.org/discussion/baby-bottle-sterilizer-3",
      "relevant_topics": [
        "equipment_sterilization",
        "equipment_maintenance",
        "water_safety"
      ],
      "topic_count": 3,
      "tagged_date": "2025-11-15T20:46:15.000000",
      "original_post_date": "Posted 03-16-2025 12:22 PM",
      "original_post_date_iso": "2025-03-16T00:00:00",
      "latest_post_date": "Posted 2 days ago",
      "latest_post_date_iso": "2025-11-12T21:30:58.939135",
      "post_count": 17,
      "user_count": 8
    },
    "baby-bottle-sterilizer-4": {
      "thread_file": "baby-bottle-sterilizer-4_Baby-Bottle-Sterilizer.md",
      "thread_title": "Baby Bottle Sterilizer",
      "thread_url": "https://connect.ntminfo.org/discussion/baby-bottle-sterilizer-4",
      "relevant_topics": [
        "equipment_sterilization",
        "equipment_maintenance"
      ],
      "topic_count": 2,
      "tagged_date": "2025-11-15T20:46:16.000000",
      "original_post_date": "Posted 10-14-2025 02:33 AM",
      "original_post_date_iso": "2025-10-14T00:00:00",
      "latest_post_date": "Posted 27 days ago",
      "latest_post_date_iso": "2025-10-18T21:30:51.691223",
      "post_count": 7,
      "user_count": 2
    },
    "baby-bottle-sterilizer-temperature": {
      "thread_file": "baby-bottle-sterilizer-temperature_Baby-bottle-sterilizer-temperature.md",
      "thread_title": "Baby bottle sterilizer temperature",
      "thread_url": "https://connect.ntminfo.org/discussion/baby-bottle-sterilizer-temperature",
      "relevant_topics": [
        "equipment_sterilization",
        "equipment_maintenance",
        "research_trials",
        "medical_centers"
      ],
      "topic_count": 4,
      "tagged_date": "2025-11-15T20:46:17.000000",
      "original_post_date": "Posted 07-08-2025 10:35 PM",
      "original_post_date_iso": "2025-07-08T00:00:00",
      "latest_post_date": "Posted 07-15-2025 09:06 AM",
      "latest_post_date_iso": "2025-07-15T00:00:00",
      "post_count": 18,
      "user_count": 9
    },
    "baby-brezza-in-mexico": {
      "thread_file": "baby-brezza-in-mexico_Baby-Brezza-in-Mexico.md",
      "thread_title": "Baby Brezza in Mexico",
      "thread_url": "https://connect.ntminfo.org/discussion/baby-brezza-in-mexico",
      "relevant_topics": [
        "travel_equipment",
        "equipment_sterilization"
      ],
      "topic_count": 2,
      "tagged_date": "2025-11-15T20:46:18.000000",
      "original_post_date": "Posted 09-10-2025 11:14 AM",
      "original_post_date_iso": "2025-09-10T00:00:00",
      "latest_post_date": "Posted 09-12-2025 12:25 PM",
      "latest_post_date_iso": "2025-09-12T00:00:00",
      "post_count": 4,
      "user_count": 3
    },
    "bacteria-safe-plastic": {
      "thread_file": "bacteria-safe-plastic_Bacteria-Safe-Plastic.md",
      "thread_title": "Bacteria Safe Plastic?",
      "thread_url": "https://connect.ntminfo.org/discussion/bacteria-safe-plastic",
      "relevant_topics": [
        "research_trials",
        "aerobika_opep",
        "medical_centers",
        "equipment_maintenance"
      ],
      "topic_count": 4,
      "tagged_date": "2025-11-15T20:46:19.000000",
      "original_post_date": "Posted 06-23-2025 02:56 PM",
      "original_post_date_iso": "2025-06-23T00:00:00",
      "latest_post_date": "Posted 06-24-2025 09:10 AM",
      "latest_post_date_iso": "2025-06-24T00:00:00",
      "post_count": 7,
      "user_count": 6
    },
    "bactrim": {
      "thread_file": "bactrim_Bactrim.md",
      "thread_title": "Bactrim",
      "thread_url": "https://connect.ntminfo.org/discussion/bactrim",
      "relevant_topics": [
        "coinfections",
        "medication_side_effects",
        "medical_centers"
      ],
      "topic_count": 3,
      "tagged_date": "2025-11-15T20:46:20.000000",
      "original_post_date": "Posted 04-10-2025 02:58 PM",
      "original_post_date_iso": "2025-04-10T00:00:00",
      "latest_post_date": "Posted 04-11-2025 10:10 AM",
      "latest_post_date_iso": "2025-04-11T00:00:00",
      "post_count": 3,
      "user_count": 2
    },
    "baskets-with-mildew": {
      "thread_file": "baskets-with-mildew_Baskets-with-mildew.md",
      "thread_title": "Baskets with mildew",
      "thread_url": "https://connect.ntminfo.org/discussion/baskets-with-mildew",
      "relevant_topics": [
        "environmental_exposures",
        "infection_prevention"
      ],
      "topic_count": 2,
      "tagged_date": "2025-11-15T20:46:21.000000",
      "original_post_date": "Posted 02-03-2025 11:51 AM",
      "original_post_date_iso": "2025-02-03T00:00:00",
      "latest_post_date": "Posted 02-03-2025 11:51 AM",
      "latest_post_date_iso": "2025-02-03T00:00:00",
      "post_count": 1,
      "user_count": 1
    },
    "bath-takers": {
      "thread_file": "bath-takers_Bath-takers.md",
      "thread_title": "Bath takers",
      "thread_url": "https://connect.ntminfo.org/discussion/bath-takers",
      "relevant_topics": [
        "water_safety",
        "environmental_exposures",
        "medical_centers",
        "infection_prevention"
      ],
      "topic_count": 4,
      "tagged_date": "2025-11-15T20:46:22.000000",
      "original_post_date": "Posted 08-31-2025 08:02 AM",
      "original_post_date_iso": "2025-08-31T00:00:00",
      "latest_post_date": "Posted 09-14-2025 10:36 AM",
      "latest_post_date_iso": "2025-09-14T00:00:00",
      "post_count": 10,
      "user_count": 4
    },
    "be-mac-airway-clearance-talk-w-head-of-lenox-hill-hospital-program-wed-42425": {
      "thread_file": "be-mac-airway-clearance-talk-w-head-of-lenox-hill-hospital-program-wed-42425_BE-MAC-Airway-Clearance-talk-w-head-of-L.md",
      "thread_title": "BE, MAC, Airway Clearance talk w/ head of Lenox Hill Hospital program -Wed 4/23/25",
      "thread_url": "https://connect.ntminfo.org/discussion/be-mac-airway-clearance-talk-w-head-of-lenox-hill-hospital-program-wed-42425",
      "relevant_topics": [
        "medical_centers",
        "manual_techniques",
        "exercise_activity"
      ],
      "topic_count": 3,
      "tagged_date": "2025-11-15T20:46:23.000000",
      "original_post_date": "Posted 04-18-2025 09:39 AMEdited by Bekah Weidner 04-18-2025 10:41 AM",
      "original_post_date_iso": "2025-04-18T00:00:00",
      "latest_post_date": "Posted 04-20-2025 12:03 PM",
      "latest_post_date_iso": "2025-04-20T00:00:00",
      "post_count": 5,
      "user_count": 3
    },
    "bed-wedge": {
      "thread_file": "bed-wedge_Bed-wedge.md",
      "thread_title": "Bed wedge",
      "thread_url": "https://connect.ntminfo.org/discussion/bed-wedge",
      "relevant_topics": [
        "digestive_issues",
        "other_complications"
      ],
      "topic_count": 2,
      "tagged_date": "2025-11-15T20:46:24.000000",
      "original_post_date": "Posted 02-29-2024 11:22 AM",
      "original_post_date_iso": "2024-02-29T00:00:00",
      "latest_post_date": "Posted 07-13-2025 08:08 AM",
      "latest_post_date_iso": "2025-07-13T00:00:00",
      "post_count": 19,
      "user_count": 9
    },
    "bedaquelene": {
      "thread_file": "bedaquelene_Bedaquelene.md",
      "thread_title": "Bedaquelene",
      "thread_url": "https://connect.ntminfo.org/discussion/bedaquelene",
      "relevant_topics": [
        "newer_antibiotics",
        "species_specific_treatment",
        "insurance_costs",
        "patient_stories"
      ],
      "topic_count": 4,
      "tagged_date": "2025-11-15T20:46:25.000000",
      "original_post_date": "Posted 12-20-2024 12:35 PM",
      "original_post_date_iso": "2024-12-20T00:00:00",
      "latest_post_date": "Posted 12-23-2024 04:45 PM",
      "latest_post_date_iso": "2024-12-23T00:00:00",
      "post_count": 5,
      "user_count": 2
    },
    "best-shower-head-for-preventing-bacteria": {
      "thread_file": "best-shower-head-for-preventing-bacteria_Best-shower-head-for-preventing-bacteria.md",
      "thread_title": "Best shower head for preventing bacteria",
      "thread_url": "https://connect.ntminfo.org/discussion/best-shower-head-for-preventing-bacteria",
      "relevant_topics": [
        "water_safety",
        "infection_prevention",
        "medical_centers",
        "equipment_maintenance",
        "environmental_exposures"
      ],
      "topic_count": 5,
      "tagged_date": "2025-11-15T20:46:26.000000",
      "original_post_date": "Posted 07-14-2024 11:34 AM",
      "original_post_date_iso": "2024-07-14T00:00:00",
      "latest_post_date": "Posted 10-12-2025 05:47 PM",
      "latest_post_date_iso": "2025-10-12T00:00:00",
      "post_count": 34,
      "user_count": 12
    },
    "best-times-for-act": {
      "thread_file": "best-times-for-act_Best-times-for-ACT.md",
      "thread_title": "Best times for ACT",
      "thread_url": "https://connect.ntminfo.org/discussion/best-times-for-act",
      "relevant_topics": [
        "manual_techniques",
        "saline_therapy",
        "aerobika_opep",
        "equipment_sterilization",
        "exercise_activity",
        "work_employment"
      ],
      "topic_count": 6,
      "tagged_date": "2025-11-15T20:46:27.000000",
      "original_post_date": "Posted 10-29-2024 10:21 PM",
      "original_post_date_iso": "2024-10-29T00:00:00",
      "latest_post_date": "Posted 10-31-2024 11:04 AM",
      "latest_post_date_iso": "2024-10-31T00:00:00",
      "post_count": 13,
      "user_count": 8
    },
    "big-3-and-progression": {
      "thread_file": "big-3-and-progression_Big-3-and-progression.md",
      "thread_title": "Big 3 and progression",
      "thread_url": "https://connect.ntminfo.org/discussion/big-3-and-progression",
      "relevant_topics": [
        "big3_antibiotics",
        "sputum_cultures",
        "coinfections",
        "treatment_monitoring",
        "patient_stories"
      ],
      "topic_count": 5,
      "tagged_date": "2025-11-15T20:46:28.000000",
      "original_post_date": "Posted 03-22-2025 10:12 AM",
      "original_post_date_iso": "2025-03-22T00:00:00",
      "latest_post_date": "Posted 03-23-2025 09:40 AM",
      "latest_post_date_iso": "2025-03-23T00:00:00",
      "post_count": 4,
      "user_count": 1
    },
    "big-globs-of-mucous": {
      "thread_file": "big-globs-of-mucous_Big-globs-of-mucous.md",
      "thread_title": "Big globs of mucous",
      "thread_url": "https://connect.ntminfo.org/discussion/big-globs-of-mucous",
      "relevant_topics": [
        "manual_techniques",
        "aerobika_opep",
        "saline_therapy",
        "coinfections",
        "sputum_cultures",
        "equipment_maintenance"
      ],
      "topic_count": 6,
      "tagged_date": "2025-11-15T20:46:29.000000",
      "original_post_date": "Posted 12-04-2024 06:54 PM",
      "original_post_date_iso": "2024-12-04T00:00:00",
      "latest_post_date": "Posted 12-07-2024 09:33 AM",
      "latest_post_date_iso": "2024-12-07T00:00:00",
      "post_count": 15,
      "user_count": 9
    },
    "biwaze-clear-system": {
      "thread_file": "biwaze-clear-system_BiWaze-Clear-System.md",
      "thread_title": "BiWaze Clear System",
      "thread_url": "https://connect.ntminfo.org/discussion/biwaze-clear-system",
      "relevant_topics": [
        "manual_techniques",
        "equipment_maintenance",
        "equipment_sterilization",
        "aerobika_opep"
      ],
      "topic_count": 4,
      "tagged_date": "2025-11-15T20:46:30.000000",
      "original_post_date": "Posted 07-14-2025 10:58 AM",
      "original_post_date_iso": "2025-07-14T00:00:00",
      "latest_post_date": "Posted 08-13-2025 12:09 PM",
      "latest_post_date_iso": "2025-08-13T00:00:00",
      "post_count": 11,
      "user_count": 4
    },
    "biwaze-clear-system-1": {
      "thread_file": "biwaze-clear-system-1_BiWaze-Clear-System.md",
      "thread_title": "BiWaze Clear System",
      "thread_url": "https://connect.ntminfo.org/discussion/biwaze-clear-system-1",
      "relevant_topics": [
        "equipment_maintenance",
        "equipment_sterilization",
        "manual_techniques"
      ],
      "topic_count": 3,
      "tagged_date": "2025-11-15T20:46:31.000000",
      "original_post_date": "Posted 08-20-2025 06:05 PM",
      "original_post_date_iso": "2025-08-20T00:00:00",
      "latest_post_date": "Posted 08-21-2025 09:17 AM",
      "latest_post_date_iso": "2025-08-21T00:00:00",
      "post_count": 2,
      "user_count": 2
    },
    "biwaze-clear-system-2": {
      "thread_file": "biwaze-clear-system-2_BiWaze-Clear-System.md",
      "thread_title": "BiWaze Clear System",
      "thread_url": "https://connect.ntminfo.org/discussion/biwaze-clear-system-2",
      "relevant_topics": [
        "manual_techniques",
        "equipment_maintenance"
      ],
      "topic_count": 2,
      "tagged_date": "2025-11-15T20:46:32.000000",
      "original_post_date": "Posted 7 days ago",
      "original_post_date_iso": "2025-11-07T21:31:23.958480",
      "latest_post_date": "Posted 7 days ago",
      "latest_post_date_iso": "2025-11-07T21:31:23.958480",
      "post_count": 1,
      "user_count": 1
    },
    "biwaze-clear-system-3": {
      "thread_file": "biwaze-clear-system-3_BiWaze-Clear-System.md",
      "thread_title": "BiWaze Clear System",
      "thread_url": "https://connect.ntminfo.org/discussion/biwaze-clear-system-3",
      "relevant_topics": [
        "equipment_maintenance",
        "equipment_sterilization"
      ],
      "topic_count": 2,
      "tagged_date": "2025-11-15T20:46:33.000000",
      "original_post_date": "Posted 7 days ago",
      "original_post_date_iso": "2025-11-07T21:31:24.252584",
      "latest_post_date": "Posted 7 days ago",
      "latest_post_date_iso": "2025-11-07T21:31:24.252584",
      "post_count": 1,
      "user_count": 1
    },
    "biwaze-clear-system-4": {
      "thread_file": "biwaze-clear-system-4_BiWaze-Clear-System.md",
      "thread_title": "BiWaze Clear System",
      "thread_url": "https://connect.ntminfo.org/discussion/biwaze-clear-system-4",
      "relevant_topics": [
        "manual_techniques",
        "equipment_maintenance"
      ],
      "topic_count": 2,
      "tagged_date": "2025-11-15T20:46:34.000000",
      "original_post_date": "Posted 4 days ago",
      "original_post_date_iso": "2025-11-10T21:31:37.649014",
      "latest_post_date": "Posted 3 days ago",
      "latest_post_date_iso": "2025-11-11T21:31:37.649014",
      "post_count": 2,
      "user_count": 1
    },
    "bloated": {
      "thread_file": "bloated_Bloated.md",
      "thread_title": "Bloated",
      "thread_url": "https://connect.ntminfo.org/discussion/bloated",
      "relevant_topics": [
        "digestive_issues",
        "other_complications"
      ],
      "topic_count": 2,
      "tagged_date": "2025-11-15T20:46:35.000000",
      "original_post_date": "Posted 05-28-2025 01:59 AM",
      "original_post_date_iso": "2025-05-28T00:00:00",
      "latest_post_date": "Posted 05-30-2025 10:31 AM",
      "latest_post_date_iso": "2025-05-30T00:00:00",
      "post_count": 3,
      "user_count": 3
    },
    "blood-thinners": {
      "thread_file": "blood-thinners_Blood-thinners.md",
      "thread_title": "Blood thinners",
      "thread_url": "https://connect.ntminfo.org/discussion/blood-thinners",
      "relevant_topics": [
        "other_complications",
        "medication_side_effects",
        "patient_stories"
      ],
      "topic_count": 3,
      "tagged_date": "2025-11-15T20:46:36.000000",
      "original_post_date": "Posted 12-07-2024 08:55 AM",
      "original_post_date_iso": "2024-12-07T00:00:00",
      "latest_post_date": "Posted 12-10-2024 09:08 AM",
      "latest_post_date_iso": "2024-12-10T00:00:00",
      "post_count": 14,
      "user_count": 6
    },
    "blood-tinged-sputum": {
      "thread_file": "blood-tinged-sputum_blood-tinged-sputum.md",
      "thread_title": "blood tinged sputum",
      "thread_url": "https://connect.ntminfo.org/discussion/blood-tinged-sputum",
      "relevant_topics": [
        "other_complications",
        "saline_therapy",
        "manual_techniques",
        "nebulizers",
        "emotional_support",
        "patient_stories"
      ],
      "topic_count": 6,
      "tagged_date": "2025-11-15T20:46:37.000000",
      "original_post_date": "Posted 10-24-2024 07:54 PM",
      "original_post_date_iso": "2024-10-24T00:00:00",
      "latest_post_date": "Posted 10-29-2024 09:27 AM",
      "latest_post_date_iso": "2024-10-29T00:00:00",
      "post_count": 15,
      "user_count": 7
    },
    "blood-work-when-taking-antibiotics": {
      "thread_file": "blood-work-when-taking-antibiotics_Blood-work-when-taking-antibiotics.md",
      "thread_title": "Blood work when taking antibiotics",
      "thread_url": "https://connect.ntminfo.org/discussion/blood-work-when-taking-antibiotics",
      "relevant_topics": [
        "big3_antibiotics",
        "treatment_monitoring",
        "emotional_support",
        "medical_centers",
        "patient_stories"
      ],
      "topic_count": 5,
      "tagged_date": "2025-11-15T20:46:38.000000",
      "original_post_date": "Posted 07-22-2025 02:56 PM",
      "original_post_date_iso": "2025-07-22T00:00:00",
      "latest_post_date": "Posted 07-27-2025 06:43 AM",
      "latest_post_date_iso": "2025-07-27T00:00:00",
      "post_count": 11,
      "user_count": 7
    },
    "bobolo-baby-bottle-sterilizer-and-dryer": {
      "thread_file": "bobolo-baby-bottle-sterilizer-and-dryer_Bobolo-Baby-Bottle-Sterilizer-and-Dryer.md",
      "thread_title": "Bobolo Baby Bottle Sterilizer and Dryer",
      "thread_url": "https://connect.ntminfo.org/discussion/bobolo-baby-bottle-sterilizer-and-dryer",
      "relevant_topics": [
        "equipment_sterilization",
        "equipment_maintenance",
        "aerobika_opep"
      ],
      "topic_count": 3,
      "tagged_date": "2025-11-15T20:46:39.000000",
      "original_post_date": "Posted 5 days ago",
      "original_post_date_iso": "2025-11-09T21:31:42.222659",
      "latest_post_date": "Posted 4 days ago",
      "latest_post_date_iso": "2025-11-10T21:31:42.222659",
      "post_count": 5,
      "user_count": 2
    },
    "body-adjustments-after-stopping-antibiotics": {
      "thread_file": "body-adjustments-after-stopping-antibiotics_body-adjustments-after-stopping-antibiot.md",
      "thread_title": "body adjustments after stopping antibiotics",
      "thread_url": "https://connect.ntminfo.org/discussion/body-adjustments-after-stopping-antibiotics",
      "relevant_topics": [
        "big3_antibiotics",
        "medication_side_effects",
        "saline_therapy",
        "manual_techniques",
        "patient_stories",
        "emotional_support"
      ],
      "topic_count": 6,
      "tagged_date": "2025-11-15T20:46:40.000000",
      "original_post_date": "Posted 08-10-2025 03:42 PM",
      "original_post_date_iso": "2025-08-10T00:00:00",
      "latest_post_date": "Posted 08-19-2025 03:44 PM",
      "latest_post_date_iso": "2025-08-19T00:00:00",
      "post_count": 12,
      "user_count": 6
    },
    "boiling-aerobika-in-vinegar-added-water": {
      "thread_file": "boiling-aerobika-in-vinegar-added-water_Boiling-Aerobika-in-vinegar-added-water.md",
      "thread_title": "Boiling Aerobika in vinegar added water",
      "thread_url": "https://connect.ntminfo.org/discussion/boiling-aerobika-in-vinegar-added-water",
      "relevant_topics": [
        "aerobika_opep",
        "equipment_sterilization",
        "water_safety"
      ],
      "topic_count": 3,
      "tagged_date": "2025-11-15T20:46:41.000000",
      "original_post_date": "Posted 10-14-2024 09:56 PM",
      "original_post_date_iso": "2024-10-14T00:00:00",
      "latest_post_date": "Posted 10-18-2024 12:42 PM",
      "latest_post_date_iso": "2024-10-18T00:00:00",
      "post_count": 10,
      "user_count": 4
    },
    "boiling-method-to-remove-plastics-in-water": {
      "thread_file": "boiling-method-to-remove-plastics-in-water_Boiling-Method-to-Remove-Plastics-in-Wat.md",
      "thread_title": "Boiling Method to Remove Plastics in Water?",
      "thread_url": "https://connect.ntminfo.org/discussion/boiling-method-to-remove-plastics-in-water",
      "relevant_topics": [
        "water_safety",
        "equipment_sterilization"
      ],
      "topic_count": 2,
      "tagged_date": "2025-11-15T21:00:00.000000",
      "original_post_date": "Posted 04-17-2025 02:59 PM",
      "original_post_date_iso": "2025-04-17T00:00:00",
      "latest_post_date": "Posted 04-18-2025 07:30 PM",
      "latest_post_date_iso": "2025-04-18T00:00:00",
      "post_count": 2,
      "user_count": 2
    },
    "boiling-neb-equipment-questions-timing-and-materials": {
      "thread_file": "boiling-neb-equipment-questions-timing-and-materials_Boiling-Neb-Equipment-Questions-Timing-a.md",
      "thread_title": "Boiling Neb Equipment Questions - Timing and Materials",
      "thread_url": "https://connect.ntminfo.org/discussion/boiling-neb-equipment-questions-timing-and-materials",
      "relevant_topics": [
        "equipment_sterilization",
        "nebulizers",
        "equipment_maintenance"
      ],
      "topic_count": 3,
      "tagged_date": "2025-11-15T21:00:01.000000",
      "original_post_date": "Posted 08-29-2025 10:45 AM",
      "original_post_date_iso": "2025-08-29T00:00:00",
      "latest_post_date": "Posted 08-29-2025 10:45 AM",
      "latest_post_date_iso": "2025-08-29T00:00:00",
      "post_count": 2,
      "user_count": 0
    },
    "boiling-time": {
      "thread_file": "boiling-time_Boiling-time.md",
      "thread_title": "Boiling time",
      "thread_url": "https://connect.ntminfo.org/discussion/boiling-time",
      "relevant_topics": [
        "equipment_sterilization",
        "water_safety"
      ],
      "topic_count": 2,
      "tagged_date": "2025-11-15T21:00:02.000000",
      "original_post_date": "Posted 02-25-2025 01:05 PM",
      "original_post_date_iso": "2025-02-25T00:00:00",
      "latest_post_date": "Posted 02-28-2025 11:11 AM",
      "latest_post_date_iso": "2025-02-28T00:00:00",
      "post_count": 3,
      "user_count": 1
    },
    "bololo-baby-bottle-steralizer-drying-cycle": {
      "thread_file": "bololo-baby-bottle-steralizer-drying-cycle_Bololo-Baby-Bottle-Steralizer-drying-cyc.md",
      "thread_title": "Bololo Baby Bottle Steralizer - drying cycle",
      "thread_url": "https://connect.ntminfo.org/discussion/bololo-baby-bottle-steralizer-drying-cycle",
      "relevant_topics": [
        "equipment_sterilization",
        "equipment_maintenance",
        "nebulizers",
        "aerobika_opep"
      ],
      "topic_count": 4,
      "tagged_date": "2025-11-15T21:00:03.000000",
      "original_post_date": "Posted 04-16-2024 08:46 PM",
      "original_post_date_iso": "2024-04-16T00:00:00",
      "latest_post_date": "Posted 10-14-2025 10:59 AM",
      "latest_post_date_iso": "2025-10-14T00:00:00",
      "post_count": 5,
      "user_count": 5
    },
    "bololo-baby-bottle-sterilizer": {
      "thread_file": "bololo-baby-bottle-sterilizer_Bololo-Baby-Bottle-sterilizer.md",
      "thread_title": "Bololo Baby Bottle sterilizer",
      "thread_url": "https://connect.ntminfo.org/discussion/bololo-baby-bottle-sterilizer",
      "relevant_topics": [
        "equipment_sterilization",
        "equipment_maintenance",
        "aerobika_opep",
        "nebulizers"
      ],
      "topic_count": 4,
      "tagged_date": "2025-11-15T21:00:04.000000",
      "original_post_date": "Posted 06-18-2024 09:16 AM",
      "original_post_date_iso": "2024-06-18T00:00:00",
      "latest_post_date": "Posted yesterday",
      "latest_post_date_iso": "2025-11-13T21:31:34.839536",
      "post_count": 13,
      "user_count": 7
    },
    "bololo-baby-bottle-sterilizer-1": {
      "thread_file": "bololo-baby-bottle-sterilizer-1_Bololo-baby-bottle-sterilizer.md",
      "thread_title": "Bololo baby bottle sterilizer",
      "thread_url": "https://connect.ntminfo.org/discussion/bololo-baby-bottle-sterilizer-1",
      "relevant_topics": [
        "equipment_sterilization",
        "equipment_maintenance"
      ],
      "topic_count": 2,
      "tagged_date": "2025-11-15T21:00:05.000000",
      "original_post_date": "Posted 07-23-2025 10:30 AM",
      "original_post_date_iso": "2025-07-23T00:00:00",
      "latest_post_date": "Posted 07-23-2025 10:30 AM",
      "latest_post_date_iso": "2025-07-23T00:00:00",
      "post_count": 1,
      "user_count": 1
    },
    "bololo-bottle-sterilizer": {
      "thread_file": "bololo-bottle-sterilizer_Bololo-Bottle-Sterilizer.md",
      "thread_title": "Bololo Bottle Sterilizer",
      "thread_url": "https://connect.ntminfo.org/discussion/bololo-bottle-sterilizer",
      "relevant_topics": [
        "equipment_sterilization",
        "equipment_maintenance",
        "aerobika_opep",
        "nebulizers",
        "research_trials",
        "infection_prevention"
      ],
      "topic_count": 6,
      "tagged_date": "2025-11-15T21:00:06.000000",
      "original_post_date": "Posted 02-01-2024 06:22 PM",
      "original_post_date_iso": "2024-02-01T00:00:00",
      "latest_post_date": "Posted 08-21-2025 04:34 PM",
      "latest_post_date_iso": "2025-08-21T00:00:00",
      "post_count": 140,
      "user_count": 25
    },
    "bololo-bottle-sterilizer-1": {
      "thread_file": "bololo-bottle-sterilizer-1_Bololo-Bottle-Sterilizer.md",
      "thread_title": "Bololo Bottle Sterilizer",
      "thread_url": "https://connect.ntminfo.org/discussion/bololo-bottle-sterilizer-1",
      "relevant_topics": [
        "equipment_sterilization",
        "equipment_maintenance",
        "manual_techniques"
      ],
      "topic_count": 3,
      "tagged_date": "2025-11-15T21:00:07.000000",
      "original_post_date": "Posted 04-08-2025 05:04 PM",
      "original_post_date_iso": "2025-04-08T00:00:00",
      "latest_post_date": "Posted 05-12-2025 09:51 AM",
      "latest_post_date_iso": "2025-05-12T00:00:00",
      "post_count": 9,
      "user_count": 6
    },
    "bololo-hepa-filters": {
      "thread_file": "bololo-hepa-filters_Bololo-HEPA-Filters.md",
      "thread_title": "Bololo HEPA Filters",
      "thread_url": "https://connect.ntminfo.org/discussion/bololo-hepa-filters",
      "relevant_topics": [
        "equipment_sterilization",
        "equipment_maintenance",
        "research_trials"
      ],
      "topic_count": 3,
      "tagged_date": "2025-11-15T21:00:08.000000",
      "original_post_date": "Posted 04-07-2025 08:21 AM",
      "original_post_date_iso": "2025-04-07T00:00:00",
      "latest_post_date": "Posted 04-11-2025 12:35 PM",
      "latest_post_date_iso": "2025-04-11T00:00:00",
      "post_count": 5,
      "user_count": 4
    },
    "bottle-sterilizer-1": {
      "thread_file": "bottle-sterilizer-1_Bottle-Sterilizer.md",
      "thread_title": "Bottle Sterilizer",
      "thread_url": "https://connect.ntminfo.org/discussion/bottle-sterilizer-1",
      "relevant_topics": [
        "equipment_sterilization",
        "nebulizers",
        "equipment_maintenance"
      ],
      "topic_count": 3,
      "tagged_date": "2025-11-15T21:00:09.000000",
      "original_post_date": "Posted 05-06-2025 10:29 AM",
      "original_post_date_iso": "2025-05-06T00:00:00",
      "latest_post_date": "Posted 05-11-2025 08:32 PM",
      "latest_post_date_iso": "2025-05-11T00:00:00",
      "post_count": 3,
      "user_count": 3
    },
    "breathing-issues": {
      "thread_file": "breathing-issues_Breathing-issues.md",
      "thread_title": "Breathing issues",
      "thread_url": "https://connect.ntminfo.org/discussion/breathing-issues",
      "relevant_topics": [
        "other_complications",
        "exercise_activity",
        "big3_antibiotics",
        "patient_stories",
        "emotional_support"
      ],
      "topic_count": 5,
      "tagged_date": "2025-11-15T21:00:10.000000",
      "original_post_date": "Posted 08-29-2025 05:47 PM",
      "original_post_date_iso": "2025-08-29T00:00:00",
      "latest_post_date": "Posted 08-30-2025 09:15 AM",
      "latest_post_date_iso": "2025-08-30T00:00:00",
      "post_count": 10,
      "user_count": 7
    },
    "brensocatib": {
      "thread_file": "brensocatib_Brensocatib.md",
      "thread_title": "Brensocatib",
      "thread_url": "https://connect.ntminfo.org/discussion/brensocatib",
      "relevant_topics": [
        "newer_antibiotics",
        "insurance_costs",
        "research_trials",
        "species_specific_treatment"
      ],
      "topic_count": 4,
      "tagged_date": "2025-11-15T21:00:11.000000",
      "original_post_date": "Posted 08-14-2025 10:23 AM",
      "original_post_date_iso": "2025-08-14T00:00:00",
      "latest_post_date": "Posted 08-22-2025 10:22 AM",
      "latest_post_date_iso": "2025-08-22T00:00:00",
      "post_count": 21,
      "user_count": 10
    },
    "brensocatib-1": {
      "thread_file": "brensocatib-1_Brensocatib.md",
      "thread_title": "Brensocatib",
      "thread_url": "https://connect.ntminfo.org/discussion/brensocatib-1",
      "relevant_topics": [
        "newer_antibiotics",
        "research_trials"
      ],
      "topic_count": 2,
      "tagged_date": "2025-11-15T21:00:12.000000",
      "original_post_date": "Posted 08-16-2025 09:42 AM",
      "original_post_date_iso": "2025-08-16T00:00:00",
      "latest_post_date": "Posted 08-16-2025 09:42 AM",
      "latest_post_date_iso": "2025-08-16T00:00:00",
      "post_count": 1,
      "user_count": 1
    },
    "brensocatib-aspen-trial-results-in-nejm": {
      "thread_file": "brensocatib-aspen-trial-results-in-nejm_Brensocatib-ASPEN-Trial-results-in-NEJM.md",
      "thread_title": "Brensocatib ASPEN Trial results in NEJM",
      "thread_url": "https://connect.ntminfo.org/discussion/brensocatib-aspen-trial-results-in-nejm",
      "relevant_topics": [
        "research_trials",
        "newer_antibiotics"
      ],
      "topic_count": 2,
      "tagged_date": "2025-11-15T21:00:13.000000",
      "original_post_date": "Posted 04-27-2025 09:41 AM",
      "original_post_date_iso": "2025-04-27T00:00:00",
      "latest_post_date": "Posted 07-29-2025 09:56 AM",
      "latest_post_date_iso": "2025-07-29T00:00:00",
      "post_count": 6,
      "user_count": 4
    },
    "brensocatib-for-bronchiectasis-treatment": {
      "thread_file": "brensocatib-for-bronchiectasis-treatment_Brensocatib-for-bronchiectasis-treatment.md",
      "thread_title": "\"Brensocatib\" for bronchiectasis treatment?",
      "thread_url": "https://connect.ntminfo.org/discussion/brensocatib-for-bronchiectasis-treatment",
      "relevant_topics": [
        "newer_antibiotics",
        "research_trials",
        "medication_side_effects"
      ],
      "topic_count": 3,
      "tagged_date": "2025-11-15T21:00:14.000000",
      "original_post_date": "Posted 01-25-2025 08:14 AM",
      "original_post_date_iso": "2025-01-25T00:00:00",
      "latest_post_date": "Posted 01-28-2025 06:34 PM",
      "latest_post_date_iso": "2025-01-28T00:00:00",
      "post_count": 6,
      "user_count": 6
    },
    "bringing-up-blood": {
      "thread_file": "bringing-up-blood_Bringing-up-Blood.md",
      "thread_title": "Bringing up Blood",
      "thread_url": "https://connect.ntminfo.org/discussion/bringing-up-blood",
      "relevant_topics": [
        "other_complications",
        "big3_antibiotics",
        "medication_side_effects",
        "emotional_support",
        "travel_safety",
        "aerobika_opep",
        "manual_techniques"
      ],
      "topic_count": 7,
      "tagged_date": "2025-11-15T21:15:00.000000",
      "original_post_date": "Posted 01-02-2025 03:07 PM",
      "original_post_date_iso": "2025-01-02T00:00:00",
      "latest_post_date": "Posted 04-13-2025 08:03 PM",
      "latest_post_date_iso": "2025-04-13T00:00:00",
      "post_count": 38,
      "user_count": 16
    },
    "brinsupri": {
      "thread_file": "brinsupri_Brinsupri.md",
      "thread_title": "Brinsupri",
      "thread_url": "https://connect.ntminfo.org/discussion/brinsupri",
      "relevant_topics": [
        "newer_antibiotics",
        "medication_side_effects",
        "patient_stories"
      ],
      "topic_count": 3,
      "tagged_date": "2025-11-15T21:15:01.000000",
      "original_post_date": "Posted 10-04-2025 08:01 AM",
      "original_post_date_iso": "2025-10-04T00:00:00",
      "latest_post_date": "Posted 10-14-2025 09:17 AM",
      "latest_post_date_iso": "2025-10-14T00:00:00",
      "post_count": 7,
      "user_count": 5
    },
    "brinsupri-a-beginning-for-the-bronchiectasis-community": {
      "thread_file": "brinsupri-a-beginning-for-the-bronchiectasis-community_BRINSUPRI-A-Beginning-for-the-Bronchiect.md",
      "thread_title": "BRINSUPRI: A Beginning for the Bronchiectasis Community",
      "thread_url": "https://connect.ntminfo.org/discussion/brinsupri-a-beginning-for-the-bronchiectasis-community",
      "relevant_topics": [
        "newer_antibiotics",
        "research_trials",
        "medical_centers",
        "patient_stories"
      ],
      "topic_count": 4,
      "tagged_date": "2025-11-15T21:15:02.000000",
      "original_post_date": "Posted 6 days ago",
      "original_post_date_iso": "2025-11-08T21:31:20.357864",
      "latest_post_date": "Posted 2 days ago",
      "latest_post_date_iso": "2025-11-12T21:31:20.357864",
      "post_count": 12,
      "user_count": 6
    },
    "brinsupri-formulary": {
      "thread_file": "brinsupri-formulary_Brinsupri-formulary.md",
      "thread_title": "Brinsupri formulary",
      "thread_url": "https://connect.ntminfo.org/discussion/brinsupri-formulary",
      "relevant_topics": [
        "insurance_costs",
        "newer_antibiotics"
      ],
      "topic_count": 2,
      "tagged_date": "2025-11-15T21:15:03.000000",
      "original_post_date": "Posted 23 days ago",
      "original_post_date_iso": "2025-10-22T21:31:04.658774",
      "latest_post_date": "Posted 14 days ago",
      "latest_post_date_iso": "2025-10-31T21:31:04.658774",
      "post_count": 19,
      "user_count": 12
    },
    "brinsupribrensocatib-becomes-first-fda-approved-treatment-for-bronchiectasis": {
      "thread_file": "brinsupribrensocatib-becomes-first-fda-approved-treatment-for-bronchiectasis_BRINSUPRI-brensocatib-Becomes-First-FDA-.md",
      "thread_title": "BRINSUPRI (brensocatib) Becomes First FDA-Approved Treatment for Bronchiectasis",
      "thread_url": "https://connect.ntminfo.org/discussion/brinsupribrensocatib-becomes-first-fda-approved-treatment-for-bronchiectasis",
      "relevant_topics": [
        "newer_antibiotics",
        "research_trials",
        "medication_side_effects",
        "treatment_monitoring"
      ],
      "topic_count": 4,
      "tagged_date": "2025-11-15T21:15:04.000000",
      "original_post_date": "Posted 08-12-2025 01:02 PM",
      "original_post_date_iso": "2025-08-12T00:00:00",
      "latest_post_date": "Posted 08-17-2025 10:37 AM",
      "latest_post_date_iso": "2025-08-17T00:00:00",
      "post_count": 46,
      "user_count": 18
    },
    "broken-ribs-possibly-due-to-wearing-vest-while-nebulizing": {
      "thread_file": "broken-ribs-possibly-due-to-wearing-vest-while-nebulizing_Broken-ribs-possibly-due-to-wearing-vest.md",
      "thread_title": "Broken ribs possibly due to wearing vest while nebulizing",
      "thread_url": "https://connect.ntminfo.org/discussion/broken-ribs-possibly-due-to-wearing-vest-while-nebulizing",
      "relevant_topics": [
        "vest_therapy",
        "other_complications",
        "patient_stories"
      ],
      "topic_count": 3,
      "tagged_date": "2025-11-15T21:15:05.000000",
      "original_post_date": "Posted 07-10-2025 09:52 AM",
      "original_post_date_iso": "2025-07-10T00:00:00",
      "latest_post_date": "Posted 07-11-2025 02:48 PM",
      "latest_post_date_iso": "2025-07-11T00:00:00",
      "post_count": 2,
      "user_count": 1
    },
    "bronch-and-mac-recently-diagnosed": {
      "thread_file": "bronch-and-mac-recently-diagnosed_Bronch-and-Mac-Recently-Diagnosed.md",
      "thread_title": "Bronch and Mac- Recently Diagnosed",
      "thread_url": "https://connect.ntminfo.org/discussion/bronch-and-mac-recently-diagnosed",
      "relevant_topics": [
        "emotional_support",
        "patient_stories",
        "travel_equipment",
        "water_safety",
        "environmental_exposures",
        "work_employment",
        "exercise_activity",
        "infection_prevention",
        "equipment_sterilization"
      ],
      "topic_count": 9,
      "tagged_date": "2025-11-15T21:15:06.000000",
      "original_post_date": "Posted 10-05-2025 11:02 AM",
      "original_post_date_iso": "2025-10-05T00:00:00",
      "latest_post_date": "Posted 10-12-2025 12:19 PM",
      "latest_post_date_iso": "2025-10-12T00:00:00",
      "post_count": 29,
      "user_count": 11
    },
    "bronchial-artery-embolization": {
      "thread_file": "bronchial-artery-embolization_Bronchial-artery-embolization.md",
      "thread_title": "Bronchial artery embolization",
      "thread_url": "https://connect.ntminfo.org/discussion/bronchial-artery-embolization",
      "relevant_topics": [
        "other_complications",
        "surgical_treatment",
        "manual_techniques",
        "vest_therapy",
        "aerobika_opep",
        "species_specific_treatment"
      ],
      "topic_count": 6,
      "tagged_date": "2025-11-15T21:15:07.000000",
      "original_post_date": "Posted 10-23-2024 03:51 PM",
      "original_post_date_iso": "2024-10-23T00:00:00",
      "latest_post_date": "Posted 10-24-2024 09:27 AM",
      "latest_post_date_iso": "2024-10-24T00:00:00",
      "post_count": 5,
      "user_count": 5
    },
    "bronchiectasis-3": {
      "thread_file": "bronchiectasis-3_Bronchiectasis.md",
      "thread_title": "Bronchiectasis",
      "thread_url": "https://connect.ntminfo.org/discussion/bronchiectasis-3",
      "relevant_topics": [
        "coinfections",
        "emotional_support",
        "newer_antibiotics",
        "patient_stories",
        "saline_therapy",
        "aerobika_opep"
      ],
      "topic_count": 6,
      "tagged_date": "2025-11-15T21:15:08.000000",
      "original_post_date": "Posted 10-01-2024 10:57 AM",
      "original_post_date_iso": "2024-10-01T00:00:00",
      "latest_post_date": "Posted 10-05-2024 10:05 AMEdited by Rick Stelzer 10-06-2024 09:07 AM",
      "latest_post_date_iso": "2024-10-05T00:00:00",
      "post_count": 7,
      "user_count": 3
    },
    "bronchiectasis-4": {
      "thread_file": "bronchiectasis-4_Bronchiectasis.md",
      "thread_title": "Bronchiectasis",
      "thread_url": "https://connect.ntminfo.org/discussion/bronchiectasis-4",
      "relevant_topics": [
        "other_complications",
        "patient_stories",
        "work_employment",
        "vest_therapy",
        "manual_techniques",
        "alternative_therapies"
      ],
      "topic_count": 6,
      "tagged_date": "2025-11-15T21:15:09.000000",
      "original_post_date": "Posted 10-11-2024 05:14 PM",
      "original_post_date_iso": "2024-10-11T00:00:00",
      "latest_post_date": "Posted 11-10-2024 10:15 AM",
      "latest_post_date_iso": "2024-11-10T00:00:00",
      "post_count": 11,
      "user_count": 7
    },
    "bronchiectasis-and-ntm-support-group-in-virginia": {
      "thread_file": "bronchiectasis-and-ntm-support-group-in-virginia_bronchiectasis-and-NTM-support-group-in-.md",
      "thread_title": "bronchiectasis and NTM support group in Virginia",
      "thread_url": "https://connect.ntminfo.org/discussion/bronchiectasis-and-ntm-support-group-in-virginia",
      "relevant_topics": [
        "emotional_support"
      ],
      "topic_count": 1,
      "tagged_date": "2025-11-15T21:15:10.000000",
      "original_post_date": "Posted 21 days ago",
      "original_post_date_iso": "2025-10-24T21:31:27.644966",
      "latest_post_date": "Posted 18 days ago",
      "latest_post_date_iso": "2025-10-27T21:31:27.644966",
      "post_count": 3,
      "user_count": 2
    },
    "bronchiectasis-and-stenotrophomous": {
      "thread_file": "bronchiectasis-and-stenotrophomous_Bronchiectasis-and-stenotrophomous.md",
      "thread_title": "Bronchiectasis and stenotrophomous",
      "thread_url": "https://connect.ntminfo.org/discussion/bronchiectasis-and-stenotrophomous",
      "relevant_topics": [
        "coinfections",
        "medication_side_effects",
        "species_specific_treatment",
        "medical_centers"
      ],
      "topic_count": 4,
      "tagged_date": "2025-11-15T21:15:11.000000",
      "original_post_date": "Posted 02-01-2025 05:55 PM",
      "original_post_date_iso": "2025-02-01T00:00:00",
      "latest_post_date": "Posted 02-02-2025 09:46 AM",
      "latest_post_date_iso": "2025-02-02T00:00:00",
      "post_count": 4,
      "user_count": 3
    },
    "bronchiectasis-mac": {
      "thread_file": "bronchiectasis-mac_Bronchiectasis-MAC.md",
      "thread_title": "Bronchiectasis & MAC",
      "thread_url": "https://connect.ntminfo.org/discussion/bronchiectasis-mac",
      "relevant_topics": [
        "medical_centers"
      ],
      "topic_count": 1,
      "tagged_date": "2025-11-15T21:15:12.000000",
      "original_post_date": "Posted 04-26-2025 12:14 PM",
      "original_post_date_iso": "2025-04-26T00:00:00",
      "latest_post_date": "Posted 04-29-2025 05:44 PM",
      "latest_post_date_iso": "2025-04-29T00:00:00",
      "post_count": 7,
      "user_count": 4
    },
    "bronchiectasis-med": {
      "thread_file": "bronchiectasis-med_Bronchiectasis-med.md",
      "thread_title": "Bronchiectasis med",
      "thread_url": "https://connect.ntminfo.org/discussion/bronchiectasis-med",
      "relevant_topics": [
        "newer_antibiotics"
      ],
      "topic_count": 1,
      "tagged_date": "2025-11-15T21:15:13.000000",
      "original_post_date": "Posted 07-01-2025 11:50 AM",
      "original_post_date_iso": "2025-07-01T00:00:00",
      "latest_post_date": "Posted 07-01-2025 11:50 AM",
      "latest_post_date_iso": "2025-07-01T00:00:00",
      "post_count": 1,
      "user_count": 1
    },
    "bronchiectasis-ntm-assoc-wednesday-611-3pm-et-sputum-talk": {
      "thread_file": "bronchiectasis-ntm-assoc-wednesday-611-3pm-et-sputum-talk_Bronchiectasis-NTM-Assoc-Wednesday-611-3.md",
      "thread_title": "Bronchiectasis & NTM Assoc-- Wednesday 6/11 3pm ET- Sputum Talk!",
      "thread_url": "https://connect.ntminfo.org/discussion/bronchiectasis-ntm-assoc-wednesday-611-3pm-et-sputum-talk",
      "relevant_topics": [
        "sputum_cultures",
        "medical_centers",
        "emotional_support"
      ],
      "topic_count": 3,
      "tagged_date": "2025-11-15T21:15:14.000000",
      "original_post_date": "Posted 06-10-2025 09:40 AM",
      "original_post_date_iso": "2025-06-10T00:00:00",
      "latest_post_date": "Posted 06-14-2025 06:23 PM",
      "latest_post_date_iso": "2025-06-14T00:00:00",
      "post_count": 4,
      "user_count": 2
    },
    "bronchiectasis-story-on-good-morning-america": {
      "thread_file": "bronchiectasis-story-on-good-morning-america_Bronchiectasis-story-on-Good-Morning-Ame.md",
      "thread_title": "Bronchiectasis story on Good Morning America!!",
      "thread_url": "https://connect.ntminfo.org/discussion/bronchiectasis-story-on-good-morning-america",
      "relevant_topics": [
        "emotional_support",
        "medication_side_effects",
        "alternative_therapies",
        "other_complications"
      ],
      "topic_count": 4,
      "tagged_date": "2025-11-15T21:30:00.000000",
      "original_post_date": "Posted 10 days ago",
      "original_post_date_iso": "2025-11-04T21:31:39.076278",
      "latest_post_date": "Posted 4 days ago",
      "latest_post_date_iso": "2025-11-10T21:31:39.076278",
      "post_count": 16,
      "user_count": 11
    },
    "bronchiolitis-obliterans": {
      "thread_file": "bronchiolitis-obliterans_bronchiolitis-obliterans.md",
      "thread_title": "bronchiolitis obliterans",
      "thread_url": "https://connect.ntminfo.org/discussion/bronchiolitis-obliterans",
      "relevant_topics": [
        "emotional_support",
        "other_complications"
      ],
      "topic_count": 2,
      "tagged_date": "2025-11-15T21:30:01.000000",
      "original_post_date": "Posted 06-07-2025 01:22 AM",
      "original_post_date_iso": "2025-06-07T00:00:00",
      "latest_post_date": "Posted 06-07-2025 01:22 AM",
      "latest_post_date_iso": "2025-06-07T00:00:00",
      "post_count": 1,
      "user_count": 1
    },
    "bronchmac-with-radiation-for-breast-cancer": {
      "thread_file": "bronchmac-with-radiation-for-breast-cancer_BronchMAC-with-radiation-for-breast-canc.md",
      "thread_title": "Bronch/MAC with radiation for breast cancer",
      "thread_url": "https://connect.ntminfo.org/discussion/bronchmac-with-radiation-for-breast-cancer",
      "relevant_topics": [
        "other_complications",
        "surgical_treatment",
        "medical_centers",
        "patient_stories",
        "alternative_therapies"
      ],
      "topic_count": 5,
      "tagged_date": "2025-11-15T21:30:02.000000",
      "original_post_date": "Posted 07-21-2025 01:14 PM",
      "original_post_date_iso": "2025-07-21T00:00:00",
      "latest_post_date": "Posted 07-25-2025 06:41 AM",
      "latest_post_date_iso": "2025-07-25T00:00:00",
      "post_count": 11,
      "user_count": 6
    },
    "bronchoscopy": {
      "thread_file": "bronchoscopy_Bronchoscopy.md",
      "thread_title": "Bronchoscopy",
      "thread_url": "https://connect.ntminfo.org/discussion/bronchoscopy",
      "relevant_topics": [
        "sputum_cultures",
        "treatment_monitoring"
      ],
      "topic_count": 2,
      "tagged_date": "2025-11-15T21:30:03.000000",
      "original_post_date": "Posted 02-12-2024 08:54 PM",
      "original_post_date_iso": "2024-02-12T00:00:00",
      "latest_post_date": "Posted 08-13-2025 09:53 AMEdited by Mamie Balestra 08-13-2025 09:53 AM",
      "latest_post_date_iso": "2025-08-13T00:00:00",
      "post_count": 10,
      "user_count": 6
    },
    "bronchoscopy-1": {
      "thread_file": "bronchoscopy-1_Bronchoscopy.md",
      "thread_title": "Bronchoscopy",
      "thread_url": "https://connect.ntminfo.org/discussion/bronchoscopy-1",
      "relevant_topics": [
        "sputum_cultures",
        "treatment_monitoring",
        "emotional_support",
        "coinfections",
        "patient_stories",
        "medical_centers"
      ],
      "topic_count": 6,
      "tagged_date": "2025-11-15T21:30:04.000000",
      "original_post_date": "Posted 10-23-2024 02:18 PM",
      "original_post_date_iso": "2024-10-23T00:00:00",
      "latest_post_date": "Posted 10-28-2024 11:01 AM",
      "latest_post_date_iso": "2024-10-28T00:00:00",
      "post_count": 13,
      "user_count": 11
    },
    "bronchoscopy-2": {
      "thread_file": "bronchoscopy-2_Bronchoscopy.md",
      "thread_title": "Bronchoscopy",
      "thread_url": "https://connect.ntminfo.org/discussion/bronchoscopy-2",
      "relevant_topics": [
        "coinfections",
        "treatment_monitoring",
        "sputum_cultures",
        "big3_antibiotics"
      ],
      "topic_count": 4,
      "tagged_date": "2025-11-15T21:30:05.000000",
      "original_post_date": "Posted 12-23-2024 09:34 AM",
      "original_post_date_iso": "2024-12-23T00:00:00",
      "latest_post_date": "Posted 12-27-2024 04:02 PM",
      "latest_post_date_iso": "2024-12-27T00:00:00",
      "post_count": 7,
      "user_count": 5
    },
    "buying-aerobika-online-what-to-know": {
      "thread_file": "buying-aerobika-online-what-to-know_Buying-Aerobika-online-what-to-know.md",
      "thread_title": "Buying Aerobika online - what to know",
      "thread_url": "https://connect.ntminfo.org/discussion/buying-aerobika-online-what-to-know",
      "relevant_topics": [
        "aerobika_opep",
        "insurance_costs",
        "equipment_maintenance"
      ],
      "topic_count": 3,
      "tagged_date": "2025-11-15T21:30:06.000000",
      "original_post_date": "Posted 02-25-2025 09:37 AM",
      "original_post_date_iso": "2025-02-25T00:00:00",
      "latest_post_date": "Posted 02-26-2025 03:27 PM",
      "latest_post_date_iso": "2025-02-26T00:00:00",
      "post_count": 3,
      "user_count": 3
    },
    "ca-19-9-bronchiectasis-and-ntm": {
      "thread_file": "ca-19-9-bronchiectasis-and-ntm_CA-19-9-bronchiectasis-and-NTM.md",
      "thread_title": "CA 19-9, bronchiectasis and NTM",
      "thread_url": "https://connect.ntminfo.org/discussion/ca-19-9-bronchiectasis-and-ntm",
      "relevant_topics": [
        "treatment_monitoring",
        "species_specific_treatment",
        "saline_therapy"
      ],
      "topic_count": 3,
      "tagged_date": "2025-11-15T22:00:10.000000",
      "original_post_date": "Posted 11-12-2024 12:25 PM",
      "original_post_date_iso": "2024-11-12T00:00:00",
      "latest_post_date": "Posted 11-12-2024 12:25 PM",
      "latest_post_date_iso": "2024-11-12T00:00:00",
      "post_count": 1,
      "user_count": 0
    },
    "calling-continental-us-volunteers-with-clinical-trial-experience": {
      "thread_file": "calling-continental-us-volunteers-with-clinical-trial-experience_Calling-Continental-US-Volunteers-with-C.md",
      "thread_title": "Calling Continental U.S. Volunteers with Clinical Trial Experience",
      "thread_url": "https://connect.ntminfo.org/discussion/calling-continental-us-volunteers-with-clinical-trial-experience",
      "relevant_topics": [
        "research_trials"
      ],
      "topic_count": 1,
      "tagged_date": "2025-11-15T22:00:11.000000",
      "original_post_date": "",
      "original_post_date_iso": "",
      "latest_post_date": "",
      "latest_post_date_iso": "",
      "post_count": 1,
      "user_count": 0
    },
    "can-ntm-lead-to-copd": {
      "thread_file": "can-ntm-lead-to-copd_Can-NTM-lead-to-COPD.md",
      "thread_title": "Can NTM lead to COPD?",
      "thread_url": "https://connect.ntminfo.org/discussion/can-ntm-lead-to-copd",
      "relevant_topics": [
        "other_complications"
      ],
      "topic_count": 1,
      "tagged_date": "2025-11-15T22:00:05.000000",
      "original_post_date": "Posted 09-12-2025 04:58 PM",
      "original_post_date_iso": "2025-09-12T00:00:00",
      "latest_post_date": "Posted 09-19-2025 11:44 AM",
      "latest_post_date_iso": "2025-09-19T00:00:00",
      "post_count": 2,
      "user_count": 2
    },
    "can-uv-container-kill-ntm-through-ice": {
      "thread_file": "can-uv-container-kill-ntm-through-ice_Can-UV-container-kill-NTM-through-ice.md",
      "thread_title": "Can UV container kill NTM through ice",
      "thread_url": "https://connect.ntminfo.org/discussion/can-uv-container-kill-ntm-through-ice",
      "relevant_topics": [
        "water_safety"
      ],
      "topic_count": 1,
      "tagged_date": "2025-11-15T22:00:06.000000",
      "original_post_date": "Posted 01-23-2025 07:13 PM",
      "original_post_date_iso": "2025-01-23T00:00:00",
      "latest_post_date": "Posted 01-23-2025 07:13 PM",
      "latest_post_date_iso": "2025-01-23T00:00:00",
      "post_count": 1,
      "user_count": 1
    },
    "can-we-use-uv-to-inactivate-ntm-for-drinking-water-to-a-point-where-exposure-to-light-is-ok": {
      "thread_file": "can-we-use-uv-to-inactivate-ntm-for-drinking-water-to-a-point-where-exposure-to-light-is-ok_Can-we-use-UV-to-inactivate-NTM-for-drin.md",
      "thread_title": "Can we use UV to inactivate NTM for drinking water, to a point where exposure to light is OK?",
      "thread_url": "https://connect.ntminfo.org/discussion/can-we-use-uv-to-inactivate-ntm-for-drinking-water-to-a-point-where-exposure-to-light-is-ok",
      "relevant_topics": [
        "water_safety",
        "research_trials",
        "medical_centers"
      ],
      "topic_count": 3,
      "tagged_date": "2025-11-15T22:00:07.000000",
      "original_post_date": "Posted 02-27-2025 11:38 PM",
      "original_post_date_iso": "2025-02-27T00:00:00",
      "latest_post_date": "Posted 03-01-2025 12:56 PM",
      "latest_post_date_iso": "2025-03-01T00:00:00",
      "post_count": 5,
      "user_count": 2
    },
    "cant-make-the-ntm-bronchiectasis-conference-in-person-attend-virtually-90-days-to-review-talks": {
      "thread_file": "cant-make-the-ntm-bronchiectasis-conference-in-person-attend-virtually-90-days-to-review-talks_Cant-make-the-NTM-Bronchiectasis-Confere.md",
      "thread_title": "Can't make the NTM & Bronchiectasis Conference in-person? Attend virtually-90 days to review talks!",
      "thread_url": "https://connect.ntminfo.org/discussion/cant-make-the-ntm-bronchiectasis-conference-in-person-attend-virtually-90-days-to-review-talks",
      "relevant_topics": [
        "emotional_support",
        "medical_centers"
      ],
      "topic_count": 2,
      "tagged_date": "2025-11-15T22:00:08.000000",
      "original_post_date": "Posted 05-10-2025 08:36 AM",
      "original_post_date_iso": "2025-05-10T00:00:00",
      "latest_post_date": "Posted 05-10-2025 08:36 AM",
      "latest_post_date_iso": "2025-05-10T00:00:00",
      "post_count": 1,
      "user_count": 1
    },
    "carpet-cleaning-hello-spring": {
      "thread_file": "carpet-cleaning-hello-spring_Carpet-Cleaning-Hello-Spring.md",
      "thread_title": "Carpet Cleaning.. Hello Spring",
      "thread_url": "https://connect.ntminfo.org/discussion/carpet-cleaning-hello-spring",
      "relevant_topics": [
        "environmental_exposures",
        "infection_prevention",
        "alternative_therapies"
      ],
      "topic_count": 3,
      "tagged_date": "2025-11-15T22:00:09.000000",
      "original_post_date": "Posted 04-17-2025 09:25 AM",
      "original_post_date_iso": "2025-04-17T00:00:00",
      "latest_post_date": "Posted 04-22-2025 10:26 AM",
      "latest_post_date_iso": "2025-04-22T00:00:00",
      "post_count": 4,
      "user_count": 4
    },
    "cavity-shrinkclose": {
      "thread_file": "cavity-shrinkclose_Cavity-ShrinkClose.md",
      "thread_title": "Cavity Shrink/Close",
      "thread_url": "https://connect.ntminfo.org/discussion/cavity-shrinkclose",
      "relevant_topics": [
        "big3_antibiotics",
        "imaging_scans",
        "treatment_monitoring",
        "patient_stories"
      ],
      "topic_count": 4,
      "tagged_date": "2025-11-15T21:30:14.000000",
      "original_post_date": "Posted 01-26-2025 10:51 AM",
      "original_post_date_iso": "2025-01-26T00:00:00",
      "latest_post_date": "Posted 08-05-2025 05:08 PM",
      "latest_post_date_iso": "2025-08-05T00:00:00",
      "post_count": 5,
      "user_count": 1
    },
    "center-of-excellence": {
      "thread_file": "center-of-excellence_Center-of-Excellence.md",
      "thread_title": "Center of Excellence",
      "thread_url": "https://connect.ntminfo.org/discussion/center-of-excellence",
      "relevant_topics": [
        "insurance_costs",
        "medical_centers"
      ],
      "topic_count": 2,
      "tagged_date": "2025-11-16T02:31:02.000000",
      "original_post_date": "Posted 02-17-2025 06:38 AM",
      "original_post_date_iso": "2025-02-17T00:00:00",
      "latest_post_date": "Posted 03-13-2025 07:17 AM",
      "latest_post_date_iso": "2025-03-13T00:00:00",
      "post_count": 12,
      "user_count": 5
    },
    "chest-pain": {
      "thread_file": "chest-pain_Chest-pain.md",
      "thread_title": "Chest pain",
      "thread_url": "https://connect.ntminfo.org/discussion/chest-pain",
      "relevant_topics": [
        "other_complications",
        "patient_stories",
        "medical_centers"
      ],
      "topic_count": 3,
      "tagged_date": "2025-11-15T21:45:01.000000",
      "original_post_date": "Posted 28 days ago",
      "original_post_date_iso": "2025-10-17T21:31:00.953539",
      "latest_post_date": "Posted 26 days ago",
      "latest_post_date_iso": "2025-10-19T21:31:00.953539",
      "post_count": 5,
      "user_count": 4
    },
    "choosing-not-to-take-drugs": {
      "thread_file": "choosing-not-to-take-drugs_CHOOSING-NOT-TO-TAKE-DRUGS.md",
      "thread_title": "CHOOSING NOT TO TAKE DRUGS",
      "thread_url": "https://connect.ntminfo.org/discussion/choosing-not-to-take-drugs",
      "relevant_topics": [
        "big3_antibiotics",
        "patient_stories",
        "emotional_support",
        "alternative_therapies",
        "medical_centers",
        "treatment_monitoring"
      ],
      "topic_count": 6,
      "tagged_date": "2025-11-15T21:45:02.000000",
      "original_post_date": "Posted 09-24-2025 10:49 AM",
      "original_post_date_iso": "2025-09-24T00:00:00",
      "latest_post_date": "Posted 09-29-2025 05:23 PM",
      "latest_post_date_iso": "2025-09-29T00:00:00",
      "post_count": 15,
      "user_count": 11
    },
    "clarification-on-shower-filters-for-kitchen-faucet-to-dr-falkinham-please": {
      "thread_file": "clarification-on-shower-filters-for-kitchen-faucet-to-dr-falkinham-please_Clarification-on-shower-filters-for-kitc.md",
      "thread_title": "Clarification on shower & filters for kitchen faucet to Dr. Falkinham please",
      "thread_url": "https://connect.ntminfo.org/discussion/clarification-on-shower-filters-for-kitchen-faucet-to-dr-falkinham-please",
      "relevant_topics": [
        "water_safety",
        "equipment_maintenance",
        "medical_centers",
        "research_trials"
      ],
      "topic_count": 4,
      "tagged_date": "2025-11-15T21:45:03.000000",
      "original_post_date": "Posted 01-31-2025 11:57 AM",
      "original_post_date_iso": "2025-01-31T00:00:00",
      "latest_post_date": "Posted 09-14-2025 10:53 AM",
      "latest_post_date_iso": "2025-09-14T00:00:00",
      "post_count": 54,
      "user_count": 13
    },
    "cleaning-cpap-equipment": {
      "thread_file": "cleaning-cpap-equipment_Cleaning-CPAP-Equipment.md",
      "thread_title": "Cleaning CPAP Equipment",
      "thread_url": "https://connect.ntminfo.org/discussion/cleaning-cpap-equipment",
      "relevant_topics": [
        "equipment_sterilization",
        "water_safety",
        "medical_centers"
      ],
      "topic_count": 3,
      "tagged_date": "2025-11-15T21:45:04.000000",
      "original_post_date": "Posted 02-24-2025 10:17 AM",
      "original_post_date_iso": "2025-02-24T00:00:00",
      "latest_post_date": "Posted 07-21-2025 12:35 AM",
      "latest_post_date_iso": "2025-07-21T00:00:00",
      "post_count": 5,
      "user_count": 5
    },
    "cleaning-nebulizer-equipment": {
      "thread_file": "cleaning-nebulizer-equipment_Cleaning-nebulizer-equipment.md",
      "thread_title": "Cleaning nebulizer equipment",
      "thread_url": "https://connect.ntminfo.org/discussion/cleaning-nebulizer-equipment",
      "relevant_topics": [
        "equipment_sterilization",
        "nebulizers",
        "equipment_maintenance",
        "water_safety"
      ],
      "topic_count": 4,
      "tagged_date": "2025-11-15T21:45:05.000000",
      "original_post_date": "Posted 08-28-2025 11:08 AM",
      "original_post_date_iso": "2025-08-28T00:00:00",
      "latest_post_date": "Posted 11 days ago",
      "latest_post_date_iso": "2025-11-03T21:31:45.313335",
      "post_count": 39,
      "user_count": 11
    },
    "cold-water": {
      "thread_file": "cold-water_Cold-water.md",
      "thread_title": "Cold water",
      "thread_url": "https://connect.ntminfo.org/discussion/cold-water",
      "relevant_topics": [
        "equipment_sterilization",
        "water_safety"
      ],
      "topic_count": 2,
      "tagged_date": "2025-11-15T21:45:06.000000",
      "original_post_date": "Posted 12-26-2024 09:20 AM",
      "original_post_date_iso": "2024-12-26T00:00:00",
      "latest_post_date": "Posted 12-27-2024 11:05 AM",
      "latest_post_date_iso": "2024-12-27T00:00:00",
      "post_count": 3,
      "user_count": 3
    },
    "conference-1": {
      "thread_file": "conference-1_Conference.md",
      "thread_title": "Conference",
      "thread_url": "https://connect.ntminfo.org/discussion/conference-1",
      "relevant_topics": [
        "emotional_support"
      ],
      "topic_count": 1,
      "tagged_date": "2025-11-15T21:45:07.000000",
      "original_post_date": "Posted 09-13-2025 10:16 AM",
      "original_post_date_iso": "2025-09-13T00:00:00",
      "latest_post_date": "Posted 09-17-2025 09:54 AM",
      "latest_post_date_iso": "2025-09-17T00:00:00",
      "post_count": 7,
      "user_count": 2
    },
    "coughing-up-blood": {
      "thread_file": "coughing-up-blood_Coughing-up-blood.md",
      "thread_title": "Coughing up blood",
      "thread_url": "https://connect.ntminfo.org/discussion/coughing-up-blood",
      "relevant_topics": [
        "other_complications",
        "coinfections",
        "sputum_cultures",
        "manual_techniques"
      ],
      "topic_count": 4,
      "tagged_date": "2025-11-15T22:00:00.000000",
      "original_post_date": "Posted 10-07-2025 04:56 PM",
      "original_post_date_iso": "2025-10-07T00:00:00",
      "latest_post_date": "Posted 10-08-2025 09:49 AM",
      "latest_post_date_iso": "2025-10-08T00:00:00",
      "post_count": 6,
      "user_count": 3
    },
    "cdc-recommends-second-covid-vaccine": {
      "thread_file": "cdc-recommends-second-covid-vaccine_CDC-recommends-second-COVID-vaccine.md",
      "thread_title": "CDC recommends second COVID vaccine",
      "thread_url": "https://connect.ntminfo.org/discussion/cdc-recommends-second-covid-vaccine",
      "relevant_topics": [
        "infection_prevention"
      ],
      "topic_count": 1,
      "tagged_date": "2025-11-15T22:00:01.000000",
      "original_post_date": "Posted 12-07-2024 01:16 AM",
      "original_post_date_iso": "2024-12-07T00:00:00",
      "latest_post_date": "Posted 12-07-2024 01:16 AM",
      "latest_post_date_iso": "2024-12-07T00:00:00",
      "post_count": 1,
      "user_count": 1
    },
    "ceramicspottery-class": {
      "thread_file": "ceramicspottery-class_Ceramicspottery-class.md",
      "thread_title": "Ceramics/pottery class",
      "thread_url": "https://connect.ntminfo.org/discussion/ceramicspottery-class",
      "relevant_topics": [
        "environmental_exposures",
        "infection_prevention",
        "medical_centers"
      ],
      "topic_count": 3,
      "tagged_date": "2025-11-15T22:00:02.000000",
      "original_post_date": "Posted 01-30-2025 09:53 AM",
      "original_post_date_iso": "2025-01-30T00:00:00",
      "latest_post_date": "Posted 02-05-2025 09:21 AM",
      "latest_post_date_iso": "2025-02-05T00:00:00",
      "post_count": 10,
      "user_count": 7
    },
    "cftr-protein-gene-mutation": {
      "thread_file": "cftr-protein-gene-mutation_CFTR-Protein-gene-mutation.md",
      "thread_title": "CFTR Protein gene mutation",
      "thread_url": "https://connect.ntminfo.org/discussion/cftr-protein-gene-mutation",
      "relevant_topics": [
        "newer_antibiotics",
        "medication_side_effects",
        "patient_stories"
      ],
      "topic_count": 3,
      "tagged_date": "2025-11-15T22:00:03.000000",
      "original_post_date": "Posted 09-10-2025 12:20 PM",
      "original_post_date_iso": "2025-09-10T00:00:00",
      "latest_post_date": "Posted 09-17-2025 12:47 PM",
      "latest_post_date_iso": "2025-09-17T00:00:00",
      "post_count": 6,
      "user_count": 5
    },
    "chimaera-treatment-side-effects": {
      "thread_file": "chimaera-treatment-side-effects_Chimaera-treatment-side-effects.md",
      "thread_title": "Chimaera treatment side effects.",
      "thread_url": "https://connect.ntminfo.org/discussion/chimaera-treatment-side-effects",
      "relevant_topics": [
        "species_specific_treatment",
        "medication_side_effects",
        "iv_antibiotics",
        "inhaled_medications",
        "patient_stories"
      ],
      "topic_count": 5,
      "tagged_date": "2025-11-15T22:00:04.000000",
      "original_post_date": "Posted 07-27-2025 05:35 AM",
      "original_post_date_iso": "2025-07-27T00:00:00",
      "latest_post_date": "Posted 09-16-2025 07:13 PM",
      "latest_post_date_iso": "2025-09-16T00:00:00",
      "post_count": 3,
      "user_count": 2
    },
    "distilled-water-2": {
      "thread_file": "distilled-water-2_Distilled-water.md",
      "thread_title": "Distilled water",
      "thread_url": "https://connect.ntminfo.org/discussion/distilled-water-2",
      "relevant_topics": [],
      "topic_count": 0,
      "tagged_date": "2025-11-15T22:15:00.000000",
      "original_post_date": "Posted 02-23-2025 06:05 PM",
      "original_post_date_iso": "2025-02-23T00:00:00",
      "latest_post_date": "Posted 02-23-2025 06:05 PM",
      "latest_post_date_iso": "2025-02-23T00:00:00",
      "post_count": 1,
      "user_count": 1
    },
    "distilled-water-3": {
      "thread_file": "distilled-water-3_Distilled-water.md",
      "thread_title": "Distilled water",
      "thread_url": "https://connect.ntminfo.org/discussion/distilled-water-3",
      "relevant_topics": [
        "water_safety",
        "equipment_sterilization",
        "medical_centers"
      ],
      "topic_count": 3,
      "tagged_date": "2025-11-15T22:15:01.000000",
      "original_post_date": "Posted 02-23-2025 06:06 PM",
      "original_post_date_iso": "2025-02-23T00:00:00",
      "latest_post_date": "Posted 02-28-2025 01:19 AM",
      "latest_post_date_iso": "2025-02-28T00:00:00",
      "post_count": 8,
      "user_count": 4
    },
    "distilled-water-4": {
      "thread_file": "distilled-water-4_Distilled-water.md",
      "thread_title": "Distilled water",
      "thread_url": "https://connect.ntminfo.org/discussion/distilled-water-4",
      "relevant_topics": [
        "water_safety",
        "equipment_sterilization",
        "medical_centers"
      ],
      "topic_count": 3,
      "tagged_date": "2025-11-15T22:15:02.000000",
      "original_post_date": "Posted 07-21-2025 02:46 PM",
      "original_post_date_iso": "2025-07-21T00:00:00",
      "latest_post_date": "Posted 07-22-2025 10:26 AM",
      "latest_post_date_iso": "2025-07-22T00:00:00",
      "post_count": 7,
      "user_count": 5
    },
    "distilled-water-and-sterilizing": {
      "thread_file": "distilled-water-and-sterilizing_Distilled-Water-and-Sterilizing.md",
      "thread_title": "Distilled Water and Sterilizing",
      "thread_url": "https://connect.ntminfo.org/discussion/distilled-water-and-sterilizing",
      "relevant_topics": [
        "water_safety",
        "equipment_sterilization",
        "emotional_support",
        "coinfections",
        "infection_prevention",
        "medical_centers"
      ],
      "topic_count": 6,
      "tagged_date": "2025-11-15T22:15:03.000000",
      "original_post_date": "Posted 11-30-2024 12:24 AM",
      "original_post_date_iso": "2024-11-30T00:00:00",
      "latest_post_date": "Posted 12-28-2024 12:39 PM",
      "latest_post_date_iso": "2024-12-28T00:00:00",
      "post_count": 20,
      "user_count": 12
    },
    "distilled-water-machine": {
      "thread_file": "distilled-water-machine_Distilled-Water-Machine.md",
      "thread_title": "Distilled Water Machine",
      "thread_url": "https://connect.ntminfo.org/discussion/distilled-water-machine",
      "relevant_topics": [
        "water_safety",
        "equipment_maintenance",
        "environmental_exposures"
      ],
      "topic_count": 3,
      "tagged_date": "2025-11-15T22:15:04.000000",
      "original_post_date": "Posted 02-24-2025 12:28 PM",
      "original_post_date_iso": "2025-02-24T00:00:00",
      "latest_post_date": "Posted 02-26-2025 10:00 AM",
      "latest_post_date_iso": "2025-02-26T00:00:00",
      "post_count": 7,
      "user_count": 3
    },
    "do-high-output-nebulizers-improve-airway-clearance": {
      "thread_file": "do-high-output-nebulizers-improve-airway-clearance_Do-high-output-nebulizers-improve-airway.md",
      "thread_title": "Do high output nebulizers improve airway clearance?",
      "thread_url": "https://connect.ntminfo.org/discussion/do-high-output-nebulizers-improve-airway-clearance",
      "relevant_topics": [
        "nebulizers",
        "manual_techniques",
        "aerobika_opep",
        "equipment_maintenance",
        "inhaled_medications"
      ],
      "topic_count": 5,
      "tagged_date": "2025-11-15T22:15:05.000000",
      "original_post_date": "Posted 06-29-2025 02:54 PM",
      "original_post_date_iso": "2025-06-29T00:00:00",
      "latest_post_date": "Posted 07-29-2025 02:48 PM",
      "latest_post_date_iso": "2025-07-29T00:00:00",
      "post_count": 20,
      "user_count": 6
    },
    "do-intense-geothermal-places-have-ntm": {
      "thread_file": "do-intense-geothermal-places-have-ntm_Do-intense-geothermal-places-have-NTM.md",
      "thread_title": "Do intense geothermal places have NTM",
      "thread_url": "https://connect.ntminfo.org/discussion/do-intense-geothermal-places-have-ntm",
      "relevant_topics": [
        "environmental_exposures",
        "water_safety",
        "research_trials",
        "medical_centers"
      ],
      "topic_count": 4,
      "tagged_date": "2025-11-15T22:15:06.000000",
      "original_post_date": "Posted 5 days ago",
      "original_post_date_iso": "2025-11-09T21:30:47.543962",
      "latest_post_date": "Posted 4 days ago",
      "latest_post_date_iso": "2025-11-10T21:30:47.543962",
      "post_count": 5,
      "user_count": 4
    },
    "do-you-take-eliquis": {
      "thread_file": "do-you-take-eliquis_Do-you-take-Eliquis.md",
      "thread_title": "Do you take Eliquis?",
      "thread_url": "https://connect.ntminfo.org/discussion/do-you-take-eliquis",
      "relevant_topics": [
        "other_complications",
        "medication_side_effects",
        "big3_antibiotics"
      ],
      "topic_count": 3,
      "tagged_date": "2025-11-15T22:15:07.000000",
      "original_post_date": "Posted 07-29-2025 09:21 AM",
      "original_post_date_iso": "2025-07-29T00:00:00",
      "latest_post_date": "Posted 08-01-2025 03:41 AM",
      "latest_post_date_iso": "2025-08-01T00:00:00",
      "post_count": 7,
      "user_count": 6
    },
    "doctor-visits": {
      "thread_file": "doctor-visits_Doctor-Visits.md",
      "thread_title": "Doctor Visits",
      "thread_url": "https://connect.ntminfo.org/discussion/doctor-visits",
      "relevant_topics": [
        "treatment_monitoring",
        "medical_centers",
        "imaging_scans",
        "sputum_cultures"
      ],
      "topic_count": 4,
      "tagged_date": "2025-11-15T22:15:08.000000",
      "original_post_date": "Posted 01-23-2025 09:53 AM",
      "original_post_date_iso": "2025-01-23T00:00:00",
      "latest_post_date": "Posted 01-25-2025 08:25 AM",
      "latest_post_date_iso": "2025-01-25T00:00:00",
      "post_count": 4,
      "user_count": 3
    },
    "doctors-referral-who-specialize-in-bronchiectasis-and-ntm": {
      "thread_file": "doctors-referral-who-specialize-in-bronchiectasis-and-ntm_Doctors-Referral-who-Specialize-in-Bronc.md",
      "thread_title": "Doctor's Referral who Specialize in Bronchiectasis and NTM",
      "thread_url": "https://connect.ntminfo.org/discussion/doctors-referral-who-specialize-in-bronchiectasis-and-ntm",
      "relevant_topics": [
        "medical_centers"
      ],
      "topic_count": 1,
      "tagged_date": "2025-11-15T22:15:09.000000",
      "original_post_date": "Posted 03-21-2025 09:22 AM",
      "original_post_date_iso": "2025-03-21T00:00:00",
      "latest_post_date": "Posted 03-24-2025 09:23 AM",
      "latest_post_date_iso": "2025-03-24T00:00:00",
      "post_count": 5,
      "user_count": 4
    },
    "does-anyone-work-ft-while-dealing-with-mac-lung": {
      "thread_file": "does-anyone-work-ft-while-dealing-with-mac-lung_Does-anyone-Work-FT-while-dealing-with-M.md",
      "thread_title": "Does anyone Work FT while dealing with MAC lung?",
      "thread_url": "https://connect.ntminfo.org/discussion/does-anyone-work-ft-while-dealing-with-mac-lung",
      "relevant_topics": [
        "work_employment",
        "emotional_support",
        "patient_stories",
        "insurance_costs",
        "treatment_monitoring"
      ],
      "topic_count": 5,
      "tagged_date": "2025-11-15T22:15:10.000000",
      "original_post_date": "Posted 10-16-2024 09:14 AM",
      "original_post_date_iso": "2024-10-16T00:00:00",
      "latest_post_date": "Posted 10-31-2024 01:19 PM",
      "latest_post_date_iso": "2024-10-31T00:00:00",
      "post_count": 24,
      "user_count": 19
    },
    "does-higher-levels-of-ntm-in-a-communitys-water-supplyhigher-levels-in-ambient-air": {
      "thread_file": "does-higher-levels-of-ntm-in-a-communitys-water-supplyhigher-levels-in-ambient-air_Does-higher-levels-of-NTM-in-a-community.md",
      "thread_title": "Does higher levels of NTM in a community's water supply=higher levels in ambient air?",
      "thread_url": "https://connect.ntminfo.org/discussion/does-higher-levels-of-ntm-in-a-communitys-water-supplyhigher-levels-in-ambient-air",
      "relevant_topics": [
        "environmental_exposures",
        "water_safety",
        "research_trials",
        "medical_centers"
      ],
      "topic_count": 4,
      "tagged_date": "2025-11-15T22:15:11.000000",
      "original_post_date": "Posted 07-13-2025 10:59 AM",
      "original_post_date_iso": "2025-07-13T00:00:00",
      "latest_post_date": "Posted 07-24-2025 01:49 AM",
      "latest_post_date_iso": "2025-07-24T00:00:00",
      "post_count": 10,
      "user_count": 2
    },
    "does-nasty-tasting-sputum-always-mean-an-infection": {
      "thread_file": "does-nasty-tasting-sputum-always-mean-an-infection_Does-nasty-tasting-sputum-always-mean-an.md",
      "thread_title": "Does nasty tasting sputum always mean an infection?",
      "thread_url": "https://connect.ntminfo.org/discussion/does-nasty-tasting-sputum-always-mean-an-infection",
      "relevant_topics": [
        "sputum_cultures",
        "coinfections",
        "digestive_issues",
        "other_complications"
      ],
      "topic_count": 4,
      "tagged_date": "2025-11-15T22:15:12.000000",
      "original_post_date": "Posted 07-01-2025 09:41 AM",
      "original_post_date_iso": "2025-07-01T00:00:00",
      "latest_post_date": "Posted 07-02-2025 09:05 AM",
      "latest_post_date_iso": "2025-07-02T00:00:00",
      "post_count": 4,
      "user_count": 2
    },
    "dont-miss-the-the-upcoming-australia-support-group-meeting-on-august-28th": {
      "thread_file": "dont-miss-the-the-upcoming-australia-support-group-meeting-on-august-28th_Dont-miss-the-the-upcoming-Australia-Sup.md",
      "thread_title": "Don't miss the the upcoming Australia Support Group Meeting on August 28th!!",
      "thread_url": "https://connect.ntminfo.org/discussion/dont-miss-the-the-upcoming-australia-support-group-meeting-on-august-28th",
      "relevant_topics": [
        "emotional_support",
        "research_trials"
      ],
      "topic_count": 2,
      "tagged_date": "2025-11-15T23:15:01.000000",
      "original_post_date": "Posted 08-20-2025 12:19 PM",
      "original_post_date_iso": "2025-08-20T00:00:00",
      "latest_post_date": "Posted 08-20-2025 12:19 PM",
      "latest_post_date_iso": "2025-08-20T00:00:00",
      "post_count": 1,
      "user_count": 0
    },
    "dr-charles-chuck-daley-speaks-about-brinsupri-brensocatib": {
      "thread_file": "dr-charles-chuck-daley-speaks-about-brinsupri-brensocatib_Dr-Charles-Chuck-Daley-speaks-about-BRIN.md",
      "thread_title": "Dr. Charles (Chuck) Daley speaks about BRINSUPRI (brensocatib)",
      "thread_url": "https://connect.ntminfo.org/discussion/dr-charles-chuck-daley-speaks-about-brinsupri-brensocatib",
      "relevant_topics": [
        "newer_antibiotics",
        "insurance_costs",
        "medical_centers",
        "research_trials"
      ],
      "topic_count": 4,
      "tagged_date": "2025-11-15T23:15:02.000000",
      "original_post_date": "Posted 09-14-2025 09:10 AM",
      "original_post_date_iso": "2025-09-14T00:00:00",
      "latest_post_date": "Posted 09-17-2025 09:41 AM",
      "latest_post_date_iso": "2025-09-17T00:00:00",
      "post_count": 10,
      "user_count": 8
    },
    "dr-chilly-wearable-neck-cooling-tube": {
      "thread_file": "dr-chilly-wearable-neck-cooling-tube_Dr-Chilly-wearable-neck-cooling-tube.md",
      "thread_title": "Dr Chilly wearable neck cooling tube",
      "thread_url": "https://connect.ntminfo.org/discussion/dr-chilly-wearable-neck-cooling-tube",
      "relevant_topics": [
        "environmental_exposures",
        "equipment_maintenance"
      ],
      "topic_count": 2,
      "tagged_date": "2025-11-15T23:15:03.000000",
      "original_post_date": "Posted 08-16-2025 10:22 AM",
      "original_post_date_iso": "2025-08-16T00:00:00",
      "latest_post_date": "Posted 08-18-2025 11:51 AM",
      "latest_post_date_iso": "2025-08-18T00:00:00",
      "post_count": 4,
      "user_count": 2
    },
    "dr-falkenheim-will-an-n95-filter-reduce-exposure-to-ntms-in-the-shower": {
      "thread_file": "dr-falkenheim-will-an-n95-filter-reduce-exposure-to-ntms-in-the-shower_Dr-Falkenheim-Will-an-n95-filter-reduce-.md",
      "thread_title": "Dr. Falkenheim - Will an n95 filter reduce exposure to NTMs in the shower",
      "thread_url": "https://connect.ntminfo.org/discussion/dr-falkenheim-will-an-n95-filter-reduce-exposure-to-ntms-in-the-shower",
      "relevant_topics": [
        "infection_prevention",
        "equipment_maintenance",
        "water_safety"
      ],
      "topic_count": 3,
      "tagged_date": "2025-11-15T23:15:04.000000",
      "original_post_date": "Posted 02-10-2025 09:54 AM",
      "original_post_date_iso": "2025-02-10T00:00:00",
      "latest_post_date": "Posted 03-02-2025 07:23 PM",
      "latest_post_date_iso": "2025-03-02T00:00:00",
      "post_count": 6,
      "user_count": 2
    },
    "dr-falkinham-can-you-please-explain": {
      "thread_file": "dr-falkinham-can-you-please-explain_Dr-Falkinham-can-you-please-explain.md",
      "thread_title": "Dr. Falkinham, can you please explain",
      "thread_url": "https://connect.ntminfo.org/discussion/dr-falkinham-can-you-please-explain",
      "relevant_topics": [
        "water_safety",
        "environmental_exposures",
        "medical_centers",
        "research_trials",
        "infection_prevention"
      ],
      "topic_count": 5,
      "tagged_date": "2025-11-15T23:15:05.000000",
      "original_post_date": "Posted 12-19-2024 01:52 PM",
      "original_post_date_iso": "2024-12-19T00:00:00",
      "latest_post_date": "Posted 01-21-2025 04:14 PM",
      "latest_post_date_iso": "2025-01-21T00:00:00",
      "post_count": 26,
      "user_count": 13
    },
    "dr-falkinham-i-hope-you-can-weigh-in-on-this": {
      "thread_file": "dr-falkinham-i-hope-you-can-weigh-in-on-this_Dr-Falkinham-I-Hope-You-Can-Weigh-In-On-.md",
      "thread_title": "Dr. Falkinham I Hope You Can Weigh In On This",
      "thread_url": "https://connect.ntminfo.org/discussion/dr-falkinham-i-hope-you-can-weigh-in-on-this",
      "relevant_topics": [
        "equipment_sterilization",
        "equipment_maintenance"
      ],
      "topic_count": 2,
      "tagged_date": "2025-11-15T23:15:06.000000",
      "original_post_date": "Posted 07-17-2025 11:36 AM",
      "original_post_date_iso": "2025-07-17T00:00:00",
      "latest_post_date": "Posted 07-22-2025 10:57 AM",
      "latest_post_date_iso": "2025-07-22T00:00:00",
      "post_count": 8,
      "user_count": 5
    },
    "dr-falkinham-question-bottled-water-in-amsterdam": {
      "thread_file": "dr-falkinham-question-bottled-water-in-amsterdam_Dr-Falkinham-Question-Bottled-Water-in-A.md",
      "thread_title": "Dr. Falkinham Question Bottled Water in Amsterdam",
      "thread_url": "https://connect.ntminfo.org/discussion/dr-falkinham-question-bottled-water-in-amsterdam",
      "relevant_topics": [
        "water_safety",
        "travel_safety",
        "medical_centers"
      ],
      "topic_count": 3,
      "tagged_date": "2025-11-15T23:15:07.000000",
      "original_post_date": "Posted 09-13-2025 08:19 PM",
      "original_post_date_iso": "2025-09-13T00:00:00",
      "latest_post_date": "Posted 09-14-2025 02:20 PM",
      "latest_post_date_iso": "2025-09-14T00:00:00",
      "post_count": 2,
      "user_count": 1
    },
    "dr-falkinham-re-hot-tubs-and-dry-sauna-questions": {
      "thread_file": "dr-falkinham-re-hot-tubs-and-dry-sauna-questions_Dr-Falkinham-re-hot-tubs-and-dry-sauna-q.md",
      "thread_title": "Dr. Falkinham re: hot tubs and dry sauna questions",
      "thread_url": "https://connect.ntminfo.org/discussion/dr-falkinham-re-hot-tubs-and-dry-sauna-questions",
      "relevant_topics": [
        "water_safety",
        "environmental_exposures"
      ],
      "topic_count": 2,
      "tagged_date": "2025-11-15T23:15:08.000000",
      "original_post_date": "Posted 12-11-2024 12:26 PM",
      "original_post_date_iso": "2024-12-11T00:00:00",
      "latest_post_date": "Posted 12-11-2024 12:26 PM",
      "latest_post_date_iso": "2024-12-11T00:00:00",
      "post_count": 1,
      "user_count": 1
    },
    "dr-falkinham-re-tankless-water-heaters": {
      "thread_file": "dr-falkinham-re-tankless-water-heaters_Dr-Falkinham-re-tankless-water-heaters.md",
      "thread_title": "Dr Falkinham re tankless water heaters",
      "thread_url": "https://connect.ntminfo.org/discussion/dr-falkinham-re-tankless-water-heaters",
      "relevant_topics": [
        "water_safety",
        "equipment_maintenance",
        "medical_centers"
      ],
      "topic_count": 3,
      "tagged_date": "2025-11-15T23:15:09.000000",
      "original_post_date": "Posted 01-07-2025 11:26 AM",
      "original_post_date_iso": "2025-01-07T00:00:00",
      "latest_post_date": "Posted 01-08-2025 09:51 AM",
      "latest_post_date_iso": "2025-01-08T00:00:00",
      "post_count": 3,
      "user_count": 2
    },
    "dr-falkinham-why-drink-boiled-sterile-or-lifestraw-filtered-water": {
      "thread_file": "dr-falkinham-why-drink-boiled-sterile-or-lifestraw-filtered-water_Dr-Falkinham-Why-drink-boiled-sterile-or.md",
      "thread_title": "Dr. Falkinham: Why drink boiled, sterile or Lifestraw filtered Water?",
      "thread_url": "https://connect.ntminfo.org/discussion/dr-falkinham-why-drink-boiled-sterile-or-lifestraw-filtered-water",
      "relevant_topics": [
        "water_safety",
        "digestive_issues",
        "equipment_maintenance",
        "medical_centers",
        "research_trials"
      ],
      "topic_count": 5,
      "tagged_date": "2025-11-15T23:15:10.000000",
      "original_post_date": "Posted 06-15-2025 03:35 PM",
      "original_post_date_iso": "2025-06-15T00:00:00",
      "latest_post_date": "Posted 07-05-2025 05:55 PM",
      "latest_post_date_iso": "2025-07-05T00:00:00",
      "post_count": 27,
      "user_count": 11
    },
    "dr-note-when-taking-nebulizer-traveling-by-plane": {
      "thread_file": "dr-note-when-taking-nebulizer-traveling-by-plane_Dr-note-when-taking-nebulizer-Traveling-.md",
      "thread_title": "Dr note when taking nebulizer Traveling by plane.",
      "thread_url": "https://connect.ntminfo.org/discussion/dr-note-when-taking-nebulizer-traveling-by-plane",
      "relevant_topics": [
        "travel_equipment",
        "travel_safety",
        "medical_centers"
      ],
      "topic_count": 3,
      "tagged_date": "2025-11-15T23:15:11.000000",
      "original_post_date": "Posted 10-11-2024 10:51 AMEdited by Teresa Smallwood 10-11-2024 10:52 AM",
      "original_post_date_iso": "2024-10-11T00:00:00",
      "latest_post_date": "Posted 10-12-2024 09:06 AM",
      "latest_post_date_iso": "2024-10-12T00:00:00",
      "post_count": 4,
      "user_count": 4
    },
    "dr-tim-aksamits-mayo-bronchiectasis-education-series-93024": {
      "thread_file": "dr-tim-aksamits-mayo-bronchiectasis-education-series-93024_Dr-Tim-Aksamits-Mayo-Bronchiectasis-Educ.md",
      "thread_title": "Dr Tim Aksamit's (Mayo) Bronchiectasis Education Series 9/30/24",
      "thread_url": "https://connect.ntminfo.org/discussion/dr-tim-aksamits-mayo-bronchiectasis-education-series-93024",
      "relevant_topics": [
        "medical_centers",
        "emotional_support"
      ],
      "topic_count": 2,
      "tagged_date": "2025-11-15T23:15:12.000000",
      "original_post_date": "Posted 10-02-2024 07:32 AM",
      "original_post_date_iso": "2024-10-02T00:00:00",
      "latest_post_date": "Posted 10-04-2024 02:17 PM",
      "latest_post_date_iso": "2024-10-04T00:00:00",
      "post_count": 3,
      "user_count": 2
    },
    "dupixent": {
      "thread_file": "dupixent_Dupixent.md",
      "thread_title": "Dupixent",
      "thread_url": "https://connect.ntminfo.org/discussion/dupixent",
      "relevant_topics": [
        "alternative_therapies",
        "medication_side_effects"
      ],
      "topic_count": 2,
      "tagged_date": "2025-11-15T23:30:07.000000",
      "original_post_date": "Posted 06-02-2025 10:19 AM",
      "original_post_date_iso": "2025-06-02T00:00:00",
      "latest_post_date": "Posted 06-02-2025 10:19 AM",
      "latest_post_date_iso": "2025-06-02T00:00:00",
      "post_count": 3,
      "user_count": 2
    },
    "dupixet": {
      "thread_file": "dupixet_Dupixet.md",
      "thread_title": "Dupixet",
      "thread_url": "https://connect.ntminfo.org/discussion/dupixet",
      "relevant_topics": [
        "newer_antibiotics",
        "medication_side_effects",
        "hearing_complications",
        "other_complications",
        "patient_stories"
      ],
      "topic_count": 5,
      "tagged_date": "2025-11-15T23:30:08.000000",
      "original_post_date": "Posted 12-15-2024 10:43 AM",
      "original_post_date_iso": "2024-12-15T00:00:00",
      "latest_post_date": "Posted 12-15-2024 10:43 AM",
      "latest_post_date_iso": "2024-12-15T00:00:00",
      "post_count": 1,
      "user_count": 1
    },
    "dry-sauna": {
      "thread_file": "dry-sauna_Dry-sauna.md",
      "thread_title": "Dry sauna",
      "thread_url": "https://connect.ntminfo.org/discussion/dry-sauna",
      "relevant_topics": [
        "environmental_exposures",
        "medical_centers",
        "research_trials"
      ],
      "topic_count": 3,
      "tagged_date": "2025-11-15T23:00:02.000000",
      "original_post_date": "Posted 03-03-2024 10:41 AM",
      "original_post_date_iso": "2024-03-03T00:00:00",
      "latest_post_date": "Posted 09-01-2025 04:10 PM",
      "latest_post_date_iso": "2025-09-01T00:00:00",
      "post_count": 8,
      "user_count": 3
    },
    "drying-airway-clearance-equipment": {
      "thread_file": "drying-airway-clearance-equipment_Drying-Airway-Clearance-Equipment.md",
      "thread_title": "Drying Airway Clearance Equipment",
      "thread_url": "https://connect.ntminfo.org/discussion/drying-airway-clearance-equipment",
      "relevant_topics": [
        "equipment_sterilization",
        "nebulizers",
        "equipment_maintenance",
        "water_safety",
        "medical_centers",
        "research_trials"
      ],
      "topic_count": 6,
      "tagged_date": "2025-11-15T23:30:01.000000",
      "original_post_date": "Posted 10-07-2025 05:29 PM",
      "original_post_date_iso": "2025-10-07T00:00:00",
      "latest_post_date": "Posted 4 days ago",
      "latest_post_date_iso": "2025-11-10T21:31:02.003563",
      "post_count": 61,
      "user_count": 19
    },
    "drying-clothing-indoors": {
      "thread_file": "drying-clothing-indoors_Drying-clothing-indoors.md",
      "thread_title": "Drying clothing indoors",
      "thread_url": "https://connect.ntminfo.org/discussion/drying-clothing-indoors",
      "relevant_topics": [
        "environmental_exposures",
        "work_employment",
        "medical_centers"
      ],
      "topic_count": 3,
      "tagged_date": "2025-11-15T23:30:02.000000",
      "original_post_date": "Posted 01-29-2024 02:59 PM",
      "original_post_date_iso": "2024-01-29T00:00:00",
      "latest_post_date": "Posted 08-25-2025 01:48 PM",
      "latest_post_date_iso": "2025-08-25T00:00:00",
      "post_count": 11,
      "user_count": 5
    },
    "drying-the-volara-hose": {
      "thread_file": "drying-the-volara-hose_Drying-the-Volara-hose.md",
      "thread_title": "Drying the Volara hose",
      "thread_url": "https://connect.ntminfo.org/discussion/drying-the-volara-hose",
      "relevant_topics": [
        "equipment_maintenance",
        "equipment_sterilization",
        "vest_therapy",
        "water_safety"
      ],
      "topic_count": 4,
      "tagged_date": "2025-11-15T23:30:03.000000",
      "original_post_date": "Posted 04-09-2025 12:42 PM",
      "original_post_date_iso": "2025-04-09T00:00:00",
      "latest_post_date": "Posted 10-09-2025 08:48 AM",
      "latest_post_date_iso": "2025-10-09T00:00:00",
      "post_count": 14,
      "user_count": 5
    },
    "drying-the-volara-hose-1": {
      "thread_file": "drying-the-volara-hose-1_Drying-the-Volara-hose.md",
      "thread_title": "Drying the Volara hose",
      "thread_url": "https://connect.ntminfo.org/discussion/drying-the-volara-hose-1",
      "relevant_topics": [
        "equipment_maintenance",
        "equipment_sterilization",
        "vest_therapy",
        "medical_centers"
      ],
      "topic_count": 4,
      "tagged_date": "2025-11-15T23:30:04.000000",
      "original_post_date": "Posted 05-12-2025 09:52 AM",
      "original_post_date_iso": "2025-05-12T00:00:00",
      "latest_post_date": "Posted 05-27-2025 02:07 AM",
      "latest_post_date_iso": "2025-05-27T00:00:00",
      "post_count": 13,
      "user_count": 6
    },
    "dust-from-renovations": {
      "thread_file": "dust-from-renovations_Dust-from-renovations.md",
      "thread_title": "Dust from renovations",
      "thread_url": "https://connect.ntminfo.org/discussion/dust-from-renovations",
      "relevant_topics": [
        "environmental_exposures",
        "infection_prevention",
        "work_employment",
        "medical_centers"
      ],
      "topic_count": 4,
      "tagged_date": "2025-11-15T23:30:05.000000",
      "original_post_date": "Posted 06-26-2025 10:34 AM",
      "original_post_date_iso": "2025-06-26T00:00:00",
      "latest_post_date": "Posted 06-28-2025 01:00 PM",
      "latest_post_date_iso": "2025-06-28T00:00:00",
      "post_count": 4,
      "user_count": 3
    },
    "dusty-roads": {
      "thread_file": "dusty-roads_Dusty-roads.md",
      "thread_title": "Dusty roads",
      "thread_url": "https://connect.ntminfo.org/discussion/dusty-roads",
      "relevant_topics": [
        "environmental_exposures",
        "travel_safety",
        "medical_centers",
        "infection_prevention"
      ],
      "topic_count": 4,
      "tagged_date": "2025-11-15T23:30:06.000000",
      "original_post_date": "Posted 09-21-2024 11:57 PM",
      "original_post_date_iso": "2024-09-21T00:00:00",
      "latest_post_date": "Posted 10-02-2024 08:54 PM",
      "latest_post_date_iso": "2024-10-02T00:00:00",
      "post_count": 10,
      "user_count": 6
    },
    "e-coli-and-sterilizers": {
      "thread_file": "e-coli-and-sterilizers_E-coli-and-sterilizers.md",
      "thread_title": "E. coli and sterilizers",
      "thread_url": "https://connect.ntminfo.org/discussion/e-coli-and-sterilizers",
      "relevant_topics": [
        "equipment_sterilization",
        "medical_centers",
        "research_trials"
      ],
      "topic_count": 3,
      "tagged_date": "2025-11-15T23:00:09.000000",
      "original_post_date": "Posted 10-27-2022 11:39 AM",
      "original_post_date_iso": "2022-10-27T00:00:00",
      "latest_post_date": "Posted 03-18-2025 03:59 PM",
      "latest_post_date_iso": "2025-03-18T00:00:00",
      "post_count": 5,
      "user_count": 3
    },
    "e-ntm-of-the-breast": {
      "thread_file": "e-ntm-of-the-breast_E-NTM-of-the-Breast.md",
      "thread_title": "E NTM of the Breast",
      "thread_url": "https://connect.ntminfo.org/discussion/e-ntm-of-the-breast",
      "relevant_topics": [
        "patient_stories",
        "emotional_support",
        "surgical_treatment",
        "medication_side_effects",
        "medical_centers"
      ],
      "topic_count": 5,
      "tagged_date": "2025-11-15T23:00:10.000000",
      "original_post_date": "Posted 09-30-2024 03:22 PM",
      "original_post_date_iso": "2024-09-30T00:00:00",
      "latest_post_date": "Posted 10-07-2024 10:57 AM",
      "latest_post_date_iso": "2024-10-07T00:00:00",
      "post_count": 17,
      "user_count": 8
    },
    "easy-sign-up-for-world-be-patient-takeaways-w-dr-addrzzo-harris": {
      "thread_file": "easy-sign-up-for-world-be-patient-takeaways-w-dr-addrzzo-harris_Easy-sign-up-for-World-BE-Patient-Takeaw.md",
      "thread_title": "Easy sign-up for World BE Patient Takeaways w/ Dr Addrzzo-Harris",
      "thread_url": "https://connect.ntminfo.org/discussion/easy-sign-up-for-world-be-patient-takeaways-w-dr-addrzzo-harris",
      "relevant_topics": [
        "medical_centers",
        "emotional_support"
      ],
      "topic_count": 2,
      "tagged_date": "2025-11-15T23:00:11.000000",
      "original_post_date": "Posted 07-13-2025 08:40 AM",
      "original_post_date_iso": "2025-07-13T00:00:00",
      "latest_post_date": "Posted 07-13-2025 08:40 AM",
      "latest_post_date_iso": "2025-07-13T00:00:00",
      "post_count": 1,
      "user_count": 1
    },
    "electric-toothbrushes": {
      "thread_file": "electric-toothbrushes_Electric-Toothbrushes.md",
      "thread_title": "Electric Toothbrushes",
      "thread_url": "https://connect.ntminfo.org/discussion/electric-toothbrushes",
      "relevant_topics": [
        "equipment_maintenance",
        "equipment_sterilization",
        "alternative_therapies"
      ],
      "topic_count": 3,
      "tagged_date": "2025-11-15T23:30:09.000000",
      "original_post_date": "Posted 11-19-2024 09:12 AM",
      "original_post_date_iso": "2024-11-19T00:00:00",
      "latest_post_date": "Posted 08-22-2025 09:10 AM",
      "latest_post_date_iso": "2025-08-22T00:00:00",
      "post_count": 7,
      "user_count": 5
    },
    "elfembarc-5th-bronchiectasis-patient-conference-recording-available": {
      "thread_file": "elfembarc-5th-bronchiectasis-patient-conference-recording-available_ELFEMBARC-5th-Bronchiectasis-Patient-Con.md",
      "thread_title": "ELF/EMBARC 5th Bronchiectasis Patient Conference Recording-Available!!",
      "thread_url": "https://connect.ntminfo.org/discussion/elfembarc-5th-bronchiectasis-patient-conference-recording-available",
      "relevant_topics": [
        "medical_centers",
        "emotional_support"
      ],
      "topic_count": 2,
      "tagged_date": "2025-11-15T23:30:10.000000",
      "original_post_date": "Posted 04-03-2025 02:08 PM",
      "original_post_date_iso": "2025-04-03T00:00:00",
      "latest_post_date": "Posted 04-03-2025 02:08 PM",
      "latest_post_date_iso": "2025-04-03T00:00:00",
      "post_count": 1,
      "user_count": 1
    },
    "emails-once-a-week": {
      "thread_file": "emails-once-a-week_emails-once-a-week.md",
      "thread_title": "emails once a week",
      "thread_url": "https://connect.ntminfo.org/discussion/emails-once-a-week",
      "relevant_topics": [
        "work_employment"
      ],
      "topic_count": 1,
      "tagged_date": "2025-11-15T23:30:11.000000",
      "original_post_date": "Posted 19 days ago",
      "original_post_date_iso": "2025-10-26T21:31:17.878879",
      "latest_post_date": "Posted 18 days ago",
      "latest_post_date_iso": "2025-10-27T21:31:17.878879",
      "post_count": 2,
      "user_count": 1
    },
    "embarking-on-treatment": {
      "thread_file": "embarking-on-treatment_Embarking-on-Treatment.md",
      "thread_title": "Embarking on Treatment",
      "thread_url": "https://connect.ntminfo.org/discussion/embarking-on-treatment",
      "relevant_topics": [
        "big3_antibiotics",
        "medication_side_effects",
        "emotional_support",
        "patient_stories",
        "treatment_monitoring"
      ],
      "topic_count": 5,
      "tagged_date": "2025-11-15T23:30:12.000000",
      "original_post_date": "Posted 09-06-2025 03:02 PM",
      "original_post_date_iso": "2025-09-06T00:00:00",
      "latest_post_date": "Posted 09-09-2025 10:15 PM",
      "latest_post_date_iso": "2025-09-09T00:00:00",
      "post_count": 19,
      "user_count": 11
    },
    "emergency-power-for-concentrator-perfecto2v-during-hurricanes": {
      "thread_file": "emergency-power-for-concentrator-perfecto2v-during-hurricanes_Emergency-power-for-Concentrator-Perfect.md",
      "thread_title": "Emergency power for Concentrator & Perfecto2V during Hurricanes",
      "thread_url": "https://connect.ntminfo.org/discussion/emergency-power-for-concentrator-perfecto2v-during-hurricanes",
      "relevant_topics": [
        "equipment_maintenance",
        "travel_equipment"
      ],
      "topic_count": 2,
      "tagged_date": "2025-11-15T23:30:13.000000",
      "original_post_date": "Posted 08-25-2025 09:27 AM",
      "original_post_date_iso": "2025-08-25T00:00:00",
      "latest_post_date": "Posted 08-26-2025 09:40 AM",
      "latest_post_date_iso": "2025-08-26T00:00:00",
      "post_count": 3,
      "user_count": 2
    },
    "ent-scopes-and-ntm": {
      "thread_file": "ent-scopes-and-ntm_ENT-scopes-and-NTM.md",
      "thread_title": "ENT scopes and NTM",
      "thread_url": "https://connect.ntminfo.org/discussion/ent-scopes-and-ntm",
      "relevant_topics": [
        "medical_centers",
        "equipment_sterilization",
        "infection_prevention",
        "patient_stories"
      ],
      "topic_count": 4,
      "tagged_date": "2025-11-15T23:30:14.000000",
      "original_post_date": "Posted 12-11-2024 07:17 PM",
      "original_post_date_iso": "2024-12-11T00:00:00",
      "latest_post_date": "Posted 12-17-2024 09:59 AM",
      "latest_post_date_iso": "2024-12-17T00:00:00",
      "post_count": 10,
      "user_count": 7
    },
    "enviromental-risks-for-mac": {
      "thread_file": "enviromental-risks-for-mac_Enviromental-risks-for-MAC.md",
      "thread_title": "Enviromental risks for MAC",
      "thread_url": "https://connect.ntminfo.org/discussion/enviromental-risks-for-mac",
      "relevant_topics": [
        "environmental_exposures",
        "water_safety",
        "infection_prevention",
        "medical_centers"
      ],
      "topic_count": 4,
      "tagged_date": "2025-11-15T23:00:18.000000",
      "original_post_date": "Posted 10-21-2024 01:30 PM",
      "original_post_date_iso": "2024-10-21T00:00:00",
      "latest_post_date": "Posted 10-24-2024 10:18 AM",
      "latest_post_date_iso": "2024-10-24T00:00:00",
      "post_count": 9,
      "user_count": 1
    },
    "environment-risks-specifically-dust-traveling-to-san-jose-del-cabo-dr-falkinham-please": {
      "thread_file": "environment-risks-specifically-dust-traveling-to-san-jose-del-cabo-dr-falkinham-please_Environment-risks-specifically-dust-trav.md",
      "thread_title": "Environment risks specifically dust; traveling to San Jose del Cabo. Dr Falkinham please!",
      "thread_url": "https://connect.ntminfo.org/discussion/environment-risks-specifically-dust-traveling-to-san-jose-del-cabo-dr-falkinham-please",
      "relevant_topics": [
        "travel_safety",
        "environmental_exposures",
        "infection_prevention"
      ],
      "topic_count": 3,
      "tagged_date": "2025-11-15T23:00:19.000000",
      "original_post_date": "Posted 10-23-2024 01:59 PM",
      "original_post_date_iso": "2024-10-23T00:00:00",
      "latest_post_date": "Posted 10-24-2024 09:26 AM",
      "latest_post_date_iso": "2024-10-24T00:00:00",
      "post_count": 3,
      "user_count": 3
    },
    "epa-list-of-antimicrobial-cleaning-products-effective-against-ntm": {
      "thread_file": "epa-list-of-antimicrobial-cleaning-products-effective-against-ntm_EPA-list-of-antimicrobial-cleaning-produ.md",
      "thread_title": "EPA list of antimicrobial cleaning products effective against NTM",
      "thread_url": "https://connect.ntminfo.org/discussion/epa-list-of-antimicrobial-cleaning-products-effective-against-ntm",
      "relevant_topics": [
        "equipment_sterilization",
        "nebulizers",
        "equipment_maintenance",
        "research_trials"
      ],
      "topic_count": 4,
      "tagged_date": "2025-11-15T23:00:20.000000",
      "original_post_date": "Posted 09-07-2025 02:11 PM",
      "original_post_date_iso": "2025-09-07T00:00:00",
      "latest_post_date": "Posted 09-08-2025 09:23 AM",
      "latest_post_date_iso": "2025-09-08T00:00:00",
      "post_count": 5,
      "user_count": 5
    },
    "epic-water-filters": {
      "thread_file": "epic-water-filters_Epic-Water-Filters.md",
      "thread_title": "Epic Water Filters",
      "thread_url": "https://connect.ntminfo.org/discussion/epic-water-filters",
      "relevant_topics": [
        "water_safety",
        "equipment_maintenance"
      ],
      "topic_count": 2,
      "tagged_date": "2025-11-15T23:00:21.000000",
      "original_post_date": "Posted 07-01-2025 07:09 AM",
      "original_post_date_iso": "2025-07-01T00:00:00",
      "latest_post_date": "Posted 07-02-2025 04:15 PM",
      "latest_post_date_iso": "2025-07-02T00:00:00",
      "post_count": 2,
      "user_count": 2
    },
    "escherichia-coli-in-lower-respiratory-culture": {
      "thread_file": "escherichia-coli-in-lower-respiratory-culture_Escherichia-Coli-in-Lower-Respiratory-Cu.md",
      "thread_title": "Escherichia Coli in Lower Respiratory Culture",
      "thread_url": "https://connect.ntminfo.org/discussion/escherichia-coli-in-lower-respiratory-culture",
      "relevant_topics": [
        "coinfections",
        "patient_stories",
        "digestive_issues",
        "sputum_cultures"
      ],
      "topic_count": 4,
      "tagged_date": "2025-11-15T23:00:22.000000",
      "original_post_date": "Posted 03-17-2025 04:38 PM",
      "original_post_date_iso": "2025-03-17T00:00:00",
      "latest_post_date": "Posted 03-20-2025 03:28 AM",
      "latest_post_date_iso": "2025-03-20T00:00:00",
      "post_count": 3,
      "user_count": 2
    },
    "evaporation-from-rivers-and-lakes": {
      "thread_file": "evaporation-from-rivers-and-lakes_evaporation-from-rivers-and-lakes.md",
      "thread_title": "evaporation from rivers and lakes",
      "thread_url": "https://connect.ntminfo.org/discussion/evaporation-from-rivers-and-lakes",
      "relevant_topics": [
        "environmental_exposures",
        "water_safety",
        "travel_safety",
        "infection_prevention",
        "medical_centers",
        "research_trials"
      ],
      "topic_count": 6,
      "tagged_date": "2025-11-15T23:00:23.000000",
      "original_post_date": "Posted 05-08-2025 10:36 PM",
      "original_post_date_iso": "2025-05-08T00:00:00",
      "latest_post_date": "Posted 05-19-2025 09:43 AM",
      "latest_post_date_iso": "2025-05-19T00:00:00",
      "post_count": 11,
      "user_count": 3
    },
    "exacerbations": {
      "thread_file": "exacerbations_Exacerbations.md",
      "thread_title": "Exacerbations",
      "thread_url": "https://connect.ntminfo.org/discussion/exacerbations",
      "relevant_topics": [
        "other_complications",
        "coinfections",
        "treatment_monitoring"
      ],
      "topic_count": 3,
      "tagged_date": "2025-11-15T23:00:24.000000",
      "original_post_date": "Posted 05-02-2025 09:33 AM",
      "original_post_date_iso": "2025-05-02T00:00:00",
      "latest_post_date": "Posted 05-03-2025 09:30 AM",
      "latest_post_date_iso": "2025-05-03T00:00:00",
      "post_count": 2,
      "user_count": 2
    },
    "exacerbations-1": {
      "thread_file": "exacerbations-1_Exacerbations.md",
      "thread_title": "Exacerbations",
      "thread_url": "https://connect.ntminfo.org/discussion/exacerbations-1",
      "relevant_topics": [
        "other_complications",
        "treatment_monitoring",
        "coinfections",
        "medical_centers"
      ],
      "topic_count": 4,
      "tagged_date": "2025-11-15T23:00:25.000000",
      "original_post_date": "Posted 09-11-2025 10:31 AM",
      "original_post_date_iso": "2025-09-11T00:00:00",
      "latest_post_date": "Posted 09-16-2025 10:13 AM",
      "latest_post_date_iso": "2025-09-16T00:00:00",
      "post_count": 7,
      "user_count": 5
    },
    "exciting-news-ntm-connect-is-getting-a-new-look-and-feel": {
      "thread_file": "exciting-news-ntm-connect-is-getting-a-new-look-and-feel_Exciting-News-NTM-Connect-is-getting-a-n.md",
      "thread_title": "Exciting News - NTM Connect is getting a new look and feel!",
      "thread_url": "https://connect.ntminfo.org/discussion/exciting-news-ntm-connect-is-getting-a-new-look-and-feel",
      "relevant_topics": [
        "emotional_support",
        "work_employment"
      ],
      "topic_count": 2,
      "tagged_date": "2025-11-15T23:00:26.000000",
      "original_post_date": "Posted 01-10-2025 06:32 PMEdited by Bekah Weidner 01-10-2025 06:32 PM",
      "original_post_date_iso": "2025-01-10T00:00:00",
      "latest_post_date": "Posted 01-11-2025 10:06 AMEdited by Helen Zhang 01-11-2025 10:23 AM",
      "latest_post_date_iso": "2025-01-11T00:00:00",
      "post_count": 2,
      "user_count": 2
    },
    "exciting-news-thirty-three-centers-join-new-bronchiectasis-and-ntm-care-center-network": {
      "thread_file": "exciting-news-thirty-three-centers-join-new-bronchiectasis-and-ntm-care-center-network_EXCITING-NEWS-Thirty-three-centers-join-.md",
      "thread_title": "EXCITING NEWS! Thirty-three centers join new Bronchiectasis and NTM Care Center Network",
      "thread_url": "https://connect.ntminfo.org/discussion/exciting-news-thirty-three-centers-join-new-bronchiectasis-and-ntm-care-center-network",
      "relevant_topics": [
        "medical_centers",
        "emotional_support"
      ],
      "topic_count": 2,
      "tagged_date": "2025-11-15T23:00:27.000000",
      "original_post_date": "Posted 03-12-2025 10:10 PM",
      "original_post_date_iso": "2025-03-12T00:00:00",
      "latest_post_date": "Posted 05-09-2025 08:30 AM",
      "latest_post_date_iso": "2025-05-09T00:00:00",
      "post_count": 10,
      "user_count": 9
    },
    "exercise-eating-and-nebbing": {
      "thread_file": "exercise-eating-and-nebbing_Exercise-eating-and-nebbing.md",
      "thread_title": "Exercise, eating, and nebbing",
      "thread_url": "https://connect.ntminfo.org/discussion/exercise-eating-and-nebbing",
      "relevant_topics": [
        "exercise_activity",
        "work_employment",
        "nebulizers",
        "equipment_sterilization",
        "manual_techniques",
        "saline_therapy",
        "vest_therapy"
      ],
      "topic_count": 7,
      "tagged_date": "2025-11-15T23:00:28.000000",
      "original_post_date": "Posted 22 days ago",
      "original_post_date_iso": "2025-10-23T21:31:02.700273",
      "latest_post_date": "Posted 15 days ago",
      "latest_post_date_iso": "2025-10-30T21:31:02.700273",
      "post_count": 12,
      "user_count": 8
    },
    "extra-pulmonary-ntm": {
      "thread_file": "extra-pulmonary-ntm_Extra-Pulmonary-NTM.md",
      "thread_title": "Extra-Pulmonary NTM",
      "thread_url": "https://connect.ntminfo.org/discussion/extra-pulmonary-ntm",
      "relevant_topics": [
        "patient_stories",
        "emotional_support",
        "surgical_treatment",
        "iv_antibiotics",
        "other_complications"
      ],
      "topic_count": 5,
      "tagged_date": "2025-11-15T23:00:29.000000",
      "original_post_date": "Posted 01-22-2024 08:02 PM",
      "original_post_date_iso": "2024-01-22T00:00:00",
      "latest_post_date": "Posted 02-13-2025 12:52 PM",
      "latest_post_date_iso": "2025-02-13T00:00:00",
      "post_count": 4,
      "user_count": 3
    },
    "extrapulmonary-ntm-mac-setback-duke-bound": {
      "thread_file": "extrapulmonary-ntm-mac-setback-duke-bound_Extrapulmonary-NTM-MAC-setback-Duke-boun.md",
      "thread_title": "Extrapulmonary NTM MAC setback - Duke bound.",
      "thread_url": "https://connect.ntminfo.org/discussion/extrapulmonary-ntm-mac-setback-duke-bound",
      "relevant_topics": [
        "surgical_treatment",
        "iv_antibiotics",
        "medical_centers",
        "patient_stories",
        "emotional_support"
      ],
      "topic_count": 5,
      "tagged_date": "2025-11-15T23:00:30.000000",
      "original_post_date": "Posted 05-29-2025 03:03 PM",
      "original_post_date_iso": "2025-05-29T00:00:00",
      "latest_post_date": "Posted 06-03-2025 10:01 AM",
      "latest_post_date_iso": "2025-06-03T00:00:00",
      "post_count": 7,
      "user_count": 3
    },
    "extrapulmonary-ntm-support-group-meeting-is-on-february-12th-at-3pm-et": {
      "thread_file": "extrapulmonary-ntm-support-group-meeting-is-on-february-12th-at-3pm-et_Extrapulmonary-NTM-Support-Group-Meeting.md",
      "thread_title": "Extrapulmonary NTM Support Group Meeting is on February 12th at 3pm ET",
      "thread_url": "https://connect.ntminfo.org/discussion/extrapulmonary-ntm-support-group-meeting-is-on-february-12th-at-3pm-et",
      "relevant_topics": [
        "emotional_support"
      ],
      "topic_count": 1,
      "tagged_date": "2025-11-15T23:00:31.000000",
      "original_post_date": "Posted 02-05-2024 02:29 PM",
      "original_post_date_iso": "2024-02-05T00:00:00",
      "latest_post_date": "Posted 02-13-2025 01:09 PM",
      "latest_post_date_iso": "2025-02-13T00:00:00",
      "post_count": 2,
      "user_count": 2
    },
    "family-related-mac": {
      "thread_file": "family-related-mac_Family-related-MAC.md",
      "thread_title": "Family related MAC",
      "thread_url": "https://connect.ntminfo.org/discussion/family-related-mac",
      "relevant_topics": [
        "family_relationships",
        "research_trials",
        "medical_centers"
      ],
      "topic_count": 3,
      "tagged_date": "2025-11-15T23:00:32.000000",
      "original_post_date": "Posted 07-13-2025 10:11 AM",
      "original_post_date_iso": "2025-07-13T00:00:00",
      "latest_post_date": "Posted 07-15-2025 12:02 AM",
      "latest_post_date_iso": "2025-07-15T00:00:00",
      "post_count": 12,
      "user_count": 8
    },
    "family-support": {
      "thread_file": "family-support_Family-support.md",
      "thread_title": "Family support",
      "thread_url": "https://connect.ntminfo.org/discussion/family-support",
      "relevant_topics": [
        "emotional_support",
        "family_relationships",
        "work_employment"
      ],
      "topic_count": 3,
      "tagged_date": "2025-11-15T23:00:33.000000",
      "original_post_date": "Posted 08-30-2024 01:37 PM",
      "original_post_date_iso": "2024-08-30T00:00:00",
      "latest_post_date": "Posted 05-18-2025 12:56 PM",
      "latest_post_date_iso": "2025-05-18T00:00:00",
      "post_count": 29,
      "user_count": 14
    },
    "fatigue-1": {
      "thread_file": "fatigue-1_Fatigue.md",
      "thread_title": "Fatigue",
      "thread_url": "https://connect.ntminfo.org/discussion/fatigue-1",
      "relevant_topics": [
        "other_complications",
        "exercise_activity",
        "patient_stories"
      ],
      "topic_count": 3,
      "tagged_date": "2025-11-15T23:00:34.000000",
      "original_post_date": "Posted 04-21-2025 10:14 AMEdited by Elizabeth Oram 04-21-2025 10:20 AM",
      "original_post_date_iso": "2025-04-21T00:00:00",
      "latest_post_date": "Posted 04-28-2025 09:38 AM",
      "latest_post_date_iso": "2025-04-28T00:00:00",
      "post_count": 13,
      "user_count": 9
    },
    "fatigue-2": {
      "thread_file": "fatigue-2_Fatigue.md",
      "thread_title": "Fatigue",
      "thread_url": "https://connect.ntminfo.org/discussion/fatigue-2",
      "relevant_topics": [
        "other_complications",
        "medication_side_effects",
        "patient_stories",
        "newer_antibiotics"
      ],
      "topic_count": 4,
      "tagged_date": "2025-11-15T23:00:35.000000",
      "original_post_date": "Posted 09-08-2025 11:56 AM",
      "original_post_date_iso": "2025-09-08T00:00:00",
      "latest_post_date": "Posted 09-20-2025 10:04 AM",
      "latest_post_date_iso": "2025-09-20T00:00:00",
      "post_count": 16,
      "user_count": 7
    },
    "fatigue-3": {
      "thread_file": "fatigue-3_Fatigue.md",
      "thread_title": "Fatigue",
      "thread_url": "https://connect.ntminfo.org/discussion/fatigue-3",
      "relevant_topics": [
        "other_complications",
        "alternative_therapies",
        "medication_side_effects"
      ],
      "topic_count": 3,
      "tagged_date": "2025-11-15T23:00:36.000000",
      "original_post_date": "Posted 24 days ago",
      "original_post_date_iso": "2025-10-21T21:31:32.203440",
      "latest_post_date": "Posted 22 days ago",
      "latest_post_date_iso": "2025-10-23T21:31:32.203440",
      "post_count": 4,
      "user_count": 2
    },
    "faucet-for-pall-filter-at-a-bathroom-sink": {
      "thread_file": "faucet-for-pall-filter-at-a-bathroom-sink_Faucet-for-Pall-filter-at-a-Bathroom-Sin.md",
      "thread_title": "Faucet for Pall filter at a Bathroom Sink.",
      "thread_url": "https://connect.ntminfo.org/discussion/faucet-for-pall-filter-at-a-bathroom-sink",
      "relevant_topics": [
        "water_safety",
        "equipment_maintenance"
      ],
      "topic_count": 2,
      "tagged_date": "2025-11-15T23:30:00.000000",
      "original_post_date": "Posted 10-13-2025 12:43 AM",
      "original_post_date_iso": "2025-10-13T00:00:00",
      "latest_post_date": "Posted 29 days ago",
      "latest_post_date_iso": "2025-10-16T21:31:31.224131",
      "post_count": 3,
      "user_count": 2
    },
    "faucet-to-use-with-pall-filter": {
      "thread_file": "faucet-to-use-with-pall-filter_Faucet-to-use-with-Pall-filter.md",
      "thread_title": "Faucet to use with Pall filter",
      "thread_url": "https://connect.ntminfo.org/discussion/faucet-to-use-with-pall-filter",
      "relevant_topics": [
        "water_safety",
        "equipment_maintenance"
      ],
      "topic_count": 2,
      "tagged_date": "2025-11-15T23:30:01.000000",
      "original_post_date": "Posted 08-02-2025 12:39 AM",
      "original_post_date_iso": "2025-08-02T00:00:00",
      "latest_post_date": "Posted 08-27-2025 08:02 PM",
      "latest_post_date_iso": "2025-08-27T00:00:00",
      "post_count": 5,
      "user_count": 3
    },
    "favor-1": {
      "thread_file": "favor-1_favor.md",
      "thread_title": "favor..!",
      "thread_url": "https://connect.ntminfo.org/discussion/favor-1",
      "relevant_topics": [],
      "topic_count": 0,
      "tagged_date": "2025-11-15T23:30:02.000000",
      "original_post_date": "Posted 03-27-2025 07:40 PM",
      "original_post_date_iso": "2025-03-27T00:00:00",
      "latest_post_date": "Posted 03-27-2025 07:40 PM",
      "latest_post_date_iso": "2025-03-27T00:00:00",
      "post_count": 1,
      "user_count": 1
    },
    "filter-for-bololo-baby-sterilizer": {
      "thread_file": "filter-for-bololo-baby-sterilizer_Filter-for-Bololo-baby-sterilizer.md",
      "thread_title": "Filter for Bololo baby sterilizer",
      "thread_url": "https://connect.ntminfo.org/discussion/filter-for-bololo-baby-sterilizer",
      "relevant_topics": [
        "equipment_sterilization",
        "equipment_maintenance"
      ],
      "topic_count": 2,
      "tagged_date": "2025-11-15T23:30:03.000000",
      "original_post_date": "Posted 30 days ago",
      "original_post_date_iso": "2025-10-15T21:31:40.142566",
      "latest_post_date": "Posted 28 days ago",
      "latest_post_date_iso": "2025-10-17T21:31:40.142566",
      "post_count": 4,
      "user_count": 3
    },
    "filters-for-kitchen-faucet": {
      "thread_file": "filters-for-kitchen-faucet_Filters-for-Kitchen-Faucet.md",
      "thread_title": "Filters for Kitchen Faucet",
      "thread_url": "https://connect.ntminfo.org/discussion/filters-for-kitchen-faucet",
      "relevant_topics": [
        "water_safety",
        "equipment_sterilization",
        "equipment_maintenance",
        "research_trials",
        "medical_centers"
      ],
      "topic_count": 5,
      "tagged_date": "2025-11-15T23:30:04.000000",
      "original_post_date": "Posted 07-13-2023 09:12 PM",
      "original_post_date_iso": "2023-07-13T00:00:00",
      "latest_post_date": "Posted 09-14-2025 11:16 AM",
      "latest_post_date_iso": "2025-09-14T00:00:00",
      "post_count": 77,
      "user_count": 29
    },
    "finishing-treatment": {
      "thread_file": "finishing-treatment_Finishing-treatment.md",
      "thread_title": "Finishing treatment",
      "thread_url": "https://connect.ntminfo.org/discussion/finishing-treatment",
      "relevant_topics": [
        "species_specific_treatment",
        "treatment_monitoring",
        "patient_stories"
      ],
      "topic_count": 3,
      "tagged_date": "2025-11-15T23:30:05.000000",
      "original_post_date": "Posted 03-19-2025 12:05 AM",
      "original_post_date_iso": "2025-03-19T00:00:00",
      "latest_post_date": "Posted 03-20-2025 07:47 PM",
      "latest_post_date_iso": "2025-03-20T00:00:00",
      "post_count": 2,
      "user_count": 2
    },
    "first-north-american-bronchiectasis-and-ntm-patient-education-program-december-10th-at-3pm-et": {
      "thread_file": "first-north-american-bronchiectasis-and-ntm-patient-education-program-december-10th-at-3pm-et_First-North-American-Bronchiectasis-and-.md",
      "thread_title": "First North American Bronchiectasis and NTM Patient Education Program - December 10th at 3pm ET",
      "thread_url": "https://connect.ntminfo.org/discussion/first-north-american-bronchiectasis-and-ntm-patient-education-program-december-10th-at-3pm-et",
      "relevant_topics": [
        "emotional_support",
        "medical_centers"
      ],
      "topic_count": 2,
      "tagged_date": "2025-11-15T23:30:06.000000",
      "original_post_date": "Posted 11-04-2024 04:18 PMEdited by Bekah Weidner 12-06-2024 01:33 PM",
      "original_post_date_iso": "2024-11-04T00:00:00",
      "latest_post_date": "Posted 11-04-2024 04:18 PMEdited by Bekah Weidner 12-06-2024 01:33 PM",
      "latest_post_date_iso": "2024-11-04T00:00:00",
      "post_count": 1,
      "user_count": 1
    },
    "fitful-nights": {
      "thread_file": "fitful-nights_Fitful-nights.md",
      "thread_title": "Fitful nights",
      "thread_url": "https://connect.ntminfo.org/discussion/fitful-nights",
      "relevant_topics": [
        "other_complications",
        "work_employment"
      ],
      "topic_count": 2,
      "tagged_date": "2025-11-15T23:30:07.000000",
      "original_post_date": "Posted 11-11-2024 08:21 AM",
      "original_post_date_iso": "2024-11-11T00:00:00",
      "latest_post_date": "Posted 11-11-2024 08:21 AM",
      "latest_post_date_iso": "2024-11-11T00:00:00",
      "post_count": 2,
      "user_count": 0
    },
    "drinking-water-safely-when-not-at-home-clarification-needed-form-dr-falkinham-please": {
      "thread_file": "drinking-water-safely-when-not-at-home-clarification-needed-form-dr-falkinham-please_Drinking-water-safely-when-not-at-home-c.md",
      "thread_title": "Drinking water safely when not at home: clarification needed form Dr. Falkinham please!",
      "thread_url": "https://connect.ntminfo.org/discussion/drinking-water-safely-when-not-at-home-clarification-needed-form-dr-falkinham-please",
      "relevant_topics": [
        "water_safety",
        "travel_safety",
        "equipment_maintenance",
        "medical_centers",
        "research_trials"
      ],
      "topic_count": 5,
      "tagged_date": "2025-11-15T23:15:13.000000",
      "original_post_date": "Posted 05-03-2024 01:15 PM",
      "original_post_date_iso": "2024-05-03T00:00:00",
      "latest_post_date": "Posted 06-02-2025 10:06 AM",
      "latest_post_date_iso": "2025-06-02T00:00:00",
      "post_count": 10,
      "user_count": 4
    },
    "drip-coffeemakers": {
      "thread_file": "drip-coffeemakers_Drip-coffeemakers.md",
      "thread_title": "Drip coffeemakers",
      "thread_url": "https://connect.ntminfo.org/discussion/drip-coffeemakers",
      "relevant_topics": [
        "equipment_maintenance",
        "water_safety"
      ],
      "topic_count": 2,
      "tagged_date": "2025-11-15T23:15:14.000000",
      "original_post_date": "Posted 3 days ago",
      "original_post_date_iso": "2025-11-11T21:31:17.396010",
      "latest_post_date": "Posted 3 days ago",
      "latest_post_date_iso": "2025-11-11T21:31:17.396010",
      "post_count": 1,
      "user_count": 1
    },
    "drug-side-effects": {
      "thread_file": "drug-side-effects_Drug-side-effects.md",
      "thread_title": "Drug side effects",
      "thread_url": "https://connect.ntminfo.org/discussion/drug-side-effects",
      "relevant_topics": [
        "big3_antibiotics",
        "medication_side_effects",
        "emotional_support",
        "patient_stories"
      ],
      "topic_count": 4,
      "tagged_date": "2025-11-15T23:30:00.000000",
      "original_post_date": "Posted 01-04-2025 03:44 PM",
      "original_post_date_iso": "2025-01-04T00:00:00",
      "latest_post_date": "Posted 01-09-2025 11:34 PM",
      "latest_post_date_iso": "2025-01-09T00:00:00",
      "post_count": 11,
      "user_count": 7
    },
    "drizzle-pot-when-traveling": {
      "thread_file": "drizzle-pot-when-traveling_Drizzle-pot-when-traveling.md",
      "thread_title": "Drizzle pot when traveling",
      "thread_url": "https://connect.ntminfo.org/discussion/drizzle-pot-when-traveling",
      "relevant_topics": [
        "travel_equipment",
        "equipment_sterilization"
      ],
      "topic_count": 2,
      "tagged_date": "2025-11-15T23:15:15.000000",
      "original_post_date": "Posted 25 days ago",
      "original_post_date_iso": "2025-10-20T21:31:07.922308",
      "latest_post_date": "Posted 24 days ago",
      "latest_post_date_iso": "2025-10-21T21:31:07.922308",
      "post_count": 2,
      "user_count": 1
    },
    "free-webinar-in-honor-of-world-ntm-awareness": {
      "thread_file": "free-webinar-in-honor-of-world-ntm-awareness_Free-Webinar-in-Honor-of-World-NTM-Aware.md",
      "thread_title": "Free Webinar in Honor of World NTM Awareness",
      "thread_url": "https://connect.ntminfo.org/discussion/free-webinar-in-honor-of-world-ntm-awareness",
      "relevant_topics": [
        "research_trials",
        "emotional_support"
      ],
      "topic_count": 2,
      "tagged_date": "2025-11-15T23:30:08.000000",
      "original_post_date": "Posted 07-23-2025 06:00 PMEdited by Bekah Weidner 07-23-2025 06:00 PM",
      "original_post_date_iso": "2025-07-23T00:00:00",
      "latest_post_date": "Posted 07-23-2025 06:00 PMEdited by Bekah Weidner 07-23-2025 06:00 PM",
      "latest_post_date_iso": "2025-07-23T00:00:00",
      "post_count": 1,
      "user_count": 1
    },
    "goodrx-walgreens-and-hypertonic-saline": {
      "thread_file": "goodrx-walgreens-and-hypertonic-saline_GoodRx-Walgreens-and-hypertonic-saline.md",
      "thread_title": "GoodRx , Walgreens and hypertonic saline",
      "thread_url": "https://connect.ntminfo.org/discussion/goodrx-walgreens-and-hypertonic-saline",
      "relevant_topics": [
        "insurance_costs",
        "saline_therapy",
        "equipment_maintenance"
      ],
      "topic_count": 3,
      "tagged_date": "2025-11-15T23:30:09.000000",
      "original_post_date": "Posted 07-11-2024 12:45 PM",
      "original_post_date_iso": "2024-07-11T00:00:00",
      "latest_post_date": "Posted 01-07-2025 04:23 PM",
      "latest_post_date_iso": "2025-01-07T00:00:00",
      "post_count": 40,
      "user_count": 10
    },
    "gym-with-a-pool": {
      "thread_file": "gym-with-a-pool_Gym-with-a-pool.md",
      "thread_title": "Gym with a pool",
      "thread_url": "https://connect.ntminfo.org/discussion/gym-with-a-pool",
      "relevant_topics": [
        "environmental_exposures",
        "water_safety",
        "infection_prevention"
      ],
      "topic_count": 3,
      "tagged_date": "2025-11-15T23:30:10.000000",
      "original_post_date": "Posted 02-07-2025 03:50 PMEdited by Debra Walker 02-07-2025 03:51 PM",
      "original_post_date_iso": "2025-02-07T00:00:00",
      "latest_post_date": "Posted 02-08-2025 10:07 AM",
      "latest_post_date_iso": "2025-02-08T00:00:00",
      "post_count": 3,
      "user_count": 2
    },
    "hearing-loss": {
      "thread_file": "hearing-loss_Hearing-Loss.md",
      "thread_title": "Hearing Loss",
      "thread_url": "https://connect.ntminfo.org/discussion/hearing-loss",
      "relevant_topics": [
        "hearing_complications",
        "medication_side_effects",
        "big3_antibiotics",
        "treatment_monitoring"
      ],
      "topic_count": 4,
      "tagged_date": "2025-11-15T23:30:11.000000",
      "original_post_date": "Posted 10-02-2024 02:09 PM",
      "original_post_date_iso": "2024-10-02T00:00:00",
      "latest_post_date": "Posted 04-07-2025 05:08 PM",
      "latest_post_date_iso": "2025-04-07T00:00:00",
      "post_count": 11,
      "user_count": 4
    },
    "hemoptysis-6": {
      "thread_file": "hemoptysis-6_Hemoptysis.md",
      "thread_title": "Hemoptysis",
      "thread_url": "https://connect.ntminfo.org/discussion/hemoptysis-6",
      "relevant_topics": [
        "other_complications",
        "emotional_support",
        "patient_stories",
        "saline_therapy"
      ],
      "topic_count": 4,
      "tagged_date": "2025-11-15T23:30:12.000000",
      "original_post_date": "Posted 03-25-2025 02:46 PM",
      "original_post_date_iso": "2025-03-25T00:00:00",
      "latest_post_date": "Posted 03-28-2025 03:51 PM",
      "latest_post_date_iso": "2025-03-28T00:00:00",
      "post_count": 8,
      "user_count": 6
    },
    "how-much-water-to-take-to-the-dentist": {
      "thread_file": "how-much-water-to-take-to-the-dentist_How-much-water-to-take-to-the-dentist.md",
      "thread_title": "How much water to take to the dentist?",
      "thread_url": "https://connect.ntminfo.org/discussion/how-much-water-to-take-to-the-dentist",
      "relevant_topics": [
        "water_safety",
        "infection_prevention"
      ],
      "topic_count": 2,
      "tagged_date": "2025-11-16T00:01:03.000000",
      "original_post_date": "Posted 11-03-2024 12:45 AM",
      "original_post_date_iso": "2024-11-03T00:00:00",
      "latest_post_date": "Posted 11-06-2024 05:14 PM",
      "latest_post_date_iso": "2024-11-06T00:00:00",
      "post_count": 5,
      "user_count": 2
    },
    "hvac-air-scrubbers": {
      "thread_file": "hvac-air-scrubbers_HVAC-air-scrubbers.md",
      "thread_title": "HVAC air scrubbers",
      "thread_url": "https://connect.ntminfo.org/discussion/hvac-air-scrubbers",
      "relevant_topics": [
        "environmental_exposures"
      ],
      "topic_count": 1,
      "tagged_date": "2025-11-16T00:01:10.000000",
      "original_post_date": "",
      "original_post_date_iso": "",
      "latest_post_date": "",
      "latest_post_date_iso": "",
      "post_count": 1,
      "user_count": 0
    },
    "icon-1-phase-3-trial-of-nebulized-clofazamine-for-ntm-lung-disease-stopped": {
      "thread_file": "icon-1-phase-3-trial-of-nebulized-clofazamine-for-ntm-lung-disease-stopped_IcON-1-Phase-3-trial-of-nebulized-clofaz.md",
      "thread_title": "IcON-1 Phase 3 trial of nebulized clofazamine for NTM lung disease stopped",
      "thread_url": "https://connect.ntminfo.org/discussion/icon-1-phase-3-trial-of-nebulized-clofazamine-for-ntm-lung-disease-stopped",
      "relevant_topics": [
        "research_trials",
        "newer_antibiotics"
      ],
      "topic_count": 2,
      "tagged_date": "2025-11-16T00:01:12.000000",
      "original_post_date": "Posted 4 days ago",
      "original_post_date_iso": "2025-11-10T21:31:40.846199",
      "latest_post_date": "Posted 3 days ago",
      "latest_post_date_iso": "2025-11-11T21:31:40.846199",
      "post_count": 4,
      "user_count": 3
    },
    "idea-for-spacer-for-levalbuterol": {
      "thread_file": "idea-for-spacer-for-levalbuterol_Idea-for-spacer-for-levalbuterol.md",
      "thread_title": "Idea for spacer for levalbuterol",
      "thread_url": "https://connect.ntminfo.org/discussion/idea-for-spacer-for-levalbuterol",
      "relevant_topics": [
        "inhaled_medications",
        "equipment_maintenance"
      ],
      "topic_count": 2,
      "tagged_date": "2025-11-16T00:01:13.000000",
      "original_post_date": "Posted 10-26-2024 10:12 AM",
      "original_post_date_iso": "2024-10-26T00:00:00",
      "latest_post_date": "Posted 10-30-2024 10:42 AM",
      "latest_post_date_iso": "2024-10-30T00:00:00",
      "post_count": 16,
      "user_count": 9
    },
    "if-cavity-wall-thickness-decreases-what-does-it-mean": {
      "thread_file": "if-cavity-wall-thickness-decreases-what-does-it-mean_If-cavity-wall-thickness-decreases-what-.md",
      "thread_title": "If cavity wall thickness decreases, what does it mean?",
      "thread_url": "https://connect.ntminfo.org/discussion/if-cavity-wall-thickness-decreases-what-does-it-mean",
      "relevant_topics": [
        "imaging_scans",
        "treatment_monitoring"
      ],
      "topic_count": 2,
      "tagged_date": "2025-11-16T00:01:14.000000",
      "original_post_date": "Posted 11 days ago",
      "original_post_date_iso": "2025-11-03T21:30:48.120454",
      "latest_post_date": "Posted 11 days ago",
      "latest_post_date_iso": "2025-11-03T21:30:48.120454",
      "post_count": 1,
      "user_count": 1
    },
    "im-new-to-airway-clearance-and-dont-cough-how-can-i-make-myself-cough": {
      "thread_file": "im-new-to-airway-clearance-and-dont-cough-how-can-i-make-myself-cough_Im-new-to-airway-clearance-and-dont-coug.md",
      "thread_title": "I'm new to airway clearance and don't cough, how can I make myself cough",
      "thread_url": "https://connect.ntminfo.org/discussion/im-new-to-airway-clearance-and-dont-cough-how-can-i-make-myself-cough",
      "relevant_topics": [
        "manual_techniques",
        "aerobika_opep",
        "saline_therapy",
        "patient_stories"
      ],
      "topic_count": 4,
      "tagged_date": "2025-11-16T00:01:15.000000",
      "original_post_date": "Posted 07-30-2025 12:17 AM",
      "original_post_date_iso": "2025-07-30T00:00:00",
      "latest_post_date": "Posted 07-31-2025 09:50 AM",
      "latest_post_date_iso": "2025-07-31T00:00:00",
      "post_count": 5,
      "user_count": 4
    },
    "immune-system-boosting": {
      "thread_file": "immune-system-boosting_Immune-system-boosting.md",
      "thread_title": "Immune system boosting",
      "thread_url": "https://connect.ntminfo.org/discussion/immune-system-boosting",
      "relevant_topics": [
        "nutrition_lifestyle",
        "alternative_therapies"
      ],
      "topic_count": 2,
      "tagged_date": "2025-11-16T00:01:16.000000",
      "original_post_date": "Posted 10-22-2024 01:56 PM",
      "original_post_date_iso": "2024-10-22T00:00:00",
      "latest_post_date": "Posted 10-22-2024 01:56 PM",
      "latest_post_date_iso": "2024-10-22T00:00:00",
      "post_count": 2,
      "user_count": 2
    },
    "immunization-titers": {
      "thread_file": "immunization-titers_Immunization-Titers.md",
      "thread_title": "Immunization Titers",
      "thread_url": "https://connect.ntminfo.org/discussion/immunization-titers",
      "relevant_topics": [
        "alternative_therapies",
        "infection_prevention",
        "travel_safety",
        "medical_centers"
      ],
      "topic_count": 4,
      "tagged_date": "2025-11-16T00:01:17.000000",
      "original_post_date": "Posted 03-14-2025 01:30 PM",
      "original_post_date_iso": "2025-03-14T00:00:00",
      "latest_post_date": "Posted 03-18-2025 02:59 PM",
      "latest_post_date_iso": "2025-03-18T00:00:00",
      "post_count": 6,
      "user_count": 4
    },
    "incruse-ellipta": {
      "thread_file": "incruse-ellipta_incruse-ellipta.md",
      "thread_title": "incruse ellipta",
      "thread_url": "https://connect.ntminfo.org/discussion/incruse-ellipta",
      "relevant_topics": [
        "inhaled_medications",
        "patient_stories"
      ],
      "topic_count": 2,
      "tagged_date": "2025-11-16T00:01:19.000000",
      "original_post_date": "Posted 03-31-2025 11:03 AM",
      "original_post_date_iso": "2025-03-31T00:00:00",
      "latest_post_date": "Posted 04-05-2025 06:56 PM",
      "latest_post_date_iso": "2025-04-05T00:00:00",
      "post_count": 5,
      "user_count": 4
    },
    "increase-in-antibiotic-side-effects": {
      "thread_file": "increase-in-antibiotic-side-effects_Increase-in-Antibiotic-Side-Effects.md",
      "thread_title": "Increase in Antibiotic Side Effects",
      "thread_url": "https://connect.ntminfo.org/discussion/increase-in-antibiotic-side-effects",
      "relevant_topics": [
        "medication_side_effects",
        "big3_antibiotics",
        "treatment_monitoring",
        "patient_stories"
      ],
      "topic_count": 4,
      "tagged_date": "2025-11-16T00:01:18.000000",
      "original_post_date": "Posted 11-12-2024 02:07 PM",
      "original_post_date_iso": "2024-11-12T00:00:00",
      "latest_post_date": "Posted 06-27-2025 11:31 AM",
      "latest_post_date_iso": "2025-06-27T00:00:00",
      "post_count": 25,
      "user_count": 12
    },
    "indoor-salt-water-pool-1": {
      "thread_file": "indoor-salt-water-pool-1_Indoor-Salt-Water-Pool.md",
      "thread_title": "Indoor Salt Water Pool",
      "thread_url": "https://connect.ntminfo.org/discussion/indoor-salt-water-pool-1",
      "relevant_topics": [
        "environmental_exposures",
        "water_safety",
        "medical_centers"
      ],
      "topic_count": 3,
      "tagged_date": "2025-11-16T00:01:20.000000",
      "original_post_date": "Posted 06-09-2025 07:37 PM",
      "original_post_date_iso": "2025-06-09T00:00:00",
      "latest_post_date": "Posted 06-10-2025 12:16 PM",
      "latest_post_date_iso": "2025-06-10T00:00:00",
      "post_count": 2,
      "user_count": 1
    },
    "infectious-disease-doc-in-tampa-fl": {
      "thread_file": "infectious-disease-doc-in-tampa-fl_Infectious-disease-doc-in-Tampa-FL.md",
      "thread_title": "Infectious disease doc in Tampa FL",
      "thread_url": "https://connect.ntminfo.org/discussion/infectious-disease-doc-in-tampa-fl",
      "relevant_topics": [
        "medical_centers"
      ],
      "topic_count": 1,
      "tagged_date": "2025-11-16T00:01:21.000000",
      "original_post_date": "Posted 01-02-2025 11:56 AM",
      "original_post_date_iso": "2025-01-02T00:00:00",
      "latest_post_date": "Posted 01-04-2025 09:35 AM",
      "latest_post_date_iso": "2025-01-04T00:00:00",
      "post_count": 3,
      "user_count": 1
    },
    "inhaled-amikacin": {
      "thread_file": "inhaled-amikacin_Inhaled-Amikacin.md",
      "thread_title": "Inhaled Amikacin",
      "thread_url": "https://connect.ntminfo.org/discussion/inhaled-amikacin",
      "relevant_topics": [
        "inhaled_medications",
        "iv_antibiotics",
        "medication_side_effects",
        "hearing_complications",
        "newer_antibiotics"
      ],
      "topic_count": 5,
      "tagged_date": "2025-11-16T00:01:22.000000",
      "original_post_date": "Posted 04-29-2025 12:50 PM",
      "original_post_date_iso": "2025-04-29T00:00:00",
      "latest_post_date": "Posted 05-01-2025 09:22 AM",
      "latest_post_date_iso": "2025-05-01T00:00:00",
      "post_count": 6,
      "user_count": 3
    },
    "inhaled-tobramycin": {
      "thread_file": "inhaled-tobramycin_Inhaled-tobramycin.md",
      "thread_title": "Inhaled tobramycin",
      "thread_url": "https://connect.ntminfo.org/discussion/inhaled-tobramycin",
      "relevant_topics": [
        "inhaled_medications",
        "coinfections",
        "insurance_costs"
      ],
      "topic_count": 3,
      "tagged_date": "2025-11-16T00:01:23.000000",
      "original_post_date": "Posted 11-13-2024 10:27 AM",
      "original_post_date_iso": "2024-11-13T00:00:00",
      "latest_post_date": "Posted 11-16-2024 04:43 PM",
      "latest_post_date_iso": "2024-11-16T00:00:00",
      "post_count": 4,
      "user_count": 4
    },
    "inhaled-tobramycin-and-azithromycin": {
      "thread_file": "inhaled-tobramycin-and-azithromycin_Inhaled-Tobramycin-and-Azithromycin.md",
      "thread_title": "Inhaled Tobramycin and Azithromycin",
      "thread_url": "https://connect.ntminfo.org/discussion/inhaled-tobramycin-and-azithromycin",
      "relevant_topics": [
        "inhaled_medications",
        "big3_antibiotics",
        "species_specific_treatment",
        "medication_side_effects",
        "insurance_costs"
      ],
      "topic_count": 5,
      "tagged_date": "2025-11-16T00:01:24.000000",
      "original_post_date": "Posted 10-13-2024 07:00 AM",
      "original_post_date_iso": "2024-10-13T00:00:00",
      "latest_post_date": "Posted 10-18-2024 02:05 PM",
      "latest_post_date_iso": "2024-10-18T00:00:00",
      "post_count": 9,
      "user_count": 2
    },
    "inhaler-spacers": {
      "thread_file": "inhaler-spacers_Inhaler-spacers.md",
      "thread_title": "Inhaler spacers",
      "thread_url": "https://connect.ntminfo.org/discussion/inhaler-spacers",
      "relevant_topics": [
        "inhaled_medications",
        "equipment_maintenance"
      ],
      "topic_count": 2,
      "tagged_date": "2025-11-16T00:01:25.000000",
      "original_post_date": "Posted 04-11-2025 09:10 AM",
      "original_post_date_iso": "2025-04-11T00:00:00",
      "latest_post_date": "Posted 04-11-2025 09:10 AM",
      "latest_post_date_iso": "2025-04-11T00:00:00",
      "post_count": 2,
      "user_count": 2
    },
    "inhaling-3-saline-and-tobramycin": {
      "thread_file": "inhaling-3-saline-and-tobramycin_Inhaling-3-saline-and-tobramycin.md",
      "thread_title": "Inhaling 3% saline and tobramycin",
      "thread_url": "https://connect.ntminfo.org/discussion/inhaling-3-saline-and-tobramycin",
      "relevant_topics": [
        "big3_antibiotics",
        "manual_techniques",
        "treatment_monitoring"
      ],
      "topic_count": 3,
      "tagged_date": "2025-11-16T03:34:10.000000",
      "original_post_date": "Posted 05-28-2025 11:56 AM",
      "original_post_date_iso": "2025-05-28T00:00:00",
      "latest_post_date": "Posted 05-29-2025 09:40 AM",
      "latest_post_date_iso": "2025-05-29T00:00:00",
      "post_count": 2,
      "user_count": 2
    },
    "insmed-is-still-looking-for-a-patient-voluteer": {
      "thread_file": "insmed-is-still-looking-for-a-patient-voluteer_Insmed-is-still-looking-for-a-patient-vo.md",
      "thread_title": "Insmed is still looking for a patient volunteer",
      "thread_url": "https://connect.ntminfo.org/discussion/insmed-is-still-looking-for-a-patient-voluteer",
      "relevant_topics": [
        "research_trials"
      ],
      "topic_count": 1,
      "tagged_date": "2025-11-16T00:01:27.000000",
      "original_post_date": "Posted 09-24-2025 01:20 PMEdited by Patricia Kemp 09-26-2025 02:28 PM",
      "original_post_date_iso": "2025-09-24T00:00:00",
      "latest_post_date": "Posted 09-24-2025 01:20 PMEdited by Patricia Kemp 09-26-2025 02:28 PM",
      "latest_post_date_iso": "2025-09-24T00:00:00",
      "post_count": 1,
      "user_count": 0
    },
    "insurance-coverage-for-sterile-water-for-injection-to-mix-colistimethate": {
      "thread_file": "insurance-coverage-for-sterile-water-for-injection-to-mix-colistimethate_insurance-coverage-for-STERILE-WATER-for.md",
      "thread_title": "Insurance coverage for STERILE WATER for injection to mix colistimethate",
      "thread_url": "https://connect.ntminfo.org/discussion/insurance-coverage-for-sterile-water-for-injection-to-mix-colistimethate",
      "relevant_topics": [
        "insurance_costs",
        "inhaled_medications"
      ],
      "topic_count": 2,
      "tagged_date": "2025-11-16T00:00:17.000000",
      "original_post_date": "Posted 08-21-2025 11:42 AM",
      "original_post_date_iso": "2025-08-21T00:00:00",
      "latest_post_date": "Posted 08-26-2025 07:36 PM",
      "latest_post_date_iso": "2025-08-26T00:00:00",
      "post_count": 5,
      "user_count": 3
    },
    "interesting-possible-drug-side-effect": {
      "thread_file": "interesting-possible-drug-side-effect_Interesting-possible-drug-side-effect.md",
      "thread_title": "Interesting possible drug side effect",
      "thread_url": "https://connect.ntminfo.org/discussion/interesting-possible-drug-side-effect",
      "relevant_topics": [
        "medication_side_effects",
        "species_specific_treatment",
        "patient_stories",
        "emotional_support"
      ],
      "topic_count": 4,
      "tagged_date": "2025-11-16T00:00:19.000000",
      "original_post_date": "Posted 12-12-2024 10:41 PM",
      "original_post_date_iso": "2024-12-12T00:00:00",
      "latest_post_date": "Posted 08-19-2025 02:36 PM",
      "latest_post_date_iso": "2025-08-19T00:00:00",
      "post_count": 15,
      "user_count": 6
    },
    "international-travel-insurance": {
      "thread_file": "international-travel-insurance_International-Travel-Insurance.md",
      "thread_title": "International Travel Insurance",
      "thread_url": "https://connect.ntminfo.org/discussion/international-travel-insurance",
      "relevant_topics": [
        "travel_safety",
        "work_employment"
      ],
      "topic_count": 2,
      "tagged_date": "2025-11-16T03:34:11.000000",
      "original_post_date": "Posted 09-24-2025 01:30 PM",
      "original_post_date_iso": "2025-09-24T00:00:00",
      "latest_post_date": "Posted 09-27-2025 09:14 AM",
      "latest_post_date_iso": "2025-09-27T00:00:00",
      "post_count": 3,
      "user_count": 2
    },
    "iron-supplementation": {
      "thread_file": "iron-supplementation_Iron-supplementation.md",
      "thread_title": "Iron supplementation",
      "thread_url": "https://connect.ntminfo.org/discussion/iron-supplementation",
      "relevant_topics": [
        "nutrition_lifestyle",
        "alternative_therapies",
        "research_trials",
        "medical_centers"
      ],
      "topic_count": 4,
      "tagged_date": "2025-11-16T00:00:22.000000",
      "original_post_date": "Posted 02-19-2025 09:07 PM",
      "original_post_date_iso": "2025-02-19T00:00:00",
      "latest_post_date": "Posted 03-12-2025 06:03 PM",
      "latest_post_date_iso": "2025-03-12T00:00:00",
      "post_count": 26,
      "user_count": 9
    },
    "is-it-ok-to-reusereboil-distilled-water": {
      "thread_file": "is-it-ok-to-reusereboil-distilled-water_Is-it-ok-to-reusereboil-distilled-water.md",
      "thread_title": "Is it ok to reuse/reboil distilled water?",
      "thread_url": "https://connect.ntminfo.org/discussion/is-it-ok-to-reusereboil-distilled-water",
      "relevant_topics": [
        "water_safety",
        "equipment_sterilization",
        "medical_centers",
        "research_trials"
      ],
      "topic_count": 4,
      "tagged_date": "2025-11-16T00:00:23.000000",
      "original_post_date": "Posted 08-08-2025 02:20 PM",
      "original_post_date_iso": "2025-08-08T00:00:00",
      "latest_post_date": "Posted 28 days ago",
      "latest_post_date_iso": "2025-10-17T21:31:48.281677",
      "post_count": 33,
      "user_count": 9
    },
    "is-it-safe-to-drink-out-of-glasses-that-have-gone-through-the-dishwasher": {
      "thread_file": "is-it-safe-to-drink-out-of-glasses-that-have-gone-through-the-dishwasher_Is-it-safe-to-drink-out-of-glasses-that-.md",
      "thread_title": "Is it safe to drink out of glasses that have gone through the dishwasher?",
      "thread_url": "https://connect.ntminfo.org/discussion/is-it-safe-to-drink-out-of-glasses-that-have-gone-through-the-dishwasher",
      "relevant_topics": [
        "water_safety",
        "equipment_sterilization",
        "medical_centers"
      ],
      "topic_count": 3,
      "tagged_date": "2025-11-16T00:00:24.000000",
      "original_post_date": "Posted 07-01-2025 10:38 PM",
      "original_post_date_iso": "2025-07-01T00:00:00",
      "latest_post_date": "Posted 07-05-2025 09:58 AM",
      "latest_post_date_iso": "2025-07-05T00:00:00",
      "post_count": 15,
      "user_count": 5
    },
    "jennifer-honda-lecture-on-sterilization-of-neb-parts": {
      "thread_file": "jennifer-honda-lecture-on-sterilization-of-neb-parts_Jennifer-Honda-Lecture-on-Sterilization-.md",
      "thread_title": "Jennifer Honda Lecture on Sterilization of Neb Parts",
      "thread_url": "https://connect.ntminfo.org/discussion/jennifer-honda-lecture-on-sterilization-of-neb-parts",
      "relevant_topics": [
        "equipment_maintenance",
        "equipment_sterilization"
      ],
      "topic_count": 2,
      "tagged_date": "2025-11-16T01:15:32.000000",
      "original_post_date": "Posted 09-27-2025 10:10 AM",
      "original_post_date_iso": "2025-09-27T00:00:00",
      "latest_post_date": "Posted 09-28-2025 05:08 PM",
      "latest_post_date_iso": "2025-09-28T00:00:00",
      "post_count": 2,
      "user_count": 2
    },
    "join-a-webinar-on-july-16-for-2025-world-bronchiectasis-conference-takeaways": {
      "thread_file": "join-a-webinar-on-july-16-for-2025-world-bronchiectasis-conference-takeaways_Join-a-webinar-on-July-16-for-2025-World.md",
      "thread_title": "Join a webinar on July 16 for 2025 World Bronchiectasis Conference Takeaways!",
      "thread_url": "https://connect.ntminfo.org/discussion/join-a-webinar-on-july-16-for-2025-world-bronchiectasis-conference-takeaways",
      "relevant_topics": [
        "emotional_support",
        "research_trials"
      ],
      "topic_count": 2,
      "tagged_date": "2025-11-16T01:15:33.000000",
      "original_post_date": "Posted 06-25-2025 07:00 PM",
      "original_post_date_iso": "2025-06-25T00:00:00",
      "latest_post_date": "Posted 07-01-2025 03:57 AM",
      "latest_post_date_iso": "2025-07-01T00:00:00",
      "post_count": 5,
      "user_count": 4
    },
    "kailua-kona-hawaii-in-person-support-group-mtg-is-coming-up-on-september-24-at-5pm-hawaii-time": {
      "thread_file": "kailua-kona-hawaii-in-person-support-group-mtg-is-coming-up-on-september-24-at-5pm-hawaii-time_Kailua-Kona-Hawaii-In-Person-Support-Gro.md",
      "thread_title": "Kailua Kona Hawaii In-Person Support Group Mtg is Coming up on September 24 at 5pm Hawaii time",
      "thread_url": "https://connect.ntminfo.org/discussion/kailua-kona-hawaii-in-person-support-group-mtg-is-coming-up-on-september-24-at-5pm-hawaii-time",
      "relevant_topics": [
        "emotional_support"
      ],
      "topic_count": 1,
      "tagged_date": "2025-11-16T01:15:34.000000",
      "original_post_date": "Posted 09-14-2025 12:23 PM",
      "original_post_date_iso": "2025-09-14T00:00:00",
      "latest_post_date": "Posted 09-14-2025 12:23 PM",
      "latest_post_date_iso": "2025-09-14T00:00:00",
      "post_count": 1,
      "user_count": 0
    },
    "kailua-kona-hawaii-support-group-meeting-this-month": {
      "thread_file": "kailua-kona-hawaii-support-group-meeting-this-month_Kailua-Kona-Hawaii-Support-Group-Meeting.md",
      "thread_title": "Kailua-Kona Hawaii Support Group Meeting this Month!",
      "thread_url": "https://connect.ntminfo.org/discussion/kailua-kona-hawaii-support-group-meeting-this-month",
      "relevant_topics": [
        "emotional_support"
      ],
      "topic_count": 1,
      "tagged_date": "2025-11-16T01:15:35.000000",
      "original_post_date": "Posted 08-07-2025 05:50 PM",
      "original_post_date_iso": "2025-08-07T00:00:00",
      "latest_post_date": "Posted 08-07-2025 05:50 PM",
      "latest_post_date_iso": "2025-08-07T00:00:00",
      "post_count": 1,
      "user_count": 1
    },
    "kaiser-and-outside-network-care": {
      "thread_file": "kaiser-and-outside-network-care_Kaiser-and-Outside-Network-Care.md",
      "thread_title": "Kaiser and Outside Network Care",
      "thread_url": "https://connect.ntminfo.org/discussion/kaiser-and-outside-network-care",
      "relevant_topics": [
        "insurance_costs"
      ],
      "topic_count": 1,
      "tagged_date": "2025-11-16T01:15:36.000000",
      "original_post_date": "Posted 09-05-2025 10:31 AM",
      "original_post_date_iso": "2025-09-05T00:00:00",
      "latest_post_date": "Posted 09-05-2025 10:31 AM",
      "latest_post_date_iso": "2025-09-05T00:00:00",
      "post_count": 1,
      "user_count": 0
    },
    "keurig-coffee-makers": {
      "thread_file": "keurig-coffee-makers_Keurig-coffee-makers.md",
      "thread_title": "Keurig coffee makers",
      "thread_url": "https://connect.ntminfo.org/discussion/keurig-coffee-makers",
      "relevant_topics": [
        "water_safety",
        "work_employment"
      ],
      "topic_count": 2,
      "tagged_date": "2025-11-16T01:15:37.000000",
      "original_post_date": "Posted 10-15-2024 05:42 PM",
      "original_post_date_iso": "2024-10-15T00:00:00",
      "latest_post_date": "Posted 10-16-2024 08:01 AM",
      "latest_post_date_iso": "2024-10-16T00:00:00",
      "post_count": 2,
      "user_count": 2
    },
    "keurig-coffee-makers-1": {
      "thread_file": "keurig-coffee-makers-1_keurig-coffee-makers.md",
      "thread_title": "keurig coffee makers",
      "thread_url": "https://connect.ntminfo.org/discussion/keurig-coffee-makers-1",
      "relevant_topics": [
        "water_safety",
        "work_employment"
      ],
      "topic_count": 2,
      "tagged_date": "2025-11-16T01:15:38.000000",
      "original_post_date": "Posted 06-27-2025 08:06 PM",
      "original_post_date_iso": "2025-06-27T00:00:00",
      "latest_post_date": "Posted 06-30-2025 10:04 AM",
      "latest_post_date_iso": "2025-06-30T00:00:00",
      "post_count": 8,
      "user_count": 6
    },
    "klebsiella-pneumoniae-positive-test": {
      "thread_file": "klebsiella-pneumoniae-positive-test_Klebsiella-pneumoniae-positive-test.md",
      "thread_title": "Klebsiella pneumoniae - positive test",
      "thread_url": "https://connect.ntminfo.org/discussion/klebsiella-pneumoniae-positive-test",
      "relevant_topics": [
        "coinfections",
        "sputum_cultures",
        "big3_antibiotics"
      ],
      "topic_count": 3,
      "tagged_date": "2025-11-16T01:15:39.000000",
      "original_post_date": "Posted 04-03-2025 12:01 PM",
      "original_post_date_iso": "2025-04-03T00:00:00",
      "latest_post_date": "Posted 04-21-2025 11:05 AM",
      "latest_post_date_iso": "2025-04-21T00:00:00",
      "post_count": 6,
      "user_count": 3
    },
    "kn95-and-n95-masks": {
      "thread_file": "kn95-and-n95-masks_KN95-and-N95-masks.md",
      "thread_title": "KN95 and N95 masks",
      "thread_url": "https://connect.ntminfo.org/discussion/kn95-and-n95-masks",
      "relevant_topics": [
        "infection_prevention",
        "work_employment"
      ],
      "topic_count": 2,
      "tagged_date": "2025-11-16T02:00:40.000000",
      "original_post_date": "Posted 05-28-2025 08:40 AM",
      "original_post_date_iso": "2025-05-28T00:00:00",
      "latest_post_date": "Posted 05-29-2025 09:33 AM",
      "latest_post_date_iso": "2025-05-29T00:00:00",
      "post_count": 3,
      "user_count": 2
    },
    "knee-replacement": {
      "thread_file": "knee-replacement_Knee-replacement.md",
      "thread_title": "Knee replacement",
      "thread_url": "https://connect.ntminfo.org/discussion/knee-replacement",
      "relevant_topics": [
        "surgical_treatment",
        "exercise_activity",
        "patient_stories"
      ],
      "topic_count": 3,
      "tagged_date": "2025-11-16T02:00:41.000000",
      "original_post_date": "Posted 03-16-2025 11:20 AM",
      "original_post_date_iso": "2025-03-16T00:00:00",
      "latest_post_date": "Posted 03-20-2025 03:56 PM",
      "latest_post_date_iso": "2025-03-20T00:00:00",
      "post_count": 9,
      "user_count": 5
    },
    "knee-replacement-surgery-with-mia-lung-infection": {
      "thread_file": "knee-replacement-surgery-with-mia-lung-infection_Knee-replacement-surgery-with-MIA-lung-i.md",
      "thread_title": "Knee replacement surgery with MIA lung infection",
      "thread_url": "https://connect.ntminfo.org/discussion/knee-replacement-surgery-with-mia-lung-infection",
      "relevant_topics": [
        "surgical_treatment",
        "infection_prevention"
      ],
      "topic_count": 2,
      "tagged_date": "2025-11-16T02:00:42.000000",
      "original_post_date": "Posted 01-15-2025 06:40 PM",
      "original_post_date_iso": "2025-01-15T00:00:00",
      "latest_post_date": "Posted 01-16-2025 03:08 PM",
      "latest_post_date_iso": "2025-01-16T00:00:00",
      "post_count": 2,
      "user_count": 1
    },
    "lack-of-information-on-diet-for-people-with-ntms": {
      "thread_file": "lack-of-information-on-diet-for-people-with-ntms_Lack-of-information-on-diet-for-people-w.md",
      "thread_title": "Lack of information on diet for people with NTMs",
      "thread_url": "https://connect.ntminfo.org/discussion/lack-of-information-on-diet-for-people-with-ntms",
      "relevant_topics": [
        "nutrition_lifestyle",
        "insurance_costs",
        "infection_prevention"
      ],
      "topic_count": 3,
      "tagged_date": "2025-11-16T02:00:43.000000",
      "original_post_date": "Posted 18 days ago",
      "original_post_date_iso": "2025-10-27T21:31:43.756339",
      "latest_post_date": "Posted 13 days ago",
      "latest_post_date_iso": "2025-11-01T21:31:43.756339",
      "post_count": 23,
      "user_count": 13
    },
    "lamira-nebulizer": {
      "thread_file": "lamira-nebulizer_Lamira-Nebulizer.md",
      "thread_title": "Lamira Nebulizer",
      "thread_url": "https://connect.ntminfo.org/discussion/lamira-nebulizer",
      "relevant_topics": [
        "equipment_maintenance",
        "emotional_support"
      ],
      "topic_count": 2,
      "tagged_date": "2025-11-16T02:00:44.000000",
      "original_post_date": "Posted 02-12-2024 01:27 PM",
      "original_post_date_iso": "2024-02-12T00:00:00",
      "latest_post_date": "Posted 09-10-2025 09:44 AM",
      "latest_post_date_iso": "2025-09-10T00:00:00",
      "post_count": 2,
      "user_count": 2
    },
    "larq-bottle-how-do-you-clean": {
      "thread_file": "larq-bottle-how-do-you-clean_Larq-bottle-how-do-you-clean.md",
      "thread_title": "Larq bottle- how do you clean?",
      "thread_url": "https://connect.ntminfo.org/discussion/larq-bottle-how-do-you-clean",
      "relevant_topics": [
        "equipment_maintenance",
        "equipment_sterilization",
        "water_safety"
      ],
      "topic_count": 3,
      "tagged_date": "2025-11-16T02:00:45.000000",
      "original_post_date": "Posted 07-18-2025 10:22 AM",
      "original_post_date_iso": "2025-07-18T00:00:00",
      "latest_post_date": "Posted 07-22-2025 11:04 AM",
      "latest_post_date_iso": "2025-07-22T00:00:00",
      "post_count": 10,
      "user_count": 6
    },
    "larq-water-bottle-for-sterilization": {
      "thread_file": "larq-water-bottle-for-sterilization_Larq-Water-Bottle-for-sterilization.md",
      "thread_title": "Larq Water Bottle for sterilization",
      "thread_url": "https://connect.ntminfo.org/discussion/larq-water-bottle-for-sterilization",
      "relevant_topics": [
        "water_safety",
        "equipment_sterilization",
        "equipment_maintenance"
      ],
      "topic_count": 3,
      "tagged_date": "2025-11-16T02:00:46.000000",
      "original_post_date": "Posted 04-13-2025 09:44 AM",
      "original_post_date_iso": "2025-04-13T00:00:00",
      "latest_post_date": "Posted 04-17-2025 11:14 AM",
      "latest_post_date_iso": "2025-04-17T00:00:00",
      "post_count": 11,
      "user_count": 6
    },
    "leg-cramps": {
      "thread_file": "leg-cramps_Leg-cramps.md",
      "thread_title": "Leg cramps",
      "thread_url": "https://connect.ntminfo.org/discussion/leg-cramps",
      "relevant_topics": [
        "medication_side_effects",
        "alternative_therapies",
        "exercise_activity"
      ],
      "topic_count": 3,
      "tagged_date": "2025-11-16T02:00:47.000000",
      "original_post_date": "Posted 05-01-2025 11:46 AM",
      "original_post_date_iso": "2025-05-01T00:00:00",
      "latest_post_date": "Posted 05-06-2025 12:34 PM",
      "latest_post_date_iso": "2025-05-06T00:00:00",
      "post_count": 16,
      "user_count": 12
    },
    "leg-cramps-1": {
      "thread_file": "leg-cramps-1_Leg-CRAMPS.md",
      "thread_title": "Leg CRAMPS",
      "thread_url": "https://connect.ntminfo.org/discussion/leg-cramps-1",
      "relevant_topics": [
        "medication_side_effects",
        "alternative_therapies",
        "exercise_activity"
      ],
      "topic_count": 3,
      "tagged_date": "2025-11-16T02:00:48.000000",
      "original_post_date": "Posted 05-05-2025 08:09 AM",
      "original_post_date_iso": "2025-05-05T00:00:00",
      "latest_post_date": "Posted 05-11-2025 08:34 PM",
      "latest_post_date_iso": "2025-05-11T00:00:00",
      "post_count": 2,
      "user_count": 1
    },
    "lets-post-bololo-reviews-on-amazon-saying-we-cannot-get-replacement-filters": {
      "thread_file": "lets-post-bololo-reviews-on-amazon-saying-we-cannot-get-replacement-filters_Lets-post-Bololo-reviews-on-Amazon-sayin.md",
      "thread_title": "Let's post Bololo reviews on Amazon saying we cannot get replacement filters!!!",
      "thread_url": "https://connect.ntminfo.org/discussion/lets-post-bololo-reviews-on-amazon-saying-we-cannot-get-replacement-filters",
      "relevant_topics": [
        "equipment_maintenance",
        "research_trials"
      ],
      "topic_count": 2,
      "tagged_date": "2025-11-16T02:00:49.000000",
      "original_post_date": "Posted 02-13-2024 05:38 PM",
      "original_post_date_iso": "2024-02-13T00:00:00",
      "latest_post_date": "Posted 04-07-2025 11:34 AM",
      "latest_post_date_iso": "2025-04-07T00:00:00",
      "post_count": 9,
      "user_count": 6
    },
    "levofloxacin-1": {
      "thread_file": "levofloxacin-1_Levofloxacin.md",
      "thread_title": "Levofloxacin",
      "thread_url": "https://connect.ntminfo.org/discussion/levofloxacin-1",
      "relevant_topics": [
        "big3_antibiotics",
        "medication_side_effects"
      ],
      "topic_count": 2,
      "tagged_date": "2025-11-16T02:30:50.000000",
      "original_post_date": "Posted 08-31-2025 07:07 AM",
      "original_post_date_iso": "2025-08-31T00:00:00",
      "latest_post_date": "Posted 09-01-2025 09:57 AM",
      "latest_post_date_iso": "2025-09-01T00:00:00",
      "post_count": 4,
      "user_count": 3
    },
    "levofloxacin-2": {
      "thread_file": "levofloxacin-2_Levofloxacin.md",
      "thread_title": "Levofloxacin",
      "thread_url": "https://connect.ntminfo.org/discussion/levofloxacin-2",
      "relevant_topics": [
        "big3_antibiotics",
        "medication_side_effects",
        "patient_stories"
      ],
      "topic_count": 3,
      "tagged_date": "2025-11-16T02:30:51.000000",
      "original_post_date": "Posted 08-31-2025 07:15 AM",
      "original_post_date_iso": "2025-08-31T00:00:00",
      "latest_post_date": "Posted 09-03-2025 02:34 PM",
      "latest_post_date_iso": "2025-09-03T00:00:00",
      "post_count": 18,
      "user_count": 11
    },
    "levofloxacin-3": {
      "thread_file": "levofloxacin-3_levofloxacin.md",
      "thread_title": "levofloxacin",
      "thread_url": "https://connect.ntminfo.org/discussion/levofloxacin-3",
      "relevant_topics": [
        "big3_antibiotics"
      ],
      "topic_count": 1,
      "tagged_date": "2025-11-16T02:30:52.000000",
      "original_post_date": "Posted 09-01-2025 10:38 AM",
      "original_post_date_iso": "2025-09-01T00:00:00",
      "latest_post_date": "Posted 09-03-2025 09:43 AM",
      "latest_post_date_iso": "2025-09-03T00:00:00",
      "post_count": 4,
      "user_count": 3
    },
    "life-insurance": {
      "thread_file": "life-insurance_Life-insurance.md",
      "thread_title": "Life insurance",
      "thread_url": "https://connect.ntminfo.org/discussion/life-insurance",
      "relevant_topics": [
        "insurance_costs"
      ],
      "topic_count": 1,
      "tagged_date": "2025-11-16T02:30:53.000000",
      "original_post_date": "Posted 10-03-2025 02:45 PM",
      "original_post_date_iso": "2025-10-03T00:00:00",
      "latest_post_date": "Posted 10-04-2025 09:22 PMEdited by Lawrence Aoun 10-06-2025 08:26 AM",
      "latest_post_date_iso": "2025-10-04T00:00:00",
      "post_count": 2,
      "user_count": 1
    },
    "life-straw-2": {
      "thread_file": "life-straw-2_Life-straw.md",
      "thread_title": "Life straw??",
      "thread_url": "https://connect.ntminfo.org/discussion/life-straw-2",
      "relevant_topics": [
        "water_safety",
        "equipment_maintenance"
      ],
      "topic_count": 2,
      "tagged_date": "2025-11-16T02:30:54.000000",
      "original_post_date": "Posted 03-26-2025 10:52 PM",
      "original_post_date_iso": "2025-03-26T00:00:00",
      "latest_post_date": "Posted 03-28-2025 07:30 PM",
      "latest_post_date_iso": "2025-03-28T00:00:00",
      "post_count": 7,
      "user_count": 5
    },
    "life-straw-micro-filter-and-carbon-filter": {
      "thread_file": "life-straw-micro-filter-and-carbon-filter_Life-straw-micro-filter-and-carbon-filte.md",
      "thread_title": "Life straw micro filter and carbon filter",
      "thread_url": "https://connect.ntminfo.org/discussion/life-straw-micro-filter-and-carbon-filter",
      "relevant_topics": [
        "water_safety",
        "equipment_maintenance"
      ],
      "topic_count": 2,
      "tagged_date": "2025-11-16T02:30:55.000000",
      "original_post_date": "Posted 04-03-2025 12:11 PM",
      "original_post_date_iso": "2025-04-03T00:00:00",
      "latest_post_date": "Posted 26 days ago",
      "latest_post_date_iso": "2025-10-19T21:31:02.772397",
      "post_count": 9,
      "user_count": 4
    },
    "life-straw-pitcher-3": {
      "thread_file": "life-straw-pitcher-3_Life-Straw-Pitcher.md",
      "thread_title": "Life Straw Pitcher",
      "thread_url": "https://connect.ntminfo.org/discussion/life-straw-pitcher-3",
      "relevant_topics": [
        "water_safety",
        "equipment_maintenance"
      ],
      "topic_count": 2,
      "tagged_date": "2025-11-16T02:30:56.000000",
      "original_post_date": "Posted 05-16-2025 12:46 PM",
      "original_post_date_iso": "2025-05-16T00:00:00",
      "latest_post_date": "Posted 05-19-2025 11:54 AM",
      "latest_post_date_iso": "2025-05-19T00:00:00",
      "post_count": 12,
      "user_count": 7
    },
    "lifestraw-18-cup-dispenser": {
      "thread_file": "lifestraw-18-cup-dispenser_Lifestraw-18-cup-dispenser.md",
      "thread_title": "Lifestraw 18 cup dispenser",
      "thread_url": "https://connect.ntminfo.org/discussion/lifestraw-18-cup-dispenser",
      "relevant_topics": [
        "water_safety",
        "equipment_maintenance"
      ],
      "topic_count": 2,
      "tagged_date": "2025-11-16T02:30:57.000000",
      "original_post_date": "Posted 05-05-2025 12:20 PM",
      "original_post_date_iso": "2025-05-05T00:00:00",
      "latest_post_date": "Posted 05-05-2025 12:20 PM",
      "latest_post_date_iso": "2025-05-05T00:00:00",
      "post_count": 1,
      "user_count": 1
    },
    "lifestraw-company-states-below-ntm-is-not-a-guaranteed-removal": {
      "thread_file": "lifestraw-company-states-below-ntm-is-not-a-guaranteed-removal_Lifestraw-Company-states-below-NTM-is-no.md",
      "thread_title": "Lifestraw Company states below NTM is not a guaranteed removal.",
      "thread_url": "https://connect.ntminfo.org/discussion/lifestraw-company-states-below-ntm-is-not-a-guaranteed-removal",
      "relevant_topics": [
        "water_safety",
        "equipment_maintenance",
        "equipment_sterilization"
      ],
      "topic_count": 3,
      "tagged_date": "2025-11-16T02:30:58.000000",
      "original_post_date": "Posted 07-31-2025 04:07 PM",
      "original_post_date_iso": "2025-07-31T00:00:00",
      "latest_post_date": "Posted 08-03-2025 04:18 PM",
      "latest_post_date_iso": "2025-08-03T00:00:00",
      "post_count": 15,
      "user_count": 10
    },
    "lifestraw-crazy-cap-and-other-filtered-water-bottles": {
      "thread_file": "lifestraw-crazy-cap-and-other-filtered-water-bottles_Lifestraw-Crazy-Cap-and-other-filtered-w.md",
      "thread_title": "Lifestraw, Crazy Cap and other filtered water bottles",
      "thread_url": "https://connect.ntminfo.org/discussion/lifestraw-crazy-cap-and-other-filtered-water-bottles",
      "relevant_topics": [
        "water_safety",
        "equipment_maintenance",
        "equipment_sterilization",
        "travel_safety"
      ],
      "topic_count": 4,
      "tagged_date": "2025-11-16T02:30:59.000000",
      "original_post_date": "Posted 11-21-2023 05:28 PM",
      "original_post_date_iso": "2023-11-21T00:00:00",
      "latest_post_date": "Posted 08-25-2025 12:36 PM",
      "latest_post_date_iso": "2025-08-25T00:00:00",
      "post_count": 27,
      "user_count": 17
    },
    "lifestraw-peak-solo-filters": {
      "thread_file": "lifestraw-peak-solo-filters_Lifestraw-Peak-Solo-Filters.md",
      "thread_title": "Lifestraw Peak Solo Filters",
      "thread_url": "https://connect.ntminfo.org/discussion/lifestraw-peak-solo-filters",
      "relevant_topics": [
        "water_safety",
        "equipment_maintenance",
        "travel_safety"
      ],
      "topic_count": 3,
      "tagged_date": "2025-11-16T02:31:04.000000",
      "original_post_date": "Posted 02-20-2024 03:59 PM",
      "original_post_date_iso": "2024-02-20T00:00:00",
      "latest_post_date": "Posted 08-24-2025 07:47 PM",
      "latest_post_date_iso": "2025-08-24T00:00:00",
      "post_count": 11,
      "user_count": 6
    },
    "lifestraw-pitcher-filters": {
      "thread_file": "lifestraw-pitcher-filters_Lifestraw-pitcher-filters.md",
      "thread_title": "Lifestraw pitcher filters",
      "thread_url": "https://connect.ntminfo.org/discussion/lifestraw-pitcher-filters",
      "relevant_topics": [
        "water_safety",
        "equipment_maintenance"
      ],
      "topic_count": 2,
      "tagged_date": "2025-11-16T02:31:06.000000",
      "original_post_date": "Posted 01-01-2025 12:08 PM",
      "original_post_date_iso": "2025-01-01T00:00:00",
      "latest_post_date": "Posted 01-04-2025 09:30 AM",
      "latest_post_date_iso": "2025-01-04T00:00:00",
      "post_count": 9,
      "user_count": 7
    },
    "how-long-can-we-lie-flat-on-our-backs-with-gerd": {
      "thread_file": "how-long-can-we-lie-flat-on-our-backs-with-gerd_How-long-can-we-lie-flat-on-our-backs-wi.md",
      "thread_title": "How long can we lie flat on our backs with GERD?",
      "thread_url": "https://connect.ntminfo.org/discussion/how-long-can-we-lie-flat-on-our-backs-with-gerd",
      "relevant_topics": [
        "digestive_issues",
        "exercise_activity",
        "work_employment"
      ],
      "topic_count": 3,
      "tagged_date": "2025-11-16T00:01:00.000000",
      "original_post_date": "Posted 07-15-2025 02:26 PM",
      "original_post_date_iso": "2025-07-15T00:00:00",
      "latest_post_date": "Posted 07-17-2025 11:48 AM",
      "latest_post_date_iso": "2025-07-17T00:00:00",
      "post_count": 3,
      "user_count": 3
    },
    "how-long-does-mycobacterium-survive-on-dry-surfaces": {
      "thread_file": "how-long-does-mycobacterium-survive-on-dry-surfaces_How-long-does-mycobacterium-survive-on-d.md",
      "thread_title": "How long does mycobacterium survive on dry surfaces?",
      "thread_url": "https://connect.ntminfo.org/discussion/how-long-does-mycobacterium-survive-on-dry-surfaces",
      "relevant_topics": [
        "equipment_maintenance",
        "infection_prevention",
        "medical_centers"
      ],
      "topic_count": 3,
      "tagged_date": "2025-11-16T00:01:01.000000",
      "original_post_date": "Posted 12-05-2024 12:36 PM",
      "original_post_date_iso": "2024-12-05T00:00:00",
      "latest_post_date": "Posted 05-29-2025 05:31 PM",
      "latest_post_date_iso": "2025-05-29T00:00:00",
      "post_count": 8,
      "user_count": 4
    },
    "how-long-to-culture-conversion-on-arikayce": {
      "thread_file": "how-long-to-culture-conversion-on-arikayce_How-long-to-culture-conversion-on-Arikay.md",
      "thread_title": "How long to culture conversion on Arikayce?",
      "thread_url": "https://connect.ntminfo.org/discussion/how-long-to-culture-conversion-on-arikayce",
      "relevant_topics": [
        "inhaled_medications",
        "sputum_cultures",
        "imaging_scans",
        "patient_stories"
      ],
      "topic_count": 4,
      "tagged_date": "2025-11-16T00:01:02.000000",
      "original_post_date": "Posted 05-22-2025 10:37 AM",
      "original_post_date_iso": "2025-05-22T00:00:00",
      "latest_post_date": "Posted 05-23-2025 09:13 AM",
      "latest_post_date_iso": "2025-05-23T00:00:00",
      "post_count": 7,
      "user_count": 6
    },
    "how-to-avoid-getting-sick-ask-team-usa-doctor": {
      "thread_file": "how-to-avoid-getting-sick-ask-team-usa-doctor_How-to-Avoid-Getting-Sick-Ask-Team-USA-d.md",
      "thread_title": "How to Avoid Getting Sick? Ask Team USA doctor!",
      "thread_url": "https://connect.ntminfo.org/discussion/how-to-avoid-getting-sick-ask-team-usa-doctor",
      "relevant_topics": [
        "travel_safety",
        "infection_prevention"
      ],
      "topic_count": 2,
      "tagged_date": "2025-11-16T00:01:04.000000",
      "original_post_date": "Posted 8 days ago",
      "original_post_date_iso": "2025-11-06T21:30:49.153489",
      "latest_post_date": "Posted 4 days ago",
      "latest_post_date_iso": "2025-11-10T21:30:49.153489",
      "post_count": 11,
      "user_count": 9
    },
    "how-to-find-a-good-respiratory-therapist-to-teach-airway-clearance-in-your-area": {
      "thread_file": "how-to-find-a-good-respiratory-therapist-to-teach-airway-clearance-in-your-area_How-to-find-a-good-respiratory-therapist.md",
      "thread_title": "How to find a good respiratory therapist to teach airway clearance in your area",
      "thread_url": "https://connect.ntminfo.org/discussion/how-to-find-a-good-respiratory-therapist-to-teach-airway-clearance-in-your-area",
      "relevant_topics": [
        "medical_centers",
        "manual_techniques"
      ],
      "topic_count": 2,
      "tagged_date": "2025-11-16T00:01:05.000000",
      "original_post_date": "Posted 10-09-2024 12:17 PM",
      "original_post_date_iso": "2024-10-09T00:00:00",
      "latest_post_date": "Posted 10-11-2024 01:32 PM",
      "latest_post_date_iso": "2024-10-11T00:00:00",
      "post_count": 6,
      "user_count": 5
    },
    "how-to-treat-few-pseudomonas-aeruginosa-in-recent-sputum-culture": {
      "thread_file": "how-to-treat-few-pseudomonas-aeruginosa-in-recent-sputum-culture_How-to-treat-few-Pseudomonas-aeruginosa-.md",
      "thread_title": "How to treat few Pseudomonas aeruginosa in recent sputum culture",
      "thread_url": "https://connect.ntminfo.org/discussion/how-to-treat-few-pseudomonas-aeruginosa-in-recent-sputum-culture",
      "relevant_topics": [
        "coinfections",
        "big3_antibiotics",
        "medication_side_effects",
        "sputum_cultures"
      ],
      "topic_count": 4,
      "tagged_date": "2025-11-16T00:01:06.000000",
      "original_post_date": "Posted 12-28-2024 06:18 PM",
      "original_post_date_iso": "2024-12-28T00:00:00",
      "latest_post_date": "Posted 01-02-2025 09:05 PM",
      "latest_post_date_iso": "2025-01-02T00:00:00",
      "post_count": 12,
      "user_count": 7
    },
    "hrct-image-viewing-on-mychart-for-local-md": {
      "thread_file": "hrct-image-viewing-on-mychart-for-local-md_HRCT-image-viewing-on-MyChart-for-local-.md",
      "thread_title": "HRCT image viewing on MyChart for local md",
      "thread_url": "https://connect.ntminfo.org/discussion/hrct-image-viewing-on-mychart-for-local-md",
      "relevant_topics": [
        "imaging_scans",
        "insurance_costs",
        "medical_centers"
      ],
      "topic_count": 3,
      "tagged_date": "2025-11-16T00:01:07.000000",
      "original_post_date": "Posted 12-05-2024 07:30 PM",
      "original_post_date_iso": "2024-12-05T00:00:00",
      "latest_post_date": "Posted 12-12-2024 05:36 PM",
      "latest_post_date_iso": "2024-12-12T00:00:00",
      "post_count": 12,
      "user_count": 7
    },
    "humidifier-2": {
      "thread_file": "humidifier-2_humidifier.md",
      "thread_title": "humidifier",
      "thread_url": "https://connect.ntminfo.org/discussion/humidifier-2",
      "relevant_topics": [
        "environmental_exposures",
        "equipment_maintenance",
        "medical_centers"
      ],
      "topic_count": 3,
      "tagged_date": "2025-11-16T00:01:08.000000",
      "original_post_date": "Posted 02-18-2025 12:48 PM",
      "original_post_date_iso": "2025-02-18T00:00:00",
      "latest_post_date": "Posted 02-21-2025 10:11 AM",
      "latest_post_date_iso": "2025-02-21T00:00:00",
      "post_count": 4,
      "user_count": 3
    },
    "hvac": {
      "thread_file": "hvac_HVAC.md",
      "thread_title": "HVAC",
      "thread_url": "https://connect.ntminfo.org/discussion/hvac",
      "relevant_topics": [
        "environmental_exposures",
        "equipment_sterilization"
      ],
      "topic_count": 2,
      "tagged_date": "2025-11-16T00:01:09.000000",
      "original_post_date": "Posted 09-04-2024 05:37 PM",
      "original_post_date_iso": "2024-09-04T00:00:00",
      "latest_post_date": "Posted 08-10-2025 03:12 PM",
      "latest_post_date_iso": "2025-08-10T00:00:00",
      "post_count": 5,
      "user_count": 4
    },
    "hyperbaric-chamber-therapy": {
      "thread_file": "hyperbaric-chamber-therapy_Hyperbaric-chamber-therapy.md",
      "thread_title": "Hyperbaric chamber therapy",
      "thread_url": "https://connect.ntminfo.org/discussion/hyperbaric-chamber-therapy",
      "relevant_topics": [
        "alternative_therapies",
        "medical_centers"
      ],
      "topic_count": 2,
      "tagged_date": "2025-11-16T00:01:11.000000",
      "original_post_date": "Posted 01-30-2024 09:17 AM",
      "original_post_date_iso": "2024-01-30T00:00:00",
      "latest_post_date": "Posted 06-25-2025 06:48 PM",
      "latest_post_date_iso": "2025-06-25T00:00:00",
      "post_count": 5,
      "user_count": 4
    },
    "insmed-study-participants-needed": {
      "thread_file": "insmed-study-participants-needed_Insmed-Study-Participants-Needed.md",
      "thread_title": "Insmed Study - Participants Needed",
      "thread_url": "https://connect.ntminfo.org/discussion/insmed-study-participants-needed",
      "relevant_topics": [
        "research_trials"
      ],
      "topic_count": 1,
      "tagged_date": "2025-11-16T00:01:28.000000",
      "original_post_date": "Posted 11-04-2024 12:46 PM",
      "original_post_date_iso": "2024-11-04T00:00:00",
      "latest_post_date": "Posted 11-04-2024 12:46 PM",
      "latest_post_date_iso": "2024-11-04T00:00:00",
      "post_count": 1,
      "user_count": 1
    },
    "instant-pot-for-boiling-water": {
      "thread_file": "instant-pot-for-boiling-water_Instant-Pot-for-boiling-water.md",
      "thread_title": "Instant Pot for boiling water??",
      "thread_url": "https://connect.ntminfo.org/discussion/instant-pot-for-boiling-water",
      "relevant_topics": [
        "water_safety",
        "equipment_sterilization"
      ],
      "topic_count": 2,
      "tagged_date": "2025-11-16T00:01:29.000000",
      "original_post_date": "Posted 12-15-2021 03:21 PM",
      "original_post_date_iso": "2021-12-15T00:00:00",
      "latest_post_date": "Posted 07-18-2025 11:21 AM",
      "latest_post_date_iso": "2025-07-18T00:00:00",
      "post_count": 4,
      "user_count": 2
    },
    "is-your-lifestraw-membrane-microfilter-floppy-or-stable-in-the-cap": {
      "thread_file": "is-your-lifestraw-membrane-microfilter-floppy-or-stable-in-the-cap_Is-Your-Lifestraw-membrane-microfilter-f.md",
      "thread_title": "Is Your Lifestraw membrane microfilter floppy or stable in the cap?",
      "thread_url": "https://connect.ntminfo.org/discussion/is-your-lifestraw-membrane-microfilter-floppy-or-stable-in-the-cap",
      "relevant_topics": [
        "water_safety",
        "equipment_maintenance"
      ],
      "topic_count": 2,
      "tagged_date": "2025-11-16T01:15:30.000000",
      "original_post_date": "Posted 12-31-2024 05:34 PM",
      "original_post_date_iso": "2024-12-31T00:00:00",
      "latest_post_date": "Posted 01-02-2025 10:02 AM",
      "latest_post_date_iso": "2025-01-02T00:00:00",
      "post_count": 4,
      "user_count": 3
    },
    "its-official-our-podcast-is-live-follow-the-breathing-space-with-ntmir": {
      "thread_file": "its-official-our-podcast-is-live-follow-the-breathing-space-with-ntmir_Its-official-our-podcast-is-LIVE-Follow-.md",
      "thread_title": "It's official-our podcast is LIVE! Follow The Breathing Space with NTMir",
      "thread_url": "https://connect.ntminfo.org/discussion/its-official-our-podcast-is-live-follow-the-breathing-space-with-ntmir",
      "relevant_topics": [
        "manual_techniques",
        "emotional_support"
      ],
      "topic_count": 2,
      "tagged_date": "2025-11-16T01:15:31.000000",
      "original_post_date": "Posted 09-30-2025 10:10 AM",
      "original_post_date_iso": "2025-09-30T00:00:00",
      "latest_post_date": "Posted 09-30-2025 10:10 AM",
      "latest_post_date_iso": "2025-09-30T00:00:00",
      "post_count": 1,
      "user_count": 0
    },
    "lifestraw-water-pitcher-filters-what-about-glacier-fresh-product": {
      "thread_file": "lifestraw-water-pitcher-filters-what-about-glacier-fresh-product_Lifestraw-water-pitcher-filters-What-abo.md",
      "thread_title": "Lifestraw water pitcher, filters. What about Glacier Fresh product??",
      "thread_url": "https://connect.ntminfo.org/discussion/lifestraw-water-pitcher-filters-what-about-glacier-fresh-product",
      "relevant_topics": [
        "water_safety",
        "equipment_maintenance",
        "equipment_sterilization"
      ],
      "topic_count": 3,
      "tagged_date": "2025-11-16T02:31:03.000000",
      "original_post_date": "Posted 03-07-2025 11:47 AM",
      "original_post_date_iso": "2025-03-07T00:00:00",
      "latest_post_date": "Posted 03-31-2025 10:03 AM",
      "latest_post_date_iso": "2025-03-31T00:00:00",
      "post_count": 25,
      "user_count": 8
    },
    "lignosis": {
      "thread_file": "lignosis_Lignosis.md",
      "thread_title": "Lignosis",
      "thread_url": "https://connect.ntminfo.org/discussion/lignosis",
      "relevant_topics": [
        "alternative_therapies"
      ],
      "topic_count": 1,
      "tagged_date": "2025-11-16T02:31:05.000000",
      "original_post_date": "Posted 08-11-2025 12:49 AM",
      "original_post_date_iso": "2025-08-11T00:00:00",
      "latest_post_date": "Posted 08-13-2025 10:09 AM",
      "latest_post_date_iso": "2025-08-13T00:00:00",
      "post_count": 6,
      "user_count": 2
    },
    "lifestraw-pitcher-in-dishwasher": {
      "thread_file": "lifestraw-pitcher-in-dishwasher_LifeStraw-pitcher-in-dishwasher.md",
      "thread_title": "LifeStraw pitcher in dishwasher",
      "thread_url": "https://connect.ntminfo.org/discussion/lifestraw-pitcher-in-dishwasher",
      "relevant_topics": [
        "water_safety",
        "equipment_maintenance",
        "equipment_sterilization"
      ],
      "topic_count": 3,
      "tagged_date": "2025-11-16T02:31:07.000000",
      "original_post_date": "Posted 08-24-2025 05:59 AM",
      "original_post_date_iso": "2025-08-24T00:00:00",
      "latest_post_date": "Posted 08-31-2025 09:42 AM",
      "latest_post_date_iso": "2025-08-31T00:00:00",
      "post_count": 15,
      "user_count": 6
    },
    "lifestraw-pitcher-issue": {
      "thread_file": "lifestraw-pitcher-issue_Lifestraw-Pitcher-Issue.md",
      "thread_title": "Lifestraw Pitcher Issue",
      "thread_url": "https://connect.ntminfo.org/discussion/lifestraw-pitcher-issue",
      "relevant_topics": [
        "water_safety",
        "equipment_maintenance",
        "infection_prevention"
      ],
      "topic_count": 3,
      "tagged_date": "2025-11-16T02:31:08.000000",
      "original_post_date": "Posted 12-15-2024 10:46 AM",
      "original_post_date_iso": "2024-12-15T00:00:00",
      "latest_post_date": "Posted 07-08-2025 11:36 AM",
      "latest_post_date_iso": "2025-07-08T00:00:00",
      "post_count": 11,
      "user_count": 5
    },
    "lifestraw-pitcher-membrane": {
      "thread_file": "lifestraw-pitcher-membrane_Lifestraw-pitcher-membrane.md",
      "thread_title": "Lifestraw pitcher membrane",
      "thread_url": "https://connect.ntminfo.org/discussion/lifestraw-pitcher-membrane",
      "relevant_topics": [
        "water_safety",
        "equipment_maintenance"
      ],
      "topic_count": 2,
      "tagged_date": "2025-11-16T02:31:09.000000",
      "original_post_date": "Posted 01-01-2025 08:14 PM",
      "original_post_date_iso": "2025-01-01T00:00:00",
      "latest_post_date": "Posted 01-11-2025 12:08 PM",
      "latest_post_date_iso": "2025-01-11T00:00:00",
      "post_count": 6,
      "user_count": 6
    },
    "lifestraw-products": {
      "thread_file": "lifestraw-products_Lifestraw-Products.md",
      "thread_title": "Lifestraw Products",
      "thread_url": "https://connect.ntminfo.org/discussion/lifestraw-products",
      "relevant_topics": [
        "water_safety",
        "equipment_maintenance"
      ],
      "topic_count": 2,
      "tagged_date": "2025-11-16T02:31:10.000000",
      "original_post_date": "Posted 06-01-2025 09:52 AM",
      "original_post_date_iso": "2025-06-01T00:00:00",
      "latest_post_date": "Posted 06-03-2025 04:48 PM",
      "latest_post_date_iso": "2025-06-03T00:00:00",
      "post_count": 9,
      "user_count": 7
    },
    "lifestraw-sip-reusable-steel-filter-straw-with-carry-case": {
      "thread_file": "lifestraw-sip-reusable-steel-filter-straw-with-carry-case_LifeStraw-Sip-Reusable-Steel-Filter-Stra.md",
      "thread_title": "LifeStraw Sip Reusable Steel Filter Straw with carry case",
      "thread_url": "https://connect.ntminfo.org/discussion/lifestraw-sip-reusable-steel-filter-straw-with-carry-case",
      "relevant_topics": [
        "water_safety",
        "equipment_maintenance",
        "travel_safety"
      ],
      "topic_count": 3,
      "tagged_date": "2025-11-16T02:31:11.000000",
      "original_post_date": "Posted 04-07-2025 11:31 AM",
      "original_post_date_iso": "2025-04-07T00:00:00",
      "latest_post_date": "Posted 04-19-2025 01:44 PM",
      "latest_post_date_iso": "2025-04-19T00:00:00",
      "post_count": 6,
      "user_count": 4
    },
    "lifestraw-water-filter-1": {
      "thread_file": "lifestraw-water-filter-1_Lifestraw-Water-Filter.md",
      "thread_title": "Lifestraw Water Filter ?",
      "thread_url": "https://connect.ntminfo.org/discussion/lifestraw-water-filter-1",
      "relevant_topics": [
        "water_safety",
        "equipment_maintenance",
        "travel_safety",
        "equipment_sterilization"
      ],
      "topic_count": 4,
      "tagged_date": "2025-11-16T02:31:12.000000",
      "original_post_date": "Posted 03-20-2025 08:06 PM",
      "original_post_date_iso": "2025-03-20T00:00:00",
      "latest_post_date": "Posted 04-10-2025 07:49 AM",
      "latest_post_date_iso": "2025-04-10T00:00:00",
      "post_count": 28,
      "user_count": 9
    },
    "lignosus-tiger-milk-mushroom-supplement": {
      "thread_file": "lignosus-tiger-milk-mushroom-supplement_LIGNOSUS-Tiger-milk-mushroom-supplement.md",
      "thread_title": "LIGNOSUS /Tiger milk mushroom supplement",
      "thread_url": "https://connect.ntminfo.org/discussion/lignosus-tiger-milk-mushroom-supplement",
      "relevant_topics": [
        "alternative_therapies",
        "research_trials"
      ],
      "topic_count": 2,
      "tagged_date": "2025-11-16T02:31:13.000000",
      "original_post_date": "Posted 01-06-2025 09:01 AM",
      "original_post_date_iso": "2025-01-06T00:00:00",
      "latest_post_date": "Posted 01-08-2025 01:59 AM",
      "latest_post_date_iso": "2025-01-08T00:00:00",
      "post_count": 3,
      "user_count": 2
    },
    "limited-spots-remain-for-the-2025-patient-conference": {
      "thread_file": "limited-spots-remain-for-the-2025-patient-conference_Limited-spots-remain-for-the-2025-Patien.md",
      "thread_title": "Limited spots remain for the 2025 Patient Conference!",
      "thread_url": "https://connect.ntminfo.org/discussion/limited-spots-remain-for-the-2025-patient-conference",
      "relevant_topics": [],
      "topic_count": 0,
      "tagged_date": "2025-11-16T02:31:14.000000",
      "original_post_date": "Posted 04-09-2025 05:53 PMEdited by Bekah Weidner 04-09-2025 05:54 PM",
      "original_post_date_iso": "2025-04-09T00:00:00",
      "latest_post_date": "Posted 04-09-2025 05:53 PMEdited by Bekah Weidner 04-09-2025 05:54 PM",
      "latest_post_date_iso": "2025-04-09T00:00:00",
      "post_count": 1,
      "user_count": 1
    },
    "linezolid-vs-tedezolid": {
      "thread_file": "linezolid-vs-tedezolid_Linezolid-vs-Tedezolid.md",
      "thread_title": "Linezolid vs Tedezolid",
      "thread_url": "https://connect.ntminfo.org/discussion/linezolid-vs-tedezolid",
      "relevant_topics": [
        "big3_antibiotics",
        "medication_side_effects",
        "insurance_costs"
      ],
      "topic_count": 3,
      "tagged_date": "2025-11-16T02:31:15.000000",
      "original_post_date": "Posted 09-24-2024 07:39 AM",
      "original_post_date_iso": "2024-09-24T00:00:00",
      "latest_post_date": "Posted 10-02-2024 06:47 PM",
      "latest_post_date_iso": "2024-10-02T00:00:00",
      "post_count": 2,
      "user_count": 1
    },
    "liquid-in-store-containers": {
      "thread_file": "liquid-in-store-containers_Liquid-in-store-containers.md",
      "thread_title": "Liquid in store containers",
      "thread_url": "https://connect.ntminfo.org/discussion/liquid-in-store-containers",
      "relevant_topics": [
        "water_safety",
        "infection_prevention"
      ],
      "topic_count": 2,
      "tagged_date": "2025-11-16T02:31:16.000000",
      "original_post_date": "Posted 09-05-2025 11:16 AM",
      "original_post_date_iso": "2025-09-05T00:00:00",
      "latest_post_date": "Posted 09-10-2025 09:34 AM",
      "latest_post_date_iso": "2025-09-10T00:00:00",
      "post_count": 4,
      "user_count": 2
    },
    "liquids": {
      "thread_file": "liquids_Liquids.md",
      "thread_title": "Liquids",
      "thread_url": "https://connect.ntminfo.org/discussion/liquids",
      "relevant_topics": [
        "water_safety",
        "infection_prevention"
      ],
      "topic_count": 2,
      "tagged_date": "2025-11-16T02:31:17.000000",
      "original_post_date": "Posted 08-27-2025 12:52 PM",
      "original_post_date_iso": "2025-08-27T00:00:00",
      "latest_post_date": "Posted 08-28-2025 02:48 PM",
      "latest_post_date_iso": "2025-08-28T00:00:00",
      "post_count": 2,
      "user_count": 1
    },
    "liver-function": {
      "thread_file": "liver-function_Liver-function.md",
      "thread_title": "Liver function.",
      "thread_url": "https://connect.ntminfo.org/discussion/liver-function",
      "relevant_topics": [
        "coinfections",
        "medication_side_effects"
      ],
      "topic_count": 2,
      "tagged_date": "2025-11-16T02:31:18.000000",
      "original_post_date": "Posted 10-30-2024 01:16 AM",
      "original_post_date_iso": "2024-10-30T00:00:00",
      "latest_post_date": "Posted 10-31-2024 10:11 AM",
      "latest_post_date_iso": "2024-10-31T00:00:00",
      "post_count": 4,
      "user_count": 3
    },
    "living-close-to-wetland-and-beach": {
      "thread_file": "living-close-to-wetland-and-beach_Living-close-to-wetland-and-beach.md",
      "thread_title": "Living close to wetland and beach",
      "thread_url": "https://connect.ntminfo.org/discussion/living-close-to-wetland-and-beach",
      "relevant_topics": [
        "environmental_exposures",
        "infection_prevention"
      ],
      "topic_count": 2,
      "tagged_date": "2025-11-16T02:31:19.000000",
      "original_post_date": "Posted 06-23-2025 08:26 PM",
      "original_post_date_iso": "2025-06-23T00:00:00",
      "latest_post_date": "Posted 06-25-2025 10:16 AM",
      "latest_post_date_iso": "2025-06-25T00:00:00",
      "post_count": 5,
      "user_count": 1
    },
    "living-on-the-water": {
      "thread_file": "living-on-the-water_Living-on-the-water.md",
      "thread_title": "Living on the water",
      "thread_url": "https://connect.ntminfo.org/discussion/living-on-the-water",
      "relevant_topics": [
        "environmental_exposures",
        "medical_centers"
      ],
      "topic_count": 2,
      "tagged_date": "2025-11-16T02:31:20.000000",
      "original_post_date": "Posted 10-07-2025 02:36 PM",
      "original_post_date_iso": "2025-10-07T00:00:00",
      "latest_post_date": "Posted 10-10-2025 01:06 PM",
      "latest_post_date_iso": "2025-10-10T00:00:00",
      "post_count": 13,
      "user_count": 5
    },
    "location": {
      "thread_file": "location_Location.md",
      "thread_title": "Location",
      "thread_url": "https://connect.ntminfo.org/discussion/location",
      "relevant_topics": [
        "environmental_exposures"
      ],
      "topic_count": 1,
      "tagged_date": "2025-11-16T02:31:21.000000",
      "original_post_date": "Posted 06-18-2025 03:23 PM",
      "original_post_date_iso": "2025-06-18T00:00:00",
      "latest_post_date": "Posted 06-22-2025 05:07 PM",
      "latest_post_date_iso": "2025-06-22T00:00:00",
      "post_count": 5,
      "user_count": 2
    },
    "log-in": {
      "thread_file": "log-in_Log-in.md",
      "thread_title": "Log in",
      "thread_url": "https://connect.ntminfo.org/discussion/log-in",
      "relevant_topics": [],
      "topic_count": 0,
      "tagged_date": "2025-11-16T02:31:22.000000",
      "original_post_date": "Posted 05-17-2025 11:01 AM",
      "original_post_date_iso": "2025-05-17T00:00:00",
      "latest_post_date": "Posted 05-24-2025 02:30 AM",
      "latest_post_date_iso": "2025-05-24T00:00:00",
      "post_count": 13,
      "user_count": 8
    },
    "looking-for-a-bronchiectasis-and-ntm-specialist-in-delray-beach-florida": {
      "thread_file": "looking-for-a-bronchiectasis-and-ntm-specialist-in-delray-beach-florida_Looking-for-a-Bronchiectasis-and-NTM-spe.md",
      "thread_title": "Looking for a Bronchiectasis and NTM specialist in Delray Beach, Florida",
      "thread_url": "https://connect.ntminfo.org/discussion/looking-for-a-bronchiectasis-and-ntm-specialist-in-delray-beach-florida",
      "relevant_topics": [
        "insurance_costs",
        "medical_centers"
      ],
      "topic_count": 2,
      "tagged_date": "2025-11-16T02:31:23.000000",
      "original_post_date": "Posted 04-23-2025 03:06 PM",
      "original_post_date_iso": "2025-04-23T00:00:00",
      "latest_post_date": "Posted 04-29-2025 12:14 AM",
      "latest_post_date_iso": "2025-04-29T00:00:00",
      "post_count": 12,
      "user_count": 4
    },
    "looking-for-a-good-be-doctor-in-okc-ok": {
      "thread_file": "looking-for-a-good-be-doctor-in-okc-ok_Looking-for-a-good-BE-doctor-in-OKC-OK.md",
      "thread_title": "Looking for a good BE doctor in OKC OK",
      "thread_url": "https://connect.ntminfo.org/discussion/looking-for-a-good-be-doctor-in-okc-ok",
      "relevant_topics": [
        "insurance_costs"
      ],
      "topic_count": 1,
      "tagged_date": "2025-11-16T02:31:24.000000",
      "original_post_date": "Posted 04-29-2025 03:25 AM",
      "original_post_date_iso": "2025-04-29T00:00:00",
      "latest_post_date": "Posted 05-01-2025 01:27 PM",
      "latest_post_date_iso": "2025-05-01T00:00:00",
      "post_count": 3,
      "user_count": 3
    },
    "looking-for-a-spanish-speaking-volunteer": {
      "thread_file": "looking-for-a-spanish-speaking-volunteer_Looking-for-a-Spanish-Speaking-Volunteer.md",
      "thread_title": "Looking for a Spanish Speaking Volunteer!",
      "thread_url": "https://connect.ntminfo.org/discussion/looking-for-a-spanish-speaking-volunteer",
      "relevant_topics": [],
      "topic_count": 0,
      "tagged_date": "2025-11-16T02:31:25.000000",
      "original_post_date": "Posted 03-28-2025 12:53 PMEdited by Bekah Weidner 04-15-2025 11:06 AM",
      "original_post_date_iso": "2025-03-28T00:00:00",
      "latest_post_date": "Posted 03-28-2025 12:53 PMEdited by Bekah Weidner 04-15-2025 11:06 AM",
      "latest_post_date_iso": "2025-03-28T00:00:00",
      "post_count": 1,
      "user_count": 1
    },
    "looking-for-doc-near-princeton-nj-or-bucks-county-pa": {
      "thread_file": "looking-for-doc-near-princeton-nj-or-bucks-county-pa_Looking-for-doc-near-Princeton-NJ-or-Buc.md",
      "thread_title": "Looking for doc near Princeton NJ or Bucks County PA",
      "thread_url": "https://connect.ntminfo.org/discussion/looking-for-doc-near-princeton-nj-or-bucks-county-pa",
      "relevant_topics": [
        "insurance_costs",
        "medical_centers"
      ],
      "topic_count": 2,
      "tagged_date": "2025-11-16T02:31:26.000000",
      "original_post_date": "Posted 05-03-2025 10:33 AM",
      "original_post_date_iso": "2025-05-03T00:00:00",
      "latest_post_date": "Posted 05-05-2025 11:25 AM",
      "latest_post_date_iso": "2025-05-05T00:00:00",
      "post_count": 7,
      "user_count": 3
    },
    "looking-for-dr-falkinghams-hydrogen-peroxide-results-form-624-lab-study-etc-will-it-kill-ntm": {
      "thread_file": "looking-for-dr-falkinghams-hydrogen-peroxide-results-form-624-lab-study-etc-will-it-kill-ntm_Looking-for-Dr-Falkinghams-Hydrogen-Pero.md",
      "thread_title": "Looking for Dr Falkinghams Hydrogen Peroxide results form 6/24 lab study etc. WIll it kill NTM?",
      "thread_url": "https://connect.ntminfo.org/discussion/looking-for-dr-falkinghams-hydrogen-peroxide-results-form-624-lab-study-etc-will-it-kill-ntm",
      "relevant_topics": [
        "equipment_sterilization",
        "medical_centers"
      ],
      "topic_count": 2,
      "tagged_date": "2025-11-16T02:31:27.000000",
      "original_post_date": "Posted 08-21-2025 04:56 PM",
      "original_post_date_iso": "2025-08-21T00:00:00",
      "latest_post_date": "Posted 08-22-2025 11:59 AM",
      "latest_post_date_iso": "2025-08-22T00:00:00",
      "post_count": 2,
      "user_count": 2
    },
    "looking-for-medicare-part-b-contracted-dme-supplier-for-parilc-splint-nebulizer-cup": {
      "thread_file": "looking-for-medicare-part-b-contracted-dme-supplier-for-parilc-splint-nebulizer-cup_Looking-for-Medicare-Part-B-contracted-D.md",
      "thread_title": "Looking for Medicare Part B contracted DME supplier for PariLC splint Nebulizer cup",
      "thread_url": "https://connect.ntminfo.org/discussion/looking-for-medicare-part-b-contracted-dme-supplier-for-parilc-splint-nebulizer-cup",
      "relevant_topics": [
        "insurance_costs",
        "nebulizers"
      ],
      "topic_count": 2,
      "tagged_date": "2025-11-16T02:31:28.000000",
      "original_post_date": "Posted 06-09-2025 11:26 PM",
      "original_post_date_iso": "2025-06-09T00:00:00",
      "latest_post_date": "Posted 06-16-2025 09:11 AM",
      "latest_post_date_iso": "2025-06-16T00:00:00",
      "post_count": 7,
      "user_count": 5
    },
    "looking-for-new-pulmonologist": {
      "thread_file": "looking-for-new-pulmonologist_Looking-for-New-pulmonologist.md",
      "thread_title": "Looking for New pulmonologist",
      "thread_url": "https://connect.ntminfo.org/discussion/looking-for-new-pulmonologist",
      "relevant_topics": [
        "insurance_costs"
      ],
      "topic_count": 1,
      "tagged_date": "2025-11-16T02:31:29.000000",
      "original_post_date": "Posted 08-01-2025 10:02 AM",
      "original_post_date_iso": "2025-08-01T00:00:00",
      "latest_post_date": "Posted 08-02-2025 09:25 AM",
      "latest_post_date_iso": "2025-08-02T00:00:00",
      "post_count": 4,
      "user_count": 2
    },
    "looking-for-ntm-bronchiectasis-specialists-in-indiana": {
      "thread_file": "looking-for-ntm-bronchiectasis-specialists-in-indiana_Looking-for-NTM-Bronchiectasis-specialis.md",
      "thread_title": "Looking for NTM / Bronchiectasis specialists in Indiana",
      "thread_url": "https://connect.ntminfo.org/discussion/looking-for-ntm-bronchiectasis-specialists-in-indiana",
      "relevant_topics": [
        "insurance_costs",
        "medical_centers"
      ],
      "topic_count": 2,
      "tagged_date": "2025-11-16T02:31:30.000000",
      "original_post_date": "Posted 02-26-2025 02:08 PMEdited by Patricia Kemp 02-28-2025 09:17 AM",
      "original_post_date_iso": "2025-02-26T00:00:00",
      "latest_post_date": "Posted 02-26-2025 02:08 PMEdited by Patricia Kemp 02-28-2025 09:17 AM",
      "latest_post_date_iso": "2025-02-26T00:00:00",
      "post_count": 1,
      "user_count": 0
    },
    "looking-for-ntm-pulmonary-id-doctors-in-las-vegas-nv": {
      "thread_file": "looking-for-ntm-pulmonary-id-doctors-in-las-vegas-nv_Looking-for-NTM-pulmonary-ID-doctors-in-.md",
      "thread_title": "Looking for NTM pulmonary & ID doctors in Las Vegas NV",
      "thread_url": "https://connect.ntminfo.org/discussion/looking-for-ntm-pulmonary-id-doctors-in-las-vegas-nv",
      "relevant_topics": [
        "insurance_costs"
      ],
      "topic_count": 1,
      "tagged_date": "2025-11-16T02:31:31.000000",
      "original_post_date": "Posted 12-07-2022 09:21 AM",
      "original_post_date_iso": "2022-12-07T00:00:00",
      "latest_post_date": "Posted 06-28-2025 09:03 PM",
      "latest_post_date_iso": "2025-06-28T00:00:00",
      "post_count": 2,
      "user_count": 2
    },
    "looking-for-solution-for-shower-head-problem": {
      "thread_file": "looking-for-solution-for-shower-head-problem_Looking-for-solution-for-shower-head-pro.md",
      "thread_title": "Looking for solution for shower head problem",
      "thread_url": "https://connect.ntminfo.org/discussion/looking-for-solution-for-shower-head-problem",
      "relevant_topics": [
        "water_safety",
        "equipment_maintenance"
      ],
      "topic_count": 2,
      "tagged_date": "2025-11-16T02:31:32.000000",
      "original_post_date": "Posted 10-24-2024 04:08 PM",
      "original_post_date_iso": "2024-10-24T00:00:00",
      "latest_post_date": "Posted 10-26-2024 09:27 AM",
      "latest_post_date_iso": "2024-10-26T00:00:00",
      "post_count": 8,
      "user_count": 3
    },
    "loss-of-voice-on-amikacin": {
      "thread_file": "loss-of-voice-on-amikacin_Loss-of-voice-on-Amikacin.md",
      "thread_title": "Loss of voice on Amikacin",
      "thread_url": "https://connect.ntminfo.org/discussion/loss-of-voice-on-amikacin",
      "relevant_topics": [
        "iv_antibiotics",
        "medication_side_effects"
      ],
      "topic_count": 2,
      "tagged_date": "2025-11-16T02:31:33.000000",
      "original_post_date": "Posted 11-24-2024 12:04 PM",
      "original_post_date_iso": "2024-11-24T00:00:00",
      "latest_post_date": "Posted 12-09-2024 01:22 PM",
      "latest_post_date_iso": "2024-12-09T00:00:00",
      "post_count": 8,
      "user_count": 5
    },
    "low-grade-fever-with-lung-congestion-can-this-be-my-mac": {
      "thread_file": "low-grade-fever-with-lung-congestion-can-this-be-my-mac_Low-grade-fever-with-lung-congestion-Can.md",
      "thread_title": "Low-grade fever with lung congestion - Can this be my MAC?",
      "thread_url": "https://connect.ntminfo.org/discussion/low-grade-fever-with-lung-congestion-can-this-be-my-mac",
      "relevant_topics": [
        "other_complications",
        "treatment_monitoring"
      ],
      "topic_count": 2,
      "tagged_date": "2025-11-16T02:31:34.000000",
      "original_post_date": "Posted 01-01-2025 11:54 AM",
      "original_post_date_iso": "2025-01-01T00:00:00",
      "latest_post_date": "Posted 01-03-2025 12:56 PM",
      "latest_post_date_iso": "2025-01-03T00:00:00",
      "post_count": 3,
      "user_count": 2
    },
    "low-grade-fevers": {
      "thread_file": "low-grade-fevers_Low-Grade-Fevers.md",
      "thread_title": "Low Grade Fevers",
      "thread_url": "https://connect.ntminfo.org/discussion/low-grade-fevers",
      "relevant_topics": [
        "other_complications",
        "treatment_monitoring"
      ],
      "topic_count": 2,
      "tagged_date": "2025-11-16T02:31:35.000000",
      "original_post_date": "",
      "original_post_date_iso": "",
      "latest_post_date": "",
      "latest_post_date_iso": "",
      "post_count": 1,
      "user_count": 0
    },
    "lung-exercises-by-donna-wilson": {
      "thread_file": "lung-exercises-by-donna-wilson_Lung-Exercises-by-Donna-Wilson.md",
      "thread_title": "Lung Exercises by Donna Wilson",
      "thread_url": "https://connect.ntminfo.org/discussion/lung-exercises-by-donna-wilson",
      "relevant_topics": [
        "exercise_activity",
        "manual_techniques"
      ],
      "topic_count": 2,
      "tagged_date": "2025-11-16T02:31:36.000000",
      "original_post_date": "Posted 05-24-2022 07:13 AM",
      "original_post_date_iso": "2022-05-24T00:00:00",
      "latest_post_date": "Posted 02-22-2025 11:52 AM",
      "latest_post_date_iso": "2025-02-22T00:00:00",
      "post_count": 6,
      "user_count": 5
    },
    "lung-pain-2": {
      "thread_file": "lung-pain-2_Lung-Pain.md",
      "thread_title": "Lung Pain",
      "thread_url": "https://connect.ntminfo.org/discussion/lung-pain-2",
      "relevant_topics": [
        "other_complications",
        "treatment_monitoring"
      ],
      "topic_count": 2,
      "tagged_date": "2025-11-16T02:31:37.000000",
      "original_post_date": "Posted 12-09-2024 01:58 PM",
      "original_post_date_iso": "2024-12-09T00:00:00",
      "latest_post_date": "Posted 12-16-2024 05:53 PM",
      "latest_post_date_iso": "2024-12-16T00:00:00",
      "post_count": 8,
      "user_count": 8
    },
    "mac-is-gone-on-its-own-without-any-treatment": {
      "thread_file": "mac-is-gone-on-its-own-without-any-treatment_MAC-is-gone-on-its-own-without-any-treat.md",
      "thread_title": "MAC is gone on its own without any treatment",
      "thread_url": "https://connect.ntminfo.org/discussion/mac-is-gone-on-its-own-without-any-treatment",
      "relevant_topics": [
        "treatment_monitoring"
      ],
      "topic_count": 1,
      "tagged_date": "2025-11-16T02:31:38.000000",
      "original_post_date": "Posted 12-05-2024 08:29 PM",
      "original_post_date_iso": "2024-12-05T00:00:00",
      "latest_post_date": "Posted 12-07-2024 10:47 AM",
      "latest_post_date_iso": "2024-12-07T00:00:00",
      "post_count": 3,
      "user_count": 3
    },
    "mac-treatment-1": {
      "thread_file": "mac-treatment-1_MAC-treatment.md",
      "thread_title": "MAC treatment",
      "thread_url": "https://connect.ntminfo.org/discussion/mac-treatment-1",
      "relevant_topics": [
        "big3_antibiotics",
        "treatment_monitoring",
        "manual_techniques"
      ],
      "topic_count": 3,
      "tagged_date": "2025-11-16T02:31:39.000000",
      "original_post_date": "Posted 04-04-2024 08:06 AM",
      "original_post_date_iso": "2024-04-04T00:00:00",
      "latest_post_date": "Posted 05-28-2025 11:16 AM",
      "latest_post_date_iso": "2025-05-28T00:00:00",
      "post_count": 13,
      "user_count": 7
    },
    "mac-treatment-and-working-full-time-how-have-you-handled-it": {
      "thread_file": "mac-treatment-and-working-full-time-how-have-you-handled-it_MAC-Treatment-and-working-full-time-How-.md",
      "thread_title": "MAC Treatment and working full time? How have you handled it?",
      "thread_url": "https://connect.ntminfo.org/discussion/mac-treatment-and-working-full-time-how-have-you-handled-it",
      "relevant_topics": [
        "big3_antibiotics",
        "medication_side_effects",
        "work_employment"
      ],
      "topic_count": 3,
      "tagged_date": "2025-11-16T02:31:40.000000",
      "original_post_date": "Posted 03-16-2025 09:44 AM",
      "original_post_date_iso": "2025-03-16T00:00:00",
      "latest_post_date": "Posted 03-19-2025 10:04 AM",
      "latest_post_date_iso": "2025-03-19T00:00:00",
      "post_count": 14,
      "user_count": 8
    },
    "mac-treatment-when-you-have-tachycardia": {
      "thread_file": "mac-treatment-when-you-have-tachycardia_MAC-treatment-when-you-have-tachycardia.md",
      "thread_title": "MAC treatment when you have tachycardia",
      "thread_url": "https://connect.ntminfo.org/discussion/mac-treatment-when-you-have-tachycardia",
      "relevant_topics": [
        "big3_antibiotics",
        "other_complications",
        "medication_side_effects"
      ],
      "topic_count": 3,
      "tagged_date": "2025-11-16T02:31:41.000000",
      "original_post_date": "Posted 06-07-2025 09:40 PM",
      "original_post_date_iso": "2025-06-07T00:00:00",
      "latest_post_date": "Posted 06-12-2025 07:58 PM",
      "latest_post_date_iso": "2025-06-12T00:00:00",
      "post_count": 10,
      "user_count": 5
    },
    "mac2v3-study-update-summer-2025": {
      "thread_file": "mac2v3-study-update-summer-2025_MAC2v3-study-update-Summer-2025.md",
      "thread_title": "MAC2v3 study update  Summer 2025",
      "thread_url": "https://connect.ntminfo.org/discussion/mac2v3-study-update-summer-2025",
      "relevant_topics": [
        "research_trials"
      ],
      "topic_count": 1,
      "tagged_date": "2025-11-16T02:31:42.000000",
      "original_post_date": "Posted 07-28-2025 01:00 PM",
      "original_post_date_iso": "2025-07-28T00:00:00",
      "latest_post_date": "Posted 07-30-2025 04:15 AM",
      "latest_post_date_iso": "2025-07-30T00:00:00",
      "post_count": 3,
      "user_count": 1
    },
    "mailing-sputum-specimens-to-njh": {
      "thread_file": "mailing-sputum-specimens-to-njh_mailing-sputum-specimens-to-NJH.md",
      "thread_title": "mailing sputum specimens to NJH",
      "thread_url": "https://connect.ntminfo.org/discussion/mailing-sputum-specimens-to-njh",
      "relevant_topics": [
        "sputum_cultures",
        "travel_equipment"
      ],
      "topic_count": 2,
      "tagged_date": "2025-11-16T02:31:43.000000",
      "original_post_date": "Posted 09-28-2023 06:47 PM",
      "original_post_date_iso": "2023-09-28T00:00:00",
      "latest_post_date": "Posted 09-28-2025 10:56 AMEdited by Evan Petee 09-28-2025 10:57 AM",
      "latest_post_date_iso": "2025-09-28T00:00:00",
      "post_count": 20,
      "user_count": 15
    },
    "manufacturers-instructions-for-various-air-clearance-devices": {
      "thread_file": "manufacturers-instructions-for-various-air-clearance-devices_manufacturers-instructions-for-various-a.md",
      "thread_title": "manufacturer's instructions for various air clearance devices",
      "thread_url": "https://connect.ntminfo.org/discussion/manufacturers-instructions-for-various-air-clearance-devices",
      "relevant_topics": [
        "equipment_maintenance",
        "equipment_sterilization"
      ],
      "topic_count": 2,
      "tagged_date": "2025-11-16T02:31:44.000000",
      "original_post_date": "Posted 07-23-2025 09:45 PM",
      "original_post_date_iso": "2025-07-23T00:00:00",
      "latest_post_date": "Posted 07-24-2025 06:44 PM",
      "latest_post_date_iso": "2025-07-24T00:00:00",
      "post_count": 2,
      "user_count": 2
    },
    "manuka-honey": {
      "thread_file": "manuka-honey_Manuka-honey.md",
      "thread_title": "Manuka honey",
      "thread_url": "https://connect.ntminfo.org/discussion/manuka-honey",
      "relevant_topics": [
        "alternative_therapies",
        "manual_techniques"
      ],
      "topic_count": 2,
      "tagged_date": "2025-11-16T02:31:45.000000",
      "original_post_date": "Posted 11-06-2024 03:24 PM",
      "original_post_date_iso": "2024-11-06T00:00:00",
      "latest_post_date": "Posted 11-12-2024 10:23 AM",
      "latest_post_date_iso": "2024-11-12T00:00:00",
      "post_count": 16,
      "user_count": 11
    },
    "manuka-honey-with-amicaccine": {
      "thread_file": "manuka-honey-with-amicaccine_Manuka-Honey-with-amicaccine.md",
      "thread_title": "Manuka Honey with amicaccine",
      "thread_url": "https://connect.ntminfo.org/discussion/manuka-honey-with-amicaccine",
      "relevant_topics": [
        "alternative_therapies",
        "iv_antibiotics",
        "species_specific_treatment"
      ],
      "topic_count": 3,
      "tagged_date": "2025-11-16T02:31:46.000000",
      "original_post_date": "Posted 08-04-2025 06:23 PM",
      "original_post_date_iso": "2025-08-04T00:00:00",
      "latest_post_date": "Posted 08-06-2025 10:05 AM",
      "latest_post_date_iso": "2025-08-06T00:00:00",
      "post_count": 3,
      "user_count": 3
    },
    "map-of-us-levels-of-ntm": {
      "thread_file": "map-of-us-levels-of-ntm_Map-of-US-Levels-of-NTM.md",
      "thread_title": "Map of US Levels of NTM",
      "thread_url": "https://connect.ntminfo.org/discussion/map-of-us-levels-of-ntm",
      "relevant_topics": [
        "research_trials",
        "environmental_exposures"
      ],
      "topic_count": 2,
      "tagged_date": "2025-11-16T02:31:47.000000",
      "original_post_date": "Posted 04-15-2025 06:12 PM",
      "original_post_date_iso": "2025-04-15T00:00:00",
      "latest_post_date": "Posted 04-16-2025 10:33 AM",
      "latest_post_date_iso": "2025-04-16T00:00:00",
      "post_count": 4,
      "user_count": 1
    },
    "masks": {
      "thread_file": "masks_Masks.md",
      "thread_title": "Masks",
      "thread_url": "https://connect.ntminfo.org/discussion/masks",
      "relevant_topics": [
        "infection_prevention",
        "equipment_maintenance"
      ],
      "topic_count": 2,
      "tagged_date": "2025-11-16T02:31:48.000000",
      "original_post_date": "Posted 05-29-2025 08:53 PM",
      "original_post_date_iso": "2025-05-29T00:00:00",
      "latest_post_date": "Posted 06-02-2025 10:01 AM",
      "latest_post_date_iso": "2025-06-02T00:00:00",
      "post_count": 15,
      "user_count": 6
    },
    "masks-and-other-preventative-measures-how-much-are-you-willing-to-do": {
      "thread_file": "masks-and-other-preventative-measures-how-much-are-you-willing-to-do_MASKS-AND-OTHER-PREVENTATIVE-MEASURES-HO.md",
      "thread_title": "MASKS AND OTHER PREVENTATIVE MEASURES; HOW MUCH ARE YOU WILLING TO DO?",
      "thread_url": "https://connect.ntminfo.org/discussion/masks-and-other-preventative-measures-how-much-are-you-willing-to-do",
      "relevant_topics": [
        "infection_prevention",
        "emotional_support",
        "water_safety"
      ],
      "topic_count": 3,
      "tagged_date": "2025-11-16T02:31:49.000000",
      "original_post_date": "Posted 10-06-2025 08:03 PM",
      "original_post_date_iso": "2025-10-06T00:00:00",
      "latest_post_date": "Posted 10-10-2025 11:32 AM",
      "latest_post_date_iso": "2025-10-10T00:00:00",
      "post_count": 32,
      "user_count": 12
    },
    "massage": {
      "thread_file": "massage_Massage.md",
      "thread_title": "Massage",
      "thread_url": "https://connect.ntminfo.org/discussion/massage",
      "relevant_topics": [
        "manual_techniques"
      ],
      "topic_count": 1,
      "tagged_date": "2025-11-16T02:31:50.000000",
      "original_post_date": "Posted 01-23-2025 06:36 PM",
      "original_post_date_iso": "2025-01-23T00:00:00",
      "latest_post_date": "Posted 01-25-2025 09:48 AM",
      "latest_post_date_iso": "2025-01-25T00:00:00",
      "post_count": 4,
      "user_count": 3
    },
    "massage-vest": {
      "thread_file": "massage-vest_Massage-vest.md",
      "thread_title": "Massage vest",
      "thread_url": "https://connect.ntminfo.org/discussion/massage-vest",
      "relevant_topics": [
        "equipment_maintenance"
      ],
      "topic_count": 1,
      "tagged_date": "2025-11-16T02:31:51.000000",
      "original_post_date": "Posted 08-19-2025 09:48 AM",
      "original_post_date_iso": "2025-08-19T00:00:00",
      "latest_post_date": "Posted 08-19-2025 09:48 AM",
      "latest_post_date_iso": "2025-08-19T00:00:00",
      "post_count": 1,
      "user_count": 1
    },
    "medela-bags-for-sterilizing-equipment": {
      "thread_file": "medela-bags-for-sterilizing-equipment_Medela-bags-for-sterilizing-equipment.md",
      "thread_title": "Medela bags for sterilizing equipment",
      "thread_url": "https://connect.ntminfo.org/discussion/medela-bags-for-sterilizing-equipment",
      "relevant_topics": [
        "equipment_sterilization",
        "water_safety"
      ],
      "topic_count": 2,
      "tagged_date": "2025-11-16T02:31:52.000000",
      "original_post_date": "Posted 08-23-2025 02:39 PM",
      "original_post_date_iso": "2025-08-23T00:00:00",
      "latest_post_date": "Posted 08-25-2025 11:19 AM",
      "latest_post_date_iso": "2025-08-25T00:00:00",
      "post_count": 4,
      "user_count": 2
    },
    "medela-quick-clean-micro-steam-bags": {
      "thread_file": "medela-quick-clean-micro-steam-bags_Medela-Quick-clean-Micro-Steam-Bags.md",
      "thread_title": "Medela Quick clean Micro Steam Bags",
      "thread_url": "https://connect.ntminfo.org/discussion/medela-quick-clean-micro-steam-bags",
      "relevant_topics": [
        "equipment_sterilization",
        "equipment_maintenance"
      ],
      "topic_count": 2,
      "tagged_date": "2025-11-16T02:31:53.000000",
      "original_post_date": "Posted 02-07-2025 02:09 PM",
      "original_post_date_iso": "2025-02-07T00:00:00",
      "latest_post_date": "Posted 02-15-2025 09:54 AM",
      "latest_post_date_iso": "2025-02-15T00:00:00",
      "post_count": 20,
      "user_count": 14
    },
    "medical-travel-bag-for-nebulizer-compressor-and-portable-sterilizer": {
      "thread_file": "medical-travel-bag-for-nebulizer-compressor-and-portable-sterilizer_Medical-travel-bag-for-nebulizer-compres.md",
      "thread_title": "Medical travel bag for nebulizer compressor and portable sterilizer",
      "thread_url": "https://connect.ntminfo.org/discussion/medical-travel-bag-for-nebulizer-compressor-and-portable-sterilizer",
      "relevant_topics": [
        "travel_safety",
        "equipment_maintenance",
        "equipment_sterilization"
      ],
      "topic_count": 3,
      "tagged_date": "2025-11-16T02:31:54.000000",
      "original_post_date": "Posted 03-29-2025 04:51 PM",
      "original_post_date_iso": "2025-03-29T00:00:00",
      "latest_post_date": "Posted 08-20-2025 12:12 AM",
      "latest_post_date_iso": "2025-08-20T00:00:00",
      "post_count": 22,
      "user_count": 9
    },
    "medicare-coverage-ipratropuim-bromide-albuterol-sulfate-and-saline-solutions": {
      "thread_file": "medicare-coverage-ipratropuim-bromide-albuterol-sulfate-and-saline-solutions_Medicare-coverage-Ipratropuim-Bromide-Al.md",
      "thread_title": "Medicare coverage Ipratropuim Bromide -Albuterol Sulfate and Saline solutions",
      "thread_url": "https://connect.ntminfo.org/discussion/medicare-coverage-ipratropuim-bromide-albuterol-sulfate-and-saline-solutions",
      "relevant_topics": [
        "insurance_costs",
        "inhaled_medications"
      ],
      "topic_count": 2,
      "tagged_date": "2025-11-16T02:31:55.000000",
      "original_post_date": "Posted 01-08-2025 09:15 AM",
      "original_post_date_iso": "2025-01-08T00:00:00",
      "latest_post_date": "Posted 01-10-2025 09:31 AM",
      "latest_post_date_iso": "2025-01-10T00:00:00",
      "post_count": 5,
      "user_count": 4
    },
    "medicare-d-sign-up-for-2025": {
      "thread_file": "medicare-d-sign-up-for-2025_Medicare-D-sign-up-for-2025.md",
      "thread_title": "Medicare D sign up for 2025",
      "thread_url": "https://connect.ntminfo.org/discussion/medicare-d-sign-up-for-2025",
      "relevant_topics": [
        "insurance_costs"
      ],
      "topic_count": 1,
      "tagged_date": "2025-11-16T02:31:56.000000",
      "original_post_date": "Posted 11-18-2024 04:14 PM",
      "original_post_date_iso": "2024-11-18T00:00:00",
      "latest_post_date": "Posted 11-19-2024 09:11 AM",
      "latest_post_date_iso": "2024-11-19T00:00:00",
      "post_count": 9,
      "user_count": 6
    },
    "medicare-plan-d-2026-for-people-with-ntms": {
      "thread_file": "medicare-plan-d-2026-for-people-with-ntms_Medicare-Plan-D-2026-for-people-with-NTM.md",
      "thread_title": "Medicare Plan D 2026 for people with NTMs",
      "thread_url": "https://connect.ntminfo.org/discussion/medicare-plan-d-2026-for-people-with-ntms",
      "relevant_topics": [
        "insurance_costs"
      ],
      "topic_count": 1,
      "tagged_date": "2025-11-16T02:31:57.000000",
      "original_post_date": "Posted 20 days ago",
      "original_post_date_iso": "2025-10-25T21:31:32.666984",
      "latest_post_date": "Posted 14 days ago",
      "latest_post_date_iso": "2025-10-31T21:31:32.666984",
      "post_count": 13,
      "user_count": 7
    },
    "medication-for-osteoporosis": {
      "thread_file": "medication-for-osteoporosis_Medication-for-osteoporosis.md",
      "thread_title": "Medication for osteoporosis",
      "thread_url": "https://connect.ntminfo.org/discussion/medication-for-osteoporosis",
      "relevant_topics": [
        "other_complications",
        "alternative_therapies"
      ],
      "topic_count": 2,
      "tagged_date": "2025-11-16T02:31:58.000000",
      "original_post_date": "Posted 03-20-2025 03:57 PM",
      "original_post_date_iso": "2025-03-20T00:00:00",
      "latest_post_date": "Posted 04-07-2025 04:57 PM",
      "latest_post_date_iso": "2025-04-07T00:00:00",
      "post_count": 18,
      "user_count": 12
    },
    "medicine": {
      "thread_file": "medicine_Medicine.md",
      "thread_title": "Medicine",
      "thread_url": "https://connect.ntminfo.org/discussion/medicine",
      "relevant_topics": [
        "insurance_costs",
        "other_complications"
      ],
      "topic_count": 2,
      "tagged_date": "2025-11-16T02:31:59.000000",
      "original_post_date": "Posted 06-11-2025 06:12 PM",
      "original_post_date_iso": "2025-06-11T00:00:00",
      "latest_post_date": "Posted 06-14-2025 04:08 PM",
      "latest_post_date_iso": "2025-06-14T00:00:00",
      "post_count": 7,
      "user_count": 7
    },
    "mesh-nebulizer-chart": {
      "thread_file": "mesh-nebulizer-chart_Mesh-Nebulizer-Chart.md",
      "thread_title": "Mesh Nebulizer Chart",
      "thread_url": "https://connect.ntminfo.org/discussion/mesh-nebulizer-chart",
      "relevant_topics": [
        "nebulizers",
        "equipment_maintenance",
        "insurance_costs"
      ],
      "topic_count": 3,
      "tagged_date": "2025-11-16T02:32:00.000000",
      "original_post_date": "Posted 03-16-2025 05:40 PM",
      "original_post_date_iso": "2025-03-16T00:00:00",
      "latest_post_date": "Posted 03-17-2025 09:35 PM",
      "latest_post_date_iso": "2025-03-17T00:00:00",
      "post_count": 2,
      "user_count": 1
    },
    "mesh-nebulizers-2": {
      "thread_file": "mesh-nebulizers-2_Mesh-nebulizers.md",
      "thread_title": "Mesh nebulizers",
      "thread_url": "https://connect.ntminfo.org/discussion/mesh-nebulizers-2",
      "relevant_topics": [
        "nebulizers",
        "equipment_maintenance",
        "travel_safety"
      ],
      "topic_count": 3,
      "tagged_date": "2025-11-16T02:32:01.000000",
      "original_post_date": "Posted 01-19-2025 02:07 PM",
      "original_post_date_iso": "2025-01-19T00:00:00",
      "latest_post_date": "Posted 01-24-2025 10:55 AM",
      "latest_post_date_iso": "2025-01-24T00:00:00",
      "post_count": 3,
      "user_count": 1
    },
    "message-to-prof-falkinham": {
      "thread_file": "message-to-prof-falkinham_Message-to-Prof-Falkinham.md",
      "thread_title": "Message to Prof Falkinham",
      "thread_url": "https://connect.ntminfo.org/discussion/message-to-prof-falkinham",
      "relevant_topics": [
        "environmental_exposures",
        "medical_centers"
      ],
      "topic_count": 2,
      "tagged_date": "2025-11-16T02:32:02.000000",
      "original_post_date": "Posted 07-13-2025 10:52 AM",
      "original_post_date_iso": "2025-07-13T00:00:00",
      "latest_post_date": "Posted 07-16-2025 12:16 PM",
      "latest_post_date_iso": "2025-07-16T00:00:00",
      "post_count": 5,
      "user_count": 1
    },
    "micro-steam-bags": {
      "thread_file": "micro-steam-bags_Micro-steam-bags.md",
      "thread_title": "Micro steam bags",
      "thread_url": "https://connect.ntminfo.org/discussion/micro-steam-bags",
      "relevant_topics": [
        "equipment_sterilization",
        "travel_safety",
        "equipment_maintenance"
      ],
      "topic_count": 3,
      "tagged_date": "2025-11-16T02:32:03.000000",
      "original_post_date": "Posted 09-22-2024 08:54 PM",
      "original_post_date_iso": "2024-09-22T00:00:00",
      "latest_post_date": "Posted 01-19-2025 06:42 PM",
      "latest_post_date_iso": "2025-01-19T00:00:00",
      "post_count": 13,
      "user_count": 6
    },
    "microplastics-through-nebulizing": {
      "thread_file": "microplastics-through-nebulizing_Microplastics-through-nebulizing.md",
      "thread_title": "Microplastics through nebulizing ??",
      "thread_url": "https://connect.ntminfo.org/discussion/microplastics-through-nebulizing",
      "relevant_topics": [
        "infection_prevention",
        "saline_therapy",
        "environmental_exposures"
      ],
      "topic_count": 3,
      "tagged_date": "2025-11-16T02:32:04.000000",
      "original_post_date": "Posted 09-24-2025 02:56 PM",
      "original_post_date_iso": "2025-09-24T00:00:00",
      "latest_post_date": "Posted 09-26-2025 09:07 AMEdited by Kate Diago 09-26-2025 09:07 AM",
      "latest_post_date_iso": "2025-09-26T00:00:00",
      "post_count": 6,
      "user_count": 3
    },
    "migraines-and-meds": {
      "thread_file": "migraines-and-meds_Migraines-and-Meds.md",
      "thread_title": "Migraines and Meds",
      "thread_url": "https://connect.ntminfo.org/discussion/migraines-and-meds",
      "relevant_topics": [
        "medication_side_effects",
        "big3_antibiotics"
      ],
      "topic_count": 2,
      "tagged_date": "2025-11-16T02:32:05.000000",
      "original_post_date": "Posted 11-16-2024 10:48 PM",
      "original_post_date_iso": "2024-11-16T00:00:00",
      "latest_post_date": "Posted 11-17-2024 11:56 AM",
      "latest_post_date_iso": "2024-11-17T00:00:00",
      "post_count": 3,
      "user_count": 2
    },
    "mineral-water-in-humidifier": {
      "thread_file": "mineral-water-in-humidifier_Mineral-water-in-humidifier.md",
      "thread_title": "Mineral water in humidifier?",
      "thread_url": "https://connect.ntminfo.org/discussion/mineral-water-in-humidifier",
      "relevant_topics": [
        "water_safety",
        "environmental_exposures",
        "medical_centers"
      ],
      "topic_count": 3,
      "tagged_date": "2025-11-16T02:32:06.000000",
      "original_post_date": "Posted 03-26-2025 09:25 AM",
      "original_post_date_iso": "2025-03-26T00:00:00",
      "latest_post_date": "Posted 03-27-2025 09:24 AM",
      "latest_post_date_iso": "2025-03-27T00:00:00",
      "post_count": 4,
      "user_count": 2
    },
    "molecular-hydrogen": {
      "thread_file": "molecular-hydrogen_Molecular-hydrogen.md",
      "thread_title": "Molecular hydrogen",
      "thread_url": "https://connect.ntminfo.org/discussion/molecular-hydrogen",
      "relevant_topics": [
        "alternative_therapies",
        "medical_centers"
      ],
      "topic_count": 2,
      "tagged_date": "2025-11-16T02:32:07.000000",
      "original_post_date": "Posted 02-07-2025 01:42 PM",
      "original_post_date_iso": "2025-02-07T00:00:00",
      "latest_post_date": "Posted 02-15-2025 10:00 AM",
      "latest_post_date_iso": "2025-02-15T00:00:00",
      "post_count": 2,
      "user_count": 2
    },
    "monday-may-12-last-day-to-register": {
      "thread_file": "monday-may-12-last-day-to-register_Monday-May-12-Last-Day-to-Register.md",
      "thread_title": "Monday, May 12 Last Day to Register!",
      "thread_url": "https://connect.ntminfo.org/discussion/monday-may-12-last-day-to-register",
      "relevant_topics": [
        "research_trials"
      ],
      "topic_count": 1,
      "tagged_date": "2025-11-16T02:32:08.000000",
      "original_post_date": "Posted 05-06-2025 09:44 AM",
      "original_post_date_iso": "2025-05-06T00:00:00",
      "latest_post_date": "Posted 05-06-2025 09:44 AM",
      "latest_post_date_iso": "2025-05-06T00:00:00",
      "post_count": 1,
      "user_count": 0
    },
    "more-informaton-about-safe-water-filters": {
      "thread_file": "more-informaton-about-safe-water-filters_More-informaton-about-Safe-Water-filters.md",
      "thread_title": "More informaton about Safe Water filters",
      "thread_url": "https://connect.ntminfo.org/discussion/more-informaton-about-safe-water-filters",
      "relevant_topics": [
        "water_safety",
        "equipment_maintenance",
        "environmental_exposures"
      ],
      "topic_count": 3,
      "tagged_date": "2025-11-16T02:32:09.000000",
      "original_post_date": "Posted 20 days ago",
      "original_post_date_iso": "2025-10-25T21:30:42.079633",
      "latest_post_date": "Posted 18 days ago",
      "latest_post_date_iso": "2025-10-27T21:30:42.079633",
      "post_count": 10,
      "user_count": 4
    },
    "mouthwash": {
      "thread_file": "mouthwash_Mouthwash.md",
      "thread_title": "Mouthwash",
      "thread_url": "https://connect.ntminfo.org/discussion/mouthwash",
      "relevant_topics": [
        "infection_prevention",
        "water_safety",
        "medical_centers",
        "environmental_exposures"
      ],
      "topic_count": 4,
      "tagged_date": "2025-11-16T02:32:10.000000",
      "original_post_date": "Posted 03-09-2025 12:54 AM",
      "original_post_date_iso": "2025-03-09T00:00:00",
      "latest_post_date": "Posted 03-31-2025 08:00 AM",
      "latest_post_date_iso": "2025-03-31T00:00:00",
      "post_count": 10,
      "user_count": 6
    },
    "move-to-boston": {
      "thread_file": "move-to-boston_Move-to-Boston.md",
      "thread_title": "Move to Boston",
      "thread_url": "https://connect.ntminfo.org/discussion/move-to-boston",
      "relevant_topics": [
        "insurance_costs",
        "medical_centers"
      ],
      "topic_count": 2,
      "tagged_date": "2025-11-16T02:32:11.000000",
      "original_post_date": "Posted 09-05-2025 10:59 AM",
      "original_post_date_iso": "2025-09-05T00:00:00",
      "latest_post_date": "Posted 09-06-2025 12:38 PM",
      "latest_post_date_iso": "2025-09-06T00:00:00",
      "post_count": 3,
      "user_count": 3
    },
    "mucinex": {
      "thread_file": "mucinex_Mucinex.md",
      "thread_title": "Mucinex",
      "thread_url": "https://connect.ntminfo.org/discussion/mucinex",
      "relevant_topics": [
        "manual_techniques",
        "alternative_therapies"
      ],
      "topic_count": 2,
      "tagged_date": "2025-11-16T02:32:12.000000",
      "original_post_date": "Posted 11-05-2024 07:25 PM",
      "original_post_date_iso": "2024-11-05T00:00:00",
      "latest_post_date": "Posted 11-08-2024 09:25 AM",
      "latest_post_date_iso": "2024-11-08T00:00:00",
      "post_count": 7,
      "user_count": 7
    },
    "mucinex-1": {
      "thread_file": "mucinex-1_Mucinex.md",
      "thread_title": "Mucinex",
      "thread_url": "https://connect.ntminfo.org/discussion/mucinex-1",
      "relevant_topics": [
        "manual_techniques",
        "alternative_therapies"
      ],
      "topic_count": 2,
      "tagged_date": "2025-11-16T02:32:13.000000",
      "original_post_date": "Posted 07-12-2025 06:38 PM",
      "original_post_date_iso": "2025-07-12T00:00:00",
      "latest_post_date": "Posted 08-29-2025 07:20 PM",
      "latest_post_date_iso": "2025-08-29T00:00:00",
      "post_count": 13,
      "user_count": 9
    },
    "mucinex-2": {
      "thread_file": "mucinex-2_Mucinex.md",
      "thread_title": "Mucinex",
      "thread_url": "https://connect.ntminfo.org/discussion/mucinex-2",
      "relevant_topics": [
        "manual_techniques",
        "alternative_therapies",
        "sputum_cultures"
      ],
      "topic_count": 3,
      "tagged_date": "2025-11-16T02:32:14.000000",
      "original_post_date": "Posted yesterday",
      "original_post_date_iso": "2025-11-13T21:30:51.097214",
      "latest_post_date": "Posted yesterday",
      "latest_post_date_iso": "2025-11-13T21:30:51.097214",
      "post_count": 4,
      "user_count": 3
    },
    "mucinex-600mg": {
      "thread_file": "mucinex-600mg_Mucinex-600mg.md",
      "thread_title": "Mucinex 600mg",
      "thread_url": "https://connect.ntminfo.org/discussion/mucinex-600mg",
      "relevant_topics": [
        "manual_techniques",
        "alternative_therapies",
        "other_complications"
      ],
      "topic_count": 3,
      "tagged_date": "2025-11-16T02:32:15.000000",
      "original_post_date": "Posted 04-21-2024 06:01 PM",
      "original_post_date_iso": "2024-04-21T00:00:00",
      "latest_post_date": "Posted 07-13-2025 02:26 PM",
      "latest_post_date_iso": "2025-07-13T00:00:00",
      "post_count": 12,
      "user_count": 6
    },
    "mucinex-600mg-1": {
      "thread_file": "mucinex-600mg-1_Mucinex-600mg.md",
      "thread_title": "Mucinex 600mg",
      "thread_url": "https://connect.ntminfo.org/discussion/mucinex-600mg-1",
      "relevant_topics": [
        "manual_techniques",
        "alternative_therapies",
        "treatment_monitoring"
      ],
      "topic_count": 3,
      "tagged_date": "2025-11-16T02:32:16.000000",
      "original_post_date": "Posted 07-13-2025 07:35 PM",
      "original_post_date_iso": "2025-07-13T00:00:00",
      "latest_post_date": "Posted 07-13-2025 07:35 PM",
      "latest_post_date_iso": "2025-07-13T00:00:00",
      "post_count": 1,
      "user_count": 0
    },
    "mucus-plugging": {
      "thread_file": "mucus-plugging_Mucus-Plugging.md",
      "thread_title": "Mucus Plugging",
      "thread_url": "https://connect.ntminfo.org/discussion/mucus-plugging",
      "relevant_topics": [
        "other_complications",
        "manual_techniques",
        "bronchoscopy"
      ],
      "topic_count": 3,
      "tagged_date": "2025-11-16T02:32:17.000000",
      "original_post_date": "Posted 12 days ago",
      "original_post_date_iso": "2025-11-02T21:30:49.533200",
      "latest_post_date": "Posted yesterday",
      "latest_post_date_iso": "2025-11-13T21:30:49.533200",
      "post_count": 14,
      "user_count": 10
    },
    "mucus-vocal-cords": {
      "thread_file": "mucus-vocal-cords_Mucus-vocal-cords.md",
      "thread_title": "Mucus & vocal cords",
      "thread_url": "https://connect.ntminfo.org/discussion/mucus-vocal-cords",
      "relevant_topics": [
        "other_complications",
        "digestive_issues",
        "manual_techniques"
      ],
      "topic_count": 3,
      "tagged_date": "2025-11-16T02:32:18.000000",
      "original_post_date": "Posted 19 days ago",
      "original_post_date_iso": "2025-10-26T21:31:24.497453",
      "latest_post_date": "Posted 7 days ago",
      "latest_post_date_iso": "2025-11-07T21:31:24.497453",
      "post_count": 7,
      "user_count": 6
    },
    "muscle-fatigue": {
      "thread_file": "muscle-fatigue_Muscle-Fatigue.md",
      "thread_title": "Muscle Fatigue",
      "thread_url": "https://connect.ntminfo.org/discussion/muscle-fatigue",
      "relevant_topics": [
        "other_complications",
        "exercise_activity",
        "patient_stories"
      ],
      "topic_count": 3,
      "tagged_date": "2025-11-16T02:32:19.000000",
      "original_post_date": "Posted 06-02-2022 09:33 AM",
      "original_post_date_iso": "2022-06-02T00:00:00",
      "latest_post_date": "Posted 09-29-2025 10:30 AM",
      "latest_post_date_iso": "2025-09-29T00:00:00",
      "post_count": 8,
      "user_count": 3
    },
    "muscle-weaknesslosing-balance-not-on-mac-meds": {
      "thread_file": "muscle-weaknesslosing-balance-not-on-mac-meds_Muscle-weaknesslosing-balance-NOT-on-MAC.md",
      "thread_title": "Muscle weakness/losing balance NOT on MAC meds",
      "thread_url": "https://connect.ntminfo.org/discussion/muscle-weaknesslosing-balance-not-on-mac-meds",
      "relevant_topics": [
        "other_complications",
        "medication_side_effects"
      ],
      "topic_count": 2,
      "tagged_date": "2025-11-16T02:32:20.000000",
      "original_post_date": "Posted 02-06-2025 12:32 PM",
      "original_post_date_iso": "2025-02-06T00:00:00",
      "latest_post_date": "Posted 02-12-2025 10:25 AM",
      "latest_post_date_iso": "2025-02-12T00:00:00",
      "post_count": 11,
      "user_count": 8
    },
    "musinex": {
      "thread_file": "musinex_Musinex.md",
      "thread_title": "Musinex",
      "thread_url": "https://connect.ntminfo.org/discussion/musinex",
      "relevant_topics": [
        "manual_techniques",
        "alternative_therapies"
      ],
      "topic_count": 2,
      "tagged_date": "2025-11-16T02:32:21.000000",
      "original_post_date": "Posted 12-03-2024 03:56 PM",
      "original_post_date_iso": "2024-12-03T00:00:00",
      "latest_post_date": "Posted 02-06-2025 01:21 PM",
      "latest_post_date_iso": "2025-02-06T00:00:00",
      "post_count": 11,
      "user_count": 8
    },
    "my-doctor-is-leaving": {
      "thread_file": "my-doctor-is-leaving_My-doctor-is-leaving.md",
      "thread_title": "My doctor is leaving",
      "thread_url": "https://connect.ntminfo.org/discussion/my-doctor-is-leaving",
      "relevant_topics": [
        "insurance_costs",
        "medical_centers",
        "patient_stories",
        "emotional_support"
      ],
      "topic_count": 4,
      "tagged_date": "2025-11-16T02:32:22.000000",
      "original_post_date": "Posted 01-10-2025 04:49 PM",
      "original_post_date_iso": "2025-01-10T00:00:00",
      "latest_post_date": "Posted 01-15-2025 06:35 PM",
      "latest_post_date_iso": "2025-01-15T00:00:00",
      "post_count": 24,
      "user_count": 8
    },
    "mycobacter-abscessus": {
      "thread_file": "mycobacter-abscessus_Mycobacter-Abscessus.md",
      "thread_title": "Mycobacter Abscessus",
      "thread_url": "https://connect.ntminfo.org/discussion/mycobacter-abscessus",
      "relevant_topics": [
        "species_specific_treatment",
        "medical_centers",
        "patient_stories",
        "emotional_support"
      ],
      "topic_count": 4,
      "tagged_date": "2025-11-16T02:32:23.000000",
      "original_post_date": "Posted 09-22-2025 02:31 PM",
      "original_post_date_iso": "2025-09-22T00:00:00",
      "latest_post_date": "Posted 09-24-2025 09:16 AM",
      "latest_post_date_iso": "2025-09-24T00:00:00",
      "post_count": 10,
      "user_count": 7
    },
    "mycobacterium-abcessus": {
      "thread_file": "mycobacterium-abcessus_Mycobacterium-Abcessus.md",
      "thread_title": "Mycobacterium Abcessus",
      "thread_url": "https://connect.ntminfo.org/discussion/mycobacterium-abcessus",
      "relevant_topics": [
        "species_specific_treatment",
        "patient_stories",
        "treatment_monitoring"
      ],
      "topic_count": 3,
      "tagged_date": "2025-11-16T02:32:24.000000",
      "original_post_date": "Posted 09-11-2025 11:05 AM",
      "original_post_date_iso": "2025-09-11T00:00:00",
      "latest_post_date": "Posted 09-23-2025 10:29 PM",
      "latest_post_date_iso": "2025-09-23T00:00:00",
      "post_count": 11,
      "user_count": 8
    },
    "mycobacterium-abscessus-susp-abscessus-erm41": {
      "thread_file": "mycobacterium-abscessus-susp-abscessus-erm41_Mycobacterium-abscessus-susp-abscessus-e.md",
      "thread_title": "Mycobacterium abscessus (susp abscessus) erm41",
      "thread_url": "https://connect.ntminfo.org/discussion/mycobacterium-abscessus-susp-abscessus-erm41",
      "relevant_topics": [
        "species_specific_treatment",
        "treatment_monitoring",
        "environmental_exposures"
      ],
      "topic_count": 3,
      "tagged_date": "2025-11-16T02:32:25.000000",
      "original_post_date": "Posted 02-20-2023 07:24 PM",
      "original_post_date_iso": "2023-02-20T00:00:00",
      "latest_post_date": "Posted 05-19-2025 07:51 AM",
      "latest_post_date_iso": "2025-05-19T00:00:00",
      "post_count": 9,
      "user_count": 5
    },
    "mycobacterium-arupense": {
      "thread_file": "mycobacterium-arupense_Mycobacterium-Arupense.md",
      "thread_title": "Mycobacterium Arupense",
      "thread_url": "https://connect.ntminfo.org/discussion/mycobacterium-arupense",
      "relevant_topics": [
        "species_specific_treatment"
      ],
      "topic_count": 1,
      "tagged_date": "2025-11-16T02:32:26.000000",
      "original_post_date": "Posted 06-11-2025 08:33 AM",
      "original_post_date_iso": "2025-06-11T00:00:00",
      "latest_post_date": "Posted 06-11-2025 08:33 AM",
      "latest_post_date_iso": "2025-06-11T00:00:00",
      "post_count": 1,
      "user_count": 1
    },
    "mycobacterium-fortuitum": {
      "thread_file": "mycobacterium-fortuitum_Mycobacterium-fortuitum.md",
      "thread_title": "Mycobacterium fortuitum",
      "thread_url": "https://connect.ntminfo.org/discussion/mycobacterium-fortuitum",
      "relevant_topics": [
        "species_specific_treatment",
        "patient_stories"
      ],
      "topic_count": 2,
      "tagged_date": "2025-11-16T02:32:27.000000",
      "original_post_date": "Posted 09-12-2025 11:50 AM",
      "original_post_date_iso": "2025-09-12T00:00:00",
      "latest_post_date": "Posted 09-14-2025 01:14 PM",
      "latest_post_date_iso": "2025-09-14T00:00:00",
      "post_count": 3,
      "user_count": 3
    },
    "mycobacterium-intracellulare-mai": {
      "thread_file": "mycobacterium-intracellulare-mai_Mycobacterium-intracellulare-MAI.md",
      "thread_title": "Mycobacterium intracellulare MAI",
      "thread_url": "https://connect.ntminfo.org/discussion/mycobacterium-intracellulare-mai",
      "relevant_topics": [
        "big3_antibiotics",
        "medication_side_effects",
        "treatment_monitoring",
        "surgical_treatment",
        "patient_stories"
      ],
      "topic_count": 5,
      "tagged_date": "2025-11-16T02:32:28.000000",
      "original_post_date": "Posted 08-12-2025 10:23 AM",
      "original_post_date_iso": "2025-08-12T00:00:00",
      "latest_post_date": "Posted 08-23-2025 10:42 AM",
      "latest_post_date_iso": "2025-08-23T00:00:00",
      "post_count": 24,
      "user_count": 10
    },
    "mycobacterium-simiae-m-palustre": {
      "thread_file": "mycobacterium-simiae-m-palustre_Mycobacterium-simiae-M-Palustre.md",
      "thread_title": "Mycobacterium simiae /M. Palustre",
      "thread_url": "https://connect.ntminfo.org/discussion/mycobacterium-simiae-m-palustre",
      "relevant_topics": [
        "species_specific_treatment",
        "surgical_treatment",
        "treatment_monitoring"
      ],
      "topic_count": 3,
      "tagged_date": "2025-11-16T02:32:29.000000",
      "original_post_date": "Posted 04-04-2025 10:03 AM",
      "original_post_date_iso": "2025-04-04T00:00:00",
      "latest_post_date": "Posted 04-06-2025 02:38 PM",
      "latest_post_date_iso": "2025-04-06T00:00:00",
      "post_count": 4,
      "user_count": 3
    },
    "nac-1": {
      "thread_file": "nac-1.md",
      "thread_title": "NAC",
      "thread_url": "https://connect.ntminfo.org/discussion/nac-1",
      "relevant_topics": [
        "alternative_therapies",
        "manual_techniques",
        "medication_side_effects"
      ],
      "topic_count": 3,
      "tagged_date": "2025-11-16T02:32:30.000000",
      "original_post_date": "Posted 14 days ago",
      "original_post_date_iso": "2025-10-31T21:31:25.716465",
      "latest_post_date": "Posted 12 days ago",
      "latest_post_date_iso": "2025-11-02T21:31:25.716465",
      "post_count": 6,
      "user_count": 5
    },
    "nasal-rinse": {
      "thread_file": "nasal-rinse_Nasal-rinse.md",
      "thread_title": "Nasal rinse",
      "thread_url": "https://connect.ntminfo.org/discussion/nasal-rinse",
      "relevant_topics": [
        "water_safety",
        "environmental_exposures",
        "equipment_maintenance",
        "other_complications"
      ],
      "topic_count": 4,
      "tagged_date": "2025-11-16T02:32:31.000000",
      "original_post_date": "Posted 10-16-2024 01:53 AM",
      "original_post_date_iso": "2024-10-16T00:00:00",
      "latest_post_date": "Posted 11-05-2024 11:09 AM",
      "latest_post_date_iso": "2024-11-05T00:00:00",
      "post_count": 10,
      "user_count": 9
    },
    "national-jewish-evaluation-looking-for-shared-experiences-and-feedback": {
      "thread_file": "national-jewish-evaluation-looking-for-shared-experiences-and-feedback_National-Jewish-Evaluation-looking-for-s.md",
      "thread_title": "National Jewish Evaluation- looking for shared experiences and feedback",
      "thread_url": "https://connect.ntminfo.org/discussion/national-jewish-evaluation-looking-for-shared-experiences-and-feedback",
      "relevant_topics": [
        "medical_centers",
        "patient_stories",
        "manual_techniques",
        "sputum_cultures"
      ],
      "topic_count": 4,
      "tagged_date": "2025-11-16T02:32:32.000000",
      "original_post_date": "Posted 12-10-2024 01:05 PM",
      "original_post_date_iso": "2024-12-10T00:00:00",
      "latest_post_date": "Posted 12-17-2024 10:00 AM",
      "latest_post_date_iso": "2024-12-17T00:00:00",
      "post_count": 11,
      "user_count": 8
    },
    "national-jewish-patient-conference-911": {
      "thread_file": "national-jewish-patient-conference-911_National-Jewish-Patient-Conference-911.md",
      "thread_title": "National Jewish Patient Conference 9/11!!",
      "thread_url": "https://connect.ntminfo.org/discussion/national-jewish-patient-conference-911",
      "relevant_topics": [
        "research_trials"
      ],
      "topic_count": 1,
      "tagged_date": "2025-11-16T02:32:33.000000",
      "original_post_date": "Posted 09-05-2025 10:59 AM",
      "original_post_date_iso": "2025-09-05T00:00:00",
      "latest_post_date": "Posted 09-05-2025 10:59 AM",
      "latest_post_date_iso": "2025-09-05T00:00:00",
      "post_count": 1,
      "user_count": 1
    },
    "natonal-jewish-health-patient-recording-available": {
      "thread_file": "natonal-jewish-health-patient-recording-available_Natonal-Jewish-Health-Patient-Recording-.md",
      "thread_title": "Natonal Jewish Health Patient Recording AVAILABLE!!!",
      "thread_url": "https://connect.ntminfo.org/discussion/natonal-jewish-health-patient-recording-available",
      "relevant_topics": [
        "research_trials"
      ],
      "topic_count": 1,
      "tagged_date": "2025-11-16T02:32:34.000000",
      "original_post_date": "Posted 09-16-2025 05:11 PM",
      "original_post_date_iso": "2025-09-16T00:00:00",
      "latest_post_date": "Posted 09-17-2025 02:14 PM",
      "latest_post_date_iso": "2025-09-17T00:00:00",
      "post_count": 2,
      "user_count": 1
    },
    "nebulizer-7": {
      "thread_file": "nebulizer-7_Nebulizer.md",
      "thread_title": "Nebulizer",
      "thread_url": "https://connect.ntminfo.org/discussion/nebulizer-7",
      "relevant_topics": [
        "nebulizers",
        "equipment_sterilization",
        "equipment_maintenance"
      ],
      "topic_count": 3,
      "tagged_date": "2025-11-16T02:32:35.000000",
      "original_post_date": "Posted 12-14-2024 07:09 PM",
      "original_post_date_iso": "2024-12-14T00:00:00",
      "latest_post_date": "Posted 12-27-2024 07:50 PMEdited by Samantha Lane 12-27-2024 07:52 PM",
      "latest_post_date_iso": "2024-12-27T00:00:00",
      "post_count": 22,
      "user_count": 9
    },
    "nebulizer-cup-mask-brand": {
      "thread_file": "nebulizer-cup-mask-brand_nebulizer-cup-mask-brand.md",
      "thread_title": "nebulizer cup & mask brand",
      "thread_url": "https://connect.ntminfo.org/discussion/nebulizer-cup-mask-brand",
      "relevant_topics": [
        "nebulizers",
        "equipment_maintenance",
        "manual_techniques"
      ],
      "topic_count": 3,
      "tagged_date": "2025-11-16T02:32:36.000000",
      "original_post_date": "Posted 11-11-2024 10:08 AM",
      "original_post_date_iso": "2024-11-11T00:00:00",
      "latest_post_date": "Posted 11-14-2024 09:39 AM",
      "latest_post_date_iso": "2024-11-14T00:00:00",
      "post_count": 6,
      "user_count": 3
    },
    "nebulizer-cup-tubing-mask": {
      "thread_file": "nebulizer-cup-tubing-mask_nebulizer-cup-tubing-mask.md",
      "thread_title": "nebulizer cup, tubing & mask",
      "thread_url": "https://connect.ntminfo.org/discussion/nebulizer-cup-tubing-mask",
      "relevant_topics": [
        "nebulizers",
        "equipment_maintenance",
        "equipment_sterilization"
      ],
      "topic_count": 3,
      "tagged_date": "2025-11-16T02:32:37.000000",
      "original_post_date": "Posted 04-17-2025 09:05 AM",
      "original_post_date_iso": "2025-04-17T00:00:00",
      "latest_post_date": "Posted 04-18-2025 02:17 PM",
      "latest_post_date_iso": "2025-04-18T00:00:00",
      "post_count": 2,
      "user_count": 2
    },
    "nebulizer-cups-can-i-reuse-after-one-use-if-in-same-day": {
      "thread_file": "nebulizer-cups-can-i-reuse-after-one-use-if-in-same-day_Nebulizer-cups-can-I-reuse-after-one-use.md",
      "thread_title": "Nebulizer cups - can I reuse after one use if in same day?",
      "thread_url": "https://connect.ntminfo.org/discussion/nebulizer-cups-can-i-reuse-after-one-use-if-in-same-day",
      "relevant_topics": [
        "equipment_maintenance",
        "infection_prevention",
        "nebulizers"
      ],
      "topic_count": 3,
      "tagged_date": "2025-11-16T02:32:38.000000",
      "original_post_date": "Posted 08-28-2025 09:20 PM",
      "original_post_date_iso": "2025-08-28T00:00:00",
      "latest_post_date": "Posted 08-29-2025 09:50 AM",
      "latest_post_date_iso": "2025-08-29T00:00:00",
      "post_count": 3,
      "user_count": 1
    },
    "nebulizer-equipment-weekly-disinfecting": {
      "thread_file": "nebulizer-equipment-weekly-disinfecting_Nebulizer-equipment-weekly-disinfecting.md",
      "thread_title": "Nebulizer equipment - weekly disinfecting",
      "thread_url": "https://connect.ntminfo.org/discussion/nebulizer-equipment-weekly-disinfecting",
      "relevant_topics": [
        "equipment_sterilization",
        "equipment_maintenance",
        "infection_prevention"
      ],
      "topic_count": 3,
      "tagged_date": "2025-11-16T02:32:39.000000",
      "original_post_date": "Posted 08-28-2025 09:26 PM",
      "original_post_date_iso": "2025-08-28T00:00:00",
      "latest_post_date": "Posted 08-29-2025 01:58 PM",
      "latest_post_date_iso": "2025-08-29T00:00:00",
      "post_count": 6,
      "user_count": 1
    },
    "nebulizer-first-use": {
      "thread_file": "nebulizer-first-use_Nebulizer-first-use.md",
      "thread_title": "Nebulizer first use",
      "thread_url": "https://connect.ntminfo.org/discussion/nebulizer-first-use",
      "relevant_topics": [
        "nebulizers",
        "sputum_cultures",
        "saline_therapy",
        "equipment_maintenance"
      ],
      "topic_count": 4,
      "tagged_date": "2025-11-16T02:32:40.000000",
      "original_post_date": "Posted 07-15-2025 08:46 AM",
      "original_post_date_iso": "2025-07-15T00:00:00",
      "latest_post_date": "Posted 07-18-2025 11:21 AM",
      "latest_post_date_iso": "2025-07-18T00:00:00",
      "post_count": 12,
      "user_count": 6
    },
    "nebulizer-for-inhaled-hypertonic-saline-solution": {
      "thread_file": "nebulizer-for-inhaled-hypertonic-saline-solution_Nebulizer-for-inhaled-hypertonic-saline-.md",
      "thread_title": "Nebulizer for inhaled hypertonic saline solution",
      "thread_url": "https://connect.ntminfo.org/discussion/nebulizer-for-inhaled-hypertonic-saline-solution",
      "relevant_topics": [
        "nebulizers",
        "equipment_maintenance",
        "saline_therapy",
        "manual_techniques"
      ],
      "topic_count": 4,
      "tagged_date": "2025-11-16T02:32:41.000000",
      "original_post_date": "Posted 06-15-2025 11:43 AM",
      "original_post_date_iso": "2025-06-15T00:00:00",
      "latest_post_date": "Posted 06-16-2025 09:11 AM",
      "latest_post_date_iso": "2025-06-16T00:00:00",
      "post_count": 7,
      "user_count": 6
    },
    "nebulizer-gets-loud-after-a-year": {
      "thread_file": "nebulizer-gets-loud-after-a-year_Nebulizer-gets-loud-after-a-year.md",
      "thread_title": "Nebulizer gets loud after a year",
      "thread_url": "https://connect.ntminfo.org/discussion/nebulizer-gets-loud-after-a-year",
      "relevant_topics": [
        "nebulizers",
        "equipment_maintenance",
        "insurance_costs"
      ],
      "topic_count": 3,
      "tagged_date": "2025-11-16T02:32:42.000000",
      "original_post_date": "Posted 10-03-2024 07:35 AM",
      "original_post_date_iso": "2024-10-03T00:00:00",
      "latest_post_date": "Posted 10-08-2024 09:16 AM",
      "latest_post_date_iso": "2024-10-08T00:00:00",
      "post_count": 5,
      "user_count": 4
    },
    "nebulizer-getting-slower-and-slower": {
      "thread_file": "nebulizer-getting-slower-and-slower_Nebulizer-getting-slower-and-slower.md",
      "thread_title": "Nebulizer getting slower and slower",
      "thread_url": "https://connect.ntminfo.org/discussion/nebulizer-getting-slower-and-slower",
      "relevant_topics": [
        "nebulizers",
        "equipment_maintenance"
      ],
      "topic_count": 2,
      "tagged_date": "2025-11-16T02:32:43.000000",
      "original_post_date": "Posted 12-30-2024 07:41 PM",
      "original_post_date_iso": "2024-12-30T00:00:00",
      "latest_post_date": "Posted 12-31-2024 09:25 AM",
      "latest_post_date_iso": "2024-12-31T00:00:00",
      "post_count": 3,
      "user_count": 3
    },
    "nebulizer-hoses-1": {
      "thread_file": "nebulizer-hoses-1_Nebulizer-Hoses.md",
      "thread_title": "Nebulizer Hoses",
      "thread_url": "https://connect.ntminfo.org/discussion/nebulizer-hoses-1",
      "relevant_topics": [
        "nebulizers",
        "equipment_maintenance",
        "insurance_costs"
      ],
      "topic_count": 3,
      "tagged_date": "2025-11-16T02:32:44.000000",
      "original_post_date": "Posted 10-21-2024 10:32 AM",
      "original_post_date_iso": "2024-10-21T00:00:00",
      "latest_post_date": "Posted 10-25-2024 09:35 AM",
      "latest_post_date_iso": "2024-10-25T00:00:00",
      "post_count": 9,
      "user_count": 7
    },
    "nebulizer-mask-and-cups": {
      "thread_file": "nebulizer-mask-and-cups_Nebulizer-mask-and-cups.md",
      "thread_title": "Nebulizer mask and cups",
      "thread_url": "https://connect.ntminfo.org/discussion/nebulizer-mask-and-cups",
      "relevant_topics": [
        "nebulizers",
        "equipment_sterilization",
        "equipment_maintenance"
      ],
      "topic_count": 3,
      "tagged_date": "2025-11-16T02:32:45.000000",
      "original_post_date": "Posted 5 days ago",
      "original_post_date_iso": "2025-11-09T21:31:26.492725",
      "latest_post_date": "Posted 2 days ago",
      "latest_post_date_iso": "2025-11-12T21:31:26.492725",
      "post_count": 5,
      "user_count": 4
    },
    "nebulizer-on-the-road-for-outdoors-people": {
      "thread_file": "nebulizer-on-the-road-for-outdoors-people_Nebulizer-on-the-Road-for-Outdoors-Peopl.md",
      "thread_title": "Nebulizer on the Road for Outdoors People",
      "thread_url": "https://connect.ntminfo.org/discussion/nebulizer-on-the-road-for-outdoors-people",
      "relevant_topics": [
        "travel_safety",
        "nebulizers",
        "work_employment"
      ],
      "topic_count": 3,
      "tagged_date": "2025-11-16T02:32:46.000000",
      "original_post_date": "Posted 10-11-2025 11:41 AM",
      "original_post_date_iso": "2025-10-11T00:00:00",
      "latest_post_date": "Posted 10-11-2025 11:41 AM",
      "latest_post_date_iso": "2025-10-11T00:00:00",
      "post_count": 1,
      "user_count": 1
    },
    "nebulizer-solution": {
      "thread_file": "nebulizer-solution_Nebulizer-solution.md",
      "thread_title": "Nebulizer solution",
      "thread_url": "https://connect.ntminfo.org/discussion/nebulizer-solution",
      "relevant_topics": [
        "saline_therapy",
        "inhaled_medications",
        "sputum_cultures"
      ],
      "topic_count": 3,
      "tagged_date": "2025-11-16T02:32:47.000000",
      "original_post_date": "Posted 11-07-2024 03:04 PM",
      "original_post_date_iso": "2024-11-07T00:00:00",
      "latest_post_date": "Posted 11-08-2024 09:24 AM",
      "latest_post_date_iso": "2024-11-08T00:00:00",
      "post_count": 3,
      "user_count": 3
    },
    "nebulizer-times": {
      "thread_file": "nebulizer-times_Nebulizer-Times.md",
      "thread_title": "Nebulizer Times",
      "thread_url": "https://connect.ntminfo.org/discussion/nebulizer-times",
      "relevant_topics": [
        "nebulizers",
        "equipment_maintenance",
        "manual_techniques"
      ],
      "topic_count": 3,
      "tagged_date": "2025-11-16T02:32:48.000000",
      "original_post_date": "Posted 06-16-2025 08:21 AM",
      "original_post_date_iso": "2025-06-16T00:00:00",
      "latest_post_date": "Posted 06-20-2025 09:22 AM",
      "latest_post_date_iso": "2025-06-20T00:00:00",
      "post_count": 10,
      "user_count": 6
    },
    "nebulizer-tubing-testing-for-contaminates": {
      "thread_file": "nebulizer-tubing-testing-for-contaminates_Nebulizer-tubing-testing-for-contaminate.md",
      "thread_title": "Nebulizer tubing - testing for contaminates",
      "thread_url": "https://connect.ntminfo.org/discussion/nebulizer-tubing-testing-for-contaminates",
      "relevant_topics": [
        "equipment_maintenance",
        "medical_centers",
        "environmental_exposures",
        "infection_prevention"
      ],
      "topic_count": 4,
      "tagged_date": "2025-11-16T02:32:49.000000",
      "original_post_date": "Posted 02-01-2025 09:13 PM",
      "original_post_date_iso": "2025-02-01T00:00:00",
      "latest_post_date": "Posted 02-01-2025 09:13 PM",
      "latest_post_date_iso": "2025-02-01T00:00:00",
      "post_count": 1,
      "user_count": 2
    },
    "nebulizer-with-or-without-aerobika-connected": {
      "thread_file": "nebulizer-with-or-without-aerobika-connected_Nebulizer-with-or-without-Aerobika-conne.md",
      "thread_title": "Nebulizer with or without Aerobika connected?",
      "thread_url": "https://connect.ntminfo.org/discussion/nebulizer-with-or-without-aerobika-connected",
      "relevant_topics": [
        "manual_techniques",
        "saline_therapy",
        "equipment_maintenance"
      ],
      "topic_count": 3,
      "tagged_date": "2025-11-16T02:32:50.000000",
      "original_post_date": "Posted 05-05-2025 11:06 AM",
      "original_post_date_iso": "2025-05-05T00:00:00",
      "latest_post_date": "Posted 05-07-2025 11:10 AM",
      "latest_post_date_iso": "2025-05-07T00:00:00",
      "post_count": 5,
      "user_count": 3
    },
    "nebulizing-3-saline": {
      "thread_file": "nebulizing-3-saline_Nebulizing-3-saline.md",
      "thread_title": "Nebulizing 3% saline",
      "thread_url": "https://connect.ntminfo.org/discussion/nebulizing-3-saline",
      "relevant_topics": [
        "saline_therapy",
        "sputum_cultures",
        "manual_techniques"
      ],
      "topic_count": 3,
      "tagged_date": "2025-11-16T02:32:51.000000",
      "original_post_date": "Posted 01-08-2025 06:05 PM",
      "original_post_date_iso": "2025-01-08T00:00:00",
      "latest_post_date": "Posted 01-10-2025 09:55 AM",
      "latest_post_date_iso": "2025-01-10T00:00:00",
      "post_count": 2,
      "user_count": 2
    },
    "nebulizing-advice-misc-questions": {
      "thread_file": "nebulizing-advice-misc-questions_Nebulizing-advice-misc-questions.md",
      "thread_title": "Nebulizing advice, misc questions",
      "thread_url": "https://connect.ntminfo.org/discussion/nebulizing-advice-misc-questions",
      "relevant_topics": [
        "nebulizers",
        "equipment_maintenance",
        "insurance_costs"
      ],
      "topic_count": 3,
      "tagged_date": "2025-11-16T02:32:52.000000",
      "original_post_date": "Posted 10-19-2024 04:36 PM",
      "original_post_date_iso": "2024-10-19T00:00:00",
      "latest_post_date": "Posted 10-23-2024 09:11 AM",
      "latest_post_date_iso": "2024-10-23T00:00:00",
      "post_count": 18,
      "user_count": 9
    },
    "nebulizing-during-high-air-pollution": {
      "thread_file": "nebulizing-during-high-air-pollution_Nebulizing-during-high-air-pollution.md",
      "thread_title": "Nebulizing during high air pollution",
      "thread_url": "https://connect.ntminfo.org/discussion/nebulizing-during-high-air-pollution",
      "relevant_topics": [
        "environmental_exposures",
        "infection_prevention",
        "medical_centers"
      ],
      "topic_count": 3,
      "tagged_date": "2025-11-16T02:32:53.000000",
      "original_post_date": "Posted 06-08-2025 01:01 PM",
      "original_post_date_iso": "2025-06-08T00:00:00",
      "latest_post_date": "Posted 06-09-2025 12:22 PM",
      "latest_post_date_iso": "2025-06-09T00:00:00",
      "post_count": 2,
      "user_count": 2
    },
    "nebulizing-hypertonic-saline-solution-and-purifier-indicating-polluted-air": {
      "thread_file": "nebulizing-hypertonic-saline-solution-and-purifier-indicating-polluted-air_Nebulizing-hypertonic-saline-solution-an.md",
      "thread_title": "Nebulizing hypertonic saline solution and purifier indicating polluted air",
      "thread_url": "https://connect.ntminfo.org/discussion/nebulizing-hypertonic-saline-solution-and-purifier-indicating-polluted-air",
      "relevant_topics": [
        "saline_therapy",
        "environmental_exposures",
        "equipment_maintenance",
        "medical_centers"
      ],
      "topic_count": 4,
      "tagged_date": "2025-11-16T02:32:54.000000",
      "original_post_date": "Posted yesterday",
      "original_post_date_iso": "2025-11-13T21:31:22.479758",
      "latest_post_date": "Posted yesterday",
      "latest_post_date_iso": "2025-11-13T21:31:22.479758",
      "post_count": 11,
      "user_count": 6
    },
    "nebulizing-saline-and-arikayce": {
      "thread_file": "nebulizing-saline-and-arikayce_Nebulizing-saline-and-Arikayce.md",
      "thread_title": "Nebulizing saline and Arikayce",
      "thread_url": "https://connect.ntminfo.org/discussion/nebulizing-saline-and-arikayce",
      "relevant_topics": [
        "inhaled_medications",
        "saline_therapy",
        "treatment_monitoring",
        "manual_techniques"
      ],
      "topic_count": 4,
      "tagged_date": "2025-11-16T02:32:55.000000",
      "original_post_date": "Posted 08-17-2024 05:40 PM",
      "original_post_date_iso": "2024-08-17T00:00:00",
      "latest_post_date": "Posted 05-25-2025 10:55 AM",
      "latest_post_date_iso": "2025-05-25T00:00:00",
      "post_count": 10,
      "user_count": 8
    },
    "nebulizing-with-hard-water-sterilized-aerobika": {
      "thread_file": "nebulizing-with-hard-water-sterilized-aerobika_Nebulizing-with-hard-water-sterilized-Ae.md",
      "thread_title": "Nebulizing with hard-water sterilized Aerobika",
      "thread_url": "https://connect.ntminfo.org/discussion/nebulizing-with-hard-water-sterilized-aerobika",
      "relevant_topics": [
        "water_safety",
        "equipment_sterilization",
        "medical_centers",
        "infection_prevention"
      ],
      "topic_count": 4,
      "tagged_date": "2025-11-16T02:32:56.000000",
      "original_post_date": "Posted 01-08-2025 01:00 PM",
      "original_post_date_iso": "2025-01-08T00:00:00",
      "latest_post_date": "Posted 01-08-2025 01:00 PM",
      "latest_post_date_iso": "2025-01-08T00:00:00",
      "post_count": 1,
      "user_count": 1
    },
    "need-for-pukmonologist": {
      "thread_file": "need-for-pukmonologist_Need-for-pukmonologist.md",
      "thread_title": "Need for pukmonologist",
      "thread_url": "https://connect.ntminfo.org/discussion/need-for-pukmonologist",
      "relevant_topics": [
        "medical_centers",
        "treatment_monitoring"
      ],
      "topic_count": 2,
      "tagged_date": "2025-11-16T02:33:01.000000",
      "original_post_date": "Posted 12-13-2024 07:55 AM",
      "original_post_date_iso": "2024-12-13T00:00:00",
      "latest_post_date": "Posted 12-15-2024 09:31 AM",
      "latest_post_date_iso": "2024-12-15T00:00:00",
      "post_count": 5,
      "user_count": 2
    },
    "need-volunteers-for-home-study": {
      "thread_file": "need-volunteers-for-home-study_NEED-VOLUNTEERS-FOR-HOME-STUDY.md",
      "thread_title": "NEED VOLUNTEERS FOR HOME STUDY.",
      "thread_url": "https://connect.ntminfo.org/discussion/need-volunteers-for-home-study",
      "relevant_topics": [
        "research_trials"
      ],
      "topic_count": 1,
      "tagged_date": "2025-11-16T02:33:02.000000",
      "original_post_date": "Posted 06-02-2025 03:47 PM",
      "original_post_date_iso": "2025-06-02T00:00:00",
      "latest_post_date": "Posted 06-02-2025 03:47 PM",
      "latest_post_date_iso": "2025-06-02T00:00:00",
      "post_count": 1,
      "user_count": 0
    },
    "negative-mac": {
      "thread_file": "negative-mac_Negative-MAC.md",
      "thread_title": "Negative MAC",
      "thread_url": "https://connect.ntminfo.org/discussion/negative-mac",
      "relevant_topics": [
        "treatment_monitoring",
        "inhaled_medications"
      ],
      "topic_count": 2,
      "tagged_date": "2025-11-16T02:33:03.000000",
      "original_post_date": "Posted 07-12-2025 12:37 AM",
      "original_post_date_iso": "2025-07-12T00:00:00",
      "latest_post_date": "Posted 07-14-2025 12:39 PM",
      "latest_post_date_iso": "2025-07-14T00:00:00",
      "post_count": 6,
      "user_count": 6
    },
    "neil-med-sinus-rinse": {
      "thread_file": "neil-med-sinus-rinse_Neil-Med-Sinus-Rinse.md",
      "thread_title": "Neil Med Sinus Rinse",
      "thread_url": "https://connect.ntminfo.org/discussion/neil-med-sinus-rinse",
      "relevant_topics": [
        "water_safety",
        "equipment_sterilization",
        "medical_centers",
        "infection_prevention"
      ],
      "topic_count": 4,
      "tagged_date": "2025-11-16T02:33:04.000000",
      "original_post_date": "Posted 08-26-2025 03:10 PM",
      "original_post_date_iso": "2025-08-26T00:00:00",
      "latest_post_date": "Posted 09-08-2025 04:01 PM",
      "latest_post_date_iso": "2025-09-08T00:00:00",
      "post_count": 33,
      "user_count": 11
    },
    "neilmed-nasamist-extra-strength-hypertonic-sterile-saline-nasal-spray-423-ounce-125-ml": {
      "thread_file": "neilmed-nasamist-extra-strength-hypertonic-sterile-saline-nasal-spray-423-ounce-125-ml_NeilMed-NasaMist-Extra-Strength-Hyperton.md",
      "thread_title": "NeilMed NasaMist Extra Strength Hypertonic Sterile Saline Nasal Spray, 4.23 Ounce (125 mL)",
      "thread_url": "https://connect.ntminfo.org/discussion/neilmed-nasamist-extra-strength-hypertonic-sterile-saline-nasal-spray-423-ounce-125-ml",
      "relevant_topics": [
        "equipment_sterilization",
        "infection_prevention"
      ],
      "topic_count": 2,
      "tagged_date": "2025-11-16T02:33:05.000000",
      "original_post_date": "Posted 05-03-2025 12:32 PM",
      "original_post_date_iso": "2025-05-03T00:00:00",
      "latest_post_date": "Posted 05-08-2025 04:07 PM",
      "latest_post_date_iso": "2025-05-08T00:00:00",
      "post_count": 6,
      "user_count": 3
    },
    "neuropathy-headaches-covid-vacines": {
      "thread_file": "neuropathy-headaches-covid-vacines_Neuropathy-Headaches-Covid-Vacines.md",
      "thread_title": "Neuropathy & Headaches Covid Vacines",
      "thread_url": "https://connect.ntminfo.org/discussion/neuropathy-headaches-covid-vacines",
      "relevant_topics": [
        "alternative_therapies",
        "medication_side_effects"
      ],
      "topic_count": 2,
      "tagged_date": "2025-11-16T02:33:06.000000",
      "original_post_date": "Posted 11-05-2024 01:17 PM",
      "original_post_date_iso": "2024-11-05T00:00:00",
      "latest_post_date": "Posted 11-11-2024 09:17 AM",
      "latest_post_date_iso": "2024-11-11T00:00:00",
      "post_count": 15,
      "user_count": 10
    },
    "new-antibiotics-question-for-ntm-medical-experts": {
      "thread_file": "new-antibiotics-question-for-ntm-medical-experts_New-Antibiotics-Question-for-NTM-Medical.md",
      "thread_title": "New Antibiotics -- Question for NTM Medical Experts",
      "thread_url": "https://connect.ntminfo.org/discussion/new-antibiotics-question-for-ntm-medical-experts",
      "relevant_topics": [
        "research_trials"
      ],
      "topic_count": 1,
      "tagged_date": "2025-11-16T02:33:07.000000",
      "original_post_date": "Posted 03-28-2025 07:52 AM",
      "original_post_date_iso": "2025-03-28T00:00:00",
      "latest_post_date": "Posted 03-31-2025 02:15 AM",
      "latest_post_date_iso": "2025-03-31T00:00:00",
      "post_count": 4,
      "user_count": 2
    },
    "new-cancer-diagnosis": {
      "thread_file": "new-cancer-diagnosis_New-cancer-diagnosis.md",
      "thread_title": "New cancer diagnosis",
      "thread_url": "https://connect.ntminfo.org/discussion/new-cancer-diagnosis",
      "relevant_topics": [
        "other_complications",
        "treatment_monitoring"
      ],
      "topic_count": 2,
      "tagged_date": "2025-11-16T02:33:08.000000",
      "original_post_date": "Posted 8 days ago",
      "original_post_date_iso": "2025-11-06T21:31:13.448881",
      "latest_post_date": "Posted 7 days ago",
      "latest_post_date_iso": "2025-11-07T21:31:13.448881",
      "post_count": 2,
      "user_count": 0
    },
    "new-cavity-despite-testing-negative-for-mac": {
      "thread_file": "new-cavity-despite-testing-negative-for-mac_new-cavity-despite-testing-negative-for-.md",
      "thread_title": "new cavity despite testing negative for MAC",
      "thread_url": "https://connect.ntminfo.org/discussion/new-cavity-despite-testing-negative-for-mac",
      "relevant_topics": [
        "treatment_monitoring",
        "bronchoscopy",
        "research_trials"
      ],
      "topic_count": 3,
      "tagged_date": "2025-11-16T02:33:09.000000",
      "original_post_date": "Posted 04-10-2024 04:25 PM",
      "original_post_date_iso": "2024-04-10T00:00:00",
      "latest_post_date": "Posted 02-07-2025 12:39 PMEdited by Bekah Weidner 02-07-2025 12:38 PM",
      "latest_post_date_iso": "2025-02-07T00:00:00",
      "post_count": 35,
      "user_count": 18
    },
    "new-centers-now-available-for-bentm": {
      "thread_file": "new-centers-now-available-for-bentm_new-Centers-now-available-for-BENTM.md",
      "thread_title": "new Centers now available for BE?NTM",
      "thread_url": "https://connect.ntminfo.org/discussion/new-centers-now-available-for-bentm",
      "relevant_topics": [
        "medical_centers"
      ],
      "topic_count": 1,
      "tagged_date": "2025-11-16T02:33:10.000000",
      "original_post_date": "Posted 03-14-2025 09:24 AM",
      "original_post_date_iso": "2025-03-14T00:00:00",
      "latest_post_date": "Posted 03-18-2025 10:00 AM",
      "latest_post_date_iso": "2025-03-18T00:00:00",
      "post_count": 12,
      "user_count": 7
    },
    "new-dx-of-abscessus": {
      "thread_file": "new-dx-of-abscessus_New-dx-of-abscessus.md",
      "thread_title": "New dx of abscessus",
      "thread_url": "https://connect.ntminfo.org/discussion/new-dx-of-abscessus",
      "relevant_topics": [
        "species_specific_treatment",
        "treatment_monitoring"
      ],
      "topic_count": 2,
      "tagged_date": "2025-11-16T02:33:11.000000",
      "original_post_date": "Posted 07-24-2025 12:49 PM",
      "original_post_date_iso": "2025-07-24T00:00:00",
      "latest_post_date": "Posted 07-29-2025 12:55 PM",
      "latest_post_date_iso": "2025-07-29T00:00:00",
      "post_count": 19,
      "user_count": 9
    },
    "new-in-person-support-group-in-kailua-kona-hawaii": {
      "thread_file": "new-in-person-support-group-in-kailua-kona-hawaii_New-In-Person-Support-Group-in-Kailua-Ko.md",
      "thread_title": "New In-Person Support Group in Kailua-Kona, Hawai'i!",
      "thread_url": "https://connect.ntminfo.org/discussion/new-in-person-support-group-in-kailua-kona-hawaii",
      "relevant_topics": [
        "emotional_support"
      ],
      "topic_count": 1,
      "tagged_date": "2025-11-16T02:33:12.000000",
      "original_post_date": "Posted 07-08-2025 11:16 PM",
      "original_post_date_iso": "2025-07-08T00:00:00",
      "latest_post_date": "Posted 07-08-2025 11:16 PM",
      "latest_post_date_iso": "2025-07-08T00:00:00",
      "post_count": 1,
      "user_count": 1
    },
    "new-indiana-illinois-ntmbe-support-group-meeting": {
      "thread_file": "new-indiana-illinois-ntmbe-support-group-meeting_NEW-Indiana-Illinois-NTMBE-Support-group.md",
      "thread_title": "NEW Indiana & Illinois NTM/BE Support group meeting!!!!",
      "thread_url": "https://connect.ntminfo.org/discussion/new-indiana-illinois-ntmbe-support-group-meeting",
      "relevant_topics": [
        "emotional_support"
      ],
      "topic_count": 1,
      "tagged_date": "2025-11-16T02:33:13.000000",
      "original_post_date": "Posted 02-16-2025 09:10 AM",
      "original_post_date_iso": "2025-02-16T00:00:00",
      "latest_post_date": "Posted 02-17-2025 11:54 AM",
      "latest_post_date_iso": "2025-02-17T00:00:00",
      "post_count": 2,
      "user_count": 1
    },
    "new-look-and-feel-coming-next-week": {
      "thread_file": "new-look-and-feel-coming-next-week_New-look-and-feel-coming-next-week.md",
      "thread_title": "New look and feel coming next week!",
      "thread_url": "https://connect.ntminfo.org/discussion/new-look-and-feel-coming-next-week",
      "relevant_topics": [],
      "topic_count": 0,
      "tagged_date": "2025-11-16T02:33:14.000000",
      "original_post_date": "Posted 01-11-2025 12:34 PM",
      "original_post_date_iso": "2025-01-11T00:00:00",
      "latest_post_date": "Posted 01-11-2025 12:34 PM",
      "latest_post_date_iso": "2025-01-11T00:00:00",
      "post_count": 1,
      "user_count": 1
    },
    "new-los-angeles-evening-support-group": {
      "thread_file": "new-los-angeles-evening-support-group_New-Los-Angeles-Evening-Support-Group.md",
      "thread_title": "New Los Angeles Evening Support Group",
      "thread_url": "https://connect.ntminfo.org/discussion/new-los-angeles-evening-support-group",
      "relevant_topics": [
        "emotional_support"
      ],
      "topic_count": 1,
      "tagged_date": "2025-11-16T02:33:15.000000",
      "original_post_date": "Posted 11-20-2024 08:49 PM",
      "original_post_date_iso": "2024-11-20T00:00:00",
      "latest_post_date": "Posted 11-20-2024 08:49 PM",
      "latest_post_date_iso": "2024-11-20T00:00:00",
      "post_count": 1,
      "user_count": 1
    },
    "new-meds": {
      "thread_file": "new-meds_New-meds.md",
      "thread_title": "New meds",
      "thread_url": "https://connect.ntminfo.org/discussion/new-meds",
      "relevant_topics": [
        "treatment_monitoring",
        "newer_antibiotics"
      ],
      "topic_count": 2,
      "tagged_date": "2025-11-16T02:33:16.000000",
      "original_post_date": "Posted 07-31-2025 02:14 PM",
      "original_post_date_iso": "2025-07-31T00:00:00",
      "latest_post_date": "Posted 07-31-2025 02:14 PM",
      "latest_post_date_iso": "2025-07-31T00:00:00",
      "post_count": 1,
      "user_count": 1
    },
    "new-member-saying-hello": {
      "thread_file": "new-member-saying-hello_New-member-saying-hello.md",
      "thread_title": "New member saying hello!",
      "thread_url": "https://connect.ntminfo.org/discussion/new-member-saying-hello",
      "relevant_topics": [
        "inhaled_medications",
        "treatment_monitoring",
        "manual_techniques"
      ],
      "topic_count": 3,
      "tagged_date": "2025-11-16T02:33:17.000000",
      "original_post_date": "Posted 08-29-2025 01:30 PM",
      "original_post_date_iso": "2025-08-29T00:00:00",
      "latest_post_date": "Posted 09-02-2025 11:26 AM",
      "latest_post_date_iso": "2025-09-02T00:00:00",
      "post_count": 6,
      "user_count": 3
    },
    "new-mens-bronchiectasis-ntm-support-group": {
      "thread_file": "new-mens-bronchiectasis-ntm-support-group_NEW-Mens-Bronchiectasis-NTM-Support-Grou.md",
      "thread_title": "NEW!!! Men's Bronchiectasis & NTM Support Group",
      "thread_url": "https://connect.ntminfo.org/discussion/new-mens-bronchiectasis-ntm-support-group",
      "relevant_topics": [
        "emotional_support"
      ],
      "topic_count": 1,
      "tagged_date": "2025-11-16T02:33:18.000000",
      "original_post_date": "Posted 07-14-2025 10:58 AMEdited by Patricia Kemp 07-14-2025 12:02 PM",
      "original_post_date_iso": "2025-07-14T00:00:00",
      "latest_post_date": "Posted 07-14-2025 10:58 AMEdited by Patricia Kemp 07-14-2025 12:02 PM",
      "latest_post_date_iso": "2025-07-14T00:00:00",
      "post_count": 1,
      "user_count": 1
    },
    "new-never-opened-omron-nebulizer-kits": {
      "thread_file": "new-never-opened-omron-nebulizer-kits_New-Never-Opened-Omron-Nebulizer-Kits.md",
      "thread_title": "New Never Opened Omron Nebulizer Kits",
      "thread_url": "https://connect.ntminfo.org/discussion/new-never-opened-omron-nebulizer-kits",
      "relevant_topics": [
        "nebulizers",
        "emotional_support"
      ],
      "topic_count": 2,
      "tagged_date": "2025-11-16T02:33:19.000000",
      "original_post_date": "Posted 03-31-2025 06:21 PM",
      "original_post_date_iso": "2025-03-31T00:00:00",
      "latest_post_date": "Posted 04-05-2025 06:20 PM",
      "latest_post_date_iso": "2025-04-05T00:00:00",
      "post_count": 7,
      "user_count": 4
    },
    "new-north-american-bronchiectasis-guidelines-are-imminent": {
      "thread_file": "new-north-american-bronchiectasis-guidelines-are-imminent_New-North-American-Bronchiectasis-Guidel.md",
      "thread_title": "New North American Bronchiectasis Guidelines Are Imminent",
      "thread_url": "https://connect.ntminfo.org/discussion/new-north-american-bronchiectasis-guidelines-are-imminent",
      "relevant_topics": [
        "treatment_monitoring",
        "medical_centers"
      ],
      "topic_count": 2,
      "tagged_date": "2025-11-16T02:33:20.000000",
      "original_post_date": "Posted 24 days ago",
      "original_post_date_iso": "2025-10-21T21:31:31.911335",
      "latest_post_date": "Posted 24 days ago",
      "latest_post_date_iso": "2025-10-21T21:31:31.911335",
      "post_count": 1,
      "user_count": 1
    },
    "new-ntm-diagnosis-trying-to-figure-it-all-out": {
      "thread_file": "new-ntm-diagnosis-trying-to-figure-it-all-out_New-NTM-Diagnosis-Trying-to-Figure-It-Al.md",
      "thread_title": "New NTM Diagnosis Trying to Figure It All Out",
      "thread_url": "https://connect.ntminfo.org/discussion/new-ntm-diagnosis-trying-to-figure-it-all-out",
      "relevant_topics": [
        "manual_techniques",
        "saline_therapy",
        "medical_centers",
        "other_complications"
      ],
      "topic_count": 4,
      "tagged_date": "2025-11-16T02:33:21.000000",
      "original_post_date": "Posted 02-14-2025 10:43 PM",
      "original_post_date_iso": "2025-02-14T00:00:00",
      "latest_post_date": "Posted 02-17-2025 12:18 PM",
      "latest_post_date_iso": "2025-02-17T00:00:00",
      "post_count": 15,
      "user_count": 7
    },
    "new-ntmir-support-group-for-men-launches": {
      "thread_file": "new-ntmir-support-group-for-men-launches_NEW-NTMir-support-group-for-men-launches.md",
      "thread_title": "NEW NTMir support group for men launches!",
      "thread_url": "https://connect.ntminfo.org/discussion/new-ntmir-support-group-for-men-launches",
      "relevant_topics": [
        "emotional_support"
      ],
      "topic_count": 1,
      "tagged_date": "2025-11-16T02:33:22.000000",
      "original_post_date": "Posted 07-15-2025 03:50 PM",
      "original_post_date_iso": "2025-07-15T00:00:00",
      "latest_post_date": "Posted 07-15-2025 03:50 PM",
      "latest_post_date_iso": "2025-07-15T00:00:00",
      "post_count": 1,
      "user_count": 1
    },
    "new-program-let-the-button-do-the-talking": {
      "thread_file": "new-program-let-the-button-do-the-talking_New-Program-Let-the-Button-do-the-Talkin.md",
      "thread_title": "New Program: Let the Button do the Talking!",
      "thread_url": "https://connect.ntminfo.org/discussion/new-program-let-the-button-do-the-talking",
      "relevant_topics": [
        "family_relationships",
        "emotional_support"
      ],
      "topic_count": 2,
      "tagged_date": "2025-11-16T02:33:23.000000",
      "original_post_date": "Posted 08-18-2025 01:51 PM",
      "original_post_date_iso": "2025-08-18T00:00:00",
      "latest_post_date": "Posted 09-06-2025 05:13 PM",
      "latest_post_date_iso": "2025-09-06T00:00:00",
      "post_count": 19,
      "user_count": 10
    },
    "new-support-group-for-spanish-speaking-patients": {
      "thread_file": "new-support-group-for-spanish-speaking-patients_New-Support-Group-for-Spanish-Speaking-P.md",
      "thread_title": "New Support Group for Spanish Speaking Patients!",
      "thread_url": "https://connect.ntminfo.org/discussion/new-support-group-for-spanish-speaking-patients",
      "relevant_topics": [
        "emotional_support"
      ],
      "topic_count": 1,
      "tagged_date": "2025-11-16T02:33:24.000000",
      "original_post_date": "Posted 04-14-2025 05:03 PM",
      "original_post_date_iso": "2025-04-14T00:00:00",
      "latest_post_date": "Posted 04-14-2025 05:03 PM",
      "latest_post_date_iso": "2025-04-14T00:00:00",
      "post_count": 1,
      "user_count": 1
    },
    "new-video-how-the-lab-works-with-dr-retti-khare": {
      "thread_file": "new-video-how-the-lab-works-with-dr-retti-khare_New-Video-How-the-Lab-Works-with-Dr-Reet.md",
      "thread_title": "New Video - How the Lab Works with Dr. Reeti Khare",
      "thread_url": "https://connect.ntminfo.org/discussion/new-video-how-the-lab-works-with-dr-retti-khare",
      "relevant_topics": [
        "treatment_monitoring",
        "research_trials"
      ],
      "topic_count": 2,
      "tagged_date": "2025-11-16T02:33:25.000000",
      "original_post_date": "Posted 09-03-2024 09:06 AMEdited by Bekah Weidner 09-10-2024 11:18 AM",
      "original_post_date_iso": "2024-09-03T00:00:00",
      "latest_post_date": "Posted 10-09-2024 08:59 AM",
      "latest_post_date_iso": "2024-10-09T00:00:00",
      "post_count": 9,
      "user_count": 4
    },
    "new-zealand-support-group": {
      "thread_file": "new-zealand-support-group_New-Zealand-Support-Group.md",
      "thread_title": "New Zealand Support Group",
      "thread_url": "https://connect.ntminfo.org/discussion/new-zealand-support-group",
      "relevant_topics": [
        "emotional_support"
      ],
      "topic_count": 1,
      "tagged_date": "2025-11-16T02:33:26.000000",
      "original_post_date": "Posted 03-08-2025 11:17 PM",
      "original_post_date_iso": "2025-03-08T00:00:00",
      "latest_post_date": "Posted 03-08-2025 11:17 PM",
      "latest_post_date_iso": "2025-03-08T00:00:00",
      "post_count": 1,
      "user_count": 1
    },
    "next-coffee-break-call-with-john-torrence-is-scheduled-for-october-8-at-3pm-et": {
      "thread_file": "next-coffee-break-call-with-john-torrence-is-scheduled-for-october-8-at-3pm-et_Next-Coffee-Break-call-with-John-Torrenc.md",
      "thread_title": "Next Coffee Break call with John Torrence is scheduled for October 8 at 3pm ET",
      "thread_url": "https://connect.ntminfo.org/discussion/next-coffee-break-call-with-john-torrence-is-scheduled-for-october-8-at-3pm-et",
      "relevant_topics": [
        "research_trials",
        "treatment_monitoring"
      ],
      "topic_count": 2,
      "tagged_date": "2025-11-16T02:33:27.000000",
      "original_post_date": "Posted 09-15-2025 02:11 PMEdited by Patricia Kemp 09-16-2025 01:20 PM",
      "original_post_date_iso": "2025-09-15T00:00:00",
      "latest_post_date": "Posted 09-17-2025 10:31 AM",
      "latest_post_date_iso": "2025-09-17T00:00:00",
      "post_count": 4,
      "user_count": 1
    },
    "night-sweat": {
      "thread_file": "night-sweat_Night-sweat.md",
      "thread_title": "Night sweat",
      "thread_url": "https://connect.ntminfo.org/discussion/night-sweat",
      "relevant_topics": [
        "other_complications",
        "treatment_monitoring"
      ],
      "topic_count": 2,
      "tagged_date": "2025-11-16T02:33:28.000000",
      "original_post_date": "Posted 11-21-2024 10:13 AM",
      "original_post_date_iso": "2024-11-21T00:00:00",
      "latest_post_date": "Posted 11-21-2024 10:13 AM",
      "latest_post_date_iso": "2024-11-21T00:00:00",
      "post_count": 1,
      "user_count": 0
    },
    "night-sweats-2": {
      "thread_file": "night-sweats-2_Night-Sweats.md",
      "thread_title": "Night Sweats",
      "thread_url": "https://connect.ntminfo.org/discussion/night-sweats-2",
      "relevant_topics": [
        "other_complications"
      ],
      "topic_count": 1,
      "tagged_date": "2025-11-16T02:33:29.000000",
      "original_post_date": "Posted 07-14-2025 07:40 AM",
      "original_post_date_iso": "2025-07-14T00:00:00",
      "latest_post_date": "Posted 07-19-2025 09:57 AM",
      "latest_post_date_iso": "2025-07-19T00:00:00",
      "post_count": 6,
      "user_count": 4
    },
    "night-sweats-3": {
      "thread_file": "night-sweats-3_Night-sweats.md",
      "thread_title": "Night sweats",
      "thread_url": "https://connect.ntminfo.org/discussion/night-sweats-3",
      "relevant_topics": [
        "other_complications"
      ],
      "topic_count": 1,
      "tagged_date": "2025-11-16T02:33:30.000000",
      "original_post_date": "Posted 07-22-2025 10:09 AM",
      "original_post_date_iso": "2025-07-22T00:00:00",
      "latest_post_date": "Posted 07-23-2025 10:10 AM",
      "latest_post_date_iso": "2025-07-23T00:00:00",
      "post_count": 4,
      "user_count": 3
    },
    "njh-appointment": {
      "thread_file": "njh-appointment_NJH-Appointment.md",
      "thread_title": "NJH Appointment",
      "thread_url": "https://connect.ntminfo.org/discussion/njh-appointment",
      "relevant_topics": [
        "medical_centers",
        "treatment_monitoring",
        "travel_equipment"
      ],
      "topic_count": 3,
      "tagged_date": "2025-11-16T02:33:31.000000",
      "original_post_date": "Posted 08-17-2023 05:42 PM",
      "original_post_date_iso": "2023-08-17T00:00:00",
      "latest_post_date": "Posted 02-12-2025 09:41 AM",
      "latest_post_date_iso": "2025-02-12T00:00:00",
      "post_count": 31,
      "user_count": 15
    },
    "no-sputum": {
      "thread_file": "no-sputum_no-sputum.md",
      "thread_title": "no sputum",
      "thread_url": "https://connect.ntminfo.org/discussion/no-sputum",
      "relevant_topics": [
        "manual_techniques",
        "treatment_monitoring",
        "medical_centers"
      ],
      "topic_count": 3,
      "tagged_date": "2025-11-16T02:33:32.000000",
      "original_post_date": "Posted 03-30-2025 05:33 PM",
      "original_post_date_iso": "2025-03-30T00:00:00",
      "latest_post_date": "Posted 04-01-2025 10:18 AM",
      "latest_post_date_iso": "2025-04-01T00:00:00",
      "post_count": 7,
      "user_count": 4
    },
    "nodules-disappear": {
      "thread_file": "nodules-disappear_nodules-disappear.md",
      "thread_title": "nodules disappear",
      "thread_url": "https://connect.ntminfo.org/discussion/nodules-disappear",
      "relevant_topics": [
        "treatment_monitoring",
        "bronchoscopy"
      ],
      "topic_count": 2,
      "tagged_date": "2025-11-16T02:33:33.000000",
      "original_post_date": "Posted 01-17-2025 11:37 PM",
      "original_post_date_iso": "2025-01-17T00:00:00",
      "latest_post_date": "Posted 01-18-2025 09:23 AM",
      "latest_post_date_iso": "2025-01-18T00:00:00",
      "post_count": 6,
      "user_count": 4
    },
    "ntm-and-albuterol": {
      "thread_file": "ntm-and-albuterol_NTM-and-Albuterol.md",
      "thread_title": "NTM and Albuterol",
      "thread_url": "https://connect.ntminfo.org/discussion/ntm-and-albuterol",
      "relevant_topics": [
        "medication_side_effects",
        "manual_techniques",
        "equipment_maintenance"
      ],
      "topic_count": 3,
      "tagged_date": "2025-11-16T02:33:34.000000",
      "original_post_date": "Posted 02-15-2025 01:42 PM",
      "original_post_date_iso": "2025-02-15T00:00:00",
      "latest_post_date": "Posted 02-17-2025 12:28 PM",
      "latest_post_date_iso": "2025-02-17T00:00:00",
      "post_count": 8,
      "user_count": 7
    },
    "ntm-and-chest-painbreathing": {
      "thread_file": "ntm-and-chest-painbreathing_NTM-and-chest-painbreathing.md",
      "thread_title": "NTM and chest pain/breathing",
      "thread_url": "https://connect.ntminfo.org/discussion/ntm-and-chest-painbreathing",
      "relevant_topics": [
        "other_complications",
        "treatment_monitoring"
      ],
      "topic_count": 2,
      "tagged_date": "2025-11-16T02:33:35.000000",
      "original_post_date": "Posted 08-02-2025 06:52 PM",
      "original_post_date_iso": "2025-08-02T00:00:00",
      "latest_post_date": "Posted 08-09-2025 05:17 AM",
      "latest_post_date_iso": "2025-08-09T00:00:00",
      "post_count": 9,
      "user_count": 6
    },
    "ntm-and-steam-heat": {
      "thread_file": "ntm-and-steam-heat_NTM-and-steam-heat.md",
      "thread_title": "NTM and steam heat?",
      "thread_url": "https://connect.ntminfo.org/discussion/ntm-and-steam-heat",
      "relevant_topics": [
        "environmental_exposures",
        "infection_prevention"
      ],
      "topic_count": 2,
      "tagged_date": "2025-11-16T02:33:36.000000",
      "original_post_date": "",
      "original_post_date_iso": "",
      "latest_post_date": "",
      "latest_post_date_iso": "",
      "post_count": 1,
      "user_count": 1
    },
    "ntm-canada": {
      "thread_file": "ntm-canada_NTM-Canada.md",
      "thread_title": "NTM Canada",
      "thread_url": "https://connect.ntminfo.org/discussion/ntm-canada",
      "relevant_topics": [
        "emotional_support",
        "medical_centers"
      ],
      "topic_count": 2,
      "tagged_date": "2025-11-16T02:33:37.000000",
      "original_post_date": "Posted 03-09-2025 09:18 AM",
      "original_post_date_iso": "2025-03-09T00:00:00",
      "latest_post_date": "Posted 03-13-2025 11:29 AM",
      "latest_post_date_iso": "2025-03-13T00:00:00",
      "post_count": 5,
      "user_count": 3
    },
    "ntm-connect-wrapped": {
      "thread_file": "ntm-connect-wrapped_NTM-Connect-Wrapped.md",
      "thread_title": "NTM Connect \"Wrapped!\"",
      "thread_url": "https://connect.ntminfo.org/discussion/ntm-connect-wrapped",
      "relevant_topics": [
        "emotional_support"
      ],
      "topic_count": 1,
      "tagged_date": "2025-11-16T02:33:38.000000",
      "original_post_date": "Posted 12-27-2024 12:08 PMEdited by Bekah Weidner 12-27-2024 12:09 PM",
      "original_post_date_iso": "2024-12-27T00:00:00",
      "latest_post_date": "Posted 12-27-2024 12:08 PMEdited by Bekah Weidner 12-27-2024 12:09 PM",
      "latest_post_date_iso": "2024-12-27T00:00:00",
      "post_count": 1,
      "user_count": 1
    },
    "ntm-contamination-brita-standard-water-filter": {
      "thread_file": "ntm-contamination-brita-standard-water-filter_NTM-contamination-Brita-standard-water-f.md",
      "thread_title": "NTM contamination Brita standard water filter",
      "thread_url": "https://connect.ntminfo.org/discussion/ntm-contamination-brita-standard-water-filter",
      "relevant_topics": [
        "water_safety",
        "medical_centers",
        "infection_prevention"
      ],
      "topic_count": 3,
      "tagged_date": "2025-11-16T02:33:39.000000",
      "original_post_date": "Posted 12-29-2024 12:21 AM",
      "original_post_date_iso": "2024-12-29T00:00:00",
      "latest_post_date": "Posted 01-02-2025 12:40 AM",
      "latest_post_date_iso": "2025-01-02T00:00:00",
      "post_count": 7,
      "user_count": 4
    },
    "ntm-diagnosis": {
      "thread_file": "ntm-diagnosis_NTM-diagnosis.md",
      "thread_title": "NTM diagnosis",
      "thread_url": "https://connect.ntminfo.org/discussion/ntm-diagnosis",
      "relevant_topics": [
        "treatment_monitoring",
        "medication_side_effects",
        "medical_centers",
        "emotional_support"
      ],
      "topic_count": 4,
      "tagged_date": "2025-11-16T02:33:40.000000",
      "original_post_date": "Posted 23 days ago",
      "original_post_date_iso": "2025-10-22T21:30:49.673116",
      "latest_post_date": "Posted 18 days ago",
      "latest_post_date_iso": "2025-10-27T21:30:49.673116",
      "post_count": 24,
      "user_count": 11
    },
    "ntm-estuaries-and-salt-water": {
      "thread_file": "ntm-estuaries-and-salt-water_NTM-estuaries-and-salt-water.md",
      "thread_title": "NTM estuaries and salt water",
      "thread_url": "https://connect.ntminfo.org/discussion/ntm-estuaries-and-salt-water",
      "relevant_topics": [
        "environmental_exposures",
        "medical_centers",
        "travel_safety"
      ],
      "topic_count": 3,
      "tagged_date": "2025-11-16T02:33:41.000000",
      "original_post_date": "Posted 04-01-2025 08:17 AM",
      "original_post_date_iso": "2025-04-01T00:00:00",
      "latest_post_date": "Posted 26 days ago",
      "latest_post_date_iso": "2025-10-19T21:31:32.002963",
      "post_count": 9,
      "user_count": 5
    },
    "ntm-filter-follow-up": {
      "thread_file": "ntm-filter-follow-up_NTM-FILTER-FOLLOW-UP.md",
      "thread_title": "NTM FILTER FOLLOW UP",
      "thread_url": "https://connect.ntminfo.org/discussion/ntm-filter-follow-up",
      "relevant_topics": [
        "water_safety",
        "equipment_maintenance",
        "medical_centers"
      ],
      "topic_count": 3,
      "tagged_date": "2025-11-16T02:33:42.000000",
      "original_post_date": "Posted 22 days ago",
      "original_post_date_iso": "2025-10-23T21:30:41.790748",
      "latest_post_date": "Posted 19 days ago",
      "latest_post_date_iso": "2025-10-26T21:30:41.790748",
      "post_count": 14,
      "user_count": 5
    },
    "ntm-in-sputum-sample-is-it-really-reliable-for-therapy-monitoring": {
      "thread_file": "ntm-in-sputum-sample-is-it-really-reliable-for-therapy-monitoring_NTM-in-sputum-sample-is-it-really-reliab.md",
      "thread_title": "NTM in sputum sample: is it really reliable for therapy monitoring?",
      "thread_url": "https://connect.ntminfo.org/discussion/ntm-in-sputum-sample-is-it-really-reliable-for-therapy-monitoring",
      "relevant_topics": [
        "treatment_monitoring",
        "bronchoscopy",
        "infection_prevention"
      ],
      "topic_count": 3,
      "tagged_date": "2025-11-16T02:33:43.000000",
      "original_post_date": "Posted 11-08-2024 09:51 AM",
      "original_post_date_iso": "2024-11-08T00:00:00",
      "latest_post_date": "Posted 11-23-2024 09:16 AM",
      "latest_post_date_iso": "2024-11-23T00:00:00",
      "post_count": 37,
      "user_count": 12
    },
    "ntm-mac-in-cows-milk": {
      "thread_file": "ntm-mac-in-cows-milk_NTM-Mac-in-cows-milk.md",
      "thread_title": "NTM (Mac) in cow's milk?",
      "thread_url": "https://connect.ntminfo.org/discussion/ntm-mac-in-cows-milk",
      "relevant_topics": [
        "infection_prevention",
        "medical_centers"
      ],
      "topic_count": 2,
      "tagged_date": "2025-11-16T02:33:44.000000",
      "original_post_date": "Posted 01-16-2025 11:31 AM",
      "original_post_date_iso": "2025-01-16T00:00:00",
      "latest_post_date": "Posted 01-17-2025 04:10 PM",
      "latest_post_date_iso": "2025-01-17T00:00:00",
      "post_count": 2,
      "user_count": 2
    },
    "ntm-specialist-in-vero-beach": {
      "thread_file": "ntm-specialist-in-vero-beach_NTM-Specialist-in-Vero-Beach.md",
      "thread_title": "NTM Specialist in Vero Beach",
      "thread_url": "https://connect.ntminfo.org/discussion/ntm-specialist-in-vero-beach",
      "relevant_topics": [
        "medical_centers"
      ],
      "topic_count": 1,
      "tagged_date": "2025-11-16T02:33:45.000000",
      "original_post_date": "Posted 05-09-2025 10:30 AM",
      "original_post_date_iso": "2025-05-09T00:00:00",
      "latest_post_date": "Posted 05-12-2025 01:50 PM",
      "latest_post_date_iso": "2025-05-12T00:00:00",
      "post_count": 4,
      "user_count": 1
    },
    "ntm-treatment-issues-with-arikayce": {
      "thread_file": "ntm-treatment-issues-with-arikayce_NTM-treatment-issues-with-Arikayce.md",
      "thread_title": "NTM treatment issues with Arikayce",
      "thread_url": "https://connect.ntminfo.org/discussion/ntm-treatment-issues-with-arikayce",
      "relevant_topics": [
        "inhaled_medications",
        "medication_side_effects",
        "other_complications"
      ],
      "topic_count": 3,
      "tagged_date": "2025-11-16T02:33:46.000000",
      "original_post_date": "Posted 08-29-2025 09:04 AM",
      "original_post_date_iso": "2025-08-29T00:00:00",
      "latest_post_date": "Posted 09-01-2025 11:51 AM",
      "latest_post_date_iso": "2025-09-01T00:00:00",
      "post_count": 4,
      "user_count": 3
    },
    "ntm-water-filters-solutions": {
      "thread_file": "ntm-water-filters-solutions_NTM-water-filters-solutions.md",
      "thread_title": "NTM water filters solutions",
      "thread_url": "https://connect.ntminfo.org/discussion/ntm-water-filters-solutions",
      "relevant_topics": [
        "water_safety",
        "equipment_maintenance"
      ],
      "topic_count": 2,
      "tagged_date": "2025-11-16T02:33:47.000000",
      "original_post_date": "Posted 01-24-2025 10:24 AM",
      "original_post_date_iso": "2025-01-24T00:00:00",
      "latest_post_date": "Posted 01-26-2025 09:57 AM",
      "latest_post_date_iso": "2025-01-26T00:00:00",
      "post_count": 3,
      "user_count": 2
    },
    "ntm-xenopi": {
      "thread_file": "ntm-xenopi_NTM-Xenopi.md",
      "thread_title": "NTM Xenopi",
      "thread_url": "https://connect.ntminfo.org/discussion/ntm-xenopi",
      "relevant_topics": [
        "species_specific_treatment",
        "treatment_monitoring",
        "medication_side_effects",
        "emotional_support"
      ],
      "topic_count": 4,
      "tagged_date": "2025-11-16T02:33:48.000000",
      "original_post_date": "Posted 01-31-2024 09:48 AM",
      "original_post_date_iso": "2024-01-31T00:00:00",
      "latest_post_date": "Posted 10-13-2025 04:00 PM",
      "latest_post_date_iso": "2025-10-13T00:00:00",
      "post_count": 6,
      "user_count": 2
    },
    "ntmaspergillus-fungus": {
      "thread_file": "ntmaspergillus-fungus_NTMAspergillus-fungus.md",
      "thread_title": "NTM/Aspergillus fungus",
      "thread_url": "https://connect.ntminfo.org/discussion/ntmaspergillus-fungus",
      "relevant_topics": [
        "coinfections",
        "treatment_monitoring"
      ],
      "topic_count": 2,
      "tagged_date": "2025-11-16T02:33:49.000000",
      "original_post_date": "Posted 05-11-2025 06:51 PM",
      "original_post_date_iso": "2025-05-11T00:00:00",
      "latest_post_date": "Posted 05-14-2025 01:43 PM",
      "latest_post_date_iso": "2025-05-14T00:00:00",
      "post_count": 10,
      "user_count": 8
    },
    "ntmaspergillus-fungus-1": {
      "thread_file": "ntmaspergillus-fungus-1_NTMAspergillus-fungus.md",
      "thread_title": "NTM/Aspergillus fungus",
      "thread_url": "https://connect.ntminfo.org/discussion/ntmaspergillus-fungus-1",
      "relevant_topics": [
        "coinfections",
        "treatment_monitoring",
        "medication_side_effects"
      ],
      "topic_count": 3,
      "tagged_date": "2025-11-16T02:33:50.000000",
      "original_post_date": "Posted 05-15-2025 02:37 PM",
      "original_post_date_iso": "2025-05-15T00:00:00",
      "latest_post_date": "Posted 05-17-2025 10:37 AM",
      "latest_post_date_iso": "2025-05-17T00:00:00",
      "post_count": 10,
      "user_count": 7
    },
    "ntmaspergillus-fungus-2": {
      "thread_file": "ntmaspergillus-fungus-2_NTMAspergillus-fungus.md",
      "thread_title": "NTM/Aspergillus fungus",
      "thread_url": "https://connect.ntminfo.org/discussion/ntmaspergillus-fungus-2",
      "relevant_topics": [
        "medication_side_effects",
        "big3_antibiotics"
      ],
      "topic_count": 2,
      "tagged_date": "2025-11-16T02:45:01.000000",
      "original_post_date": "Posted 05-17-2025 02:41 PM",
      "original_post_date_iso": "2025-05-17T00:00:00",
      "latest_post_date": "Posted 05-19-2025 06:50 PM",
      "latest_post_date_iso": "2025-05-19T00:00:00",
      "post_count": 2,
      "user_count": 2
    },
    "ntmbe-under-50-years-old-new-support-group": {
      "thread_file": "ntmbe-under-50-years-old-new-support-group_NTMBE-Under-50-Years-Old-New-Support-Gro.md",
      "thread_title": "NTM/BE Under 50 Years Old - New Support Group!",
      "thread_url": "https://connect.ntminfo.org/discussion/ntmbe-under-50-years-old-new-support-group",
      "relevant_topics": [
        "emotional_support"
      ],
      "topic_count": 1,
      "tagged_date": "2025-11-16T02:45:02.000000",
      "original_post_date": "Posted 12-06-2024 11:18 PMEdited by Raegan B 12-06-2024 11:26 PM",
      "original_post_date_iso": "2024-12-06T00:00:00",
      "latest_post_date": "Posted 12-06-2024 11:18 PMEdited by Raegan B 12-06-2024 11:26 PM",
      "latest_post_date_iso": "2024-12-06T00:00:00",
      "post_count": 1,
      "user_count": 1
    },
    "ntmir-conference-scholarship-application": {
      "thread_file": "ntmir-conference-scholarship-application_NTMir-Conference-Scholarship-Application.md",
      "thread_title": "NTMir Conference Scholarship Application",
      "thread_url": "https://connect.ntminfo.org/discussion/ntmir-conference-scholarship-application",
      "relevant_topics": [
        "research_trials"
      ],
      "topic_count": 1,
      "tagged_date": "2025-11-16T02:45:03.000000",
      "original_post_date": "Posted 02-18-2025 04:56 PMEdited by Bekah Weidner 02-18-2025 04:56 PM",
      "original_post_date_iso": "2025-02-18T00:00:00",
      "latest_post_date": "Posted 02-18-2025 04:56 PMEdited by Bekah Weidner 02-18-2025 04:56 PM",
      "latest_post_date_iso": "2025-02-18T00:00:00",
      "post_count": 1,
      "user_count": 1
    },
    "ntmir-wishes-linda-esposito-a-very-happy-birthday-this-weekend": {
      "thread_file": "ntmir-wishes-linda-esposito-a-very-happy-birthday-this-weekend_NTMir-wishes-Linda-Esposito-a-very-happy.md",
      "thread_title": "NTMir wishes Linda Esposito a very happy birthday this weekend!!!!!!!!!!!!",
      "thread_url": "https://connect.ntminfo.org/discussion/ntmir-wishes-linda-esposito-a-very-happy-birthday-this-weekend",
      "relevant_topics": [
        "emotional_support"
      ],
      "topic_count": 1,
      "tagged_date": "2025-11-16T02:45:04.000000",
      "original_post_date": "Posted 14 days agoEdited by Patricia Kemp 14 days ago",
      "original_post_date_iso": "2025-10-31T21:31:03.060635",
      "latest_post_date": "Posted 11 days ago",
      "latest_post_date_iso": "2025-11-03T21:31:03.060635",
      "post_count": 20,
      "user_count": 19
    },
    "ntmpcd-treatment-in-seattle": {
      "thread_file": "ntmpcd-treatment-in-seattle_NTMPCD-Treatment-in-Seattle.md",
      "thread_title": "NTM/PCD, Treatment in Seattle?",
      "thread_url": "https://connect.ntminfo.org/discussion/ntmpcd-treatment-in-seattle",
      "relevant_topics": [
        "medical_centers"
      ],
      "topic_count": 1,
      "tagged_date": "2025-11-16T02:45:05.000000",
      "original_post_date": "Posted 05-07-2025 11:39 AM",
      "original_post_date_iso": "2025-05-07T00:00:00",
      "latest_post_date": "Posted 05-11-2025 11:29 AM",
      "latest_post_date_iso": "2025-05-11T00:00:00",
      "post_count": 9,
      "user_count": 5
    },
    "nuevo-grupo-de-apoyo-en-espaol-new-spanish-speaking-support-group": {
      "thread_file": "nuevo-grupo-de-apoyo-en-espaol-new-spanish-speaking-support-group_Nuevo-Grupo-de-Apoyo-en-Espaol-New-Span.md",
      "thread_title": "Nuevo Grupo de Apoyo en Espaol (New Spanish speaking Support Group)",
      "thread_url": "https://connect.ntminfo.org/discussion/nuevo-grupo-de-apoyo-en-espaol-new-spanish-speaking-support-group",
      "relevant_topics": [
        "emotional_support"
      ],
      "topic_count": 1,
      "tagged_date": "2025-11-16T02:45:06.000000",
      "original_post_date": "Posted 04-16-2025 01:44 PM",
      "original_post_date_iso": "2025-04-16T00:00:00",
      "latest_post_date": "Posted 04-16-2025 01:44 PM",
      "latest_post_date_iso": "2025-04-16T00:00:00",
      "post_count": 1,
      "user_count": 0
    },
    "nutritional-drink": {
      "thread_file": "nutritional-drink_Nutritional-drink.md",
      "thread_title": "Nutritional drink",
      "thread_url": "https://connect.ntminfo.org/discussion/nutritional-drink",
      "relevant_topics": [
        "nutrition_lifestyle",
        "water_safety"
      ],
      "topic_count": 2,
      "tagged_date": "2025-11-16T02:45:07.000000",
      "original_post_date": "Posted 10-03-2024 04:43 PM",
      "original_post_date_iso": "2024-10-03T00:00:00",
      "latest_post_date": "Posted 10-06-2024 11:25 AM",
      "latest_post_date_iso": "2024-10-06T00:00:00",
      "post_count": 8,
      "user_count": 6
    },
    "ocean-and-ntm": {
      "thread_file": "ocean-and-ntm_Ocean-and-NTM.md",
      "thread_title": "Ocean and NTM",
      "thread_url": "https://connect.ntminfo.org/discussion/ocean-and-ntm",
      "relevant_topics": [
        "water_safety",
        "environmental_exposures"
      ],
      "topic_count": 2,
      "tagged_date": "2025-11-16T02:45:08.000000",
      "original_post_date": "Posted 03-04-2025 09:39 AM",
      "original_post_date_iso": "2025-03-04T00:00:00",
      "latest_post_date": "Posted 05-12-2025 01:26 PM",
      "latest_post_date_iso": "2025-05-12T00:00:00",
      "post_count": 8,
      "user_count": 3
    },
    "ohsu": {
      "thread_file": "ohsu_OHSU.md",
      "thread_title": "OHSU",
      "thread_url": "https://connect.ntminfo.org/discussion/ohsu",
      "relevant_topics": [
        "medical_centers"
      ],
      "topic_count": 1,
      "tagged_date": "2025-11-16T02:45:09.000000",
      "original_post_date": "Posted 07-27-2025 01:24 PM",
      "original_post_date_iso": "2025-07-27T00:00:00",
      "latest_post_date": "Posted 07-28-2025 12:41 PMEdited by Ling Wang 07-28-2025 01:03 PM",
      "latest_post_date_iso": "2025-07-28T00:00:00",
      "post_count": 2,
      "user_count": 2
    },
    "ok-to-drink-water-before-nebulizing": {
      "thread_file": "ok-to-drink-water-before-nebulizing_OK-to-drink-water-before-nebulizing.md",
      "thread_title": "OK to drink water before nebulizing?",
      "thread_url": "https://connect.ntminfo.org/discussion/ok-to-drink-water-before-nebulizing",
      "relevant_topics": [
        "saline_therapy",
        "treatment_monitoring"
      ],
      "topic_count": 2,
      "tagged_date": "2025-11-16T02:45:10.000000",
      "original_post_date": "Posted 28 days ago",
      "original_post_date_iso": "2025-10-17T21:30:53.131737",
      "latest_post_date": "Posted 27 days ago",
      "latest_post_date_iso": "2025-10-18T21:30:53.131737",
      "post_count": 2,
      "user_count": 2
    },
    "oklahoma-patients": {
      "thread_file": "oklahoma-patients_Oklahoma-Patients.md",
      "thread_title": "Oklahoma Patients",
      "thread_url": "https://connect.ntminfo.org/discussion/oklahoma-patients",
      "relevant_topics": [
        "emotional_support"
      ],
      "topic_count": 1,
      "tagged_date": "2025-11-16T02:55:01.000000",
      "original_post_date": "Posted 02-08-2025 03:12 PM",
      "original_post_date_iso": "2025-02-08T00:00:00",
      "latest_post_date": "Posted 02-09-2025 09:15 AM",
      "latest_post_date_iso": "2025-02-09T00:00:00",
      "post_count": 2,
      "user_count": 2
    },
    "ole-users": {
      "thread_file": "ole-users_OLE-Users.md",
      "thread_title": "OLE Users",
      "thread_url": "https://connect.ntminfo.org/discussion/ole-users",
      "relevant_topics": [
        "manual_techniques"
      ],
      "topic_count": 1,
      "tagged_date": "2025-11-16T02:55:02.000000",
      "original_post_date": "Posted 24 days ago",
      "original_post_date_iso": "2025-10-21T21:31:43.865513",
      "latest_post_date": "Posted 22 days ago",
      "latest_post_date_iso": "2025-10-23T21:31:43.865513",
      "post_count": 3,
      "user_count": 1
    },
    "omadacycline-insurance-approval": {
      "thread_file": "omadacycline-insurance-approval_Omadacycline-Insurance-Approval.md",
      "thread_title": "Omadacycline Insurance Approval",
      "thread_url": "https://connect.ntminfo.org/discussion/omadacycline-insurance-approval",
      "relevant_topics": [
        "insurance_costs",
        "species_specific_treatment"
      ],
      "topic_count": 2,
      "tagged_date": "2025-11-16T02:55:03.000000",
      "original_post_date": "Posted 11-03-2024 11:38 AM",
      "original_post_date_iso": "2024-11-03T00:00:00",
      "latest_post_date": "Posted 11-04-2024 12:10 PM",
      "latest_post_date_iso": "2024-11-04T00:00:00",
      "post_count": 5,
      "user_count": 5
    },
    "ombra-aeroeclipse-xl-r-ban-nebulizer": {
      "thread_file": "ombra-aeroeclipse-xl-r-ban-nebulizer_Ombra-AEROECLIPSE-XL-R-BAN-Nebulizer.md",
      "thread_title": "Ombra AEROECLIPSE XL R BAN Nebulizer",
      "thread_url": "https://connect.ntminfo.org/discussion/ombra-aeroeclipse-xl-r-ban-nebulizer",
      "relevant_topics": [
        "equipment_sterilization",
        "nebulizers"
      ],
      "topic_count": 2,
      "tagged_date": "2025-11-16T02:55:04.000000",
      "original_post_date": "Posted 03-25-2025 04:21 PM",
      "original_post_date_iso": "2025-03-25T00:00:00",
      "latest_post_date": "Posted 04-01-2025 12:46 PM",
      "latest_post_date_iso": "2025-04-01T00:00:00",
      "post_count": 8,
      "user_count": 3
    },
    "ombra-compressor": {
      "thread_file": "ombra-compressor_Ombra-compressor.md",
      "thread_title": "Ombra compressor",
      "thread_url": "https://connect.ntminfo.org/discussion/ombra-compressor",
      "relevant_topics": [
        "nebulizers"
      ],
      "topic_count": 1,
      "tagged_date": "2025-11-16T02:55:05.000000",
      "original_post_date": "Posted 12-01-2024 09:20 AM",
      "original_post_date_iso": "2024-12-01T00:00:00",
      "latest_post_date": "Posted 12-03-2024 10:03 AM",
      "latest_post_date_iso": "2024-12-03T00:00:00",
      "post_count": 5,
      "user_count": 3
    },
    "ombra-compressor-1": {
      "thread_file": "ombra-compressor-1_Ombra-compressor.md",
      "thread_title": "Ombra compressor",
      "thread_url": "https://connect.ntminfo.org/discussion/ombra-compressor-1",
      "relevant_topics": [
        "nebulizers"
      ],
      "topic_count": 1,
      "tagged_date": "2025-11-16T02:55:06.000000",
      "original_post_date": "Posted 12-03-2024 03:22 PM",
      "original_post_date_iso": "2024-12-03T00:00:00",
      "latest_post_date": "Posted 12-04-2024 09:16 AM",
      "latest_post_date_iso": "2024-12-04T00:00:00",
      "post_count": 3,
      "user_count": 2
    },
    "ombra-compressor-kit": {
      "thread_file": "ombra-compressor-kit_Ombra-Compressor-Kit.md",
      "thread_title": "Ombra Compressor Kit",
      "thread_url": "https://connect.ntminfo.org/discussion/ombra-compressor-kit",
      "relevant_topics": [
        "nebulizers"
      ],
      "topic_count": 1,
      "tagged_date": "2025-11-16T02:55:07.000000",
      "original_post_date": "Posted 11-04-2024 01:53 PM",
      "original_post_date_iso": "2024-11-04T00:00:00",
      "latest_post_date": "Posted 11-06-2024 09:43 PM",
      "latest_post_date_iso": "2024-11-06T00:00:00",
      "post_count": 3,
      "user_count": 2
    },
    "ombraaeroclipsexl-nebulizing-take-long-time": {
      "thread_file": "ombraaeroclipsexl-nebulizing-take-long-time_OMBRAAEROCLIPSEXL-NEBULIZING-TAKE-LONG-T.md",
      "thread_title": "OMBRA/AEROCLIPSEXL NEBULIZING TAKE LONG TIME",
      "thread_url": "https://connect.ntminfo.org/discussion/ombraaeroclipsexl-nebulizing-take-long-time",
      "relevant_topics": [
        "nebulizers",
        "saline_therapy"
      ],
      "topic_count": 2,
      "tagged_date": "2025-11-16T02:55:08.000000",
      "original_post_date": "Posted 12-29-2023 05:00 PMEdited by Sherri Gadbois 01-03-2024 12:05 PM",
      "original_post_date_iso": "2023-12-29T00:00:00",
      "latest_post_date": "Posted 02-25-2025 11:04 AM",
      "latest_post_date_iso": "2025-02-25T00:00:00",
      "post_count": 16,
      "user_count": 9
    },
    "one-colony-ralstonia-pickettii-as-opposed-to-rare": {
      "thread_file": "one-colony-ralstonia-pickettii-as-opposed-to-rare_One-colony-Ralstonia-pickettii-as-oppose.md",
      "thread_title": "One colony Ralstonia pickettii as opposed to Rare",
      "thread_url": "https://connect.ntminfo.org/discussion/one-colony-ralstonia-pickettii-as-opposed-to-rare",
      "relevant_topics": [
        "treatment_monitoring",
        "coinfections"
      ],
      "topic_count": 2,
      "tagged_date": "2025-11-16T02:55:09.000000",
      "original_post_date": "Posted 02-03-2025 06:47 PM",
      "original_post_date_iso": "2025-02-03T00:00:00",
      "latest_post_date": "Posted 02-06-2025 09:08 AM",
      "latest_post_date_iso": "2025-02-06T00:00:00",
      "post_count": 5,
      "user_count": 2
    },
    "outdoor-pools-prof-falkinham": {
      "thread_file": "outdoor-pools-prof-falkinham_Outdoor-pools-prof-Falkinham.md",
      "thread_title": "Outdoor pools - prof Falkinham",
      "thread_url": "https://connect.ntminfo.org/discussion/outdoor-pools-prof-falkinham",
      "relevant_topics": [
        "water_safety",
        "environmental_exposures"
      ],
      "topic_count": 2,
      "tagged_date": "2025-11-16T02:55:10.000000",
      "original_post_date": "Posted 01-08-2025 09:43 AM",
      "original_post_date_iso": "2025-01-08T00:00:00",
      "latest_post_date": "Posted 04-30-2025 12:58 PM",
      "latest_post_date_iso": "2025-04-30T00:00:00",
      "post_count": 18,
      "user_count": 7
    },
    "outdoor-shower-dr-falkinham-repy-please": {
      "thread_file": "outdoor-shower-dr-falkinham-repy-please_Outdoor-Shower-Dr-Falkinham-repy-please.md",
      "thread_title": "Outdoor Shower: Dr. Falkinham repy please",
      "thread_url": "https://connect.ntminfo.org/discussion/outdoor-shower-dr-falkinham-repy-please",
      "relevant_topics": [
        "water_safety",
        "environmental_exposures"
      ],
      "topic_count": 2,
      "tagged_date": "2025-11-16T03:05:01.000000",
      "original_post_date": "Posted 08-21-2025 05:46 PM",
      "original_post_date_iso": "2025-08-21T00:00:00",
      "latest_post_date": "Posted 08-22-2025 11:53 AM",
      "latest_post_date_iso": "2025-08-22T00:00:00",
      "post_count": 4,
      "user_count": 2
    },
    "oxygen": {
      "thread_file": "oxygen_Oxygen.md",
      "thread_title": "Oxygen",
      "thread_url": "https://connect.ntminfo.org/discussion/oxygen",
      "relevant_topics": [
        "other_complications",
        "treatment_monitoring"
      ],
      "topic_count": 2,
      "tagged_date": "2025-11-16T03:05:02.000000",
      "original_post_date": "Posted 05-06-2025 09:59 AM",
      "original_post_date_iso": "2025-05-06T00:00:00",
      "latest_post_date": "Posted 05-09-2025 09:35 AM",
      "latest_post_date_iso": "2025-05-09T00:00:00",
      "post_count": 5,
      "user_count": 4
    },
    "painful-to-open-squeezing-individual-plastic-vials-of-ipratropiumalbuterol-due-to-arthritic-hand": {
      "thread_file": "painful-to-open-squeezing-individual-plastic-vials-of-ipratropiumalbuterol-due-to-arthritic-hand_Painful-to-open-squeezing-individual-pla.md",
      "thread_title": "Painful to open & squeezing individual plastic vials of Ipratropium/Albuterol due to arthritic hand.",
      "thread_url": "https://connect.ntminfo.org/discussion/painful-to-open-squeezing-individual-plastic-vials-of-ipratropiumalbuterol-due-to-arthritic-hand",
      "relevant_topics": [
        "work_employment",
        "inhaled_medications"
      ],
      "topic_count": 2,
      "tagged_date": "2025-11-16T03:05:03.000000",
      "original_post_date": "Posted 09-09-2025 11:53 AM",
      "original_post_date_iso": "2025-09-09T00:00:00",
      "latest_post_date": "Posted 28 days ago",
      "latest_post_date_iso": "2025-10-17T21:31:46.321818",
      "post_count": 8,
      "user_count": 5
    },
    "pall-and-aquatool-shower-heads": {
      "thread_file": "pall-and-aquatool-shower-heads_Pall-and-AquaTool-shower-heads.md",
      "thread_title": "Pall and AquaTool shower heads",
      "thread_url": "https://connect.ntminfo.org/discussion/pall-and-aquatool-shower-heads",
      "relevant_topics": [
        "water_safety",
        "equipment_sterilization"
      ],
      "topic_count": 2,
      "tagged_date": "2025-11-16T03:05:04.000000",
      "original_post_date": "Posted 05-29-2025 05:27 PM",
      "original_post_date_iso": "2025-05-29T00:00:00",
      "latest_post_date": "Posted 26 days ago",
      "latest_post_date_iso": "2025-10-19T21:30:57.301860",
      "post_count": 22,
      "user_count": 6
    },
    "palm-coast": {
      "thread_file": "palm-coast_Palm-coast.md",
      "thread_title": "Palm coast",
      "thread_url": "https://connect.ntminfo.org/discussion/palm-coast",
      "relevant_topics": [
        "emotional_support"
      ],
      "topic_count": 1,
      "tagged_date": "2025-11-16T03:05:05.000000",
      "original_post_date": "Posted 10-04-2024 05:00 PM",
      "original_post_date_iso": "2024-10-04T00:00:00",
      "latest_post_date": "Posted 10-04-2024 05:00 PM",
      "latest_post_date_iso": "2024-10-04T00:00:00",
      "post_count": 1,
      "user_count": 1
    },
    "par-trek-disposable-cups": {
      "thread_file": "par-trek-disposable-cups_Par-Trek-disposable-cups.md",
      "thread_title": "Par Trek disposable cups",
      "thread_url": "https://connect.ntminfo.org/discussion/par-trek-disposable-cups",
      "relevant_topics": [
        "nebulizers",
        "travel_equipment"
      ],
      "topic_count": 2,
      "tagged_date": "2025-11-16T03:05:06.000000",
      "original_post_date": "Posted 06-28-2025 07:06 PM",
      "original_post_date_iso": "2025-06-28T00:00:00",
      "latest_post_date": "Posted 06-30-2025 05:59 AM",
      "latest_post_date_iso": "2025-06-30T00:00:00",
      "post_count": 11,
      "user_count": 5
    },
    "paresthesia-pins-needles-in-handsfeet": {
      "thread_file": "paresthesia-pins-needles-in-handsfeet_paresthesia-pins-needles-in-handsfeet.md",
      "thread_title": "paresthesia - pins & needles in hands/feet",
      "thread_url": "https://connect.ntminfo.org/discussion/paresthesia-pins-needles-in-handsfeet",
      "relevant_topics": [
        "medication_side_effects",
        "iv_antibiotics"
      ],
      "topic_count": 2,
      "tagged_date": "2025-11-16T03:05:07.000000",
      "original_post_date": "Posted 12-03-2024 12:44 AM",
      "original_post_date_iso": "2024-12-03T00:00:00",
      "latest_post_date": "Posted 12-04-2024 11:54 AM",
      "latest_post_date_iso": "2024-12-04T00:00:00",
      "post_count": 2,
      "user_count": 2
    },
    "pari-customer-service": {
      "thread_file": "pari-customer-service_PARI-Customer-service.md",
      "thread_title": "PARI Customer service",
      "thread_url": "https://connect.ntminfo.org/discussion/pari-customer-service",
      "relevant_topics": [
        "nebulizers"
      ],
      "topic_count": 1,
      "tagged_date": "2025-11-16T03:05:08.000000",
      "original_post_date": "Posted 03-26-2025 09:52 AM",
      "original_post_date_iso": "2025-03-26T00:00:00",
      "latest_post_date": "Posted 03-26-2025 09:52 AM",
      "latest_post_date_iso": "2025-03-26T00:00:00",
      "post_count": 1,
      "user_count": 1
    },
    "pari-e-flow-nebulizer": {
      "thread_file": "pari-e-flow-nebulizer_Pari-e-Flow-Nebulizer.md",
      "thread_title": "Pari e-Flow Nebulizer",
      "thread_url": "https://connect.ntminfo.org/discussion/pari-e-flow-nebulizer",
      "relevant_topics": [
        "nebulizers",
        "saline_therapy"
      ],
      "topic_count": 2,
      "tagged_date": "2025-11-16T03:05:09.000000",
      "original_post_date": "Posted 06-13-2025 12:33 PM",
      "original_post_date_iso": "2025-06-13T00:00:00",
      "latest_post_date": "Posted 06-21-2025 05:40 PM",
      "latest_post_date_iso": "2025-06-21T00:00:00",
      "post_count": 33,
      "user_count": 10
    },
    "pari-eflow": {
      "thread_file": "pari-eflow_Pari-eFlow.md",
      "thread_title": "Pari eFlow",
      "thread_url": "https://connect.ntminfo.org/discussion/pari-eflow",
      "relevant_topics": [
        "nebulizers",
        "saline_therapy"
      ],
      "topic_count": 2,
      "tagged_date": "2025-11-16T03:05:10.000000",
      "original_post_date": "Posted 05-29-2025 11:27 AM",
      "original_post_date_iso": "2025-05-29T00:00:00",
      "latest_post_date": "Posted 06-16-2025 07:42 PM",
      "latest_post_date_iso": "2025-06-16T00:00:00",
      "post_count": 23,
      "user_count": 10
    },
    "pari-eflow-nebulizer-use-with-levalbuterol-and-saline": {
      "thread_file": "pari-eflow-nebulizer-use-with-levalbuterol-and-saline_Pari-eflow-nebulizer-use-with-Levalbuter.md",
      "thread_title": "Pari eflow nebulizer use with Levalbuterol and saline?",
      "thread_url": "https://connect.ntminfo.org/discussion/pari-eflow-nebulizer-use-with-levalbuterol-and-saline",
      "relevant_topics": [
        "nebulizers",
        "saline_therapy",
        "inhaled_medications"
      ],
      "topic_count": 3,
      "tagged_date": "2025-11-16T03:15:01.000000",
      "original_post_date": "Posted 09-07-2025 10:43 AM",
      "original_post_date_iso": "2025-09-07T00:00:00",
      "latest_post_date": "Posted 09-25-2025 07:02 AM",
      "latest_post_date_iso": "2025-09-25T00:00:00",
      "post_count": 29,
      "user_count": 5
    },
    "pari-s-trek-vs-aerobika-wflutterpulse-device": {
      "thread_file": "pari-s-trek-vs-aerobika-wflutterpulse-device_Pari-S-Trek-vs-Aerobika-wflutterpulse-de.md",
      "thread_title": "Pari S Trek vs. Aerobika w/flutter/pulse device",
      "thread_url": "https://connect.ntminfo.org/discussion/pari-s-trek-vs-aerobika-wflutterpulse-device",
      "relevant_topics": [
        "nebulizers",
        "manual_techniques",
        "travel_equipment"
      ],
      "topic_count": 3,
      "tagged_date": "2025-11-16T03:15:02.000000",
      "original_post_date": "Posted 08-18-2024 05:43 PM",
      "original_post_date_iso": "2024-08-18T00:00:00",
      "latest_post_date": "Posted 09-06-2025 08:36 PM",
      "latest_post_date_iso": "2025-09-06T00:00:00",
      "post_count": 6,
      "user_count": 4
    },
    "pari-trek-mask-fit-nebulizing-time": {
      "thread_file": "pari-trek-mask-fit-nebulizing-time_Pari-Trek-mask-fit-nebulizing-time.md",
      "thread_title": "Pari Trek mask fit & nebulizing time?",
      "thread_url": "https://connect.ntminfo.org/discussion/pari-trek-mask-fit-nebulizing-time",
      "relevant_topics": [
        "nebulizers",
        "travel_equipment"
      ],
      "topic_count": 2,
      "tagged_date": "2025-11-16T03:15:03.000000",
      "original_post_date": "Posted 04-16-2025 10:03 AM",
      "original_post_date_iso": "2025-04-16T00:00:00",
      "latest_post_date": "Posted 04-16-2025 10:03 AM",
      "latest_post_date_iso": "2025-04-16T00:00:00",
      "post_count": 1,
      "user_count": 1
    },
    "pari-treks-and-brezza-baby-bottle-travel-anyone-used-these-in-mexico": {
      "thread_file": "pari-treks-and-brezza-baby-bottle-travel-anyone-used-these-in-mexico_Pari-TrekS-and-Brezza-Baby-Bottle-Travel.md",
      "thread_title": "Pari TrekS and Brezza Baby Bottle Travel - Anyone used these in Mexico?",
      "thread_url": "https://connect.ntminfo.org/discussion/pari-treks-and-brezza-baby-bottle-travel-anyone-used-these-in-mexico",
      "relevant_topics": [
        "travel_equipment",
        "equipment_sterilization"
      ],
      "topic_count": 2,
      "tagged_date": "2025-11-16T03:15:04.000000",
      "original_post_date": "Posted 08-19-2025 10:11 AM",
      "original_post_date_iso": "2025-08-19T00:00:00",
      "latest_post_date": "Posted 08-22-2025 10:27 AM",
      "latest_post_date_iso": "2025-08-22T00:00:00",
      "post_count": 4,
      "user_count": 2
    },
    "peptide-therapy": {
      "thread_file": "peptide-therapy_Peptide-Therapy.md",
      "thread_title": "Peptide Therapy",
      "thread_url": "https://connect.ntminfo.org/discussion/peptide-therapy",
      "relevant_topics": [
        "research_trials",
        "alternative_therapies"
      ],
      "topic_count": 2,
      "tagged_date": "2025-11-16T03:15:05.000000",
      "original_post_date": "Posted 10-07-2024 11:01 AM",
      "original_post_date_iso": "2024-10-07T00:00:00",
      "latest_post_date": "Posted 10-25-2024 10:39 AM",
      "latest_post_date_iso": "2024-10-25T00:00:00",
      "post_count": 9,
      "user_count": 2
    },
    "pfts": {
      "thread_file": "pfts_PFTs.md",
      "thread_title": "PFT's",
      "thread_url": "https://connect.ntminfo.org/discussion/pfts",
      "relevant_topics": [
        "treatment_monitoring"
      ],
      "topic_count": 1,
      "tagged_date": "2025-11-16T03:15:06.000000",
      "original_post_date": "Posted 01-22-2025 06:10 PM",
      "original_post_date_iso": "2025-01-22T00:00:00",
      "latest_post_date": "Posted 01-24-2025 12:22 AM",
      "latest_post_date_iso": "2025-01-24T00:00:00",
      "post_count": 6,
      "user_count": 5
    },
    "ph-impedance-vs-bravo-test": {
      "thread_file": "ph-impedance-vs-bravo-test_PH-Impedance-VS-Bravo-Test.md",
      "thread_title": "PH-Impedance VS Bravo Test",
      "thread_url": "https://connect.ntminfo.org/discussion/ph-impedance-vs-bravo-test",
      "relevant_topics": [
        "treatment_monitoring",
        "other_complications"
      ],
      "topic_count": 2,
      "tagged_date": "2025-11-16T03:15:07.000000",
      "original_post_date": "Posted 01-20-2025 11:24 AMEdited by Sherri Gadbois 01-20-2025 11:25 AM",
      "original_post_date_iso": "2025-01-20T00:00:00",
      "latest_post_date": "Posted 01-22-2025 09:15 AM",
      "latest_post_date_iso": "2025-01-22T00:00:00",
      "post_count": 5,
      "user_count": 3
    },
    "pharma-caribe-saline": {
      "thread_file": "pharma-caribe-saline_Pharma-Caribe-saline.md",
      "thread_title": "Pharma Caribe saline",
      "thread_url": "https://connect.ntminfo.org/discussion/pharma-caribe-saline",
      "relevant_topics": [
        "equipment_maintenance",
        "saline_therapy",
        "patient_stories",
        "insurance_costs"
      ],
      "topic_count": 4,
      "tagged_date": "2025-11-16T03:34:12.000000",
      "original_post_date": "Posted 10-26-2023 03:49 PM",
      "original_post_date_iso": "2023-10-26T00:00:00",
      "latest_post_date": "Posted 02-03-2025 07:03 PM",
      "latest_post_date_iso": "2025-02-03T00:00:00",
      "post_count": 12,
      "user_count": 5
    },
    "phase-3-clinical-trial-of-inhaled-clofazimine": {
      "thread_file": "phase-3-clinical-trial-of-inhaled-clofazimine_Phase-3-clinical-trial-of-inhaled-clofaz.md",
      "thread_title": "Phase 3 clinical trial of inhaled clofazimine",
      "thread_url": "https://connect.ntminfo.org/discussion/phase-3-clinical-trial-of-inhaled-clofazimine",
      "relevant_topics": [
        "research_trials",
        "species_specific_treatment",
        "newer_antibiotics"
      ],
      "topic_count": 3,
      "tagged_date": "2025-11-16T03:15:09.000000",
      "original_post_date": "Posted 05-07-2025 08:02 PM",
      "original_post_date_iso": "2025-05-07T00:00:00",
      "latest_post_date": "Posted 05-11-2025 06:40 AM",
      "latest_post_date_iso": "2025-05-11T00:00:00",
      "post_count": 5,
      "user_count": 5
    },
    "photoreactivation": {
      "thread_file": "photoreactivation_photoreactivation.md",
      "thread_title": "photoreactivation",
      "thread_url": "https://connect.ntminfo.org/discussion/photoreactivation",
      "relevant_topics": [
        "water_safety",
        "travel_equipment"
      ],
      "topic_count": 2,
      "tagged_date": "2025-11-16T03:15:10.000000",
      "original_post_date": "Posted 01-20-2025 08:14 PM",
      "original_post_date_iso": "2025-01-20T00:00:00",
      "latest_post_date": "Posted 01-20-2025 08:14 PM",
      "latest_post_date_iso": "2025-01-20T00:00:00",
      "post_count": 1,
      "user_count": 1
    },
    "postural-drainage-cheat-sheet": {
      "thread_file": "postural-drainage-cheat-sheet_Postural-Drainage-Cheat-Sheet.md",
      "thread_title": "Postural Drainage Cheat Sheet",
      "thread_url": "https://connect.ntminfo.org/discussion/postural-drainage-cheat-sheet",
      "relevant_topics": [
        "manual_techniques"
      ],
      "topic_count": 1,
      "tagged_date": "2025-11-16T03:16:01.000000",
      "original_post_date": "Posted 5 days ago",
      "original_post_date_iso": "2025-11-09T21:31:18.786052",
      "latest_post_date": "Posted 3 days ago",
      "latest_post_date_iso": "2025-11-11T21:31:18.786052",
      "post_count": 4,
      "user_count": 3
    },
    "postural-drainage-question": {
      "thread_file": "postural-drainage-question_Postural-drainage-question.md",
      "thread_title": "Postural drainage question",
      "thread_url": "https://connect.ntminfo.org/discussion/postural-drainage-question",
      "relevant_topics": [
        "manual_techniques",
        "digestive_issues"
      ],
      "topic_count": 2,
      "tagged_date": "2025-11-16T03:16:02.000000",
      "original_post_date": "Posted 06-04-2023 10:33 PM",
      "original_post_date_iso": "2023-06-04T00:00:00",
      "latest_post_date": "Posted 05-13-2025 09:52 AM",
      "latest_post_date_iso": "2025-05-13T00:00:00",
      "post_count": 20,
      "user_count": 9
    },
    "prebiotics-and-probiotics": {
      "thread_file": "prebiotics-and-probiotics_prebiotics-and-probiotics.md",
      "thread_title": "prebiotics and probiotics",
      "thread_url": "https://connect.ntminfo.org/discussion/prebiotics-and-probiotics",
      "relevant_topics": [
        "alternative_therapies",
        "big3_antibiotics"
      ],
      "topic_count": 2,
      "tagged_date": "2025-11-16T03:16:03.000000",
      "original_post_date": "Posted 10-19-2024 06:23 AM",
      "original_post_date_iso": "2024-10-19T00:00:00",
      "latest_post_date": "Posted 10-20-2024 01:46 PM",
      "latest_post_date_iso": "2024-10-20T00:00:00",
      "post_count": 2,
      "user_count": 1
    },
    "precautions": {
      "thread_file": "precautions_precautions.md",
      "thread_title": "precautions",
      "thread_url": "https://connect.ntminfo.org/discussion/precautions",
      "relevant_topics": [
        "infection_prevention",
        "water_safety",
        "environmental_exposures"
      ],
      "topic_count": 3,
      "tagged_date": "2025-11-16T03:16:04.000000",
      "original_post_date": "Posted 10-01-2025 05:09 AM",
      "original_post_date_iso": "2025-10-01T00:00:00",
      "latest_post_date": "Posted 10-03-2025 02:07 PM",
      "latest_post_date_iso": "2025-10-03T00:00:00",
      "post_count": 3,
      "user_count": 3
    },
    "preliminary-us-guidelines-for-adult-bronchiectasis": {
      "thread_file": "preliminary-us-guidelines-for-adult-bronchiectasis_Preliminary-US-Guidelines-for-Adult-Bron.md",
      "thread_title": "Preliminary US Guidelines for Adult Bronchiectasis",
      "thread_url": "https://connect.ntminfo.org/discussion/preliminary-us-guidelines-for-adult-bronchiectasis",
      "relevant_topics": [
        "research_trials",
        "treatment_monitoring"
      ],
      "topic_count": 2,
      "tagged_date": "2025-11-16T03:16:05.000000",
      "original_post_date": "Posted 18 days ago",
      "original_post_date_iso": "2025-10-27T21:30:50.524253",
      "latest_post_date": "Posted 15 days ago",
      "latest_post_date_iso": "2025-10-30T21:30:50.524253",
      "post_count": 2,
      "user_count": 1
    },
    "primer-grupo-para-pacientes-y-cuidadores-hispanohablantes": {
      "thread_file": "primer-grupo-para-pacientes-y-cuidadores-hispanohablantes_Primer-Grupo-para-pacientes-y-cuidadores.md",
      "thread_title": "Primer Grupo para pacientes y cuidadores hispanohablantes!",
      "thread_url": "https://connect.ntminfo.org/discussion/primer-grupo-para-pacientes-y-cuidadores-hispanohablantes",
      "relevant_topics": [
        "emotional_support"
      ],
      "topic_count": 1,
      "tagged_date": "2025-11-16T03:16:06.000000",
      "original_post_date": "Posted 04-14-2025 05:04 PMEdited by Helga Rosado 04-23-2025 04:02 PM",
      "original_post_date_iso": "2025-04-14T00:00:00",
      "latest_post_date": "Posted 04-14-2025 05:04 PMEdited by Helga Rosado 04-23-2025 04:02 PM",
      "latest_post_date_iso": "2025-04-14T00:00:00",
      "post_count": 1,
      "user_count": 1
    },
    "producing-sputum-samples": {
      "thread_file": "producing-sputum-samples_Producing-Sputum-samples.md",
      "thread_title": "Producing Sputum samples",
      "thread_url": "https://connect.ntminfo.org/discussion/producing-sputum-samples",
      "relevant_topics": [
        "sputum_cultures",
        "manual_techniques",
        "insurance_costs"
      ],
      "topic_count": 3,
      "tagged_date": "2025-11-16T03:16:07.000000",
      "original_post_date": "Posted 05-26-2025 10:17 PM",
      "original_post_date_iso": "2025-05-26T00:00:00",
      "latest_post_date": "Posted 06-01-2025 07:13 AM",
      "latest_post_date_iso": "2025-06-01T00:00:00",
      "post_count": 27,
      "user_count": 14
    },
    "prof-falkinham-about-sterilization": {
      "thread_file": "prof-falkinham-about-sterilization_Prof-Falkinham-about-sterilization.md",
      "thread_title": "Prof Falkinham - about sterilization",
      "thread_url": "https://connect.ntminfo.org/discussion/prof-falkinham-about-sterilization",
      "relevant_topics": [
        "equipment_sterilization",
        "medical_centers"
      ],
      "topic_count": 2,
      "tagged_date": "2025-11-16T03:16:08.000000",
      "original_post_date": "Posted 10-06-2025 09:40 AM",
      "original_post_date_iso": "2025-10-06T00:00:00",
      "latest_post_date": "Posted 10-06-2025 09:40 AM",
      "latest_post_date_iso": "2025-10-06T00:00:00",
      "post_count": 1,
      "user_count": 0
    },
    "prof-falkinham-time-needed-to-kill-ntms-in-plumbing": {
      "thread_file": "prof-falkinham-time-needed-to-kill-ntms-in-plumbing_Prof-Falkinham-time-needed-to-kill-NTMs-.md",
      "thread_title": "Prof Falkinham - time needed to kill NTMs in plumbing",
      "thread_url": "https://connect.ntminfo.org/discussion/prof-falkinham-time-needed-to-kill-ntms-in-plumbing",
      "relevant_topics": [
        "water_safety",
        "medical_centers"
      ],
      "topic_count": 2,
      "tagged_date": "2025-11-16T03:16:09.000000",
      "original_post_date": "Posted 07-06-2025 10:25 AM",
      "original_post_date_iso": "2025-07-06T00:00:00",
      "latest_post_date": "Posted 07-13-2025 02:35 PM",
      "latest_post_date_iso": "2025-07-13T00:00:00",
      "post_count": 3,
      "user_count": 1
    },
    "protocol-for-sputum-samples-for-diagnosis-during-treatment-and-after-treatment": {
      "thread_file": "protocol-for-sputum-samples-for-diagnosis-during-treatment-and-after-treatment_Protocol-for-sputum-samples-for-diagnosi.md",
      "thread_title": "Protocol for sputum samples for diagnosis, during treatment and after treatment",
      "thread_url": "https://connect.ntminfo.org/discussion/protocol-for-sputum-samples-for-diagnosis-during-treatment-and-after-treatment",
      "relevant_topics": [
        "sputum_cultures",
        "insurance_costs"
      ],
      "topic_count": 2,
      "tagged_date": "2025-11-16T03:16:10.000000",
      "original_post_date": "Posted 04-14-2025 01:08 AM",
      "original_post_date_iso": "2025-04-14T00:00:00",
      "latest_post_date": "Posted 04-16-2025 12:36 PM",
      "latest_post_date_iso": "2025-04-16T00:00:00",
      "post_count": 7,
      "user_count": 5
    },
    "pseudomonas-4": {
      "thread_file": "pseudomonas-4_Pseudomonas.md",
      "thread_title": "Pseudomonas",
      "thread_url": "https://connect.ntminfo.org/discussion/pseudomonas-4",
      "relevant_topics": [
        "coinfections",
        "big3_antibiotics",
        "medication_side_effects",
        "inhaled_medications"
      ],
      "topic_count": 4,
      "tagged_date": "2025-11-16T03:17:01.000000",
      "original_post_date": "Posted 09-23-2024 10:08 PM",
      "original_post_date_iso": "2024-09-23T00:00:00",
      "latest_post_date": "Posted 09-27-2024 05:13 PM",
      "latest_post_date_iso": "2024-09-27T00:00:00",
      "post_count": 11,
      "user_count": 8
    },
    "pseudomonas-aeruginosa-1": {
      "thread_file": "pseudomonas-aeruginosa-1_Pseudomonas-aeruginosa.md",
      "thread_title": "Pseudomonas aeruginosa",
      "thread_url": "https://connect.ntminfo.org/discussion/pseudomonas-aeruginosa-1",
      "relevant_topics": [
        "coinfections",
        "other_complications"
      ],
      "topic_count": 2,
      "tagged_date": "2025-11-16T03:17:02.000000",
      "original_post_date": "Posted 04-25-2024 04:15 PM",
      "original_post_date_iso": "2024-04-25T00:00:00",
      "latest_post_date": "Posted 01-16-2025 07:20 PMEdited by Renee McMillan 01-16-2025 07:20 PM",
      "latest_post_date_iso": "2025-01-16T00:00:00",
      "post_count": 2,
      "user_count": 2
    },
    "pseudomonas-aeruginosa-2": {
      "thread_file": "pseudomonas-aeruginosa-2_Pseudomonas-Aeruginosa.md",
      "thread_title": "Pseudomonas Aeruginosa",
      "thread_url": "https://connect.ntminfo.org/discussion/pseudomonas-aeruginosa-2",
      "relevant_topics": [
        "coinfections",
        "big3_antibiotics",
        "medication_side_effects"
      ],
      "topic_count": 3,
      "tagged_date": "2025-11-16T03:17:03.000000",
      "original_post_date": "Posted 09-24-2025 03:52 PM",
      "original_post_date_iso": "2025-09-24T00:00:00",
      "latest_post_date": "Posted 09-25-2025 09:20 AM",
      "latest_post_date_iso": "2025-09-25T00:00:00",
      "post_count": 11,
      "user_count": 6
    },
    "pseudomonas-aeruginosa-found-in-toms-toothpaste": {
      "thread_file": "pseudomonas-aeruginosa-found-in-toms-toothpaste_Pseudomonas-aeruginosa-found-in-Toms-Too.md",
      "thread_title": "Pseudomonas aeruginosa found in Tom's Toothpaste",
      "thread_url": "https://connect.ntminfo.org/discussion/pseudomonas-aeruginosa-found-in-toms-toothpaste",
      "relevant_topics": [
        "infection_prevention",
        "research_trials"
      ],
      "topic_count": 2,
      "tagged_date": "2025-11-16T03:17:04.000000",
      "original_post_date": "Posted 11-21-2024 11:38 AM",
      "original_post_date_iso": "2024-11-21T00:00:00",
      "latest_post_date": "Posted 11-21-2024 11:38 AM",
      "latest_post_date_iso": "2024-11-21T00:00:00",
      "post_count": 1,
      "user_count": 1
    },
    "pseudomonas-aeruginosa-treatment-with-picc-line-of-cefepime": {
      "thread_file": "pseudomonas-aeruginosa-treatment-with-picc-line-of-cefepime_Pseudomonas-aeruginosa-treatment-with-pi.md",
      "thread_title": "Pseudomonas aeruginosa treatment with picc line of cefepime?",
      "thread_url": "https://connect.ntminfo.org/discussion/pseudomonas-aeruginosa-treatment-with-picc-line-of-cefepime",
      "relevant_topics": [
        "coinfections",
        "iv_antibiotics",
        "medication_side_effects",
        "research_trials"
      ],
      "topic_count": 4,
      "tagged_date": "2025-11-16T03:17:05.000000",
      "original_post_date": "Posted 09-06-2024 10:31 PM",
      "original_post_date_iso": "2024-09-06T00:00:00",
      "latest_post_date": "Posted 07-06-2025 01:35 PM",
      "latest_post_date_iso": "2025-07-06T00:00:00",
      "post_count": 7,
      "user_count": 4
    },
    "pseudomonas-clinical-symptoms": {
      "thread_file": "pseudomonas-clinical-symptoms_Pseudomonas-Clinical-symptoms.md",
      "thread_title": "Pseudomonas Clinical symptoms",
      "thread_url": "https://connect.ntminfo.org/discussion/pseudomonas-clinical-symptoms",
      "relevant_topics": [
        "coinfections",
        "other_complications"
      ],
      "topic_count": 2,
      "tagged_date": "2025-11-16T03:17:06.000000",
      "original_post_date": "Posted 10-16-2024 07:55 AM",
      "original_post_date_iso": "2024-10-16T00:00:00",
      "latest_post_date": "Posted 10-17-2024 10:06 AM",
      "latest_post_date_iso": "2024-10-17T00:00:00",
      "post_count": 4,
      "user_count": 3
    },
    "pseudomonas-drugs-that-do-not-have-tendon-issuesruptures": {
      "thread_file": "pseudomonas-drugs-that-do-not-have-tendon-issuesruptures_Pseudomonas-drugs-that-do-NOT-have-tendo.md",
      "thread_title": "Pseudomonas drugs that do NOT have tendon issues/ruptures",
      "thread_url": "https://connect.ntminfo.org/discussion/pseudomonas-drugs-that-do-not-have-tendon-issuesruptures",
      "relevant_topics": [
        "coinfections",
        "big3_antibiotics",
        "medication_side_effects",
        "inhaled_medications"
      ],
      "topic_count": 4,
      "tagged_date": "2025-11-16T03:17:07.000000",
      "original_post_date": "Posted 07-16-2025 10:53 PM",
      "original_post_date_iso": "2025-07-16T00:00:00",
      "latest_post_date": "Posted 08-02-2025 09:40 AM",
      "latest_post_date_iso": "2025-08-02T00:00:00",
      "post_count": 16,
      "user_count": 9
    },
    "pseudomonas-in-salt-water": {
      "thread_file": "pseudomonas-in-salt-water_Pseudomonas-in-salt-water.md",
      "thread_title": "Pseudomonas in salt water?",
      "thread_url": "https://connect.ntminfo.org/discussion/pseudomonas-in-salt-water",
      "relevant_topics": [
        "environmental_exposures",
        "infection_prevention"
      ],
      "topic_count": 2,
      "tagged_date": "2025-11-16T03:17:08.000000",
      "original_post_date": "Posted 05-01-2025 01:10 AM",
      "original_post_date_iso": "2025-05-01T00:00:00",
      "latest_post_date": "Posted 05-01-2025 01:10 AM",
      "latest_post_date_iso": "2025-05-01T00:00:00",
      "post_count": 1,
      "user_count": 0
    },
    "pseudomonas-treatment": {
      "thread_file": "pseudomonas-treatment_Pseudomonas-treatment.md",
      "thread_title": "Pseudomonas treatment",
      "thread_url": "https://connect.ntminfo.org/discussion/pseudomonas-treatment",
      "relevant_topics": [
        "coinfections",
        "inhaled_medications",
        "medication_side_effects"
      ],
      "topic_count": 3,
      "tagged_date": "2025-11-16T03:17:09.000000",
      "original_post_date": "Posted 01-13-2025 11:18 AM",
      "original_post_date_iso": "2025-01-13T00:00:00",
      "latest_post_date": "Posted 01-15-2025 10:01 AM",
      "latest_post_date_iso": "2025-01-15T00:00:00",
      "post_count": 13,
      "user_count": 8
    },
    "pseudomonas-treatment-1": {
      "thread_file": "pseudomonas-treatment-1_Pseudomonas-treatment.md",
      "thread_title": "Pseudomonas treatment",
      "thread_url": "https://connect.ntminfo.org/discussion/pseudomonas-treatment-1",
      "relevant_topics": [
        "coinfections",
        "inhaled_medications",
        "iv_antibiotics",
        "insurance_costs"
      ],
      "topic_count": 4,
      "tagged_date": "2025-11-16T03:17:10.000000",
      "original_post_date": "Posted 03-27-2025 08:57 PM",
      "original_post_date_iso": "2025-03-27T00:00:00",
      "latest_post_date": "Posted 04-01-2025 07:55 PM",
      "latest_post_date_iso": "2025-04-01T00:00:00",
      "post_count": 9,
      "user_count": 7
    },
    "pseudomonas-treatment-with-oral-levaquin": {
      "thread_file": "pseudomonas-treatment-with-oral-levaquin_Pseudomonas-treatment-with-oral-levaquin.md",
      "thread_title": "Pseudomonas treatment with oral levaquin",
      "thread_url": "https://connect.ntminfo.org/discussion/pseudomonas-treatment-with-oral-levaquin",
      "relevant_topics": [
        "coinfections",
        "big3_antibiotics",
        "medication_side_effects"
      ],
      "topic_count": 3,
      "tagged_date": "2025-11-16T03:18:01.000000",
      "original_post_date": "Posted 01-26-2024 09:58 AM",
      "original_post_date_iso": "2024-01-26T00:00:00",
      "latest_post_date": "Posted 10-04-2024 09:49 AM",
      "latest_post_date_iso": "2024-10-04T00:00:00",
      "post_count": 12,
      "user_count": 30
    },
    "pulmoid": {
      "thread_file": "pulmoid_PulmoID.md",
      "thread_title": "Pulmo/ID",
      "thread_url": "https://connect.ntminfo.org/discussion/pulmoid",
      "relevant_topics": [
        "insurance_costs"
      ],
      "topic_count": 1,
      "tagged_date": "2025-11-16T03:18:02.000000",
      "original_post_date": "Posted 04-03-2025 10:38 AM",
      "original_post_date_iso": "2025-04-03T00:00:00",
      "latest_post_date": "Posted 04-16-2025 02:32 PM",
      "latest_post_date_iso": "2025-04-16T00:00:00",
      "post_count": 3,
      "user_count": 2
    },
    "pulmonary-function-test": {
      "thread_file": "pulmonary-function-test_Pulmonary-Function-Test.md",
      "thread_title": "Pulmonary Function Test",
      "thread_url": "https://connect.ntminfo.org/discussion/pulmonary-function-test",
      "relevant_topics": [
        "treatment_monitoring"
      ],
      "topic_count": 1,
      "tagged_date": "2025-11-16T03:18:03.000000",
      "original_post_date": "Posted 05-08-2024 04:00 PM",
      "original_post_date_iso": "2024-05-08T00:00:00",
      "latest_post_date": "Posted 05-02-2025 09:30 AM",
      "latest_post_date_iso": "2025-05-02T00:00:00",
      "post_count": 12,
      "user_count": 8
    },
    "pulmonologist-associated-with-uh-cleveland": {
      "thread_file": "pulmonologist-associated-with-uh-cleveland_Pulmonologist-associated-with-UH-CLEVELA.md",
      "thread_title": "Pulmonologist associated with UH CLEVELAND",
      "thread_url": "https://connect.ntminfo.org/discussion/pulmonologist-associated-with-uh-cleveland",
      "relevant_topics": [
        "insurance_costs"
      ],
      "topic_count": 1,
      "tagged_date": "2025-11-16T03:18:04.000000",
      "original_post_date": "Posted 08-03-2025 04:46 PM",
      "original_post_date_iso": "2025-08-03T00:00:00",
      "latest_post_date": "Posted 08-04-2025 11:44 AM",
      "latest_post_date_iso": "2025-08-04T00:00:00",
      "post_count": 3,
      "user_count": 3
    },
    "pulmonologist-in-pittsburgh": {
      "thread_file": "pulmonologist-in-pittsburgh_Pulmonologist-in-Pittsburgh.md",
      "thread_title": "Pulmonologist in Pittsburgh?",
      "thread_url": "https://connect.ntminfo.org/discussion/pulmonologist-in-pittsburgh",
      "relevant_topics": [
        "insurance_costs"
      ],
      "topic_count": 1,
      "tagged_date": "2025-11-16T03:18:05.000000",
      "original_post_date": "Posted 05-12-2025 07:55 PM",
      "original_post_date_iso": "2025-05-12T00:00:00",
      "latest_post_date": "Posted 06-08-2025 09:08 PM",
      "latest_post_date_iso": "2025-06-08T00:00:00",
      "post_count": 3,
      "user_count": 3
    },
    "pulmozyme": {
      "thread_file": "pulmozyme_Pulmozyme.md",
      "thread_title": "Pulmozyme",
      "thread_url": "https://connect.ntminfo.org/discussion/pulmozyme",
      "relevant_topics": [
        "insurance_costs"
      ],
      "topic_count": 1,
      "tagged_date": "2025-11-16T03:18:06.000000",
      "original_post_date": "Posted 07-13-2025 09:14 AM",
      "original_post_date_iso": "2025-07-13T00:00:00",
      "latest_post_date": "Posted 07-13-2025 09:14 AM",
      "latest_post_date_iso": "2025-07-13T00:00:00",
      "post_count": 1,
      "user_count": 1
    },
    "putting-on-weight": {
      "thread_file": "putting-on-weight_Putting-on-weight.md",
      "thread_title": "Putting on weight",
      "thread_url": "https://connect.ntminfo.org/discussion/putting-on-weight",
      "relevant_topics": [
        "nutrition_lifestyle",
        "other_complications"
      ],
      "topic_count": 2,
      "tagged_date": "2025-11-16T03:18:07.000000",
      "original_post_date": "Posted 07-13-2025 11:51 AM",
      "original_post_date_iso": "2025-07-13T00:00:00",
      "latest_post_date": "Posted 09-29-2025 07:52 AM",
      "latest_post_date_iso": "2025-09-29T00:00:00",
      "post_count": 26,
      "user_count": 10
    },
    "question-about-ntm-abscessus": {
      "thread_file": "question-about-ntm-abscessus_Question-about-NTM-Abscessus.md",
      "thread_title": "Question about NTM Abscessus",
      "thread_url": "https://connect.ntminfo.org/discussion/question-about-ntm-abscessus",
      "relevant_topics": [
        "species_specific_treatment",
        "insurance_costs"
      ],
      "topic_count": 2,
      "tagged_date": "2025-11-16T03:18:08.000000",
      "original_post_date": "Posted 10-30-2024 11:11 AM",
      "original_post_date_iso": "2024-10-30T00:00:00",
      "latest_post_date": "Posted 11-01-2024 10:35 AM",
      "latest_post_date_iso": "2024-11-01T00:00:00",
      "post_count": 4,
      "user_count": 3
    },
    "question-about-sputum-induction-procedure": {
      "thread_file": "question-about-sputum-induction-procedure_Question-about-sputum-induction-procedur.md",
      "thread_title": "Question about sputum induction procedure",
      "thread_url": "https://connect.ntminfo.org/discussion/question-about-sputum-induction-procedure",
      "relevant_topics": [
        "sputum_cultures",
        "manual_techniques",
        "insurance_costs"
      ],
      "topic_count": 3,
      "tagged_date": "2025-11-16T03:18:09.000000",
      "original_post_date": "Posted 03-04-2025 11:38 PM",
      "original_post_date_iso": "2025-03-04T00:00:00",
      "latest_post_date": "Posted 04-03-2025 06:55 PM",
      "latest_post_date_iso": "2025-04-03T00:00:00",
      "post_count": 22,
      "user_count": 7
    },
    "question-for-dr-falkinham-re-dental-work": {
      "thread_file": "question-for-dr-falkinham-re-dental-work_Question-for-Dr-Falkinham-re-Dental-Work.md",
      "thread_title": "Question for Dr. Falkinham re Dental Work",
      "thread_url": "https://connect.ntminfo.org/discussion/question-for-dr-falkinham-re-dental-work",
      "relevant_topics": [
        "infection_prevention",
        "medical_centers"
      ],
      "topic_count": 2,
      "tagged_date": "2025-11-16T03:18:10.000000",
      "original_post_date": "Posted 12-12-2024 10:21 AM",
      "original_post_date_iso": "2024-12-12T00:00:00",
      "latest_post_date": "Posted 04-24-2025 10:21 AM",
      "latest_post_date_iso": "2025-04-24T00:00:00",
      "post_count": 8,
      "user_count": 4
    },
    "question-to-dr-falkinham-re-boat-rides-on-thames-or-amsterdam-canals": {
      "thread_file": "question-to-dr-falkinham-re-boat-rides-on-thames-or-amsterdam-canals_Question-to-Dr-Falkinham-re-boat-rides-o.md",
      "thread_title": "Question to Dr. Falkinham re: boat rides on Thames or Amsterdam canals",
      "thread_url": "https://connect.ntminfo.org/discussion/question-to-dr-falkinham-re-boat-rides-on-thames-or-amsterdam-canals",
      "relevant_topics": [
        "travel_equipment",
        "medical_centers"
      ],
      "topic_count": 2,
      "tagged_date": "2025-11-16T03:19:01.000000",
      "original_post_date": "Posted 06-06-2025 09:12 AM",
      "original_post_date_iso": "2025-06-06T00:00:00",
      "latest_post_date": "Posted 06-06-2025 09:12 AM",
      "latest_post_date_iso": "2025-06-06T00:00:00",
      "post_count": 1,
      "user_count": 1
    },
    "question-to-drfalkinham-trip-to-everglades": {
      "thread_file": "question-to-drfalkinham-trip-to-everglades_Question-to-DrFalkinham-trip-to-Everglad.md",
      "thread_title": "Question to Dr.Falkinham- trip to Everglades",
      "thread_url": "https://connect.ntminfo.org/discussion/question-to-drfalkinham-trip-to-everglades",
      "relevant_topics": [
        "travel_equipment",
        "medical_centers",
        "environmental_exposures"
      ],
      "topic_count": 3,
      "tagged_date": "2025-11-16T03:19:02.000000",
      "original_post_date": "Posted 06-04-2025 11:30 AM",
      "original_post_date_iso": "2025-06-04T00:00:00",
      "latest_post_date": "Posted 06-06-2025 09:16 AM",
      "latest_post_date_iso": "2025-06-06T00:00:00",
      "post_count": 3,
      "user_count": 2
    },
    "question-to-prof-falkinham-on-swimming-pool": {
      "thread_file": "question-to-prof-falkinham-on-swimming-pool_Question-to-Prof-Falkinham-on-swimming-p.md",
      "thread_title": "Question to Prof Falkinham on swimming pool",
      "thread_url": "https://connect.ntminfo.org/discussion/question-to-prof-falkinham-on-swimming-pool",
      "relevant_topics": [
        "environmental_exposures",
        "medical_centers"
      ],
      "topic_count": 2,
      "tagged_date": "2025-11-16T03:19:03.000000",
      "original_post_date": "Posted 06-09-2025 08:16 AM",
      "original_post_date_iso": "2025-06-09T00:00:00",
      "latest_post_date": "Posted 06-10-2025 12:32 PM",
      "latest_post_date_iso": "2025-06-10T00:00:00",
      "post_count": 2,
      "user_count": 1
    },
    "questions-for-a-infectious-disease-doctor": {
      "thread_file": "questions-for-a-infectious-disease-doctor_Questions-for-a-Infectious-Disease-Docto.md",
      "thread_title": "Questions for a Infectious Disease Doctor",
      "thread_url": "https://connect.ntminfo.org/discussion/questions-for-a-infectious-disease-doctor",
      "relevant_topics": [
        "insurance_costs",
        "species_specific_treatment",
        "coinfections"
      ],
      "topic_count": 3,
      "tagged_date": "2025-11-16T03:19:04.000000",
      "original_post_date": "Posted 09-24-2025 02:26 AM",
      "original_post_date_iso": "2025-09-24T00:00:00",
      "latest_post_date": "Posted 10-13-2025 12:35 AM",
      "latest_post_date_iso": "2025-10-13T00:00:00",
      "post_count": 8,
      "user_count": 2
    },
    "questions-for-dr-faulkingham": {
      "thread_file": "questions-for-dr-faulkingham_Questions-for-DR-Faulkingham.md",
      "thread_title": "Questions for DR Faulkingham",
      "thread_url": "https://connect.ntminfo.org/discussion/questions-for-dr-faulkingham",
      "relevant_topics": [
        "infection_prevention",
        "medical_centers"
      ],
      "topic_count": 2,
      "tagged_date": "2025-11-16T03:19:05.000000",
      "original_post_date": "Posted 07-06-2025 02:16 PM",
      "original_post_date_iso": "2025-07-06T00:00:00",
      "latest_post_date": "Posted 07-07-2025 02:49 PM",
      "latest_post_date_iso": "2025-07-07T00:00:00",
      "post_count": 3,
      "user_count": 1
    },
    "questions-to-dr-falkinham-re-boat-rides-on-thames-or-amsterdam-canals": {
      "thread_file": "questions-to-dr-falkinham-re-boat-rides-on-thames-or-amsterdam-canals_Questions-to-Dr-Falkinham-re-boat-rides-.md",
      "thread_title": "Questions to Dr. Falkinham re: boat rides on Thames or Amsterdam canals",
      "thread_url": "https://connect.ntminfo.org/discussion/questions-to-dr-falkinham-re-boat-rides-on-thames-or-amsterdam-canals",
      "relevant_topics": [
        "travel_equipment",
        "medical_centers",
        "environmental_exposures"
      ],
      "topic_count": 3,
      "tagged_date": "2025-11-16T03:19:06.000000",
      "original_post_date": "Posted 06-06-2025 12:32 PM",
      "original_post_date_iso": "2025-06-06T00:00:00",
      "latest_post_date": "Posted 06-09-2025 08:06 AM",
      "latest_post_date_iso": "2025-06-09T00:00:00",
      "post_count": 4,
      "user_count": 1
    },
    "quick-question-vis-tubing": {
      "thread_file": "quick-question-vis-tubing_Quick-Question-vis-tubing.md",
      "thread_title": "Quick Question vis tubing",
      "thread_url": "https://connect.ntminfo.org/discussion/quick-question-vis-tubing",
      "relevant_topics": [
        "equipment_sterilization"
      ],
      "topic_count": 1,
      "tagged_date": "2025-11-16T03:19:07.000000",
      "original_post_date": "Posted yesterday",
      "original_post_date_iso": "2025-11-13T21:31:29.515190",
      "latest_post_date": "Posted yesterday",
      "latest_post_date_iso": "2025-11-13T21:31:29.515190",
      "post_count": 6,
      "user_count": 4
    },
    "racing-heartbeats-low-oxygen-and-infection": {
      "thread_file": "racing-heartbeats-low-oxygen-and-infection_racing-heartbeats-low-oxygen-and-infecti.md",
      "thread_title": "racing heartbeats, low oxygen and infection",
      "thread_url": "https://connect.ntminfo.org/discussion/racing-heartbeats-low-oxygen-and-infection",
      "relevant_topics": [
        "other_complications"
      ],
      "topic_count": 1,
      "tagged_date": "2025-11-16T03:19:08.000000",
      "original_post_date": "Posted 12-12-2024 04:22 PM",
      "original_post_date_iso": "2024-12-12T00:00:00",
      "latest_post_date": "Posted 12-13-2024 10:58 AM",
      "latest_post_date_iso": "2024-12-13T00:00:00",
      "post_count": 3,
      "user_count": 3
    },
    "rain-showerhead-questions": {
      "thread_file": "rain-showerhead-questions_rain-showerhead-questions.md",
      "thread_title": "rain showerhead questions",
      "thread_url": "https://connect.ntminfo.org/discussion/rain-showerhead-questions",
      "relevant_topics": [
        "water_safety",
        "medical_centers",
        "infection_prevention"
      ],
      "topic_count": 3,
      "tagged_date": "2025-11-16T03:19:09.000000",
      "original_post_date": "Posted 10-10-2025 12:11 PM",
      "original_post_date_iso": "2025-10-10T00:00:00",
      "latest_post_date": "Posted 24 days ago",
      "latest_post_date_iso": "2025-10-21T21:31:34.645307",
      "post_count": 15,
      "user_count": 8
    },
    "ralstonia-pickettii-treatment": {
      "thread_file": "ralstonia-pickettii-treatment_Ralstonia-pickettii-Treatment.md",
      "thread_title": "Ralstonia pickettii Treatment",
      "thread_url": "https://connect.ntminfo.org/discussion/ralstonia-pickettii-treatment",
      "relevant_topics": [
        "coinfections",
        "insurance_costs"
      ],
      "topic_count": 2,
      "tagged_date": "2025-11-16T03:19:10.000000",
      "original_post_date": "Posted 03-18-2025 05:58 PM",
      "original_post_date_iso": "2025-03-18T00:00:00",
      "latest_post_date": "Posted 03-18-2025 05:58 PM",
      "latest_post_date_iso": "2025-03-18T00:00:00",
      "post_count": 1,
      "user_count": 1
    },
    "rare-disease-day-february-28": {
      "thread_file": "rare-disease-day-february-28_Rare-Disease-day-February-28.md",
      "thread_title": "Rare Disease day February 28",
      "thread_url": "https://connect.ntminfo.org/discussion/rare-disease-day-february-28",
      "relevant_topics": [
        "research_trials"
      ],
      "topic_count": 1,
      "tagged_date": "2025-11-16T03:20:01.000000",
      "original_post_date": "Posted 02-15-2025 09:19 AM",
      "original_post_date_iso": "2025-02-15T00:00:00",
      "latest_post_date": "Posted 02-15-2025 09:19 AM",
      "latest_post_date_iso": "2025-02-15T00:00:00",
      "post_count": 1,
      "user_count": 1
    },
    "rare-vs-colony-and-wait-and-see-approach": {
      "thread_file": "rare-vs-colony-and-wait-and-see-approach_Rare-Vs-colony-and-wait-and-see-approach.md",
      "thread_title": "Rare Vs colony and wait and see approach",
      "thread_url": "https://connect.ntminfo.org/discussion/rare-vs-colony-and-wait-and-see-approach",
      "relevant_topics": [
        "coinfections",
        "insurance_costs"
      ],
      "topic_count": 2,
      "tagged_date": "2025-11-16T03:20:02.000000",
      "original_post_date": "Posted 04-07-2025 03:52 PM",
      "original_post_date_iso": "2025-04-07T00:00:00",
      "latest_post_date": "Posted 04-07-2025 03:52 PM",
      "latest_post_date_iso": "2025-04-07T00:00:00",
      "post_count": 1,
      "user_count": 1
    },
    "rarediseaseday-2025": {
      "thread_file": "rarediseaseday-2025_RareDiseaseDay-2025.md",
      "thread_title": "RareDiseaseDay 2025",
      "thread_url": "https://connect.ntminfo.org/discussion/rarediseaseday-2025",
      "relevant_topics": [
        "research_trials",
        "emotional_support"
      ],
      "topic_count": 2,
      "tagged_date": "2025-11-16T03:20:03.000000",
      "original_post_date": "Posted 02-28-2025 11:53 AM",
      "original_post_date_iso": "2025-02-28T00:00:00",
      "latest_post_date": "Posted 03-09-2025 03:58 PM",
      "latest_post_date_iso": "2025-03-09T00:00:00",
      "post_count": 17,
      "user_count": 10
    },
    "rec-for-sediment-filter-for-under-sink": {
      "thread_file": "rec-for-sediment-filter-for-under-sink_Rec-for-sediment-filter-for-under-sink.md",
      "thread_title": "Rec for sediment filter for under sink",
      "thread_url": "https://connect.ntminfo.org/discussion/rec-for-sediment-filter-for-under-sink",
      "relevant_topics": [
        "water_safety",
        "medical_centers"
      ],
      "topic_count": 2,
      "tagged_date": "2025-11-16T03:20:04.000000",
      "original_post_date": "Posted 08-20-2025 11:46 AM",
      "original_post_date_iso": "2025-08-20T00:00:00",
      "latest_post_date": "Posted 08-21-2025 09:10 AM",
      "latest_post_date_iso": "2025-08-21T00:00:00",
      "post_count": 4,
      "user_count": 4
    },
    "recall-sinus-cleanse-soft-tip-squeeze-bottle-nasal-wash": {
      "thread_file": "recall-sinus-cleanse-soft-tip-squeeze-bottle-nasal-wash_Recall-Sinus-Cleanse-Soft-Tip-Squeeze-Bo.md",
      "thread_title": "Recall: Sinus Cleanse Soft Tip Squeeze Bottle Nasal Wash",
      "thread_url": "https://connect.ntminfo.org/discussion/recall-sinus-cleanse-soft-tip-squeeze-bottle-nasal-wash",
      "relevant_topics": [
        "infection_prevention"
      ],
      "topic_count": 1,
      "tagged_date": "2025-11-16T03:20:05.000000",
      "original_post_date": "Posted 03-28-2025 02:50 PM",
      "original_post_date_iso": "2025-03-28T00:00:00",
      "latest_post_date": "Posted 03-28-2025 02:50 PM",
      "latest_post_date_iso": "2025-03-28T00:00:00",
      "post_count": 2,
      "user_count": 2
    },
    "recommendations-for-a-travel-size-nebulizer": {
      "thread_file": "recommendations-for-a-travel-size-nebulizer_Recommendations-for-a-Travel-size-nebuli.md",
      "thread_title": "Recommendations for a Travel size nebulizer",
      "thread_url": "https://connect.ntminfo.org/discussion/recommendations-for-a-travel-size-nebulizer",
      "relevant_topics": [
        "equipment_maintenance",
        "travel_equipment"
      ],
      "topic_count": 2,
      "tagged_date": "2025-11-16T03:20:06.000000",
      "original_post_date": "Posted 06-17-2025 10:58 AM",
      "original_post_date_iso": "2025-06-17T00:00:00",
      "latest_post_date": "Posted 06-26-2025 10:21 AM",
      "latest_post_date_iso": "2025-06-26T00:00:00",
      "post_count": 11,
      "user_count": 4
    },
    "recording-of-the-dpp-1-inhibitors-webinar-with-dr-anne-odonnell-is-now-available-for-viewing": {
      "thread_file": "recording-of-the-dpp-1-inhibitors-webinar-with-dr-anne-odonnell-is-now-available-for-viewing_Recording-of-the-DPP-1-inhibitors-webina.md",
      "thread_title": "Recording of the DPP-1 inhibitors webinar with Dr. Anne O'Donnell is now available for viewing!",
      "thread_url": "https://connect.ntminfo.org/discussion/recording-of-the-dpp-1-inhibitors-webinar-with-dr-anne-odonnell-is-now-available-for-viewing",
      "relevant_topics": [
        "research_trials",
        "alternative_therapies"
      ],
      "topic_count": 2,
      "tagged_date": "2025-11-16T03:20:07.000000",
      "original_post_date": "Posted 09-24-2025 01:41 PM",
      "original_post_date_iso": "2025-09-24T00:00:00",
      "latest_post_date": "Posted 09-24-2025 01:41 PM",
      "latest_post_date_iso": "2025-09-24T00:00:00",
      "post_count": 1,
      "user_count": 0
    },
    "recovery-from-be-flare": {
      "thread_file": "recovery-from-be-flare_Recovery-from-BE-flare.md",
      "thread_title": "Recovery from ? BE flare",
      "thread_url": "https://connect.ntminfo.org/discussion/recovery-from-be-flare",
      "relevant_topics": [
        "other_complications"
      ],
      "topic_count": 1,
      "tagged_date": "2025-11-16T03:20:08.000000",
      "original_post_date": "Posted 08-05-2025 10:03 PM",
      "original_post_date_iso": "2025-08-05T00:00:00",
      "latest_post_date": "Posted 08-06-2025 09:29 AM",
      "latest_post_date_iso": "2025-08-06T00:00:00",
      "post_count": 2,
      "user_count": 2
    },
    "reducing-ntm-exposure-by-mask-wearing": {
      "thread_file": "reducing-ntm-exposure-by-mask-wearing_Reducing-NTM-exposure-by-mask-wearing.md",
      "thread_title": "Reducing NTM exposure by mask wearing",
      "thread_url": "https://connect.ntminfo.org/discussion/reducing-ntm-exposure-by-mask-wearing",
      "relevant_topics": [
        "infection_prevention",
        "medical_centers",
        "environmental_exposures"
      ],
      "topic_count": 3,
      "tagged_date": "2025-11-16T03:20:09.000000",
      "original_post_date": "Posted 04-15-2022 11:30 AM",
      "original_post_date_iso": "2022-04-15T00:00:00",
      "latest_post_date": "Posted 02-18-2025 01:04 PM",
      "latest_post_date_iso": "2025-02-18T00:00:00",
      "post_count": 23,
      "user_count": 11
    },
    "reflux-raft": {
      "thread_file": "reflux-raft_Reflux-Raft.md",
      "thread_title": "Reflux Raft",
      "thread_url": "https://connect.ntminfo.org/discussion/reflux-raft",
      "relevant_topics": [
        "digestive_issues"
      ],
      "topic_count": 1,
      "tagged_date": "2025-11-16T03:20:10.000000",
      "original_post_date": "Posted 04-06-2025 10:33 PM",
      "original_post_date_iso": "2025-04-06T00:00:00",
      "latest_post_date": "Posted 04-07-2025 09:28 AM",
      "latest_post_date_iso": "2025-04-07T00:00:00",
      "post_count": 2,
      "user_count": 1
    },
    "register-for-our-february-27th-webinar-updates-from-european-bronchiectasis-workshop-forum": {
      "thread_file": "register-for-our-february-27th-webinar-updates-from-european-bronchiectasis-workshop-forum_Register-For-Our-February-27th-Webinar-U.md",
      "thread_title": "Register For Our February 27th Webinar: Updates from European Bronchiectasis Workshop & Forum",
      "thread_url": "https://connect.ntminfo.org/discussion/register-for-our-february-27th-webinar-updates-from-european-bronchiectasis-workshop-forum",
      "relevant_topics": [
        "research_trials"
      ],
      "topic_count": 1,
      "tagged_date": "2025-11-16T03:21:01.000000",
      "original_post_date": "Posted 02-25-2025 01:32 PM",
      "original_post_date_iso": "2025-02-25T00:00:00",
      "latest_post_date": "Posted 02-25-2025 01:32 PM",
      "latest_post_date_iso": "2025-02-25T00:00:00",
      "post_count": 1,
      "user_count": 1
    },
    "register-to-attend-the-patient-conference-virtually-registration-closes-may-12": {
      "thread_file": "register-to-attend-the-patient-conference-virtually-registration-closes-may-12_Register-to-attend-the-Patient-Conferenc.md",
      "thread_title": "Register to attend the Patient Conference Virtually! Registration closes May 12.",
      "thread_url": "https://connect.ntminfo.org/discussion/register-to-attend-the-patient-conference-virtually-registration-closes-may-12",
      "relevant_topics": [
        "research_trials"
      ],
      "topic_count": 1,
      "tagged_date": "2025-11-16T03:21:02.000000",
      "original_post_date": "Posted 04-28-2025 12:06 PM",
      "original_post_date_iso": "2025-04-28T00:00:00",
      "latest_post_date": "Posted 04-28-2025 12:06 PM",
      "latest_post_date_iso": "2025-04-28T00:00:00",
      "post_count": 1,
      "user_count": 0
    },
    "registration-is-now-open": {
      "thread_file": "registration-is-now-open_Registration-is-now-open.md",
      "thread_title": "Registration is now open!",
      "thread_url": "https://connect.ntminfo.org/discussion/registration-is-now-open",
      "relevant_topics": [
        "research_trials"
      ],
      "topic_count": 1,
      "tagged_date": "2025-11-16T03:21:03.000000",
      "original_post_date": "Posted 02-04-2025 06:15 PM",
      "original_post_date_iso": "2025-02-04T00:00:00",
      "latest_post_date": "Posted 02-04-2025 06:15 PM",
      "latest_post_date_iso": "2025-02-04T00:00:00",
      "post_count": 1,
      "user_count": 1
    },
    "registration-now-open-njh-ntm-bronchiectasis-conference": {
      "thread_file": "registration-now-open-njh-ntm-bronchiectasis-conference_REGISTRATION-NOW-OPEN-NJH-NTM-Bronchiect.md",
      "thread_title": "REGISTRATION NOW OPEN! NJH NTM & Bronchiectasis Conference",
      "thread_url": "https://connect.ntminfo.org/discussion/registration-now-open-njh-ntm-bronchiectasis-conference",
      "relevant_topics": [
        "research_trials"
      ],
      "topic_count": 1,
      "tagged_date": "2025-11-16T03:21:04.000000",
      "original_post_date": "Posted 06-25-2025 04:26 PM",
      "original_post_date_iso": "2025-06-25T00:00:00",
      "latest_post_date": "Posted 07-01-2025 03:09 AM",
      "latest_post_date_iso": "2025-07-01T00:00:00",
      "post_count": 7,
      "user_count": 5
    },
    "registration-now-open-webinar-on-the-potential-benefits-of-mindful-breathing": {
      "thread_file": "registration-now-open-webinar-on-the-potential-benefits-of-mindful-breathing_Registration-Now-Open-Webinar-on-the-pot.md",
      "thread_title": "Registration Now Open! Webinar on the potential benefits of mindful breathing",
      "thread_url": "https://connect.ntminfo.org/discussion/registration-now-open-webinar-on-the-potential-benefits-of-mindful-breathing",
      "relevant_topics": [
        "alternative_therapies"
      ],
      "topic_count": 1,
      "tagged_date": "2025-11-16T03:21:05.000000",
      "original_post_date": "Posted 07-23-2025 05:55 PMEdited by Helga Rosado 08-05-2025 12:22 PM",
      "original_post_date_iso": "2025-07-23T00:00:00",
      "latest_post_date": "Posted 07-23-2025 05:55 PMEdited by Helga Rosado 08-05-2025 12:22 PM",
      "latest_post_date_iso": "2025-07-23T00:00:00",
      "post_count": 1,
      "user_count": 1
    },
    "reme-halo-air-purification-system": {
      "thread_file": "reme-halo-air-purification-system_REME-Halo-air-purification-System.md",
      "thread_title": "REME-Halo air purification System",
      "thread_url": "https://connect.ntminfo.org/discussion/reme-halo-air-purification-system",
      "relevant_topics": [
        "environmental_exposures",
        "infection_prevention"
      ],
      "topic_count": 2,
      "tagged_date": "2025-11-16T03:21:06.000000",
      "original_post_date": "Posted 09-07-2025 01:19 PM",
      "original_post_date_iso": "2025-09-07T00:00:00",
      "latest_post_date": "Posted 09-08-2025 09:21 AM",
      "latest_post_date_iso": "2025-09-08T00:00:00",
      "post_count": 3,
      "user_count": 3
    },
    "reminder-next-australia-ntm-support-group-is-next-week": {
      "thread_file": "reminder-next-australia-ntm-support-group-is-next-week_Reminder-Next-Australia-NTM-Support-Grou.md",
      "thread_title": "Reminder: Next Australia NTM Support Group is next week!",
      "thread_url": "https://connect.ntminfo.org/discussion/reminder-next-australia-ntm-support-group-is-next-week",
      "relevant_topics": [
        "emotional_support"
      ],
      "topic_count": 1,
      "tagged_date": "2025-11-16T03:21:07.000000",
      "original_post_date": "Posted 06-20-2025 11:49 AM",
      "original_post_date_iso": "2025-06-20T00:00:00",
      "latest_post_date": "Posted 06-20-2025 11:49 AM",
      "latest_post_date_iso": "2025-06-20T00:00:00",
      "post_count": 1,
      "user_count": 1
    },
    "reminder-register-for-the-world-ntm-awareness-day-webinar": {
      "thread_file": "reminder-register-for-the-world-ntm-awareness-day-webinar_Reminder-Register-for-the-World-NTM-Awar.md",
      "thread_title": "Reminder: Register for the World NTM Awareness Day Webinar!",
      "thread_url": "https://connect.ntminfo.org/discussion/reminder-register-for-the-world-ntm-awareness-day-webinar",
      "relevant_topics": [
        "research_trials"
      ],
      "topic_count": 1,
      "tagged_date": "2025-11-16T03:21:08.000000",
      "original_post_date": "Posted 08-07-2025 06:16 PMEdited by Bekah Weidner 08-07-2025 06:16 PM",
      "original_post_date_iso": "2025-08-07T00:00:00",
      "latest_post_date": "Posted 08-07-2025 06:16 PMEdited by Bekah Weidner 08-07-2025 06:16 PM",
      "latest_post_date_iso": "2025-08-07T00:00:00",
      "post_count": 1,
      "user_count": 1
    },
    "reminder-the-kailua-kona-support-group-meeting-is-on-august-27-at-5pm-hst": {
      "thread_file": "reminder-the-kailua-kona-support-group-meeting-is-on-august-27-at-5pm-hst_Reminder-The-Kailua-Kona-Support-Group-M.md",
      "thread_title": "Reminder: The Kailua-Kona Support Group Meeting is on August 27 at 5pm HST!",
      "thread_url": "https://connect.ntminfo.org/discussion/reminder-the-kailua-kona-support-group-meeting-is-on-august-27-at-5pm-hst",
      "relevant_topics": [
        "emotional_support"
      ],
      "topic_count": 1,
      "tagged_date": "2025-11-16T03:21:09.000000",
      "original_post_date": "Posted 08-25-2025 09:34 AM",
      "original_post_date_iso": "2025-08-25T00:00:00",
      "latest_post_date": "Posted 08-25-2025 09:34 AM",
      "latest_post_date_iso": "2025-08-25T00:00:00",
      "post_count": 1,
      "user_count": 0
    },
    "remove-calcium-deposits-from-arobika": {
      "thread_file": "remove-calcium-deposits-from-arobika_Remove-calcium-deposits-from-Arobika.md",
      "thread_title": "Remove calcium deposits from Arobika",
      "thread_url": "https://connect.ntminfo.org/discussion/remove-calcium-deposits-from-arobika",
      "relevant_topics": [
        "equipment_sterilization"
      ],
      "topic_count": 1,
      "tagged_date": "2025-11-16T03:21:10.000000",
      "original_post_date": "Posted 12-18-2024 11:26 AM",
      "original_post_date_iso": "2024-12-18T00:00:00",
      "latest_post_date": "Posted 12-19-2024 09:56 AM",
      "latest_post_date_iso": "2024-12-19T00:00:00",
      "post_count": 3,
      "user_count": 2
    },
    "reply-to-sender-catherine-squeo": {
      "thread_file": "reply-to-sender-catherine-squeo_Reply-to-sender-Catherine-Squeo.md",
      "thread_title": "Reply to sender, Catherine Squeo",
      "thread_url": "https://connect.ntminfo.org/discussion/reply-to-sender-catherine-squeo",
      "relevant_topics": [
        "insurance_costs"
      ],
      "topic_count": 1,
      "tagged_date": "2025-11-16T03:22:01.000000",
      "original_post_date": "Posted 02-12-2025 03:16 PM",
      "original_post_date_iso": "2025-02-12T00:00:00",
      "latest_post_date": "Posted 02-12-2025 03:16 PM",
      "latest_post_date_iso": "2025-02-12T00:00:00",
      "post_count": 1,
      "user_count": 1
    },
    "result-of-gaining-weight": {
      "thread_file": "result-of-gaining-weight_RESULT-OF-GAINING-WEIGHT.md",
      "thread_title": "RESULT OF GAINING WEIGHT",
      "thread_url": "https://connect.ntminfo.org/discussion/result-of-gaining-weight",
      "relevant_topics": [
        "nutrition_lifestyle",
        "other_complications"
      ],
      "topic_count": 2,
      "tagged_date": "2025-11-16T03:22:02.000000",
      "original_post_date": "Posted 09-27-2025 10:45 AM",
      "original_post_date_iso": "2025-09-27T00:00:00",
      "latest_post_date": "Posted 30 days ago",
      "latest_post_date_iso": "2025-10-15T21:31:13.885493",
      "post_count": 17,
      "user_count": 10
    },
    "rhine-river-cruise": {
      "thread_file": "rhine-river-cruise_Rhine-river-cruise.md",
      "thread_title": "Rhine river cruise",
      "thread_url": "https://connect.ntminfo.org/discussion/rhine-river-cruise",
      "relevant_topics": [
        "travel_equipment",
        "infection_prevention"
      ],
      "topic_count": 2,
      "tagged_date": "2025-11-16T03:22:03.000000",
      "original_post_date": "Posted 05-21-2025 09:53 PM",
      "original_post_date_iso": "2025-05-21T00:00:00",
      "latest_post_date": "Posted 05-26-2025 09:25 AM",
      "latest_post_date_iso": "2025-05-26T00:00:00",
      "post_count": 2,
      "user_count": 1
    },
    "rhine-river-cruise-1": {
      "thread_file": "rhine-river-cruise-1_Rhine-river-cruise.md",
      "thread_title": "Rhine river cruise",
      "thread_url": "https://connect.ntminfo.org/discussion/rhine-river-cruise-1",
      "relevant_topics": [
        "travel_equipment",
        "medical_centers"
      ],
      "topic_count": 2,
      "tagged_date": "2025-11-16T03:22:04.000000",
      "original_post_date": "Posted 28 days ago",
      "original_post_date_iso": "2025-10-17T21:31:34.255147",
      "latest_post_date": "Posted 28 days ago",
      "latest_post_date_iso": "2025-10-17T21:31:34.255147",
      "post_count": 1,
      "user_count": 0
    },
    "rib-stress-fractureintercostal-muscle-strain": {
      "thread_file": "rib-stress-fractureintercostal-muscle-strain_Rib-Stress-FractureIntercostal-Muscle-St.md",
      "thread_title": "Rib Stress Fracture/Intercostal Muscle Strain",
      "thread_url": "https://connect.ntminfo.org/discussion/rib-stress-fractureintercostal-muscle-strain",
      "relevant_topics": [
        "other_complications",
        "manual_techniques"
      ],
      "topic_count": 2,
      "tagged_date": "2025-11-16T03:22:05.000000",
      "original_post_date": "Posted 10-17-2024 12:22 PM",
      "original_post_date_iso": "2024-10-17T00:00:00",
      "latest_post_date": "Posted 10-24-2024 10:08 AM",
      "latest_post_date_iso": "2024-10-24T00:00:00",
      "post_count": 8,
      "user_count": 6
    },
    "risks-on-cruises": {
      "thread_file": "risks-on-cruises_Risks-on-cruises.md",
      "thread_title": "Risks on cruises",
      "thread_url": "https://connect.ntminfo.org/discussion/risks-on-cruises",
      "relevant_topics": [
        "travel_equipment",
        "infection_prevention"
      ],
      "topic_count": 2,
      "tagged_date": "2025-11-16T03:22:06.000000",
      "original_post_date": "Posted 2 days ago",
      "original_post_date_iso": "2025-11-12T21:31:34.199228",
      "latest_post_date": "Posted yesterdayEdited by DEIDRE HUGHES yesterday",
      "latest_post_date_iso": "2025-11-13T21:31:34.199228",
      "post_count": 3,
      "user_count": 3
    },
    "rochester-mayo-clinic-doctor": {
      "thread_file": "rochester-mayo-clinic-doctor_Rochester-Mayo-Clinic-doctor.md",
      "thread_title": "Rochester Mayo Clinic doctor",
      "thread_url": "https://connect.ntminfo.org/discussion/rochester-mayo-clinic-doctor",
      "relevant_topics": [
        "insurance_costs"
      ],
      "topic_count": 1,
      "tagged_date": "2025-11-16T03:22:07.000000",
      "original_post_date": "Posted 12-27-2022 11:13 AM",
      "original_post_date_iso": "2022-12-27T00:00:00",
      "latest_post_date": "Posted 01-07-2025 11:48 PM",
      "latest_post_date_iso": "2025-01-07T00:00:00",
      "post_count": 16,
      "user_count": 9
    },
    "rsv-vaccine-1": {
      "thread_file": "rsv-vaccine-1_RSV-vaccine.md",
      "thread_title": "RSV vaccine",
      "thread_url": "https://connect.ntminfo.org/discussion/rsv-vaccine-1",
      "relevant_topics": [
        "alternative_therapies",
        "insurance_costs"
      ],
      "topic_count": 2,
      "tagged_date": "2025-11-16T03:22:08.000000",
      "original_post_date": "Posted 10-28-2023 02:42 PM",
      "original_post_date_iso": "2023-10-28T00:00:00",
      "latest_post_date": "Posted 10-05-2025 12:03 PM",
      "latest_post_date_iso": "2025-10-05T00:00:00",
      "post_count": 29,
      "user_count": 17
    },
    "rsv-vaccine-with-rheumatoid-arthritis": {
      "thread_file": "rsv-vaccine-with-rheumatoid-arthritis_RSV-vaccine-with-rheumatoid-arthritis.md",
      "thread_title": "RSV vaccine with rheumatoid arthritis",
      "thread_url": "https://connect.ntminfo.org/discussion/rsv-vaccine-with-rheumatoid-arthritis",
      "relevant_topics": [
        "alternative_therapies",
        "other_complications"
      ],
      "topic_count": 2,
      "tagged_date": "2025-11-16T03:22:09.000000",
      "original_post_date": "Posted 09-24-2025 11:01 AM",
      "original_post_date_iso": "2025-09-24T00:00:00",
      "latest_post_date": "Posted 09-28-2025 09:23 AM",
      "latest_post_date_iso": "2025-09-28T00:00:00",
      "post_count": 7,
      "user_count": 4
    },
    "saccharomyces-boulardii-and-fungal-infections": {
      "thread_file": "saccharomyces-boulardii-and-fungal-infections_Saccharomyces-boulardii-and-fungal-infec.md",
      "thread_title": "Saccharomyces boulardii and fungal infections",
      "thread_url": "https://connect.ntminfo.org/discussion/saccharomyces-boulardii-and-fungal-infections",
      "relevant_topics": [
        "alternative_therapies",
        "coinfections"
      ],
      "topic_count": 2,
      "tagged_date": "2025-11-16T03:22:10.000000",
      "original_post_date": "Posted 08-29-2025 05:47 PM",
      "original_post_date_iso": "2025-08-29T00:00:00",
      "latest_post_date": "Posted 09-10-2025 03:33 PM",
      "latest_post_date_iso": "2025-09-10T00:00:00",
      "post_count": 4,
      "user_count": 1
    },
    "salt-water-swimming-pools-salt-water-hot-tubsdr-falkinham-please": {
      "thread_file": "salt-water-swimming-pools-salt-water-hot-tubsdr-falkinham-please_Salt-water-swimming-pools-salt-water-hot.md",
      "thread_title": "Salt water swimming pools & salt water hot-tubs:Dr Falkinham please!",
      "thread_url": "https://connect.ntminfo.org/discussion/salt-water-swimming-pools-salt-water-hot-tubsdr-falkinham-please",
      "relevant_topics": [
        "medical_centers",
        "equipment_sterilization",
        "environmental_exposures"
      ],
      "topic_count": 3,
      "tagged_date": "2025-11-16T03:34:16.000000",
      "original_post_date": "Posted 02-21-2025 11:36 AM",
      "original_post_date_iso": "2025-02-21T00:00:00",
      "latest_post_date": "Posted 02-22-2025 09:05 AM",
      "latest_post_date_iso": "2025-02-22T00:00:00",
      "post_count": 2,
      "user_count": 2
    },
    "salty-taste-in-mouth": {
      "thread_file": "salty-taste-in-mouth_Salty-Taste-in-Mouth.md",
      "thread_title": "Salty Taste in Mouth",
      "thread_url": "https://connect.ntminfo.org/discussion/salty-taste-in-mouth",
      "relevant_topics": [
        "medication_side_effects",
        "patient_stories",
        "digestive_issues",
        "other_complications"
      ],
      "topic_count": 4,
      "tagged_date": "2025-11-16T03:34:17.000000",
      "original_post_date": "Posted 03-19-2025 11:25 AM",
      "original_post_date_iso": "2025-03-19T00:00:00",
      "latest_post_date": "Posted 05-05-2025 02:27 PM",
      "latest_post_date_iso": "2025-05-05T00:00:00",
      "post_count": 7,
      "user_count": 4
    },
    "sanitizing-nebulizer-cups": {
      "thread_file": "sanitizing-nebulizer-cups_Sanitizing-nebulizer-cups.md",
      "thread_title": "Sanitizing nebulizer cups",
      "thread_url": "https://connect.ntminfo.org/discussion/sanitizing-nebulizer-cups",
      "relevant_topics": [
        "equipment_sterilization"
      ],
      "topic_count": 1,
      "tagged_date": "2025-11-16T03:34:18.000000",
      "original_post_date": "Posted 04-16-2025 11:05 AM",
      "original_post_date_iso": "2025-04-16T00:00:00",
      "latest_post_date": "Posted 04-18-2025 07:33 PM",
      "latest_post_date_iso": "2025-04-18T00:00:00",
      "post_count": 2,
      "user_count": 2
    },
    "sciencedirect-1-may-2025-modelling-exposure-to-aerosols-from-showers-dr-falkinham-please-comment": {
      "thread_file": "sciencedirect-1-may-2025-modelling-exposure-to-aerosols-from-showers-dr-falkinham-please-comment_ScienceDirect-1-May-2025-Modelling-expos.md",
      "thread_title": "ScienceDirect 1 May 2025 Modelling exposure to aerosols from showers: Dr. Falkinham please comment",
      "thread_url": "https://connect.ntminfo.org/discussion/sciencedirect-1-may-2025-modelling-exposure-to-aerosols-from-showers-dr-falkinham-please-comment",
      "relevant_topics": [
        "medical_centers",
        "equipment_sterilization",
        "environmental_exposures",
        "research_trials"
      ],
      "topic_count": 4,
      "tagged_date": "2025-11-16T03:34:19.000000",
      "original_post_date": "Posted 08-21-2025 06:10 PM",
      "original_post_date_iso": "2025-08-21T00:00:00",
      "latest_post_date": "Posted 08-27-2025 05:07 AM",
      "latest_post_date_iso": "2025-08-27T00:00:00",
      "post_count": 16,
      "user_count": 4
    },
    "seeking-experiences-with-iv-ertapenem-antibiotic": {
      "thread_file": "seeking-experiences-with-iv-ertapenem-antibiotic_Seeking-Experiences-with-IV-Ertapenem-An.md",
      "thread_title": "Seeking Experiences with IV Ertapenem Antibiotic",
      "thread_url": "https://connect.ntminfo.org/discussion/seeking-experiences-with-iv-ertapenem-antibiotic",
      "relevant_topics": [
        "patient_stories",
        "big3_antibiotics"
      ],
      "topic_count": 2,
      "tagged_date": "2025-11-16T03:34:20.000000",
      "original_post_date": "Posted 09-12-2025 11:58 AM",
      "original_post_date_iso": "2025-09-12T00:00:00",
      "latest_post_date": "Posted 09-12-2025 11:58 AM",
      "latest_post_date_iso": "2025-09-12T00:00:00",
      "post_count": 1,
      "user_count": 1
    },
    "seeking-water-heater-update-from-someone-who-attended-nym-conference-in-ca-this-week": {
      "thread_file": "seeking-water-heater-update-from-someone-who-attended-nym-conference-in-ca-this-week_Seeking-water-heater-update-from-someone.md",
      "thread_title": "Seeking water heater update from someone who attended NTM conference in CA this week",
      "thread_url": "https://connect.ntminfo.org/discussion/seeking-water-heater-update-from-someone-who-attended-nym-conference-in-ca-this-week",
      "relevant_topics": [
        "medical_centers",
        "equipment_sterilization",
        "research_trials",
        "infection_prevention"
      ],
      "topic_count": 4,
      "tagged_date": "2025-11-16T03:34:21.000000",
      "original_post_date": "Posted 05-17-2025 09:26 AM",
      "original_post_date_iso": "2025-05-17T00:00:00",
      "latest_post_date": "Posted 05-30-2025 12:32 AM",
      "latest_post_date_iso": "2025-05-30T00:00:00",
      "post_count": 35,
      "user_count": 12
    },
    "share-your-bronchiectasis-story": {
      "thread_file": "share-your-bronchiectasis-story_SHARE-YOUR-BRONCHIECTASIS-STORY.md",
      "thread_title": "SHARE YOUR BRONCHIECTASIS STORY",
      "thread_url": "https://connect.ntminfo.org/discussion/share-your-bronchiectasis-story",
      "relevant_topics": [
        "research_trials",
        "emotional_support"
      ],
      "topic_count": 2,
      "tagged_date": "2025-11-16T03:34:22.000000",
      "original_post_date": "Posted 03-20-2025 04:00 PM",
      "original_post_date_iso": "2025-03-20T00:00:00",
      "latest_post_date": "Posted 03-21-2025 12:50 PM",
      "latest_post_date_iso": "2025-03-21T00:00:00",
      "post_count": 2,
      "user_count": 2
    },
    "share-your-experiences-with-bronchiectasis": {
      "thread_file": "share-your-experiences-with-bronchiectasis_Share-Your-Experiences-With-Bronchiectas.md",
      "thread_title": "Share Your Experiences With Bronchiectasis",
      "thread_url": "https://connect.ntminfo.org/discussion/share-your-experiences-with-bronchiectasis",
      "relevant_topics": [
        "research_trials"
      ],
      "topic_count": 1,
      "tagged_date": "2025-11-16T03:34:23.000000",
      "original_post_date": "Posted 12-09-2024 06:12 PM",
      "original_post_date_iso": "2024-12-09T00:00:00",
      "latest_post_date": "Posted 12-09-2024 06:12 PM",
      "latest_post_date_iso": "2024-12-09T00:00:00",
      "post_count": 1,
      "user_count": 1
    },
    "share-your-experiences-with-mac-lung-disease": {
      "thread_file": "share-your-experiences-with-mac-lung-disease_Share-Your-Experiences-With-MAC-Lung-Dis.md",
      "thread_title": "Share Your Experiences With MAC Lung Disease",
      "thread_url": "https://connect.ntminfo.org/discussion/share-your-experiences-with-mac-lung-disease",
      "relevant_topics": [
        "research_trials"
      ],
      "topic_count": 1,
      "tagged_date": "2025-11-16T03:34:24.000000",
      "original_post_date": "Posted 10-01-2025 12:46 PMEdited by Helga Rosado 16 days ago",
      "original_post_date_iso": "2025-10-01T00:00:00",
      "latest_post_date": "Posted 10-03-2025 11:53 AM",
      "latest_post_date_iso": "2025-10-03T00:00:00",
      "post_count": 4,
      "user_count": 1
    },
    "sharing-thoughts-of-my-local-pulmonologist": {
      "thread_file": "sharing-thoughts-of-my-local-pulmonologist_SHARING-THOUGHTS-OF-MY-LOCAL-PULMONOLOGI.md",
      "thread_title": "SHARING THOUGHTS OF MY LOCAL PULMONOLOGIST",
      "thread_url": "https://connect.ntminfo.org/discussion/sharing-thoughts-of-my-local-pulmonologist",
      "relevant_topics": [
        "patient_stories",
        "medical_centers",
        "emotional_support"
      ],
      "topic_count": 3,
      "tagged_date": "2025-11-16T03:34:25.000000",
      "original_post_date": "Posted 3 days ago",
      "original_post_date_iso": "2025-11-11T21:31:41.845234",
      "latest_post_date": "Posted yesterday",
      "latest_post_date_iso": "2025-11-13T21:31:41.845234",
      "post_count": 26,
      "user_count": 15
    },
    "shortness-of-breath-1": {
      "thread_file": "shortness-of-breath-1_Shortness-of-breath.md",
      "thread_title": "Shortness of breath",
      "thread_url": "https://connect.ntminfo.org/discussion/shortness-of-breath-1",
      "relevant_topics": [
        "other_complications"
      ],
      "topic_count": 1,
      "tagged_date": "2025-11-16T03:34:26.000000",
      "original_post_date": "Posted 10-26-2024 11:40 AM",
      "original_post_date_iso": "2024-10-26T00:00:00",
      "latest_post_date": "Posted 10-26-2024 11:40 AM",
      "latest_post_date_iso": "2024-10-26T00:00:00",
      "post_count": 1,
      "user_count": 1
    },
    "shortness-of-breath-after-travel-to-high-altitude": {
      "thread_file": "shortness-of-breath-after-travel-to-high-altitude_shortness-of-breath-after-travel-to-high.md",
      "thread_title": "shortness of breath after travel to high altitude",
      "thread_url": "https://connect.ntminfo.org/discussion/shortness-of-breath-after-travel-to-high-altitude",
      "relevant_topics": [
        "travel_safety",
        "other_complications",
        "sputum_cultures"
      ],
      "topic_count": 3,
      "tagged_date": "2025-11-16T03:34:27.000000",
      "original_post_date": "Posted 02-27-2025 09:45 AM",
      "original_post_date_iso": "2025-02-27T00:00:00",
      "latest_post_date": "Posted 03-03-2025 12:18 PM",
      "latest_post_date_iso": "2025-03-03T00:00:00",
      "post_count": 9,
      "user_count": 6
    },
    "should-i-avoid-hot-tubs-with-ntm-bronchiectasis": {
      "thread_file": "should-i-avoid-hot-tubs-with-ntm-bronchiectasis_Should-I-avoid-hot-tubs-with-NTM-bronchi.md",
      "thread_title": "Should I avoid hot tubs with NTM & bronchiectasis?",
      "thread_url": "https://connect.ntminfo.org/discussion/should-i-avoid-hot-tubs-with-ntm-bronchiectasis",
      "relevant_topics": [
        "medical_centers",
        "environmental_exposures",
        "infection_prevention"
      ],
      "topic_count": 3,
      "tagged_date": "2025-11-16T03:34:28.000000",
      "original_post_date": "Posted 09-28-2025 01:08 PMEdited by Kalyn Gabriel 09-29-2025 07:28 AM",
      "original_post_date_iso": "2025-09-28T00:00:00",
      "latest_post_date": "Posted 09-30-2025 09:40 AM",
      "latest_post_date_iso": "2025-09-30T00:00:00",
      "post_count": 10,
      "user_count": 3
    },
    "should-we-remove-carbon-filter-in-life-straw": {
      "thread_file": "should-we-remove-carbon-filter-in-life-straw_Should-we-remove-carbon-filters-from-Lif.md",
      "thread_title": "Should we remove carbon filters from Life Straw?",
      "thread_url": "https://connect.ntminfo.org/discussion/should-we-remove-carbon-filter-in-life-straw",
      "relevant_topics": [
        "medical_centers",
        "equipment_sterilization"
      ],
      "topic_count": 2,
      "tagged_date": "2025-11-16T03:34:29.000000",
      "original_post_date": "Posted 09-12-2022 12:54 PM",
      "original_post_date_iso": "2022-09-12T00:00:00",
      "latest_post_date": "Posted 04-01-2025 07:15 PM",
      "latest_post_date_iso": "2025-04-01T00:00:00",
      "post_count": 26,
      "user_count": 9
    },
    "shower": {
      "thread_file": "shower_Shower.md",
      "thread_title": "Shower",
      "thread_url": "https://connect.ntminfo.org/discussion/shower",
      "relevant_topics": [
        "water_safety",
        "equipment_sterilization",
        "medical_centers"
      ],
      "topic_count": 3,
      "tagged_date": "2025-11-16T03:28:04.000000",
      "original_post_date": "Posted 10-23-2024 07:39 PM",
      "original_post_date_iso": "2024-10-23T00:00:00",
      "latest_post_date": "Posted 10-25-2024 04:25 PM",
      "latest_post_date_iso": "2024-10-25T00:00:00",
      "post_count": 13,
      "user_count": 8
    },
    "shower-head-1": {
      "thread_file": "shower-head-1_Shower-head.md",
      "thread_title": "Shower head",
      "thread_url": "https://connect.ntminfo.org/discussion/shower-head-1",
      "relevant_topics": [
        "water_safety",
        "equipment_sterilization",
        "medical_centers",
        "equipment_maintenance"
      ],
      "topic_count": 4,
      "tagged_date": "2025-11-16T03:28:05.000000",
      "original_post_date": "Posted 05-13-2023 09:07 AM",
      "original_post_date_iso": "2023-05-13T00:00:00",
      "latest_post_date": "Posted 4 days ago",
      "latest_post_date_iso": "2025-11-10T21:31:50.492894",
      "post_count": 43,
      "user_count": 18
    },
    "shower-heads-etc": {
      "thread_file": "shower-heads-etc_Shower-heads-etc.md",
      "thread_title": "Shower heads etc",
      "thread_url": "https://connect.ntminfo.org/discussion/shower-heads-etc",
      "relevant_topics": [
        "water_safety",
        "equipment_maintenance",
        "patient_stories"
      ],
      "topic_count": 3,
      "tagged_date": "2025-11-16T03:28:06.000000",
      "original_post_date": "Posted 08-06-2025 05:16 PM",
      "original_post_date_iso": "2025-08-06T00:00:00",
      "latest_post_date": "Posted 08-08-2025 12:39 PM",
      "latest_post_date_iso": "2025-08-08T00:00:00",
      "post_count": 9,
      "user_count": 5
    },
    "shower-headsfilters": {
      "thread_file": "shower-headsfilters_Shower-HeadsFilters.md",
      "thread_title": "Shower Heads/Filters",
      "thread_url": "https://connect.ntminfo.org/discussion/shower-headsfilters",
      "relevant_topics": [
        "water_safety",
        "equipment_sterilization",
        "medical_centers",
        "equipment_maintenance",
        "nebulizers"
      ],
      "topic_count": 5,
      "tagged_date": "2025-11-16T03:28:07.000000",
      "original_post_date": "Posted 07-03-2024 07:42 PM",
      "original_post_date_iso": "2024-07-03T00:00:00",
      "latest_post_date": "Posted 02-17-2025 09:54 AM",
      "latest_post_date_iso": "2025-02-17T00:00:00",
      "post_count": 55,
      "user_count": 14
    },
    "shower-water-safety": {
      "thread_file": "shower-water-safety_Shower-Water-Safety.md",
      "thread_title": "Shower Water Safety",
      "thread_url": "https://connect.ntminfo.org/discussion/shower-water-safety",
      "relevant_topics": [
        "equipment_sterilization",
        "environmental_exposures"
      ],
      "topic_count": 2,
      "tagged_date": "2025-11-16T03:28:08.000000",
      "original_post_date": "Posted 06-11-2024 09:52 AM",
      "original_post_date_iso": "2024-06-11T00:00:00",
      "latest_post_date": "Posted 05-16-2025 11:57 AM",
      "latest_post_date_iso": "2025-05-16T00:00:00",
      "post_count": 6,
      "user_count": 4
    },
    "showers-vs-baths-for-doctor-falkinham": {
      "thread_file": "showers-vs-baths-for-doctor-falkinham_Showers-vs-Baths-for-Doctor-Falkinham.md",
      "thread_title": "Showers vs Baths for Doctor Falkinham",
      "thread_url": "https://connect.ntminfo.org/discussion/showers-vs-baths-for-doctor-falkinham",
      "relevant_topics": [
        "equipment_sterilization",
        "medical_centers"
      ],
      "topic_count": 2,
      "tagged_date": "2025-11-16T03:28:09.000000",
      "original_post_date": "Posted 08-26-2025 03:19 PM",
      "original_post_date_iso": "2025-08-26T00:00:00",
      "latest_post_date": "Posted 08-27-2025 10:20 AM",
      "latest_post_date_iso": "2025-08-27T00:00:00",
      "post_count": 3,
      "user_count": 3
    },
    "side-effect-of-antibiotics": {
      "thread_file": "side-effect-of-antibiotics_Side-effect-of-antibiotics.md",
      "thread_title": "Side effect of antibiotics",
      "thread_url": "https://connect.ntminfo.org/discussion/side-effect-of-antibiotics",
      "relevant_topics": [
        "medication_side_effects",
        "patient_stories"
      ],
      "topic_count": 2,
      "tagged_date": "2025-11-16T03:31:00.000000",
      "original_post_date": "Posted 08-26-2025 10:01 AM",
      "original_post_date_iso": "2025-08-26T00:00:00",
      "latest_post_date": "Posted 09-01-2025 10:03 AM",
      "latest_post_date_iso": "2025-09-01T00:00:00",
      "post_count": 16,
      "user_count": 7
    },
    "side-effects-of-tobi-podhaler": {
      "thread_file": "side-effects-of-tobi-podhaler_Side-effects-of-TOBI-Podhaler.md",
      "thread_title": "Side effects of TOBI Podhaler",
      "thread_url": "https://connect.ntminfo.org/discussion/side-effects-of-tobi-podhaler",
      "relevant_topics": [
        "medication_side_effects",
        "patient_stories",
        "treatment_monitoring"
      ],
      "topic_count": 3,
      "tagged_date": "2025-11-16T03:31:01.000000",
      "original_post_date": "Posted 08-28-2025 05:32 PM",
      "original_post_date_iso": "2025-08-28T00:00:00",
      "latest_post_date": "Posted 08-29-2025 09:25 AM",
      "latest_post_date_iso": "2025-08-29T00:00:00",
      "post_count": 4,
      "user_count": 3
    },
    "sign-up-now-for-828-talk-on-new-be-drug-brinsupri": {
      "thread_file": "sign-up-now-for-828-talk-on-new-be-drug-brinsupri_Sign-up-now-for-828-talk-on-NEW-BE-DRUG-.md",
      "thread_title": "Sign up now for 8/28 talk on NEW BE DRUG--BRINSUPRI!!",
      "thread_url": "https://connect.ntminfo.org/discussion/sign-up-now-for-828-talk-on-new-be-drug-brinsupri",
      "relevant_topics": [
        "research_trials"
      ],
      "topic_count": 1,
      "tagged_date": "2025-11-16T03:31:02.000000",
      "original_post_date": "Posted 08-25-2025 04:44 PM",
      "original_post_date_iso": "2025-08-25T00:00:00",
      "latest_post_date": "Posted 08-26-2025 09:47 AM",
      "latest_post_date_iso": "2025-08-26T00:00:00",
      "post_count": 4,
      "user_count": 1
    },
    "simplelabtap-score-can-dr-falkinham-evalute": {
      "thread_file": "simplelabtap-score-can-dr-falkinham-evalute_SimpleLabTap-Score-Can-Dr-Falkinham-eval.md",
      "thread_title": "SimpleLab/Tap Score - Can Dr. Falkinham evalute?",
      "thread_url": "https://connect.ntminfo.org/discussion/simplelabtap-score-can-dr-falkinham-evalute",
      "relevant_topics": [
        "equipment_sterilization",
        "medical_centers",
        "water_safety",
        "equipment_maintenance"
      ],
      "topic_count": 4,
      "tagged_date": "2025-11-16T03:31:03.000000",
      "original_post_date": "Posted 07-28-2025 09:03 PM",
      "original_post_date_iso": "2025-07-28T00:00:00",
      "latest_post_date": "Posted 08-29-2025 07:54 PM",
      "latest_post_date_iso": "2025-08-29T00:00:00",
      "post_count": 39,
      "user_count": 11
    },
    "singing-while-on-arikayce-therapy": {
      "thread_file": "singing-while-on-arikayce-therapy_Singing-While-on-Arikayce-Therapy.md",
      "thread_title": "Singing While on Arikayce Therapy",
      "thread_url": "https://connect.ntminfo.org/discussion/singing-while-on-arikayce-therapy",
      "relevant_topics": [
        "medication_side_effects",
        "emotional_support"
      ],
      "topic_count": 2,
      "tagged_date": "2025-11-16T03:31:04.000000",
      "original_post_date": "Posted 11-01-2024 02:33 PM",
      "original_post_date_iso": "2024-11-01T00:00:00",
      "latest_post_date": "Posted 11-03-2024 10:19 PM",
      "latest_post_date_iso": "2024-11-03T00:00:00",
      "post_count": 4,
      "user_count": 3
    },
    "skin-infection": {
      "thread_file": "skin-infection_Skin-infection.md",
      "thread_title": "Skin infection",
      "thread_url": "https://connect.ntminfo.org/discussion/skin-infection",
      "relevant_topics": [
        "medication_side_effects",
        "other_complications"
      ],
      "topic_count": 2,
      "tagged_date": "2025-11-16T03:31:05.000000",
      "original_post_date": "Posted 08-01-2025 01:47 PM",
      "original_post_date_iso": "2025-08-01T00:00:00",
      "latest_post_date": "Posted 08-04-2025 10:26 AM",
      "latest_post_date_iso": "2025-08-04T00:00:00",
      "post_count": 4,
      "user_count": 3
    },
    "skin-issues": {
      "thread_file": "skin-issues_Skin-Issues.md",
      "thread_title": "Skin Issues",
      "thread_url": "https://connect.ntminfo.org/discussion/skin-issues",
      "relevant_topics": [
        "medication_side_effects"
      ],
      "topic_count": 1,
      "tagged_date": "2025-11-16T03:31:06.000000",
      "original_post_date": "Posted 07-08-2025 05:56 PM",
      "original_post_date_iso": "2025-07-08T00:00:00",
      "latest_post_date": "Posted 07-13-2025 02:53 PM",
      "latest_post_date_iso": "2025-07-13T00:00:00",
      "post_count": 8,
      "user_count": 5
    },
    "sleep-apnea": {
      "thread_file": "sleep-apnea_Sleep-Apnea.md",
      "thread_title": "Sleep Apnea",
      "thread_url": "https://connect.ntminfo.org/discussion/sleep-apnea",
      "relevant_topics": [
        "other_complications",
        "equipment_sterilization"
      ],
      "topic_count": 2,
      "tagged_date": "2025-11-16T03:31:07.000000",
      "original_post_date": "Posted 04-20-2025 09:48 AM",
      "original_post_date_iso": "2025-04-20T00:00:00",
      "latest_post_date": "Posted 04-27-2025 09:26 AM",
      "latest_post_date_iso": "2025-04-27T00:00:00",
      "post_count": 12,
      "user_count": 8
    },
    "small-bathroom-dehumidifier": {
      "thread_file": "small-bathroom-dehumidifier_Small-Bathroom-Dehumidifier.md",
      "thread_title": "Small Bathroom Dehumidifier",
      "thread_url": "https://connect.ntminfo.org/discussion/small-bathroom-dehumidifier",
      "relevant_topics": [
        "environmental_exposures",
        "equipment_maintenance"
      ],
      "topic_count": 2,
      "tagged_date": "2025-11-16T03:31:08.000000",
      "original_post_date": "Posted 07-17-2025 11:00 PM",
      "original_post_date_iso": "2025-07-17T00:00:00",
      "latest_post_date": "Posted 07-19-2025 11:26 AM",
      "latest_post_date_iso": "2025-07-19T00:00:00",
      "post_count": 8,
      "user_count": 4
    },
    "small-portable-travel-fan-or-white-noise-sound-machine-for-travel": {
      "thread_file": "small-portable-travel-fan-or-white-noise-sound-machine-for-travel_Small-portable-travel-fan-or-white-noise.md",
      "thread_title": "Small portable travel fan or white noise sound machine for travel?",
      "thread_url": "https://connect.ntminfo.org/discussion/small-portable-travel-fan-or-white-noise-sound-machine-for-travel",
      "relevant_topics": [
        "travel_safety",
        "equipment_maintenance",
        "other_complications"
      ],
      "topic_count": 3,
      "tagged_date": "2025-11-16T03:31:09.000000",
      "original_post_date": "Posted 09-09-2025 09:31 AM",
      "original_post_date_iso": "2025-09-09T00:00:00",
      "latest_post_date": "Posted 09-11-2025 09:24 AM",
      "latest_post_date_iso": "2025-09-11T00:00:00",
      "post_count": 7,
      "user_count": 5
    },
    "smart-beds": {
      "thread_file": "smart-beds_Smart-beds.md",
      "thread_title": "Smart beds",
      "thread_url": "https://connect.ntminfo.org/discussion/smart-beds",
      "relevant_topics": [
        "emotional_support",
        "equipment_maintenance"
      ],
      "topic_count": 2,
      "tagged_date": "2025-11-16T03:34:00.000000",
      "original_post_date": "Posted 09-26-2024 02:21 PM",
      "original_post_date_iso": "2024-09-26T00:00:00",
      "latest_post_date": "Posted 09-26-2024 02:21 PM",
      "latest_post_date_iso": "2024-09-26T00:00:00",
      "post_count": 1,
      "user_count": 1
    },
    "soaking-equipment-with-dawn": {
      "thread_file": "soaking-equipment-with-dawn_Soaking-equipment-with-Dawn.md",
      "thread_title": "Soaking equipment with Dawn",
      "thread_url": "https://connect.ntminfo.org/discussion/soaking-equipment-with-dawn",
      "relevant_topics": [
        "nebulizers",
        "equipment_sterilization"
      ],
      "topic_count": 2,
      "tagged_date": "2025-11-16T03:34:01.000000",
      "original_post_date": "Posted 10-09-2024 11:53 AM",
      "original_post_date_iso": "2024-10-09T00:00:00",
      "latest_post_date": "Posted 10-11-2024 05:26 PM",
      "latest_post_date_iso": "2024-10-11T00:00:00",
      "post_count": 5,
      "user_count": 1
    },
    "soaking-men-cups-and-aerobika": {
      "thread_file": "soaking-men-cups-and-aerobika_Soaking-men-cups-and-Aerobika.md",
      "thread_title": "Soaking men cups and Aerobika",
      "thread_url": "https://connect.ntminfo.org/discussion/soaking-men-cups-and-aerobika",
      "relevant_topics": [
        "nebulizers",
        "equipment_sterilization",
        "medical_centers"
      ],
      "topic_count": 3,
      "tagged_date": "2025-11-16T03:34:02.000000",
      "original_post_date": "Posted 04-07-2023 04:55 PM",
      "original_post_date_iso": "2023-04-07T00:00:00",
      "latest_post_date": "Posted 03-12-2025 06:04 PMEdited by Samantha Lane 03-12-2025 06:24 PM",
      "latest_post_date_iso": "2025-03-12T00:00:00",
      "post_count": 32,
      "user_count": 12
    },
    "sodium-chloride-3-for-nebulizer-1": {
      "thread_file": "sodium-chloride-3-for-nebulizer-1_Sodium-Chloride-3-for-Nebulizer.md",
      "thread_title": "Sodium Chloride 3% for Nebulizer",
      "thread_url": "https://connect.ntminfo.org/discussion/sodium-chloride-3-for-nebulizer-1",
      "relevant_topics": [
        "saline_therapy",
        "treatment_monitoring"
      ],
      "topic_count": 2,
      "tagged_date": "2025-11-16T03:34:03.000000",
      "original_post_date": "Posted 04-25-2024 03:56 PM",
      "original_post_date_iso": "2024-04-25T00:00:00",
      "latest_post_date": "Posted 09-24-2025 12:34 PM",
      "latest_post_date_iso": "2025-09-24T00:00:00",
      "post_count": 8,
      "user_count": 7
    },
    "solid-and-groundglaaa-nodules-in-ct-measuring-up-to-6mm-adenocarcinoma-1": {
      "thread_file": "solid-and-groundglaaa-nodules-in-ct-measuring-up-to-6mm-adenocarcinoma-1_Solid-and-groundglaaa-nodules-in-CT-meas.md",
      "thread_title": "Solid and groundglaaa nodules in CT measuring up to 6mm, adenocarcinoma?",
      "thread_url": "https://connect.ntminfo.org/discussion/solid-and-groundglaaa-nodules-in-ct-measuring-up-to-6mm-adenocarcinoma-1",
      "relevant_topics": [
        "imaging_scans",
        "bronchoscopy"
      ],
      "topic_count": 2,
      "tagged_date": "2025-11-16T03:34:04.000000",
      "original_post_date": "Posted 09-18-2024 12:06 PM",
      "original_post_date_iso": "2024-09-18T00:00:00",
      "latest_post_date": "Posted 12-09-2024 10:42 AM",
      "latest_post_date_iso": "2024-12-09T00:00:00",
      "post_count": 2,
      "user_count": 1
    },
    "some-questions-i-have-about-treatment": {
      "thread_file": "some-questions-i-have-about-treatment_Some-Questions-I-have-about-Treatment.md",
      "thread_title": "Some Questions I have about Treatment",
      "thread_url": "https://connect.ntminfo.org/discussion/some-questions-i-have-about-treatment",
      "relevant_topics": [
        "medication_side_effects",
        "treatment_monitoring",
        "alternative_therapies",
        "patient_stories"
      ],
      "topic_count": 4,
      "tagged_date": "2025-11-16T03:34:05.000000",
      "original_post_date": "Posted 11-23-2024 04:18 PM",
      "original_post_date_iso": "2024-11-23T00:00:00",
      "latest_post_date": "Posted 11-26-2024 09:14 AM",
      "latest_post_date_iso": "2024-11-26T00:00:00",
      "post_count": 3,
      "user_count": 2
    },
    "sore-throat-from-airway-clearance": {
      "thread_file": "sore-throat-from-airway-clearance_Sore-Throat-from-Airway-Clearance.md",
      "thread_title": "Sore Throat from Airway Clearance",
      "thread_url": "https://connect.ntminfo.org/discussion/sore-throat-from-airway-clearance",
      "relevant_topics": [
        "manual_techniques",
        "medication_side_effects",
        "saline_therapy"
      ],
      "topic_count": 3,
      "tagged_date": "2025-11-16T03:34:06.000000",
      "original_post_date": "Posted 03-02-2025 09:10 AM",
      "original_post_date_iso": "2025-03-02T00:00:00",
      "latest_post_date": "Posted 06-14-2025 04:39 PM",
      "latest_post_date_iso": "2025-06-14T00:00:00",
      "post_count": 9,
      "user_count": 6
    },
    "southeastern-consortium-patient-and-family-webinar": {
      "thread_file": "southeastern-consortium-patient-and-family-webinar_Southeastern-Consortium-Patient-and-Fami.md",
      "thread_title": "Southeastern Consortium Patient and Family Webinar",
      "thread_url": "https://connect.ntminfo.org/discussion/southeastern-consortium-patient-and-family-webinar",
      "relevant_topics": [
        "medical_centers",
        "research_trials"
      ],
      "topic_count": 2,
      "tagged_date": "2025-11-16T03:34:07.000000",
      "original_post_date": "Posted 03-12-2025 11:00 AM",
      "original_post_date_iso": "2025-03-12T00:00:00",
      "latest_post_date": "Posted 03-17-2025 11:00 AM",
      "latest_post_date_iso": "2025-03-17T00:00:00",
      "post_count": 6,
      "user_count": 3
    },
    "southeastern-consortium-webinar-recording": {
      "thread_file": "southeastern-consortium-webinar-recording_Southeastern-Consortium-Webinar-Recordin.md",
      "thread_title": "Southeastern Consortium Webinar Recording",
      "thread_url": "https://connect.ntminfo.org/discussion/southeastern-consortium-webinar-recording",
      "relevant_topics": [
        "medical_centers",
        "research_trials"
      ],
      "topic_count": 2,
      "tagged_date": "2025-11-16T03:34:08.000000",
      "original_post_date": "Posted 03-24-2025 11:48 AM",
      "original_post_date_iso": "2025-03-24T00:00:00",
      "latest_post_date": "Posted 03-27-2025 10:21 PM",
      "latest_post_date_iso": "2025-03-27T00:00:00",
      "post_count": 2,
      "user_count": 1
    },
    "spanish-speaking-ntmbe-support-group-meeting-may-28": {
      "thread_file": "spanish-speaking-ntmbe-support-group-meeting-may-28_Spanish-Speaking-NTMBE-support-group-mee.md",
      "thread_title": "Spanish Speaking NTM/BE support group meeting - May 28",
      "thread_url": "https://connect.ntminfo.org/discussion/spanish-speaking-ntmbe-support-group-meeting-may-28",
      "relevant_topics": [
        "emotional_support",
        "research_trials"
      ],
      "topic_count": 2,
      "tagged_date": "2025-11-16T03:34:09.000000",
      "original_post_date": "Posted 05-16-2025 12:59 PM",
      "original_post_date_iso": "2025-05-16T00:00:00",
      "latest_post_date": "Posted 05-16-2025 12:59 PM",
      "latest_post_date_iso": "2025-05-16T00:00:00",
      "post_count": 1,
      "user_count": 1
    },
    "salt-caves-1": {
      "thread_file": "salt-caves-1_Salt-caves.md",
      "thread_title": "Salt caves",
      "thread_url": "https://connect.ntminfo.org/discussion/salt-caves-1",
      "relevant_topics": [
        "alternative_therapies",
        "medical_centers",
        "infection_prevention"
      ],
      "topic_count": 3,
      "tagged_date": "2025-11-16T03:34:13.000000",
      "original_post_date": "Posted 01-10-2025 12:27 PM",
      "original_post_date_iso": "2025-01-10T00:00:00",
      "latest_post_date": "Posted 01-22-2025 04:05 PM",
      "latest_post_date_iso": "2025-01-22T00:00:00",
      "post_count": 10,
      "user_count": 6
    },
    "salt-water": {
      "thread_file": "salt-water_Salt-water.md",
      "thread_title": "Salt water",
      "thread_url": "https://connect.ntminfo.org/discussion/salt-water",
      "relevant_topics": [
        "medical_centers",
        "equipment_sterilization"
      ],
      "topic_count": 2,
      "tagged_date": "2025-11-16T03:34:14.000000",
      "original_post_date": "Posted 06-11-2025 09:54 AM",
      "original_post_date_iso": "2025-06-11T00:00:00",
      "latest_post_date": "Posted 06-13-2025 03:35 AM",
      "latest_post_date_iso": "2025-06-13T00:00:00",
      "post_count": 4,
      "user_count": 2
    },
    "salt-water-pool": {
      "thread_file": "salt-water-pool_Salt-water-pool.md",
      "thread_title": "Salt water pool",
      "thread_url": "https://connect.ntminfo.org/discussion/salt-water-pool",
      "relevant_topics": [
        "equipment_sterilization",
        "environmental_exposures"
      ],
      "topic_count": 2,
      "tagged_date": "2025-11-16T03:34:15.000000",
      "original_post_date": "Posted 06-25-2023 08:14 AM",
      "original_post_date_iso": "2023-06-25T00:00:00",
      "latest_post_date": "Posted 10-10-2025 10:51 AM",
      "latest_post_date_iso": "2025-10-10T00:00:00",
      "post_count": 3,
      "user_count": 3
    },
    "stopping-antibiotics": {
      "thread_file": "stopping-antibiotics_Stopping-Antibiotics.md",
      "thread_title": "Stopping Antibiotics",
      "thread_url": "https://connect.ntminfo.org/discussion/stopping-antibiotics",
      "relevant_topics": [
        "medication_side_effects",
        "treatment_monitoring"
      ],
      "topic_count": 2,
      "tagged_date": "2025-11-16T03:45:01.000000",
      "original_post_date": "Posted 07-20-2024 01:03 PM",
      "original_post_date_iso": "2024-07-20T00:00:00",
      "latest_post_date": "Posted 12-03-2024 09:52 AM",
      "latest_post_date_iso": "2024-12-03T00:00:00",
      "post_count": 14,
      "user_count": 8
    },
    "success-launch-of-the-my-cough-is-not-contagious-button": {
      "thread_file": "success-launch-of-the-my-cough-is-not-contagious-button_Success-Launch-of-the-My-Cough-is-not-Co.md",
      "thread_title": "Success! Launch of the My Cough is not Contagious Button",
      "thread_url": "https://connect.ntminfo.org/discussion/success-launch-of-the-my-cough-is-not-contagious-button",
      "relevant_topics": [
        "research_trials"
      ],
      "topic_count": 1,
      "tagged_date": "2025-11-16T03:45:02.000000",
      "original_post_date": "Posted 08-19-2025 11:11 AM",
      "original_post_date_iso": "2025-08-19T00:00:00",
      "latest_post_date": "Posted 08-19-2025 11:11 AM",
      "latest_post_date_iso": "2025-08-19T00:00:00",
      "post_count": 1,
      "user_count": 0
    },
    "success-with-insurance-company-appeal": {
      "thread_file": "success-with-insurance-company-appeal_Success-with-Insurance-Company-Appeal.md",
      "thread_title": "Success with Insurance Company Appeal?",
      "thread_url": "https://connect.ntminfo.org/discussion/success-with-insurance-company-appeal",
      "relevant_topics": [
        "insurance_costs",
        "medical_centers"
      ],
      "topic_count": 2,
      "tagged_date": "2025-11-16T03:45:03.000000",
      "original_post_date": "Posted 07-14-2025 03:47 PM",
      "original_post_date_iso": "2025-07-14T00:00:00",
      "latest_post_date": "Posted 07-17-2025 09:31 AM",
      "latest_post_date_iso": "2025-07-17T00:00:00",
      "post_count": 11,
      "user_count": 8
    },
    "sugar-and-mac": {
      "thread_file": "sugar-and-mac_Sugar-and-Mac.md",
      "thread_title": "Sugar and Mac",
      "thread_url": "https://connect.ntminfo.org/discussion/sugar-and-mac",
      "relevant_topics": [
        "nutrition_lifestyle"
      ],
      "topic_count": 1,
      "tagged_date": "2025-11-16T03:45:04.000000",
      "original_post_date": "Posted 12-28-2024 04:43 PM",
      "original_post_date_iso": "2024-12-28T00:00:00",
      "latest_post_date": "Posted 12-30-2024 02:09 PM",
      "latest_post_date_iso": "2024-12-30T00:00:00",
      "post_count": 4,
      "user_count": 3
    },
    "suggestions-for-best-water-system-for-kitchen-sink-reducing-nanoplastics-and-ntm": {
      "thread_file": "suggestions-for-best-water-system-for-kitchen-sink-reducing-nanoplastics-and-ntm_Suggestions-for-best-water-system-for-ki.md",
      "thread_title": "Suggestions for best water system for kitchen sink -- reducing nanoplastics (and NTM)",
      "thread_url": "https://connect.ntminfo.org/discussion/suggestions-for-best-water-system-for-kitchen-sink-reducing-nanoplastics-and-ntm",
      "relevant_topics": [
        "equipment_sterilization"
      ],
      "topic_count": 1,
      "tagged_date": "2025-11-16T03:45:05.000000",
      "original_post_date": "Posted 04-17-2025 12:56 PM",
      "original_post_date_iso": "2025-04-17T00:00:00",
      "latest_post_date": "Posted 04-19-2025 12:26 AM",
      "latest_post_date_iso": "2025-04-19T00:00:00",
      "post_count": 9,
      "user_count": 5
    },
    "surgery-at-emory": {
      "thread_file": "surgery-at-emory_Surgery-at-Emory.md",
      "thread_title": "Surgery at Emory",
      "thread_url": "https://connect.ntminfo.org/discussion/surgery-at-emory",
      "relevant_topics": [
        "surgical_treatment",
        "treatment_monitoring",
        "medication_side_effects"
      ],
      "topic_count": 3,
      "tagged_date": "2025-11-16T03:45:06.000000",
      "original_post_date": "Posted 06-25-2025 05:14 PM",
      "original_post_date_iso": "2025-06-25T00:00:00",
      "latest_post_date": "Posted 06-25-2025 05:14 PM",
      "latest_post_date_iso": "2025-06-25T00:00:00",
      "post_count": 1,
      "user_count": 1
    },
    "surgery-concerns": {
      "thread_file": "surgery-concerns_Surgery-Concerns.md",
      "thread_title": "Surgery Concerns",
      "thread_url": "https://connect.ntminfo.org/discussion/surgery-concerns",
      "relevant_topics": [
        "surgical_treatment",
        "bronchoscopy"
      ],
      "topic_count": 2,
      "tagged_date": "2025-11-16T03:45:07.000000",
      "original_post_date": "Posted 04-23-2025 11:42 AM",
      "original_post_date_iso": "2025-04-23T00:00:00",
      "latest_post_date": "Posted 04-24-2025 09:10 AM",
      "latest_post_date_iso": "2025-04-24T00:00:00",
      "post_count": 3,
      "user_count": 2
    },
    "surgery-for-a-broncochele": {
      "thread_file": "surgery-for-a-broncochele_Surgery-for-a-broncochele.md",
      "thread_title": "Surgery for a broncochele",
      "thread_url": "https://connect.ntminfo.org/discussion/surgery-for-a-broncochele",
      "relevant_topics": [
        "surgical_treatment",
        "other_complications"
      ],
      "topic_count": 2,
      "tagged_date": "2025-11-16T03:45:08.000000",
      "original_post_date": "Posted 10-21-2024 05:02 PMEdited by Robert Frank Townsend 10-21-2024 05:03 PM",
      "original_post_date_iso": "2024-10-21T00:00:00",
      "latest_post_date": "Posted 10-21-2024 05:02 PMEdited by Robert Frank Townsend 10-21-2024 05:03 PM",
      "latest_post_date_iso": "2024-10-21T00:00:00",
      "post_count": 1,
      "user_count": 1
    },
    "surgery-for-cavity-removal": {
      "thread_file": "surgery-for-cavity-removal_Surgery-for-cavity-removal.md",
      "thread_title": "Surgery for cavity removal",
      "thread_url": "https://connect.ntminfo.org/discussion/surgery-for-cavity-removal",
      "relevant_topics": [
        "surgical_treatment",
        "patient_stories"
      ],
      "topic_count": 2,
      "tagged_date": "2025-11-16T03:45:09.000000",
      "original_post_date": "Posted 02-27-2024 02:56 PM",
      "original_post_date_iso": "2024-02-27T00:00:00",
      "latest_post_date": "Posted 12-20-2024 10:09 AM",
      "latest_post_date_iso": "2024-12-20T00:00:00",
      "post_count": 49,
      "user_count": 14
    },
    "surgery-to-remove-cavity": {
      "thread_file": "surgery-to-remove-cavity_Surgery-to-remove-cavity.md",
      "thread_title": "Surgery to remove cavity",
      "thread_url": "https://connect.ntminfo.org/discussion/surgery-to-remove-cavity",
      "relevant_topics": [
        "surgical_treatment",
        "treatment_monitoring",
        "patient_stories"
      ],
      "topic_count": 3,
      "tagged_date": "2025-11-16T03:45:10.000000",
      "original_post_date": "Posted 06-23-2024 04:27 PM",
      "original_post_date_iso": "2024-06-23T00:00:00",
      "latest_post_date": "Posted 12-30-2024 12:06 PMEdited by Helen Zhang 12-30-2024 12:20 PM",
      "latest_post_date_iso": "2024-12-30T00:00:00",
      "post_count": 11,
      "user_count": 8
    },
    "survey-opportunity-lab-collections": {
      "thread_file": "survey-opportunity-lab-collections_Survey-Opportunity-Lab-Collections.md",
      "thread_title": "Survey Opportunity - Lab Collections",
      "thread_url": "https://connect.ntminfo.org/discussion/survey-opportunity-lab-collections",
      "relevant_topics": [
        "research_trials"
      ],
      "topic_count": 1,
      "tagged_date": "2025-11-16T03:55:01.000000",
      "original_post_date": "Posted 02-12-2024 02:49 PM",
      "original_post_date_iso": "2024-02-12T00:00:00",
      "latest_post_date": "Posted 06-18-2025 12:43 AM",
      "latest_post_date_iso": "2025-06-18T00:00:00",
      "post_count": 5,
      "user_count": 5
    },
    "swimming": {
      "thread_file": "swimming_Swimming.md",
      "thread_title": "Swimming",
      "thread_url": "https://connect.ntminfo.org/discussion/swimming",
      "relevant_topics": [
        "environmental_exposures",
        "infection_prevention"
      ],
      "topic_count": 2,
      "tagged_date": "2025-11-16T03:55:02.000000",
      "original_post_date": "Posted 04-05-2025 12:44 AM",
      "original_post_date_iso": "2025-04-05T00:00:00",
      "latest_post_date": "Posted 04-05-2025 12:44 AM",
      "latest_post_date_iso": "2025-04-05T00:00:00",
      "post_count": 1,
      "user_count": 1
    },
    "swimming-hierarchy-from-dr-falkiman": {
      "thread_file": "swimming-hierarchy-from-dr-falkiman_Swimming-hierarchy-from-Dr-Falkiman.md",
      "thread_title": "Swimming hierarchy from Dr. Falkiman",
      "thread_url": "https://connect.ntminfo.org/discussion/swimming-hierarchy-from-dr-falkiman",
      "relevant_topics": [
        "medical_centers",
        "environmental_exposures"
      ],
      "topic_count": 2,
      "tagged_date": "2025-11-16T03:55:03.000000",
      "original_post_date": "Posted 02-18-2025 01:03 PM",
      "original_post_date_iso": "2025-02-18T00:00:00",
      "latest_post_date": "Posted 03-23-2025 11:24 AM",
      "latest_post_date_iso": "2025-03-23T00:00:00",
      "post_count": 5,
      "user_count": 4
    },
    "swimming-pools-snorkel-use-and-bromine-pools": {
      "thread_file": "swimming-pools-snorkel-use-and-bromine-pools_Swimming-Pools-Snorkel-Use-and-Bromine-P.md",
      "thread_title": "Swimming Pools / Snorkel Use and Bromine Pools",
      "thread_url": "https://connect.ntminfo.org/discussion/swimming-pools-snorkel-use-and-bromine-pools",
      "relevant_topics": [
        "medical_centers",
        "environmental_exposures",
        "equipment_sterilization"
      ],
      "topic_count": 3,
      "tagged_date": "2025-11-16T03:55:04.000000",
      "original_post_date": "Posted 05-29-2025 02:26 PM",
      "original_post_date_iso": "2025-05-29T00:00:00",
      "latest_post_date": "Posted 06-03-2025 11:55 AM",
      "latest_post_date_iso": "2025-06-03T00:00:00",
      "post_count": 8,
      "user_count": 3
    },
    "swimming-question-for-dr-falkinham": {
      "thread_file": "swimming-question-for-dr-falkinham_Swimming-question-for-Dr-Falkinham.md",
      "thread_title": "Swimming question for Dr Falkinham",
      "thread_url": "https://connect.ntminfo.org/discussion/swimming-question-for-dr-falkinham",
      "relevant_topics": [
        "medical_centers",
        "environmental_exposures"
      ],
      "topic_count": 2,
      "tagged_date": "2025-11-16T03:55:05.000000",
      "original_post_date": "Posted 06-02-2025 09:13 AM",
      "original_post_date_iso": "2025-06-02T00:00:00",
      "latest_post_date": "Posted 06-04-2025 09:08 AM",
      "latest_post_date_iso": "2025-06-04T00:00:00",
      "post_count": 5,
      "user_count": 3
    },
    "syaph-colonization": {
      "thread_file": "syaph-colonization_syaph-colonization.md",
      "thread_title": "syaph colonization?",
      "thread_url": "https://connect.ntminfo.org/discussion/syaph-colonization",
      "relevant_topics": [
        "other_complications"
      ],
      "topic_count": 1,
      "tagged_date": "2025-11-16T03:55:06.000000",
      "original_post_date": "Posted 04-29-2025 11:50 AM",
      "original_post_date_iso": "2025-04-29T00:00:00",
      "latest_post_date": "Posted 04-29-2025 11:50 AM",
      "latest_post_date_iso": "2025-04-29T00:00:00",
      "post_count": 1,
      "user_count": 1
    },
    "tankless-hot-water-systems": {
      "thread_file": "tankless-hot-water-systems_Tankless-Hot-Water-Systems.md",
      "thread_title": "Tankless Hot Water Systems",
      "thread_url": "https://connect.ntminfo.org/discussion/tankless-hot-water-systems",
      "relevant_topics": [
        "medical_centers",
        "equipment_sterilization"
      ],
      "topic_count": 2,
      "tagged_date": "2025-11-16T03:55:07.000000",
      "original_post_date": "Posted 05-25-2025 09:28 AM",
      "original_post_date_iso": "2025-05-25T00:00:00",
      "latest_post_date": "Posted 05-26-2025 07:14 PM",
      "latest_post_date_iso": "2025-05-26T00:00:00",
      "post_count": 3,
      "user_count": 2
    },
    "terrible-rash-across-my-chest-with-vest-use": {
      "thread_file": "terrible-rash-across-my-chest-with-vest-use_terrible-rash-across-my-chest-with-vest-.md",
      "thread_title": "terrible rash across my chest with vest use",
      "thread_url": "https://connect.ntminfo.org/discussion/terrible-rash-across-my-chest-with-vest-use",
      "relevant_topics": [
        "medication_side_effects",
        "manual_techniques",
        "vest_therapy"
      ],
      "topic_count": 3,
      "tagged_date": "2025-11-16T03:55:08.000000",
      "original_post_date": "Posted 04-13-2025 04:19 PM",
      "original_post_date_iso": "2025-04-13T00:00:00",
      "latest_post_date": "Posted 04-13-2025 04:19 PM",
      "latest_post_date_iso": "2025-04-13T00:00:00",
      "post_count": 1,
      "user_count": 1
    },
    "the-2nd-north-american-bronchiectasis-non-tuberculous-mycobacteria-ntm-conferences": {
      "thread_file": "the-2nd-north-american-bronchiectasis-non-tuberculous-mycobacteria-ntm-conferences_The-2nd-North-American-Bronchiectasis-No.md",
      "thread_title": "The 2nd North American Bronchiectasis & Non-tuberculous Mycobacteria (NTM) Conferences",
      "thread_url": "https://connect.ntminfo.org/discussion/the-2nd-north-american-bronchiectasis-non-tuberculous-mycobacteria-ntm-conferences",
      "relevant_topics": [
        "research_trials"
      ],
      "topic_count": 1,
      "tagged_date": "2025-11-16T03:55:09.000000",
      "original_post_date": "Posted 24 days ago",
      "original_post_date_iso": "2025-10-21T21:30:45.546404",
      "latest_post_date": "Posted 24 days ago",
      "latest_post_date_iso": "2025-10-21T21:30:45.546404",
      "post_count": 1,
      "user_count": 1
    },
    "the-8th-world-bronchiectasis-conferences-consumer-program-free": {
      "thread_file": "the-8th-world-bronchiectasis-conferences-consumer-program-free_The-8th-World-Bronchiectasis-Conferences.md",
      "thread_title": "The 8th World Bronchiectasis Conference's Consumer Program! FREE!!",
      "thread_url": "https://connect.ntminfo.org/discussion/the-8th-world-bronchiectasis-conferences-consumer-program-free",
      "relevant_topics": [
        "research_trials",
        "medical_centers"
      ],
      "topic_count": 2,
      "tagged_date": "2025-11-16T03:55:10.000000",
      "original_post_date": "Posted 06-09-2025 09:51 AMEdited by Patricia Kemp 07-13-2025 08:37 AM",
      "original_post_date_iso": "2025-06-09T00:00:00",
      "latest_post_date": "Posted 06-09-2025 09:51 AMEdited by Patricia Kemp 07-13-2025 08:37 AM",
      "latest_post_date_iso": "2025-06-09T00:00:00",
      "post_count": 1,
      "user_count": 1
    },
    "the-big-3-antibiotics": {
      "thread_file": "the-big-3-antibiotics_The-big-3-antibiotics.md",
      "thread_title": "The big 3 antibiotics",
      "thread_url": "https://connect.ntminfo.org/discussion/the-big-3-antibiotics",
      "relevant_topics": [
        "big3_antibiotics",
        "medication_side_effects",
        "patient_stories",
        "treatment_monitoring",
        "species_specific_treatment"
      ],
      "topic_count": 5,
      "tagged_date": "2025-11-16T04:05:01.000000",
      "original_post_date": "Posted 06-24-2025 09:07 PM",
      "original_post_date_iso": "2025-06-24T00:00:00",
      "latest_post_date": "Posted 07-05-2025 12:46 AM",
      "latest_post_date_iso": "2025-07-05T00:00:00",
      "post_count": 38,
      "user_count": 13
    },
    "the-big-3-for-mac": {
      "thread_file": "the-big-3-for-mac_The-Big-3-for-MAC.md",
      "thread_title": "The Big 3 for MAC",
      "thread_url": "https://connect.ntminfo.org/discussion/the-big-3-for-mac",
      "relevant_topics": [
        "big3_antibiotics",
        "medication_side_effects",
        "other_complications"
      ],
      "topic_count": 3,
      "tagged_date": "2025-11-16T04:05:02.000000",
      "original_post_date": "Posted 11-21-2024 11:40 AM",
      "original_post_date_iso": "2024-11-21T00:00:00",
      "latest_post_date": "Posted 11-22-2024 07:06 PM",
      "latest_post_date_iso": "2024-11-22T00:00:00",
      "post_count": 3,
      "user_count": 2
    },
    "the-big-three-antibiotics": {
      "thread_file": "the-big-three-antibiotics_The-big-three-antibiotics.md",
      "thread_title": "The big three antibiotics",
      "thread_url": "https://connect.ntminfo.org/discussion/the-big-three-antibiotics",
      "relevant_topics": [
        "big3_antibiotics",
        "medication_side_effects",
        "patient_stories"
      ],
      "topic_count": 3,
      "tagged_date": "2025-11-16T04:05:03.000000",
      "original_post_date": "Posted 08-04-2022 05:14 PM",
      "original_post_date_iso": "2022-08-04T00:00:00",
      "latest_post_date": "Posted 06-27-2025 10:55 AM",
      "latest_post_date_iso": "2025-06-27T00:00:00",
      "post_count": 16,
      "user_count": 6
    },
    "the-clorox-step-in-shower-head-cleaning": {
      "thread_file": "the-clorox-step-in-shower-head-cleaning_The-Clorox-step-in-shower-head-cleaning.md",
      "thread_title": "The Clorox step in shower head cleaning",
      "thread_url": "https://connect.ntminfo.org/discussion/the-clorox-step-in-shower-head-cleaning",
      "relevant_topics": [
        "medical_centers",
        "equipment_sterilization"
      ],
      "topic_count": 2,
      "tagged_date": "2025-11-16T04:05:04.000000",
      "original_post_date": "Posted 07-07-2025 09:54 PM",
      "original_post_date_iso": "2025-07-07T00:00:00",
      "latest_post_date": "Posted 07-09-2025 11:58 AM",
      "latest_post_date_iso": "2025-07-09T00:00:00",
      "post_count": 4,
      "user_count": 1
    },
    "the-countdown-continues": {
      "thread_file": "the-countdown-continues_The-countdown-continues.md",
      "thread_title": "The countdown continues!",
      "thread_url": "https://connect.ntminfo.org/discussion/the-countdown-continues",
      "relevant_topics": [
        "research_trials"
      ],
      "topic_count": 1,
      "tagged_date": "2025-11-16T04:05:05.000000",
      "original_post_date": "Posted 01-12-2025 12:01 PM",
      "original_post_date_iso": "2025-01-12T00:00:00",
      "latest_post_date": "Posted 01-12-2025 12:01 PM",
      "latest_post_date_iso": "2025-01-12T00:00:00",
      "post_count": 1,
      "user_count": 1
    },
    "the-next-australia-support-group-is-wednesday-june-25-1": {
      "thread_file": "the-next-australia-support-group-is-wednesday-june-25-1_The-next-Australia-Support-Group-is-Wedn.md",
      "thread_title": "The next Australia Support Group is Wednesday, June 25!",
      "thread_url": "https://connect.ntminfo.org/discussion/the-next-australia-support-group-is-wednesday-june-25-1",
      "relevant_topics": [
        "emotional_support",
        "research_trials"
      ],
      "topic_count": 2,
      "tagged_date": "2025-11-16T04:05:06.000000",
      "original_post_date": "Posted 06-11-2025 06:49 PM",
      "original_post_date_iso": "2025-06-11T00:00:00",
      "latest_post_date": "Posted 06-11-2025 06:49 PM",
      "latest_post_date_iso": "2025-06-11T00:00:00",
      "post_count": 1,
      "user_count": 1
    },
    "the-pope-has-bronchiectasis": {
      "thread_file": "the-pope-has-bronchiectasis_The-Pope-has-Bronchiectasis.md",
      "thread_title": "The Pope has Bronchiectasis",
      "thread_url": "https://connect.ntminfo.org/discussion/the-pope-has-bronchiectasis",
      "relevant_topics": [
        "research_trials"
      ],
      "topic_count": 1,
      "tagged_date": "2025-11-16T04:05:07.000000",
      "original_post_date": "Posted 02-20-2025 12:49 PM",
      "original_post_date_iso": "2025-02-20T00:00:00",
      "latest_post_date": "Posted 02-22-2025 10:49 AM",
      "latest_post_date_iso": "2025-02-22T00:00:00",
      "post_count": 5,
      "user_count": 5
    },
    "the-use-of-surgery-for-treatment-of-mycobacterium-avium-complex": {
      "thread_file": "the-use-of-surgery-for-treatment-of-mycobacterium-avium-complex_The-use-of-surgery-for-treatment-of-myco.md",
      "thread_title": "The use of surgery for treatment of mycobacterium avium complex",
      "thread_url": "https://connect.ntminfo.org/discussion/the-use-of-surgery-for-treatment-of-mycobacterium-avium-complex",
      "relevant_topics": [
        "surgical_treatment",
        "patient_stories",
        "medical_centers"
      ],
      "topic_count": 3,
      "tagged_date": "2025-11-16T04:05:08.000000",
      "original_post_date": "Posted 10-25-2024 04:28 PM",
      "original_post_date_iso": "2024-10-25T00:00:00",
      "latest_post_date": "Posted 12-17-2024 02:18 AM",
      "latest_post_date_iso": "2024-12-17T00:00:00",
      "post_count": 38,
      "user_count": 11
    },
    "things-that-made-managing-this-disease-easier-for-me": {
      "thread_file": "things-that-made-managing-this-disease-easier-for-me_Things-that-made-managing-this-disease-e.md",
      "thread_title": "Things that made managing this disease easier for me",
      "thread_url": "https://connect.ntminfo.org/discussion/things-that-made-managing-this-disease-easier-for-me",
      "relevant_topics": [
        "equipment_maintenance",
        "equipment_sterilization",
        "travel_equipment",
        "nutrition_lifestyle"
      ],
      "topic_count": 4,
      "tagged_date": "2025-11-16T04:05:09.000000",
      "original_post_date": "Posted 01-05-2023 12:24 PM",
      "original_post_date_iso": "2023-01-05T00:00:00",
      "latest_post_date": "Posted 28 days ago",
      "latest_post_date_iso": "2025-10-17T21:31:39.800391",
      "post_count": 40,
      "user_count": 17
    },
    "thoracic-surgeon-in-boston-ma": {
      "thread_file": "thoracic-surgeon-in-boston-ma_Thoracic-surgeon-in-Boston-MA.md",
      "thread_title": "Thoracic surgeon in Boston, MA",
      "thread_url": "https://connect.ntminfo.org/discussion/thoracic-surgeon-in-boston-ma",
      "relevant_topics": [
        "surgical_treatment",
        "insurance_costs"
      ],
      "topic_count": 2,
      "tagged_date": "2025-11-16T04:05:10.000000",
      "original_post_date": "Posted 01-08-2025 11:21 AM",
      "original_post_date_iso": "2025-01-08T00:00:00",
      "latest_post_date": "Posted 01-10-2025 02:22 AM",
      "latest_post_date_iso": "2025-01-10T00:00:00",
      "post_count": 6,
      "user_count": 4
    },
    "those-who-have-bronch-and-mac": {
      "thread_file": "those-who-have-bronch-and-mac_Those-who-have-bronch-and-mac.md",
      "thread_title": "Those who have bronch and mac",
      "thread_url": "https://connect.ntminfo.org/discussion/those-who-have-bronch-and-mac",
      "relevant_topics": [
        "manual_techniques",
        "saline_therapy",
        "environmental_exposures",
        "equipment_sterilization",
        "patient_stories",
        "aerobika_opep"
      ],
      "topic_count": 6,
      "tagged_date": "2025-11-16T03:45:01.000000",
      "original_post_date": "Posted 09-28-2025 12:20 PM",
      "original_post_date_iso": "2025-09-28T00:00:00",
      "latest_post_date": "Posted 10-06-2025 05:36 PM",
      "latest_post_date_iso": "2025-10-06T00:00:00",
      "post_count": 14,
      "user_count": 7
    },
    "tif-procedure-for-gerd": {
      "thread_file": "tif-procedure-for-gerd_TIF-procedure-for-GERD.md",
      "thread_title": "TIF procedure for GERD",
      "thread_url": "https://connect.ntminfo.org/discussion/tif-procedure-for-gerd",
      "relevant_topics": [
        "other_complications"
      ],
      "topic_count": 1,
      "tagged_date": "2025-11-16T03:45:02.000000",
      "original_post_date": "Posted 10-07-2025 10:28 AM",
      "original_post_date_iso": "2025-10-07T00:00:00",
      "latest_post_date": "Posted 10-07-2025 10:28 AM",
      "latest_post_date_iso": "2025-10-07T00:00:00",
      "post_count": 1,
      "user_count": 1
    },
    "time-to-reconsider-mucoactive-agents-for-airway-clearance-nejm": {
      "thread_file": "time-to-reconsider-mucoactive-agents-for-airway-clearance-nejm_Time-to-Reconsider-Mucoactive-Agents-for.md",
      "thread_title": "\"Time to Reconsider Mucoactive Agents for Airway Clearance\" NEJM",
      "thread_url": "https://connect.ntminfo.org/discussion/time-to-reconsider-mucoactive-agents-for-airway-clearance-nejm",
      "relevant_topics": [
        "research_trials",
        "manual_techniques",
        "saline_therapy"
      ],
      "topic_count": 3,
      "tagged_date": "2025-11-16T03:45:03.000000",
      "original_post_date": "Posted 19 days ago",
      "original_post_date_iso": "2025-10-26T21:31:41.611653",
      "latest_post_date": "Posted 14 days ago",
      "latest_post_date_iso": "2025-10-31T21:31:41.611653",
      "post_count": 6,
      "user_count": 3
    },
    "timing-for-aerobika-nebulizer-and-vest": {
      "thread_file": "timing-for-aerobika-nebulizer-and-vest_timing-for-Aerobika-nebulizer-and-vest.md",
      "thread_title": "timing for Aerobika, nebulizer and vest",
      "thread_url": "https://connect.ntminfo.org/discussion/timing-for-aerobika-nebulizer-and-vest",
      "relevant_topics": [
        "manual_techniques",
        "aerobika_opep",
        "nebulizers",
        "saline_therapy",
        "vest_therapy"
      ],
      "topic_count": 5,
      "tagged_date": "2025-11-16T03:45:04.000000",
      "original_post_date": "Posted 15 days ago",
      "original_post_date_iso": "2025-10-30T21:30:52.783501",
      "latest_post_date": "Posted 10 days ago",
      "latest_post_date_iso": "2025-11-04T21:30:52.783501",
      "post_count": 13,
      "user_count": 7
    },
    "timing-of-testing-results": {
      "thread_file": "timing-of-testing-results_Timing-of-testing-results.md",
      "thread_title": "Timing of testing results",
      "thread_url": "https://connect.ntminfo.org/discussion/timing-of-testing-results",
      "relevant_topics": [
        "bronchoscopy",
        "sputum_cultures"
      ],
      "topic_count": 2,
      "tagged_date": "2025-11-16T03:45:05.000000",
      "original_post_date": "Posted 11-13-2024 09:36 AM",
      "original_post_date_iso": "2024-11-13T00:00:00",
      "latest_post_date": "Posted 11-13-2024 09:36 AM",
      "latest_post_date_iso": "2024-11-13T00:00:00",
      "post_count": 2,
      "user_count": 2
    },
    "tip-tuesday-editing-your-discussion-signature": {
      "thread_file": "tip-tuesday-editing-your-discussion-signature_Tip-Tuesday-Editing-Your-Discussion-Sign.md",
      "thread_title": "Tip Tuesday: Editing Your Discussion Signature",
      "thread_url": "https://connect.ntminfo.org/discussion/tip-tuesday-editing-your-discussion-signature",
      "relevant_topics": [
        "research_trials"
      ],
      "topic_count": 1,
      "tagged_date": "2025-11-16T03:45:06.000000",
      "original_post_date": "Posted 04-29-2025 07:07 PM",
      "original_post_date_iso": "2025-04-29T00:00:00",
      "latest_post_date": "Posted 04-29-2025 07:07 PM",
      "latest_post_date_iso": "2025-04-29T00:00:00",
      "post_count": 1,
      "user_count": 1
    },
    "tip-tuesday-how-to-update-your-privacy-settings": {
      "thread_file": "tip-tuesday-how-to-update-your-privacy-settings_Tip-Tuesday-How-to-Update-your-Privacy-S.md",
      "thread_title": "Tip Tuesday: How to Update your Privacy Settings",
      "thread_url": "https://connect.ntminfo.org/discussion/tip-tuesday-how-to-update-your-privacy-settings",
      "relevant_topics": [
        "research_trials"
      ],
      "topic_count": 1,
      "tagged_date": "2025-11-16T03:45:07.000000",
      "original_post_date": "Posted 05-20-2025 04:09 AM",
      "original_post_date_iso": "2025-05-20T00:00:00",
      "latest_post_date": "Posted 05-20-2025 04:09 AM",
      "latest_post_date_iso": "2025-05-20T00:00:00",
      "post_count": 1,
      "user_count": 1
    },
    "tip-tuesday-tour-your-personalized-member-home-page-1": {
      "thread_file": "tip-tuesday-tour-your-personalized-member-home-page-1_Tip-Tuesday-Tour-Your-Personalized-Membe.md",
      "thread_title": "Tip Tuesday: Tour Your Personalized Member Home Page!",
      "thread_url": "https://connect.ntminfo.org/discussion/tip-tuesday-tour-your-personalized-member-home-page-1",
      "relevant_topics": [
        "research_trials"
      ],
      "topic_count": 1,
      "tagged_date": "2025-11-16T03:45:08.000000",
      "original_post_date": "Posted 05-27-2025 03:00 AM",
      "original_post_date_iso": "2025-05-27T00:00:00",
      "latest_post_date": "Posted 05-27-2025 03:00 AM",
      "latest_post_date_iso": "2025-05-27T00:00:00",
      "post_count": 1,
      "user_count": 1
    },
    "tip-tuesday-updating-your-email-preferences": {
      "thread_file": "tip-tuesday-updating-your-email-preferences_Tip-Tuesday-Updating-Your-Email-Preferen.md",
      "thread_title": "Tip Tuesday: Updating Your Email Preferences",
      "thread_url": "https://connect.ntminfo.org/discussion/tip-tuesday-updating-your-email-preferences",
      "relevant_topics": [
        "research_trials"
      ],
      "topic_count": 1,
      "tagged_date": "2025-11-16T03:45:09.000000",
      "original_post_date": "Posted 05-13-2025 08:09 AM",
      "original_post_date_iso": "2025-05-13T00:00:00",
      "latest_post_date": "Posted 05-13-2025 08:09 AM",
      "latest_post_date_iso": "2025-05-13T00:00:00",
      "post_count": 1,
      "user_count": 1
    },
    "to-gym-or-not-to-gym": {
      "thread_file": "to-gym-or-not-to-gym_To-gym-or-not-to-gym.md",
      "thread_title": "To gym or not to gym?",
      "thread_url": "https://connect.ntminfo.org/discussion/to-gym-or-not-to-gym",
      "relevant_topics": [
        "environmental_exposures",
        "exercise_activity",
        "patient_stories"
      ],
      "topic_count": 3,
      "tagged_date": "2025-11-16T03:45:10.000000",
      "original_post_date": "Posted 12 days ago",
      "original_post_date_iso": "2025-11-02T21:31:39.436342",
      "latest_post_date": "Posted 10 days ago",
      "latest_post_date_iso": "2025-11-04T21:31:39.436342",
      "post_count": 10,
      "user_count": 6
    },
    "tobramycin": {
      "thread_file": "tobramycin_Tobramycin.md",
      "thread_title": "Tobramycin",
      "thread_url": "https://connect.ntminfo.org/discussion/tobramycin",
      "relevant_topics": [
        "inhaled_medications",
        "medication_side_effects",
        "patient_stories"
      ],
      "topic_count": 3,
      "tagged_date": "2025-11-16T03:45:11.000000",
      "original_post_date": "Posted 11-30-2024 07:52 PM",
      "original_post_date_iso": "2024-11-30T00:00:00",
      "latest_post_date": "Posted 12-20-2024 10:44 AM",
      "latest_post_date_iso": "2024-12-20T00:00:00",
      "post_count": 8,
      "user_count": 5
    },
    "tobramycin-and-bad-taste": {
      "thread_file": "tobramycin-and-bad-taste_Tobramycin-and-Bad-Taste.md",
      "thread_title": "Tobramycin and Bad Taste",
      "thread_url": "https://connect.ntminfo.org/discussion/tobramycin-and-bad-taste",
      "relevant_topics": [
        "inhaled_medications",
        "medication_side_effects"
      ],
      "topic_count": 2,
      "tagged_date": "2025-11-16T03:45:12.000000",
      "original_post_date": "Posted 08-02-2025 09:35 AM",
      "original_post_date_iso": "2025-08-02T00:00:00",
      "latest_post_date": "Posted 08-03-2025 09:17 AM",
      "latest_post_date_iso": "2025-08-03T00:00:00",
      "post_count": 2,
      "user_count": 2
    },
    "tobramycin-and-ringing-in-ears": {
      "thread_file": "tobramycin-and-ringing-in-ears_Tobramycin-and-ringing-in-ears.md",
      "thread_title": "Tobramycin and ringing in ears",
      "thread_url": "https://connect.ntminfo.org/discussion/tobramycin-and-ringing-in-ears",
      "relevant_topics": [
        "inhaled_medications",
        "medication_side_effects"
      ],
      "topic_count": 2,
      "tagged_date": "2025-11-16T03:45:13.000000",
      "original_post_date": "Posted 11-28-2024 09:39 AM",
      "original_post_date_iso": "2024-11-28T00:00:00",
      "latest_post_date": "Posted 11-28-2024 09:39 AM",
      "latest_post_date_iso": "2024-11-28T00:00:00",
      "post_count": 1,
      "user_count": 0
    },
    "tomorrow-is-the-big-day": {
      "thread_file": "tomorrow-is-the-big-day_Tomorrow-is-the-BIG-day.md",
      "thread_title": "Tomorrow is the BIG day!",
      "thread_url": "https://connect.ntminfo.org/discussion/tomorrow-is-the-big-day",
      "relevant_topics": [
        "research_trials"
      ],
      "topic_count": 1,
      "tagged_date": "2025-11-16T03:45:14.000000",
      "original_post_date": "Posted 01-13-2025 07:23 PM",
      "original_post_date_iso": "2025-01-13T00:00:00",
      "latest_post_date": "Posted 01-14-2025 12:13 PM",
      "latest_post_date_iso": "2025-01-14T00:00:00",
